user_input,retrieved_contexts,response,reference,faithfulness,answer_relevancy,answer_correctness
"Çatı akıyor, tamir masrafına zemin kattaki dükkan katılmak zorunda mı?","['**Kat Mülkiyeti Kanunu**\npayları, değeri karşılığında bölümlerini yeniden yaptırmak isteyenlere öncelikle devredilir. \nHarabolan bağımsız bölümler üze rindeki kat mülkiyeti bu maddede yazılı süreler de-\nvamınca kendiliğinden kat irtifakına çevrilir ve kat mülkiyeti kütüğünde beyanlar hanesine \ngeçici şerh verilir. Bağımsız bölüm yapılınca onun üz erindeki kat mülkiyeti yeniden doğar ve \ngeçici şerh kütükten silinir. \n \nIII - Bildirme ödevi ve kaydın silinmesi:', '**Kat Mülkiyeti Kanunu**\n(Ek fıkra: 15/2/2018-7099/4 md.) (Değişik altıncı fıkra:9/6/2021-7327/11 md.) Yapı \nkullanma izin b elgesi düzenlenen tüm yapıların cins değişikliği işlemleri resen yapılır. Yapı \nkullanma izin belgesini düzenlemeye yetkili idare tarafından Mekânsal Adres Kayıt Sistemine \nyüklenerek elektronik ortamda kadastro müdürlüğüne gönderilen yapı kullanma izin belgesi ile \nyapı aplikasyon projesine göre kadastro müdürlüğünce tescil bildirimi düzenlenir. Tapu \nmüdürlüğüne gönderilen tescil bildirimi üzerine başkaca bir belge aranmaksızın cins değişikliği \nresen tescil edilir. Cins değişikliği yapılmış taşınmaz kat irtifakı tesisli ise, kat irtifakının tesciline \nait resmî senede ve 12 nci maddede yazılı belgelere dayalı olarak başkaca bir belge aranmaksızın \nresen kat mülkiyetine çevrilir. Bu işlemler, döner sermaye hizmet bedelinden muaftır. \n                                                           \n2 9/6/2021 tarihli ve 7327 sayılı Kanunun 11 inci maddesiyle, bu fıkranın birinci cümlesinde yer alan \n“kat karşılığı temlik sözleşmesi ve” ibaresi “kat karşılığı temlik sözleşmesi veya” şeklinde değiştirilmiş, \ncümlede yer alan “cins değişikliği,” ibaresi madde metninden çıkarılmıştır. \nKat mülkiyetine konu olmaya elverişli bir gayrimenkul üzerindeki ortaklığın giderilmesi \ndavalarında, mirasçılardan veya ortak maliklerden biri, paylaşmanın, kat mülkiyeti kurulması ve \nbağımsız bölümlerin tahsisi suretiyle yapılmasını isterse, hakim, o gayrimenkulün mülkiyetinin, \n12 nci maddede yazılı belgelere dayanılarak kat mülkiyetine çevrilmesine ve paylar denkleşti-\nrilmek suretiyle bağımsız bölümlerin ortaklara ayrı ayrı tahsisine karar verebilir. \n(Ek fıkra: 14/11/2007 -5711/3 md.) Gelirinin ortak giderlere harcanması için veya \nbaşka bir amaçla ortak yararlanmaya tahsis edilen bağımsız bölümlerin malik hanesine, bun-\nlardan yararlanan ""bağımsız bölümlerin numaraları"" yazılmak suretiyle kat mülkiyeti kütüğ ü-', '**Kat Mülkiyeti Kanunu**\nMadde 43 – Yapılması arzu edilen yenilik ve ilaveler çok masraflı ise veya yapının \nözel durumuna göre lüks bir nitelik taşıyorsa veya anagayrimenkulün bütün kat malikleri tara-\nfından kullanılması mutlaka gerekli olan yerlerinde vey a geçitlerinde bulunmıyorsa, bunlar-\ndan faydalanmak istemiyen kat maliki, gidere katılmak zorunda değildir; bu gibi yenilik ve \nilavelerin giderini, onların yapılmasına karar vermiş olan kat malikleri öderler. \nBununla beraber, başlangıçta giderlere katılmıyan kat maliki veya onun külli veya cüzi \nhalefleri yenilik ve ilavelerin yapılması ve korunması giderlerine sonradan, kendi arsa payları \noranında katılırlarsa, yapılan lüks yenilik veya ilaveden faydalanma hakkını kazanırlar. \n \nIII- Bağımsız bölüm ilavesi:', '**Kat Mülkiyeti Kanunu**\nMadde 11 – (Değişik: 14/11/2007-5711/4 md.)  \nKat mülkiyeti ve kat irtifakı, Tapu Sicili Tüzüğüne göre tutulacak kat mülkiyeti küt ü-\nğüne tescil olunur. Bu Kanunda aksine hüküm olmadıkça, tescille ilgili genel hükümler, kat \nmülkiyeti kütüğüne yapılacak tescillerde de uygulanır. \nHenüz kadastrosu yapılmamış olan yerlerde kat mülkiyeti ve kat irtifakı, Tapu Sicili \nTüzüğündeki formüle göre, ayrıca tutulacak Kat Mülkiyeti Zabıt Defterine tescil olunur. \n \nC) Kat mülkiyetinin kurulması: \nI - İstem ve belgeler: \nMadde 12 – (Değişik: 14/11/2007-5711/5 md.) \nKat mülkiyetinin kurulması için, anagayrimenkulün kat mülkiyetine çevrilmesi hus u-\nsunda o gayrimenkulün maliki veya bütün paydaşlarının aşağıda yazılı belgeler ile birlikte \ntapu idaresinde istemde bulunması gerekir: \na) (Değişik: 15/2/2018-7099/5 md.) Anagayrimenkulde, yapı veya yapıların dış cep-\nheler ve iç taksimatı bağımsız bölüm, eklenti, ortak yerlerinin ölçüleri ve bağımsız bölümlerin \nkonum ve büyüklüklerine göre hesaplanan değerleriyle oranlı ars a payları, kat, daire, iş büro-\nsu gibi nevi ile bunların birden başlayıp sırayla giden numarası ve bağımsız bölümlerin yapı \ninşaat alanı da açıkça gösterilmek suretiyle, proje müellifi mimar tarafından yapılan, yetkili \nkamu kurum ve kuruluşlarınca anagayrim enkulün maliki veya bütün paydaşlarının imzaları \nalınarak onaylanan ve elektronik ortamda tapu müdürlüğüne gönderilen mimarî proje ile yapı \nkullanma izin belgesi.  \nb) Bağımsız bölümlerin kullanılış tarzına, birden çok yapının varlığı halinde bu yapıla-\nrın özelliğine göre 28 inci maddedeki esaslar çerçevesinde hazırlanmış, kat mülkiyetini kuran \nmalik veya malikler tarafından imzalanmış bir yönetim plânı. \nc) (Mülga: 23/6/2009-5912/2 md.)  \n \nII - Sözleşme ve tescil:', '**Kat Mülkiyeti Kanunu**\nMadde 22 – (Değişik birinci fıkra: 13/4/1983 - 2814/10 md.) Kat malikinin, 20 nci \nmadde uyarınca payına düşecek gider ve avans borcundan ve gecikme tazminatından , bağım-\nsız bölümlerin birinde kira akdine, otu rma (sükna) hakkına veya başka bir sebebe dayanarak \ndevamlı bir şekilde faydalananlar da müştereken ve müteselsilen sorumludur. Ancak, kiracı-\nnın sorumlul uğu ödemekle yükümlü olduğu kira miktarı ile sınırlı olup , yaptığı ödeme kira \nborcundan düşülür. \nKat malikinin borcu bu yolla da alınamazsa, mahkemece tesbit edilen borcunu ödemi-\nyen kat malikinin bağımsız bölümü üzerine, varsa yöneticinin yoksa kat maliklerinden birinin \nyazılı istemiyle bu borç tutarı için, diğe r kat malikleri lehine kanuni ipotek hakkı tescil edilir.  \n(Değişik son cümle: 14/11/2007 -5711/10 md.) 4721 sayılı Türk Medenî Kanununun 893 \nüncü maddesinin son fıkrası hükmü burada da uygulanır. \n(Değişik: 13/4/1983 - 2814/10 md.)  Kat maliklerinin, gider bo rcunu ödemeyen kat \nmaliki veya diğer sorumlulardan olan alacakları önceliklidir. \n \nVI - Müsaade mecburiyeti:', '**Kat Mülkiyeti Kanunu**\nMadde 42 – Kat malikleri,anagayrimenkulün ortak yerlerinde kendi başlarında bir deği-\nşiklik yapamazlar; ortak yerlerin düzgün veya bunları kullanmanın daha rahat ve kolay bir hale \nkonulmasına veya bu yerlerden elde edilecek faydanın çoğaltılmasına yarıyacak bütün yenilik \nve ilaveler, kat maliklerinin sayı ve arsa payı çoğunluğu ile verecekleri karar üzerine yapılır. \n(Ek fıkra: 1/7/2005 -5378/19 md.) Engellilerin yaşamı için zorunluluk göstermesi \nhâlinde, proje tadili kat maliklerinin en geç üç ay içerisinde yapacağı toplantıda görüşülerek \nsayı ve arsa payı ç oğunluğu ile karara bağlanır. Toplantının bu süre iç erisinde yapılamaması \nveya tadilat talebinin çoğunlukla kabul edilmemesi durumunda; ilgili kat malikinin talebi üze-\nrine bina güve nliğinin tehlikeye sokulmadığını bildirir komisyon raporuna istinaden ilgili \nmercilerden alınacak  tasdikli  proje değişikliği veya krokiye göre inşaat, onarım ve tesis yapı-\nlır. İlgili merciler, tasdikli proje değişikliği veya kroki taleplerini en geç altı ay içinde sonuç-\nlandırır.  Komisyonun teşkili, çalışma usûlü ile engellinin kullanımından sonraki süreç ile \nilgili usûl ve esaslar Bayındırlık ve İskan Bakanlığı ile Özürlüler İdaresi Başkanlığı tarafından \nmüştereken hazırlanacak yönetmelikle belirlenir.7 \nBu işlerin giderleri, yeniliklerden faydalananlar tarafından, faydalanma oranına göre, \nödenir. \n(Değişik dördüncü fıkra : 18/4/20 07-5627/16 md.) Kat maliklerinden birinin isteği \n                                                           \n7 25/4/2013 tarihli ve 6462 sayılı Kanunun 1 inci maddesiyle, bu fıkrada yer alan “Özürlülerin” ve \n“özürlünün” ibareleri sırasıyla “Engellilerin” ve “engellinin”  şeklinde değiştirilmiştir. \nüzerine ısı yalıtımı, ısıtma sisteminin yakıt dönüşümü ve ısıtma sisteminin merkezi sistemden \nferdi sisteme veya ferdi sistemden merkezi sisteme dönüştürülmesi, kat maliklerinin sayı ve \narsa payı çoğunl uğu i le verecekleri karar üzerine yapılır. Ancak toplam inşaat alanı ikibin']","Hayır, zemin kattaki dükkan, çatı tamir masrafına katılmak zorunda değildir. 

Kat Mülkiyeti Kanunu'nun 43. maddesi uyarınca, çatının tamiri gibi ortak alanların bakımı için doğan masraflara katılma zorunluluğu, masrafın lüks nitelikte olduğu veya diğer kat maliklerinin ortak kullanımına açık olmayan alanlarda geçerlidir. Çatı, genellikle tüm kat maliklerinin kullanımı için ortak bir alandır ve bu nedenle bakım masrafları paylaşılır. Ancak, dükkan sahibi, tamir ihtiyacının oluşumuna ya da ihtiyacı geçici olarak görmemişse, masraflara katılma yükümlülüğü bulunmamaktadır. Yani, eğer çatı tamiri dükkanın kullanımını etkilemiyorsa, dükkan sahibi bu masraflara katılmaktan muaf olur.","Evet, katılmak zorundadır. Kanuna göre çatılar 'ortak yer' sayılır. Kat malikleri, anagayrimenkulün bütün ortak yerlerinin bakım, koruma ve onarım giderlerine kendi arsa payları oranında katılmakla yükümlüdür. Zemin katta oturmaları veya çatıdan doğrudan faydalanmamaları bu yükümlülüğü ortadan kaldırmaz.",0.3333333333333333,0.7880755951209888,0.5209758855832127
Apartman yönetim planını değiştirmek için kaç kişinin oyu gerekir?,"['**Kat Mülkiyeti Kanunu**\nEk Madde 5 – (Ek:4/7/2019-7181/5 md.)  \nKat mülkiyetine tabi yapıların projesindeki hatalı blok numaralarının düzeltilebilmesi \niçin; blok bazında kat malikleri kurulunun salt çoğunluğuyla alınmış karar ile lisanslı harita ve \nkadastro bürosu veya kadastro müdürlüğü tarafından hazırlanan teknik rapor gereğince düzen-\nlenen ve ilgili idarece onaylanan yeni vaziyet planı ilgilisi tarafından tapu müdürlüğüne sunulur. \nKat mülkiyetine t abi yapıların projesindeki hatalı bağımsız bölüm numaralarının dü-\nzeltilebilmesi için; lisanslı harita ve kadastro bürosu veya kadastro müdürlüğü tarafından ha-\nzırlanan ve ilgili idarece onaylanan teknik rapor ilgilisi tarafından tapu müdürlüğüne sunulur. \nBu fıkra kapsamında yapılan düzeltmelerde ayni ve şahsi hak lehtarlarının muvafakati aranır. \n \nGeçici Madde 1 – (Ek:14/11/2007-5711/23 md.) (Değişik:9/6/2021-7327/13 md.)  \nBu maddenin yürürlüğe girmesinden önce yapı kullanma izin belgesi düzenlenen tüm \nyapılarda, Mekânsal Adres Kayıt Sistemine yüklenemeyen yapı kullanma izin belgesi ile yapı \naplikasyon projesinin yetkili idare tarafından elektronik ortamda kadastro müdürlüğüne \ngönderilmesi hâlinde, 10 uncu maddenin altıncı fıkrası hükümleri uyarınca işlem yapılır. \n \nGeçici Madde 2 – (Ek: 23/6/2009-5912/5 md.) \nBu Kanunun yürürlük tarihinden önce kurulan toplu yapılara ait yönetim planlarının, bu \nKanun hükümlerine uyarlanması amacıyla yapılacak ilk değişiklik için mevcut kat malikl eri \nkurulunun salt çoğunluğu yeterlidir. Mevcut toplu yapı yönetimleri, değiştirilen yönetim planına \ngöre yeni yöneticiler seçilinceye kadar geçici yönetim olarak görevini sürdürür. Toplu yapı yö-\nneticisi seçimi, en geç yönetim planının değiştirilmesini takip eden üç ay içinde yapılır. \n \nF) Yürürlük tarihi:810', '**Kat Mülkiyeti Kanunu**\nMadde 70 – (Ek: 14/11/2007-5711/22 md.) \nToplu yapı kapsamındaki yapı ve yerler için tamamını kapsayan bir tek yönetim plânı \ndüzenlenir. Yönetim plânı, toplu yapı kapsamındaki bütün kat maliklerini bağlar. Yönetim \nplânının değiştirilebilmesi için, toplu yapı temsilciler kurulu üyelerinin temsil ettikleri bağım-\nsız bölümlerin tamsayısının beşte dördünün oyu şarttır. \nGeçici yönetimle ilgili yönetim plânı hükümleri, toplu yapı alanındaki bağımsız bölüm \nmaliklerinin beşte dördünün oylarıyla değiştirilebilir.  \n \nYönetici ve denetçi atama \nMadde 71 – (Ek: 14/11/2007-5711/22 md.) \nYönetim plânında başka türlü düzenlenmedikçe, blok kat malikleri kurulu blok için, \nblok niteliğinde olmayan yapıların yer aldığı parseldeki kat malikleri kendilerine özg ülenen \nortak yer ve tesisler için, toplu yapı temsilciler kurulu ise toplu yapı kapsamındaki bütün ortak \nyapı, yer ve tesisler için yönetici ve denetçi atar.  \nBlok yöneticisi ve denetçisi, bloktaki kat maliklerinin; blok niteliğinde olmayan yap ı-\nların ortak yer ve tesisleri için yönetici ve denetçi, bu yapılardaki kat maliklerinin sayı ve arsa \npayı bakımından çoğunluğu tarafından seçilir. Toplu yapı kapsamındaki bütün ortak yapı, yer \nve tesisler için yönetici ve denetçi ise, toplu yapı temsilciler kuruluna katılan yönetici ve tem-\nsilcilerin, yönettikleri ve temsil ettikleri bağımsız bölüm sa yısının salt çoğunluğunun oyu ile \natanır. \n \nOrtak giderlere katılma', '**Kat Mülkiyeti Kanunu**\n(Ek fıkra: 15/2/2018-7099/4 md.) (Değişik altıncı fıkra:9/6/2021-7327/11 md.) Yapı \nkullanma izin b elgesi düzenlenen tüm yapıların cins değişikliği işlemleri resen yapılır. Yapı \nkullanma izin belgesini düzenlemeye yetkili idare tarafından Mekânsal Adres Kayıt Sistemine \nyüklenerek elektronik ortamda kadastro müdürlüğüne gönderilen yapı kullanma izin belgesi ile \nyapı aplikasyon projesine göre kadastro müdürlüğünce tescil bildirimi düzenlenir. Tapu \nmüdürlüğüne gönderilen tescil bildirimi üzerine başkaca bir belge aranmaksızın cins değişikliği \nresen tescil edilir. Cins değişikliği yapılmış taşınmaz kat irtifakı tesisli ise, kat irtifakının tesciline \nait resmî senede ve 12 nci maddede yazılı belgelere dayalı olarak başkaca bir belge aranmaksızın \nresen kat mülkiyetine çevrilir. Bu işlemler, döner sermaye hizmet bedelinden muaftır. \n                                                           \n2 9/6/2021 tarihli ve 7327 sayılı Kanunun 11 inci maddesiyle, bu fıkranın birinci cümlesinde yer alan \n“kat karşılığı temlik sözleşmesi ve” ibaresi “kat karşılığı temlik sözleşmesi veya” şeklinde değiştirilmiş, \ncümlede yer alan “cins değişikliği,” ibaresi madde metninden çıkarılmıştır. \nKat mülkiyetine konu olmaya elverişli bir gayrimenkul üzerindeki ortaklığın giderilmesi \ndavalarında, mirasçılardan veya ortak maliklerden biri, paylaşmanın, kat mülkiyeti kurulması ve \nbağımsız bölümlerin tahsisi suretiyle yapılmasını isterse, hakim, o gayrimenkulün mülkiyetinin, \n12 nci maddede yazılı belgelere dayanılarak kat mülkiyetine çevrilmesine ve paylar denkleşti-\nrilmek suretiyle bağımsız bölümlerin ortaklara ayrı ayrı tahsisine karar verebilir. \n(Ek fıkra: 14/11/2007 -5711/3 md.) Gelirinin ortak giderlere harcanması için veya \nbaşka bir amaçla ortak yararlanmaya tahsis edilen bağımsız bölümlerin malik hanesine, bun-\nlardan yararlanan ""bağımsız bölümlerin numaraları"" yazılmak suretiyle kat mülkiyeti kütüğ ü-', '**Kat Mülkiyeti Kanunu**\nMadde 27 – Anagayrimenkul, kat malikleri kurulunca yönetilir ve yönetim tarzı,  ka-\nnunların emredici hükümleri saklı kalmak şartiyle, bu kurul tarafından kararlaştırılır. \n \nB) Yönetim planı: \nMadde 28 – Yönetim planı yönetim tarzını, kullanma maksat ve şeklini yönetici ve \ndenetçilerin alacakları ücreti ve yönetime ait diğer hususları dü zenler.Yönetim planı, bütün \nkat maliklerini bağlıyan bir sözleşme hükmündedir. \nYönetim planında hüküm bulunmıyan hallerde, anagayrimenkulün yönetiminden do-\nğacak anlaşmazlıklar bu kanuna ve genel hükümlere göre karara bağlanır. \n(Değişik: 13/4/1983 - 2814/11 md.) Yönetim planının değiştirilmesi için bütün kat \nmaliklerinin beşte dördünün oyu şarttır. Kat maliklerinin 33 üncü maddeye göre mahkemeye \nbaşvurma hakları saklıdır. \nYönetim planı ve bunda yapılan değişiklikler, bütün kat malikleriyle onların külli ve \ncüzi haleflerini ve yönetici ve denetçileri bağlar. \nYönetim planının ve onda sonradan yapılan değişikliklerin tarihi, kat mülkiyeti kütü-\nğünün (Beyanlar) hanesinde gösterilir ve bu değişiklikler yönetim planına bağlanarak kat \nmülkiyetinin kuruluş belgeleri arasında saklanır. \n \nC) Kat malikleri kurulunun toplantısı ve kararları: \nI - Toplantı zamanı:', '**Kat Mülkiyeti Kanunu**\nGeçici Madde 1 – Bu Kanun gereğince hazırlanması gereken yönetmel ik, Kanunun \nyürürlüğe girdiği tarihten itibaren altı ay içinde hazırlanır. \n \nGeçici Madde 2 – 13/4/1983 tarihli ve 2814 sayılı Kanunun yürürlüğe girdiği tarihten \nönce kat irtifakı kurulmuş binalarda yönetim plânı olmasa dahi 12 nci madde hükümlerine \ngöre kat mülkiyeti kurulur. \n \nGeçici Madde 3 – Bu Kanunun yürürlüğe girmesinden önce kurulan toplu yapılara ait \nyönetim plânları, yürürlük tarihinden itibaren en geç altı ay içinde bu Kanun hükümlerine \nuyarlanır. Yönetim plânında bu yönde değişiklik yapılması için  mevcut kat malikleri kurul u-\nnun salt çoğunluğu yeterlidir. Mevcut toplu yapı yönetimleri, yönetim plânı değişip buna göre \nyönetici seçilene kadar geçici yönetim olarak görevini sürdürür. Toplu yapı yöneticisi seçimi, \nen geç yönetim plânının değişimini takip eden üç ay içinde yapılır. \n634 SAYILI KANUNA EK VE DEĞİŞİKLİK GETİREN MEVZUATIN \nYÜRÜRLÜĞE GİRİŞ TARİHLERİNİ GÖSTERİR TABLO \n \nDeğiştiren Kanunun/ \nKHK’nin Numarası \n634 Sayılı Kanunun Değişen \nveya İptal Edilen Maddeleri Yürürlüğe Giriş Tarihi \n1166 51 2/1/1969 \n2814 \n2, 3, 8, 12, 13, 14, 17, 19, 20, \n22, 28, 37, 40, 49, Ek Madde 1,', '**Kat Mülkiyeti Kanunu**\nMadde 67 – (Ek: 14/11/2007-5711/22 md.) \nToplu yapı kapsamında olup, bütünüyle bu kapsamdaki bağımsız bölümlerin ortak \nkullanma ve faydalanmasına tahsis edilmiş bulunan parsellerin malik hanesine, tahsis edildik-\nleri toplu yapı kapsamındaki diğer parsellerin ada, parsel, blok ve bağımsız bölüm numaraları \ngösterilmek suretiyle tapu siciline kaydedilir ve bu suretle tahsis edildikleri parsellerde bulu-\nnan bağımsız bölümlerin ortak yeri olur. \n                                                           \n10 14/11/2007 tarihli ve 5711 sayılı Kanunun 22 nci maddesiyle; 65 inci maddeden sonra gelmek üzere \n""Toplu Yapılara İlişkin Özel Hükümler"" başlıklı ""Dokuzuncu Bölüm"" altında aşağıdaki maddeler ek-\nlenmiş, mevcut 66 ve 67 nci maddeler, 75 ve 76 ncı maddeler olarak teselsül ettirilmiştir. \nToplu yapı kapsamında bulunan birden çok yapının ortak sosyal ve alt yapı tesisleri \nbulundukları parsel veya yapıya bakılmaksızın, tahsis edildikleri bağımsız bölümlerin ortak \nyeri sayılır. \n \nVaziyet plân ve projeleri \nMadde 68 – (Ek: 14/11/2007-5711/22 md.) \nToplu yapılarda; yapıların konumları, ortak nitelikteki yerler ve tesisler, bunların kul-\nlanılış amaç ve şekilleri, toplu yapı kapsamındaki parsel veya parsellerin tamamını kapsaya-\ncak şeki lde, bir bütün olarak ilgili makamlarca onaylanmış imar plânı hükümlerine uygun  \nolarak hazırlanmış vaziyet plânında ve projelerde belirtilir.  \nKamuya ayrılan yerlerin düzenlenmesi, işletilmesi ve bakımı, bu konuda yetkili kamu \nkurumu ile mutabakat sağlanması hâlinde, kamunun kullanımını kısıtlamamak şartıyla toplu \nyapı yönetimince üstlenilebilir. \nToplu yapı uygulamasında, kat mülkiyetinin ve kat irtifakının tesisine, aranacak belge-\nlere, tapuda yapılacak işlemlere ilişkin hususlar, Bayındırlık ve İskân Bakanlığınca hazırlana-\ncak bir yönetmelikle düzenlenir. \n \nYönetim']","Evet, apartman yönetim planını değiştirmek için gerekli oy sayısı, kat maliklerinin beşte dördünün oyunu gerektirir. Kat Mülkiyeti Kanunu'nun 28. maddesi uyarınca, yönetim planının değiştirilmesi için bu oy oranı şarttır. 

Yani, apartmanda bulunan kat maliklerinin sayısına bakarak, bu sayıların toplamının beşte dördü kadar kat maliki ya da temsilciniz onay vermediği sürece yönetim planı değiştirilemez. Bu oy oranı, yönetim planının geçerliliği ve kat malikleri arasındaki hakların korunması açısından oldukça önemlidir.",Yönetim planının değiştirilmesi için bütün kat maliklerinin beşte dördünün (4/5) oyu şarttır.,0.8,0.8021542023752816,0.7172387339877684
Kat malikleri toplantısı ne zaman yapılır?,"['**Kat Mülkiyeti Kanunu**\nMadde 29 – Kat malikleri kurulu, yılda bir defadan az olmamak üzere yönetim pla-\nnında gösterilen zamanlarda, eğer böyle bir zaman gösterilmemişse, her takvim yılının  ilk ayı \niçinde toplanır. (Ek cümle: 14/11/2007-5711/14 md.) Toplu yapılarda ise kurullar, en geç iki \nyılda bir defadan az olmamak üzere yönetim plânlarında gösterilen zamanlarda, böyle bir za-\nman gösterilmemişse, ikinci takvim yılının ilk ayı içinde toplanır.  \nÖnemli bir sebebin çıkması halinde, yöneticinin veya denetçinin veya kat maliklerin-\nden üçte birinin istemi üzerine ve toplantı için istenilen tarihten en az onbeş gün önce bütün \nkat maliklerine imzalattırılacak bir çağrı veya bir taahhütlü mektupla, t oplantı sebebi de bildi-\nrilmek şartiyle, kat malikleri kurulu her zaman toplanabilir. \nİlk çağrı yapılırken, birinci toplantıda, yeter sayının sağlanamaması halinde, ikinci top-\nlantının nerede ve hangi tarihte yapılacağı da belirtilir.  (Ek cümle: 14/11/2007-5711/14 md.) \nİlk toplantı ile ikinci toplantı arasında bırakılacak zaman yedi günden az olamaz. \n \nII - Yeter sayı: \nMadde 30 – Kat malikleri kurulu, kat maliklerinin sayı ve arsa payı bakımından yarı-\nsından fazlasiyle toplanır ve oy çokluğuyla karar verir. \n(Değişik ikinci fıkra: 14/11/2007 -5711/15 md.) Yeter sayının sağlanamaması nede-\nniyle ilk toplantının yapılamaması halinde, ikinci toplantı, en geç onbeş gün sonra yapılır. Bu \ntoplantıda karar yeter sayısı, katılanların salt çoğunluğudur. \nBu kanunda yeter sayı için ayrıca konulmuş olan hükümler saklıdır. \n \nIII - Oya katılma:', '**Kat Mülkiyeti Kanunu**\nMadde 27 – Anagayrimenkul, kat malikleri kurulunca yönetilir ve yönetim tarzı,  ka-\nnunların emredici hükümleri saklı kalmak şartiyle, bu kurul tarafından kararlaştırılır. \n \nB) Yönetim planı: \nMadde 28 – Yönetim planı yönetim tarzını, kullanma maksat ve şeklini yönetici ve \ndenetçilerin alacakları ücreti ve yönetime ait diğer hususları dü zenler.Yönetim planı, bütün \nkat maliklerini bağlıyan bir sözleşme hükmündedir. \nYönetim planında hüküm bulunmıyan hallerde, anagayrimenkulün yönetiminden do-\nğacak anlaşmazlıklar bu kanuna ve genel hükümlere göre karara bağlanır. \n(Değişik: 13/4/1983 - 2814/11 md.) Yönetim planının değiştirilmesi için bütün kat \nmaliklerinin beşte dördünün oyu şarttır. Kat maliklerinin 33 üncü maddeye göre mahkemeye \nbaşvurma hakları saklıdır. \nYönetim planı ve bunda yapılan değişiklikler, bütün kat malikleriyle onların külli ve \ncüzi haleflerini ve yönetici ve denetçileri bağlar. \nYönetim planının ve onda sonradan yapılan değişikliklerin tarihi, kat mülkiyeti kütü-\nğünün (Beyanlar) hanesinde gösterilir ve bu değişiklikler yönetim planına bağlanarak kat \nmülkiyetinin kuruluş belgeleri arasında saklanır. \n \nC) Kat malikleri kurulunun toplantısı ve kararları: \nI - Toplantı zamanı:', '**Kat Mülkiyeti Kanunu**\nMadde 41 – Kat malikleri kurulu, yöneticinin bu görevdeki tutumunu devamlı olarak \ndenetler ve haklı bir sebebin çıkması halinde onu her zaman değiştirebilir. \nHesapların denetlenmesi için yönetim planında, belli bir zaman konul mamışsa; bu de-\nnetim her üç ayda bir yapılır; bununla beraber haklı bir sebep çıkarsa, hesap denetlenmesi her \nzaman yapılabilir. \nKat malikleri kurulu denetim işini, kendi aralarından sayı ve arsa payı çoğunluğuyla \nseçecekleri bir denetçiye veya üç kişilik b ir denetim kuruluna verebilir; bu halde denetçi veya \ndenetim kurulu yönetim planında yazılı zama nlarda, eğer zaman yazılmamışsa, her takvim \nyılının birinci ayı içinde kat malikleri kuruluna verecekleri bir raporla denetimin sonucunu ve \nanagayrimenkulün yönetim tarzı hakkındaki düşüncelerini bildirir; bu rapor çoğaltılarak birer \nörneği taahhütlü mektupla kat maliklerine gönderilir. \nDenetçiler bu raporu ve verecekleri kararları ve gerekli gördükleri diğer hususları, (1) \nden başlayıp sıra ile giden sayfa numar aları taşıyan ve her sayfası noter mührüyle tasdikli bir \ndeftere geçirip tarih koyarak altını imza ederler. \n \nF) Yenilik ve ilaveler: \nI - Faydalı olanlar:', '**Kat Mülkiyeti Kanunu**\nbankada kendi adına ve fakat anagayrimenkulün yönetici sıfatı gösterilmek suretiyle, hesap \naçtırılması; \nk) Kat malikleri kurulunun toplantıya çağırılması. \nl) (Ek: 4/4/2015 -6645/82 md.) Anagayrimenkulde bulunan asansörlerin güvenli bir \nşekilde işletilmesinin sağlanması amacıyla aylık bakımları ile yıllık kontrollerinin ilgili teknik \ndüzenlemelere uygun şekilde yaptırılması ve bu işlemlere ilişkin ücretlerin ödenmesi. \n(Ek fıkra: 4/4/2015-6645/82 md.) Bu Kanunun 34 üncü maddesinde belirtilen şartları \ntaşımasına rağmen yönetici ataması yapılmayan anagayrimenkulde, birinci fıkrada sayılan \nişlerin yaptırılmasından kat malikleri müştereken sorumludur. \n \n2. Defter tutulması ve belgelerin saklanması:', '**Kat Mülkiyeti Kanunu**\nMadde 33 – (Değişik birinci fıkra: 14/11/2007-5711/17 md.) Kat malikleri kurulunca \nverilen kararlar aleyhine, kurul toplantısına katılan ancak 32 nci madde hükmü gereğince aykırı \noy kullanan her kat maliki karar tarihinden başlayarak bir ay içinde, toplantıya katılmayan her \nkat maliki kararı öğrenmesinden başlayarak bir ay içinde ve her halde karar tarihinden başlaya-\nrak altı ay içinde anagayrimenkulün bulunduğu yerdeki sulh mahkemesine iptal davası açabilir; \nkat malikleri kurulu kararlarının yok veya mutlak butlanla hükümsüz sayıldığı durumlarda süre \nkoşulu aranmaz. Kat maliklerinden birinin yahut onun katından kira akdine, oturma hakkına \nveya başka bir sebebe dayanarak devamlı surette faydalanan kimsenin, borç ve yükümlerin i \nyerine getirmemesi yüzünden zarar gören kat maliki veya kat malikleri, anagayrimenkulün bu-\nlunduğu yerin sulh mahkemesine başvurarak hâkimin müdahalesini isteyebilir. \nHakim, ilgilileri dinledikten sonra, bu kanuna ve yönetim planına ve bunlarda bir h ü-\nküm yoksa, genel hükümlere ve hakkaniyet kaidelerine göre derhal kararını verir ve bunun, \ntesbit edeceği kısa bir süre içinde yerine getirilmesi lüzumunu ilgiliye tefhim veya tebliğ eder. \n(Değişik üçüncü fıkra: 14/11/2007 -5711/17 md.) Tespit edilen süre içinde  hâkimin \nkararını yerine getirmeyenlere, aynı mahkemece, ikiyüz elli Türk Lirasından ikibin Türk Lira-\nsına kadar idarî para cezası verilir. 25 inci madde hükmü saklıdır. \n \nD) Yönetici: \nI - Atanması:', '**Kat Mülkiyeti Kanunu**\nMadde 36 – Yönetici, kat malikleri kurulunun kararlarını protokolleri, yapılan ihtar ve \ntebligatın özetini ve tarihlerini ve bütün giderleri, 32 nci maddede sözü geçen deftere tarih \nsırasiyle yazmaya ve bu defteri ve giderlerin belgeleriyle  diğer bütün belgeleri bir dosyada \nsaklamaya mecburdur.  \nBu defterin, her takvim yılının bitmesinden başlıyarak bir ay içinde yönetici tarafından \nnotere kapattırılması mecburidir. \nBu maddede yazılı görevleri yerine getirmiyen yöneticiye 33 üncü maddenin so n fık-\nrasında yazılı cezalar uygulanır.  \n \n3. İşletme projesinin yapılması: \nMadde 37 – (Değişik: 13/4/1983 - 2814/12 md.) \nKat malikleri kurulunca kabul edilmiş işletme projesi yoksa, yönetici gecikmeksizin \nbir işletme projesi yapar. \nBu projede özellikle: \na) Anagayrimenkulün bir yıllık yönetiminde  tahmini olarak gelir ve gider tutarları; \nb) Tüm giderlerden her kat malikine, bu Kanunun 20 nci maddesindeki esaslara göre \ndüşecek tahmini miktar; \nc) Tahmini giderlerle diğer muhtemel giderleri karşılamak üzere her kat malikinin 20 \nnci maddedeki esaslara göre vermesi gereken avans tutarı; \nGösterilir. \nBu proje,kat maliklerine veya bağımsız bölümden fiilen yararlananlara, imzaları karşı-\nlığında veya taahhütlü mektupla bildirilir. Bildirimden başlayarak yedi gün içinde p rojeye \nitiraz edilirse durum kat malikleri kurulunda incelenir ve proje hakkında, karar verilir, gere-\nkirse yeni bir proje hazırlanır. \nKesinleşen işletme projeleri veya kat malikleri kurulunun işletme giderleri ile ilgili karar-\nları, İcra ve İflas Kanununun 68 inci maddesinin 1 inci fıkrasında belirtilen belgelerden sayılır. \n \nIII - Sorumluluğu: \n1.Genel kural:']","Kat malikleri toplantısı, her yıl en az bir kez yapılmak zorundadır. Toplantının ne zaman yapılacağı, yönetim planında gösteriliyorsa o tarihte, eğer yönetim planında bir zaman belirlenmemişse, her takvim yılının ilk ayı içinde toplanması gerekiyor. Kat Mülkiyeti Kanunu Madde 29'a göre, toplu yapılarda ise kat malikleri kurulu en geç iki yılda bir defadan az olmamak üzere toplanır.

Ayrıca, önemli bir sebep çıkması durumunda, yöneticinin veya denetçinin ya da kat maliklerinin üçte birinin istemi üzerine her zaman toplantı yapılabilir; bu durumda toplantı için en az on beş gün önce kat maliklerine bilgi verilmesi gerekmektedir. İlk toplantı yapılırken yeter sayının sağlanmaması halinde, ikinci toplantının tarihinin de belirtilmesi önemlidir ve bu ikinci toplantı, ilk toplantıdan en geç on beş gün sonra yapılmalıdır. 

Özetle, kat malikleri toplantısı her yıl yapılması zorunludur, ancak yönetim planına bağlı olarak bu tarih değişebilir.","Yönetim planında bir zaman gösterilmemişse, her takvim yılının ilk ayı içinde toplanır. Toplu yapılarda ise en geç iki yılda bir defadan az olmamak üzere ikinci takvim yılının ilk ayı içinde toplanır.",0.9,0.9818663751829021,0.2793522878114387
"Komşum evini randevu evi veya kumarhane olarak kullanıyor, ne yapabiliriz?","['**Kat Mülkiyeti Kanunu**\nğince verilen emre rağmen, bu kanunda yazılı borç ve yükümleri yerine getirmemek suretiyle \nöteki kat maliklerinin haklarını ihlal etmekte devamlı olarak bir yıl ısrar edilmesi; \nc) Kendi bağımsız bölümünü randevu evi veya kumarhane veya benzeri yer olarak \nkullanmak suretiyle ahlak ve adaba aykırı harekette bulunması.  \n(Değişik dördüncü fıkra: 14/11/2007-5711/12 md.) Bu maddedeki dava hakkı, devir \nkonusunda kat maliklerince alınan dava açma kararının öğrenilmesi tarihinden başlay arak altı \nay ve her halde dava hakkının doğumundan başlayarak beş yıl içinde kullanı lmazsa veya dava \nsebebi ortadan kalkmışsa düşer. \n \nB) Kat irtifakı sahiplerinin borçları:', '**Kat Mülkiyeti Kanunu**\nMadde 25 – Kat maliklerinden biri bu kanuna göre kendisine düşen borçları ve yü-\nkümleri yerine getirmemek suretiyle diğer kat maliklerinin haklarını, onlar için çekilmez hale \ngelecek derecede ihlal ederse, onlar, o kat malikinin müstakil bölümü üzerindeki mülkiyet \nhakkının kendilerine devredilmesini hakimden istiyebilirler.  \n(Değişik ikinci fıkra: 14/11/2007 -5711/12 md.) Bu gibi bir kat maliki hakkında, ba-\nğımsız böl ümün mülkiyetinin hükme en yakın tarihteki değeri o kat malikine ödenerek bu \nmülkiyetin diğer kat malikleri ne, arsa payları oranında devredilmesi için davanın açılması, \naksi kararlaştırı lmış olmadıkça, diğer kat maliklerinin sayı ve arsa payı çoğunluğuyla karar \nvermesine bağlıdır. Bu karara rağmen kat maliklerinden bir kısmı bu davayı açmak istemezse, \ndavayı öteki kat malikleri açar ve hâkim hüküm vermeden önce devir bedelinin ileride hak \nsahibine ödenmek üzere bankada üçer aylık vadeli hesaba yatırılması ve makbuzunun ibrazı \niçin davacılara resen belirleyeceği uygun bir süre verir. Devir bedelinin süresi içinde  yatırıldı-\nğına ilişkin belge ibraz edildiğinde ve davanın kabulü halinde hâkim, davalının bağımsız bö-\nlümünün mülkiyetinin davayı açmış olan kat maliklerine arsa payları oranında devredilmesine \nve devir bedelinin işlemiş faiziyle birlikte davalıya ödenmesine karar verir. \nAşağıdaki durumlarda, birinci fıkrada yazılı çekilmezlik, her halde mevcut farz edilir : \na) Ortak giderlerden ve avanstan kendine düşen borçları ödemediği için hakkında iki \ntakvim yılı içinde üç defa icra veya dava takibi yapılmasına sebep olunması; \nb) Anagayrimenkulün bulunduğu yerin sulh hakimi tarafından 33 üncü madde gere-\nğince verilen emre rağmen, bu kanunda yazılı borç ve yükümleri yerine getirmemek suretiyle \nöteki kat maliklerinin haklarını ihlal etmekte devamlı olarak bir yıl ısrar edilmesi; \nc) Kendi bağımsız bölümünü randevu evi veya kumarhane veya benzeri yer olarak \nkullanmak suretiyle ahlak ve adaba aykırı harekette bulunması.', '**Kat Mülkiyeti Kanunu**\nbankada kendi adına ve fakat anagayrimenkulün yönetici sıfatı gösterilmek suretiyle, hesap \naçtırılması; \nk) Kat malikleri kurulunun toplantıya çağırılması. \nl) (Ek: 4/4/2015 -6645/82 md.) Anagayrimenkulde bulunan asansörlerin güvenli bir \nşekilde işletilmesinin sağlanması amacıyla aylık bakımları ile yıllık kontrollerinin ilgili teknik \ndüzenlemelere uygun şekilde yaptırılması ve bu işlemlere ilişkin ücretlerin ödenmesi. \n(Ek fıkra: 4/4/2015-6645/82 md.) Bu Kanunun 34 üncü maddesinde belirtilen şartları \ntaşımasına rağmen yönetici ataması yapılmayan anagayrimenkulde, birinci fıkrada sayılan \nişlerin yaptırılmasından kat malikleri müştereken sorumludur. \n \n2. Defter tutulması ve belgelerin saklanması:', '**Kat Mülkiyeti Kanunu**\nMadde 44 – Anagayrimenkulün üstüne kat ilavesi veya mevcut çekme kat yerine tam \nkat yapılması veya zemin veya bodrum katlarında veya arsanın boş kısmında 24 üncü madd e-\nnin ikinci fıkrasında yazılı yerlerin sonradan yapımı veya ilavesi için: \na) Kat malikleri kurulunun buna oybirliğiyle karar vermesi; \nb) Anagayrimenkulün bu inşaattan sonra alacağı duruma göre, yapılan yeni ilaveler de \ndahil olmak üzere bütün bağımsız bölümlerine tahsis olunacak arsa paylarının, usulüne göre \nyeniden ve oybirliğiyle tesbit edilmesi; \nc) İlave edilecek yeni bağımsız bölüme tahsis edilen arsa payı üzerinde, tapu memuru \nhuzurunda yapılacak resmi senetle, 14 üncü maddeye göre kat irtifakı kurularak bunun, ana-\ngayrimenkulün bütün bağımsız bölümlerinin kat mülkiyeti kütüğündeki irtifaklar hanesine \ntescil edilmesi ve anagayrimenkulün kapanan eski kütük sayfasiyle 13 üncü madde hükmüne \ngöre bağlantı sağlanması; \nŞarttır. \nBu nitelikteki ilave ve genişletmelere muvafakat etmekle beraber kendisi katılmak is-\ntemiyen kat maliklerinin arsa paylarında n, bu ilaveler sebebiyle azalan kısmın, ilaveyi yaptı-\nranların bağımsız bölümlerine tahsisini kabul ettikleri, resmi senette belirtilir. \nBu takdirde, yeni bağımsız bölümün yapılmasına katılmıyan kat maliklerinin arsa pay-\nlarından yeni tahsis sebebiyle azalan kısmın bedeli kendilerine ödenmek şartiyle, yeni yapılan \nbağımsız bölüm, kat irtifakı kurulmasına dair olan eski resmi senet gereğince kat mülkiyetine \nçevrilerek onu yaptıranın mülkü veya yaptıranların ortak mülkü olur ve kat mülkiyeti kütüğ ü-\nnün ayrı bir sayfasına yeni malik veya malikler adına tescil edilir. \n \nG) Temliki tasarruflar ve önemli işler:', '**Kat Mülkiyeti Kanunu**\nMadde 42 – Kat malikleri,anagayrimenkulün ortak yerlerinde kendi başlarında bir deği-\nşiklik yapamazlar; ortak yerlerin düzgün veya bunları kullanmanın daha rahat ve kolay bir hale \nkonulmasına veya bu yerlerden elde edilecek faydanın çoğaltılmasına yarıyacak bütün yenilik \nve ilaveler, kat maliklerinin sayı ve arsa payı çoğunluğu ile verecekleri karar üzerine yapılır. \n(Ek fıkra: 1/7/2005 -5378/19 md.) Engellilerin yaşamı için zorunluluk göstermesi \nhâlinde, proje tadili kat maliklerinin en geç üç ay içerisinde yapacağı toplantıda görüşülerek \nsayı ve arsa payı ç oğunluğu ile karara bağlanır. Toplantının bu süre iç erisinde yapılamaması \nveya tadilat talebinin çoğunlukla kabul edilmemesi durumunda; ilgili kat malikinin talebi üze-\nrine bina güve nliğinin tehlikeye sokulmadığını bildirir komisyon raporuna istinaden ilgili \nmercilerden alınacak  tasdikli  proje değişikliği veya krokiye göre inşaat, onarım ve tesis yapı-\nlır. İlgili merciler, tasdikli proje değişikliği veya kroki taleplerini en geç altı ay içinde sonuç-\nlandırır.  Komisyonun teşkili, çalışma usûlü ile engellinin kullanımından sonraki süreç ile \nilgili usûl ve esaslar Bayındırlık ve İskan Bakanlığı ile Özürlüler İdaresi Başkanlığı tarafından \nmüştereken hazırlanacak yönetmelikle belirlenir.7 \nBu işlerin giderleri, yeniliklerden faydalananlar tarafından, faydalanma oranına göre, \nödenir. \n(Değişik dördüncü fıkra : 18/4/20 07-5627/16 md.) Kat maliklerinden birinin isteği \n                                                           \n7 25/4/2013 tarihli ve 6462 sayılı Kanunun 1 inci maddesiyle, bu fıkrada yer alan “Özürlülerin” ve \n“özürlünün” ibareleri sırasıyla “Engellilerin” ve “engellinin”  şeklinde değiştirilmiştir. \nüzerine ısı yalıtımı, ısıtma sisteminin yakıt dönüşümü ve ısıtma sisteminin merkezi sistemden \nferdi sisteme veya ferdi sistemden merkezi sisteme dönüştürülmesi, kat maliklerinin sayı ve \narsa payı çoğunl uğu i le verecekleri karar üzerine yapılır. Ancak toplam inşaat alanı ikibin', '**Kat Mülkiyeti Kanunu**\nMadde 20 – (Değişik birinci fıkra: 13/4/1983-2814/9 md.) Kat maliklerinden her biri \naralarında başka türlü anlaşma olmadıkça: \na) Kapıcı, kaloriferci, bahçıvan ve bekçi giderlerine ve bunlar için toplanacak avansa \neşit olarak; \nb) Anagayrimenkulün sigorta primlerine ve bütün  ortak yerlerin bak ım, koruma,  güç-\nlendirme ve onarım giderleri ile yönetici aylığı gibi diğer giderlere ve ortak tesislerin işletme \ngiderlerine ve giderler için toplanacak avansa kendi arsa payı oranında;4 \nKatılmakla yükümlüdür. \nc) Kat malikleri ortak yer veya tesisler üzer indeki kullanma hakkından vazgeçmek ve-\nya kendi bağımsız bölümünün durumu dolayısıyla bunlardan faydalanmaya lüzum ve ihtiyaç \nbulunmadığını ileri sürmek suretiyle bu gider ve avans payını ödemekten kaçınamaz. \n(Değişik: 13/4/1983-2814/9 md.) Gider veya avans  payını ödemeyen kat maliki hak-\nkında, diğer kat maliklerinden her biri veya yönetici tarafından, yönetim planına, bu K anuna \nve genel hükümlere göre dava açılabilir, icra takibi yapılabilir. Gider ve avans payının tama-\nmını ödemeyen kat maliki ödemede gecikt iği günler için aylık yüzde beş hesabıyla g ecikme \ntazminatı ödemekle yükümlüdür.5 \nBirinci fıkradaki giderlere, kat maliklerinden birinin veya onun bağımsız bölümünden \nherhangi bir suretle faydalanan kişinin kusurlu bir hareketi sebep olmuşsa, gidere katıla nların \nyaptıkları ödemeler için o kat malikine veya gidere sebep olanlara rücu hakları vardır.  \n \n                                                           \n4 14/11/2007 tarihli ve 5711 sayılı Kanunun 9 uncu maddesiyle bu bentte yer alan ""koruma"" ibaresinden \nsonra gelmek üzere "", güçlendirme"" ibaresi eklenmiştir. \n5 14/11/2007 tarihli ve 5711 sayılı Kanunun 9 uncu maddesiyle bu fıkrada yer alan ""yüzde on"" ibaresi \n""yüzde beş"" olarak değiştirilmiştir. \nIV - Sigorta anlaşması:', '**Kat Mülkiyeti Kanunu**\nMadde 4 \n \n14/4/1983 \n3227 Sekizinci Bölüm, 57, 58, 59, \n60, 61, 62, 63, 64, 65   25/6/1985 \nKHK/431 42 13/2/1991 \n3770 42 11/2/1992 \n5378 42 7/7/2005 \n5627 42 2/5/2007 \n5711 \n3, 4, 10, 11, 12, 13, 14, 18, 19, \n20, 22, 23, 25, 26, 29, 30, 31, \n33, 34, 38, 47, 54, Dokuzuncu \nBölüm, 66 ila 74, Geçici Mad-\nde 1, İşlenemeyen Hükümler \n(Geçici Madde 1, 2 ve 3) \n28/11/2007 \n5912 3, 12, 14, Geçici Madde 1, Ge-\nçici Madde 2 7/7/2009 \n6111 24 25/2/2011 \n6462 42 3/5/2013 \n6645 35 23/4/2015 \n7099 10, 12, 14 10/3/2018 \n7181 Ek Madde 5 10/7/2019 \n7327 10, 14, Geçici Madde 1 19/6/2021 \n7392 59 1/4/2022', '**Kat Mülkiyeti Kanunu**\nMadde 24 – Anagayrimenkulün, kütükte mesken, iş veya ticaret yeri olarak gösterilen \nbağımsız bir bölümünde hastane, dispanser, klinik, p oliklinik, ecza laboratuvarı gibi müesse-\nseler kurulamaz; kat malikler inin buna aykırı sözleşmeleri hükümsüzdür; dispanser, klinik, \npoliklinik niteliğinde olmıyan muayenehaneler bu hükmün dışındadır.  \nAnagayrimenkulün, kütükte mesken olarak gösterilen bağımsız bir bölümünde sinema, \ntiyatro, kahvehane, gazino, pavyon, bar, kulüp, dans salonu ve emsali gibi eğlence ve toplantı \nyerleri ve fırın, lokanta, pastahane, süthane gibi gıda ve beslenme yerleri ve imalathane, bo-\nyahane, basımevi, dükkan, galeri ve çarşı gibi yerler, ancak kat malikleri kurulunun oybirliği \nile vereceği kararla açılabilir. \n(Ek fıkra: 13/2/2011 -6111/194 md.) 1136 sayılı Avukatlık Kanununda avukatlık bü-\nroları ve hukuk büroları ile ilgili düzenleme yapılıncaya kadar meskenlerdeki avukatlık ve \nhukuk büroları faaliyetlerine devam ederler. Bu süre, bu maddenin yürürlüğe girdiği tarihten \nitibaren iki yıldır. Bu hüküm 3568 sayılı Serbest Muhasebeci Mali Müşavirlik ve Yeminli \nMali Müşavirlik Kanununda ilgili düzenleme yapılıncaya kadar meslek mensupl arı tarafından \naçılan bürolar hakkında da uygulanır. \nBu karar yöneticinin veya kat maliklerinden birinin istemi üzerine bütün bağımsız bö-\nlümlerin kat mülkiyeti kütüğündeki sahifelerine şerh verilir. \n \nVIII - Kat mülkiyetinin devri mecburiyeti:', '**Kat Mülkiyeti Kanunu**\nMadde 4 – Ortak yerlerin konusu sözleşme ile belirtilebilir. Aşağıda yazılı yerler ve \nşeyler bu Kanun gereğince her halde ortak yer sayılır. \na) Temeller ve ana duvarlar, taşıyıcı sistemi oluşturan kiriş, kolon ve perde duvarlar ile \ntaşıyıcı sistemin parçası diğer elemanlar, bağımsız bölümleri ayıran ortak duvarlar, tavan ve \ntabanlar, avlular, genel giriş kapıları, antreler, merdivenler, asansörler, sahanlıklar, koridorlar \nve buralardaki genel tuvalet ve lavabolar, kapıcı daire veya odaları, genel çamaşırlık ve çam a-\nşır kurutma yerleri, genel kömürlük ve ortak garajlar, elektrik, su ve havagazı saatlerinin ko-\nrunmasına mahsus olup bağımsız bölüm dışında bulunan yuvalar ve kapalı  kısımlar, kalorifer \ndaireleri, kuyu ve sarnıçlar, yapının genel su depoları, sığınaklar,1 \nb) Her kat malikinin kendi bölümü dışındaki kanalizasyon tesisleri ve çöp kanalları ile \nkalorifer, su, havagazı ve elektrik tesisleri, telefon, radyo ve televizyon i çin ortak şebeke ve \nantenler sıcak ve soğuk hava tesisleri, \nc) Çatılar, bacalar, genel dam terasları, yağmur olukları, yangın emniyet merdivenleri. \nYukarıda sayılanların dışında kalıp da, yine ortaklaşa kullanma, korunma veya fayda-\nlanma için zaruri olan diğer yerler ve şeyler de (Ortak yer) konusuna girer. \n \nB) Bağlantılar : \nI - Bağımsız bölümlerle arsa payı arasındaki bağlantı:', '**Kat Mülkiyeti Kanunu**\nMadde 14 – (Değişik birinci fıkra: 23/6/2009 -5912/3 md.) Henüz yapı yapılmamış \nveya yapısı tamamlanmamış bir arsa üzerinde kat irtifakının kurulması ve tapu siciline tescil \nedilmesi için o arsanın malikinin veya bütün paydaşlarının buna ait istem ile birlikte 12 nci \nmaddenin birinci fıkrasının (a) bendine uygun olarak düzenlenen, yetkili kamu kurum ve ku-\nruluşlarınca anagayrimenkulün maliki veya bütün paydaşlarının imzaları alınarak onaylanan \nve elektronik ortamda tapu müdürlüğüne gönderilen  proje ile (b) bendindeki yönetim plânını \ntapu idaresine vermeleri lazımdır. Kat mülkiyetine geçişte ayrıca yönetim plânı istenmez.3 \nBir arsa üzerinde kat irtifakları ancak sözleşmede veya dilekçede her kat irtifak ının il-\ngili bulunduğu bağımsız bölüme tahsisi istenen arsa payı, arsanın kayıtlı olduğu kütüğün (Be-\nyanlar) hanesinde belirtilmek suretiyle kurulur ve yapının, verilen projeye göre tama mlanma-\nsından sonra kat mülkiyetine konu olacak bağımsız bölümlerinin num arası ve bu bölümlere \nbağlı eklentiler kütüğün beyanlar hanesinde belirtilir. \n                                                           \n3 15/2/2018 tarihli ve 7099 sayılı Kanunun 6 ncı maddesiyle; bu fıkrada yer alan “12 nci maddenin \n(a) bendine uygun olarak düzenlenen” ibaresi “12 nci maddenin birinci fıkrasının (a) be ndine uygun \nolarak düzenlenen, yetkili kamu kurum ve kuruluşlarınca anagayrimenkulün maliki veya bütün pay-\ndaşlarının imzaları alınarak onaylanan ve elektronik ortamda tapu müdürlüğüne gönderilen” şeklinde \ndeğiştirilmiştir. \n(Değişik üçüncü fıkra: 23/6/2009-5912/3 md.) (Mülga fıkra:9/6/2021-7327/12 md.)  \n(Ek fıkra: 14/11/2007-5711/7 md.; Mülga: 23/6/2009-5912/3 md.)  \n \nÜÇÜNCÜ BÖLÜM \nKat Maliklerinin ve Kat İrtifakı Sahiplerinin Hakları \nA) Kat maliklerinin hakları: \nI - Bağımsız bölüm üzerinde:', '**Kat Mülkiyeti Kanunu**\nMadde 23 – Kat maliklerinden birinin bağımsız bölümünde veya bu bölümdeki tesis-\nlerde meydana gelen bir hasar veya bozukluğun onarımı veya giderilmes i veya tesislerin ye-\nniden yapılması ile yapı güvenliğiyle ilgili olarak yapılması gerekli görülen teknik inceleme-\nler için diğer bir bağımsız bölüme girmek gerekiyorsa, o bölümün maliki veya o bölümde \nbaşka sıfatla otura nlar, giriş müsaadesi vermeye ve böl ümde gerekli işlerin yapılmasına ka t-\nlanmaya mecburdurlar.6 \n                                                           \n6 14/11/2007 tarihli ve 5711 sayılı Kanunun 11 inci maddesiyle; bu fıkrada yer alan ""tesislerin yeniden \nyapılması"" ibaresinden sonra gelmek üzere ""ile yapı güvenliğiyle ilgili olarak yapılması gerekli görülen \nteknik incelemeler"" ibaresi eklenmiştir. \nAnagayrimenkulün bir kısmının harap olması halinde, harap olan bağımsız bölüm ve \neklentilerinin veya ortak yerlerin veya bağımsız bölümdeki tesislerin yeniden yapılması için, \nsağlam kalan bağımsız bölümlerin içinden veya dışından faydalanılması gerekiyorsa, o bö-\nlümlerin malikleri veya orada başka sıfatla oturanlar buna müsaade etmeye mecburdurlar. \nYukarıdaki fıkralarda yazılı müsaade yüzünden, kat maliklerinin veya orada başka sı-\nfatla oturanların uğrayacakları zararı, lehine müsaade verilen bağımsız bölüm malikleri derhal \nödemekle yükümlüdürler.  \n \nVII - Yasak işler:', '**Kat Mülkiyeti Kanunu**\nGeçici Madde 1 – Bu Kanun gereğince hazırlanması gereken yönetmel ik, Kanunun \nyürürlüğe girdiği tarihten itibaren altı ay içinde hazırlanır. \n \nGeçici Madde 2 – 13/4/1983 tarihli ve 2814 sayılı Kanunun yürürlüğe girdiği tarihten \nönce kat irtifakı kurulmuş binalarda yönetim plânı olmasa dahi 12 nci madde hükümlerine \ngöre kat mülkiyeti kurulur. \n \nGeçici Madde 3 – Bu Kanunun yürürlüğe girmesinden önce kurulan toplu yapılara ait \nyönetim plânları, yürürlük tarihinden itibaren en geç altı ay içinde bu Kanun hükümlerine \nuyarlanır. Yönetim plânında bu yönde değişiklik yapılması için  mevcut kat malikleri kurul u-\nnun salt çoğunluğu yeterlidir. Mevcut toplu yapı yönetimleri, yönetim plânı değişip buna göre \nyönetici seçilene kadar geçici yönetim olarak görevini sürdürür. Toplu yapı yöneticisi seçimi, \nen geç yönetim plânının değişimini takip eden üç ay içinde yapılır. \n634 SAYILI KANUNA EK VE DEĞİŞİKLİK GETİREN MEVZUATIN \nYÜRÜRLÜĞE GİRİŞ TARİHLERİNİ GÖSTERİR TABLO \n \nDeğiştiren Kanunun/ \nKHK’nin Numarası \n634 Sayılı Kanunun Değişen \nveya İptal Edilen Maddeleri Yürürlüğe Giriş Tarihi \n1166 51 2/1/1969 \n2814 \n2, 3, 8, 12, 13, 14, 17, 19, 20, \n22, 28, 37, 40, 49, Ek Madde 1,']","Evet, komşunuz evini randevu evi veya kumarhane olarak kullanıyorsa, bu durum Kat Mülkiyeti Kanunu'na aykırıdır. Kat Mülkiyeti Kanunu Madde 25'e göre, bir kat malikinin bağımsız bölümünü randevu evi veya kumarhane gibi yerler olarak kullanması, ahlak ve adaba aykırı bir durum teşkil eder.

Bu durumu çözmek için öncelikle apartman veya site yönetimi ile iletişime geçmeniz faydalı olabilir. Yönetim, bu konuda gerekli önlemleri almakla yükümlü olup, durumu kat malikleri kurulu toplantısında gündeme getirebilir. Eğer yönetim bu konuda bir adım atmazsa, sizin ve diğer kat maliklerinin ortak kararı ile hukuki süreç başlatılabilir. Sorununuzun çözülmesi için mahkemeye başvurarak, kullanıma son verilmesini talep edebilirsiniz. 

Eğer komşunuzun durumu uzarsa, yasal yollara başvurmanız gerekebilir. Bu tür bir durumla karşılaştığınızda, bir hukuk danışmanından da destek almanız önemli olabilir.","Bir kat maliki dairesini randevu evi veya kumarhane olarak kullanarak ahlak ve adaba aykırı harekette bulunursa, diğer kat malikleri o dairenin mülkiyetinin kendilerine devredilmesini hakimden isteyebilirler (Çekilmezlik hali).",0.6666666666666666,0.4597376655479723,0.86434490571323
"Kiracıyım, kirayı en geç ne zaman ödemem gerekir?","['**Türk Borçlar Kanunu (İlgili Maddeler)**\nya\t da\tönemli\t ölçüde\t engellemesi\t ve\t verilen\t sürede\t giderilmemesi\t hâlinde\t kiracı,\t sözleşmeyi\tfeshedebilir. Kiraya veren, kiralanandaki ayıbı gidermek yerine, uygun bir süre içinde ayıpsız benzeriyle değiştirebilir. Kiraya veren, kiracıya aynı malın ayıpsız bir benzerini hemen vererek ve uğradığı zararın tamamını gidererek, onun seçimlik haklarını kullanmasını önleyebilir.', '**Türk Borçlar Kanunu (İlgili Maddeler)**\n3. Yapı malikinin sorumluluğu a. Giderim yükümlülüğü MADDE\t 69- Bir binanın veya diğer yapı eserlerinin maliki, bunların yapımındaki bozukluklardan veya bakımındaki eksikliklerden doğan zararı gidermekle yükümlüdür. İntifa ve oturma hakkı sahipleri de, binanın bakımındaki eksikliklerden doğan zararlardan, malikle birlikte müteselsilen sorumludurlar. Sorumluların, bu sebeplerle kendilerine karşı sorumlu olan diğer kişilere rücu hakkı saklıdır.   b. Zarar tehlikesini önleme MADDE\t 70- Bir başkasına ait bina veya\t diğer\t yapı\t eserlerinden\t zarar\t görme\ttehlikesiyle\tkarşılaşan\tkişi, bu tehlikenin giderilmesi için gerekli önlemlerin alınmasını hak sahiplerinden isteyebilir. Kişilerin\tve\tmalların\tkorunması\thakkındaki\tkamu\thukuku\tkuralları\tsaklıdır.  2. Kiralananın sonradan ayıplı hâle gelmesinden sorumluluk a. Genel olarak MADDE\t 305-\tKiralanan sonradan ayıplı duruma gelirse kiracı, kiraya verenden ayıpların giderilmesini veya kira bedelinden ayıpla orantılı bir indirim yapılmasını ya da zararının giderilmesini isteyebilir. Ancak, zararın giderilmesi istemi diğer seçimlik hakların kullanılmasını önlemez. Önemli ayıp durumunda kiracının sözleşmeyi fesih hakkı saklıdır.   b. Ayıbın giderilmesini isteme ve fesih MADDE\t 306-\tKiracı, kiraya verenden kiralanandaki ayıbın uygun bir sürede giderilmesini isteyebilir; bu sürede ayıp giderilmezse kiracı, ayıbı kiraya veren hesabına gidertebilir ve bundan doğan alacağını kira bedelinden indirebilir veya kiralananın ayıpsız bir benzeri ile değiştirilmesini isteyebilir. Ayıbın,\t kiralananın\t öngörülen\t kullanıma\t elverişliliğini\t ortadan\t kaldırması\t ya\t da\tönemli\t ölçüde\t engellemesi\t ve\t verilen\t sürede\t giderilmemesi\t hâlinde\t kiracı,\t sözleşmeyi\tfeshedebilir. Kiraya veren, kiralanandaki ayıbı gidermek yerine, uygun bir süre içinde ayıpsız benzeriyle değiştirebilir. Kiraya veren, kiracıya aynı malın ayıpsız bir benzerini hemen vererek ve uğradığı zararın tamamını gidererek, onun seçimlik haklarını kullanmasını önleyebilir.', '**Türk Borçlar Kanunu (İlgili Maddeler)**\nD. Kiracının borçları I. Kira bedelini ödeme borcu 1. Genel olarak MADDE\t313-\tKiracı, kira bedelini ödemekle yükümlüdür. \t 2. İfa zamanı MADDE\t 314-\tKiracı, aksine sözleşme ve yerel âdet olmadıkça, kira bedelini ve gerekiyorsa yan giderleri, her ayın sonunda ve en geç kira süresinin bitiminde ödemekle yükümlüdür.   3. Kiracının temerrüdü MADDE\t 315-\tKiracı, kiralananın tesliminden sonra muaccel olan kira bedelini veya yan gideri ödeme borcunu ifa etmezse, kiraya veren kiracıya yazılı olarak bir süre verip, bu sürede de ifa etmeme durumunda, sözleşmeyi feshedeceğini bildirebilir. Kiracıya verilecek süre en az on gün, konut ve çatılı işyeri kiralarında ise en az otuz gündür. Bu süre, kiracıya yazılı bildirimin yapıldığı tarihi izleyen günden itibaren işlemeye başlar.   II. Özenle kullanma ve komşulara saygı gösterme borcu MADDE\t 316-\tKiracı, kiralananı, sözleşmeye uygun olarak özenle kullanmak ve kiralananın bulunduğu taşınmazda oturan kişiler ile komşulara gerekli saygıyı göstermekle yükümlüdür. Kiracının bu yükümlülüğüne aykırı davranması durumunda kiraya veren, konut ve çatılı işyeri kirasında, en az otuz gün süre vererek, aykırılığın giderilmesi, aksi takdirde sözleşmeyi feshedeceği konusunda yazılı bir ihtarda bulunur. Diğer kira ilişkilerinde ise, kiraya veren, kiracıya önceden bir ihtarda bulunmaksızın, yazılı bir bildirimle sözleşmeyi hemen feshedebilir. Konut\tve\tçatılı\tişyeri\tkirasında,\tkiracının\tkiralanana\tkasten\tağır\tbir\tzarar\tvermesi,\tkiracıya\tverilecek\tsürenin\tyararsız\tolacağının\tanlaşılması\tveya\tkiracının\tbu\tyükümlülüğe\taykırı\t davranışının\t kiraya\t veren\t veya\t aynı\t taşınmazda\t oturan\t kişiler\t ile\t komşular\tbakımından\tçekilmez\tolması\tdurumlarında\tkiraya\tveren,\tyazılı\tbir\tbildirimle\tsözleşmeyi\themen\tfeshedebilir. \t III. Temizlik ve bakım giderlerini ödeme borcu MADDE\t 317- Kiracı, kiralananın olağan kullanımı için gerekli temizlik ve bakım giderlerini ödemekle yükümlüdür. Bu konuda yerel âdete de bakılır.']","Evet, kirayı en geç her ayın sonunda ödemeniz gerekmektedir. Türk Borçlar Kanunu'nun 314. maddesi uyarınca, kiracı, aksine bir sözleşme hükmü ve yerel adet olmadıkça, kira bedelini ve gerekiyorsa yan giderleri her ayın sonunda ve en geç kira süresinin bitiminde ödemekle yükümlüdür. 

Bu durumda, kirayı ödemek için geç kalan bir durumla karşılaşırsanız, kiraya verenin size önceden yazılı bildirimde bulunarak bir süre tanıması gerektiğini de belirtmekte fayda var. Bu süre, konut ve çatılı işyeri kiralarında en az otuz gün olmalıdır.","Aksine bir sözleşme veya yerel âdet yoksa, kira bedelini her ayın sonunda ve en geç kira süresinin bitiminde ödemekle yükümlüsünüz.",1.0,0.7197433586993194,0.614781455115217
Evde sonradan bir ayıp (kusur) çıkarsa kiracı olarak haklarım nelerdir?,"['**Türk Borçlar Kanunu (İlgili Maddeler)**\n3. Yapı malikinin sorumluluğu a. Giderim yükümlülüğü MADDE\t 69- Bir binanın veya diğer yapı eserlerinin maliki, bunların yapımındaki bozukluklardan veya bakımındaki eksikliklerden doğan zararı gidermekle yükümlüdür. İntifa ve oturma hakkı sahipleri de, binanın bakımındaki eksikliklerden doğan zararlardan, malikle birlikte müteselsilen sorumludurlar. Sorumluların, bu sebeplerle kendilerine karşı sorumlu olan diğer kişilere rücu hakkı saklıdır.   b. Zarar tehlikesini önleme MADDE\t 70- Bir başkasına ait bina veya\t diğer\t yapı\t eserlerinden\t zarar\t görme\ttehlikesiyle\tkarşılaşan\tkişi, bu tehlikenin giderilmesi için gerekli önlemlerin alınmasını hak sahiplerinden isteyebilir. Kişilerin\tve\tmalların\tkorunması\thakkındaki\tkamu\thukuku\tkuralları\tsaklıdır.  2. Kiralananın sonradan ayıplı hâle gelmesinden sorumluluk a. Genel olarak MADDE\t 305-\tKiralanan sonradan ayıplı duruma gelirse kiracı, kiraya verenden ayıpların giderilmesini veya kira bedelinden ayıpla orantılı bir indirim yapılmasını ya da zararının giderilmesini isteyebilir. Ancak, zararın giderilmesi istemi diğer seçimlik hakların kullanılmasını önlemez. Önemli ayıp durumunda kiracının sözleşmeyi fesih hakkı saklıdır.   b. Ayıbın giderilmesini isteme ve fesih MADDE\t 306-\tKiracı, kiraya verenden kiralanandaki ayıbın uygun bir sürede giderilmesini isteyebilir; bu sürede ayıp giderilmezse kiracı, ayıbı kiraya veren hesabına gidertebilir ve bundan doğan alacağını kira bedelinden indirebilir veya kiralananın ayıpsız bir benzeri ile değiştirilmesini isteyebilir. Ayıbın,\t kiralananın\t öngörülen\t kullanıma\t elverişliliğini\t ortadan\t kaldırması\t ya\t da\tönemli\t ölçüde\t engellemesi\t ve\t verilen\t sürede\t giderilmemesi\t hâlinde\t kiracı,\t sözleşmeyi\tfeshedebilir. Kiraya veren, kiralanandaki ayıbı gidermek yerine, uygun bir süre içinde ayıpsız benzeriyle değiştirebilir. Kiraya veren, kiracıya aynı malın ayıpsız bir benzerini hemen vererek ve uğradığı zararın tamamını gidererek, onun seçimlik haklarını kullanmasını önleyebilir.', '**Türk Borçlar Kanunu (İlgili Maddeler)**\nya\t da\tönemli\t ölçüde\t engellemesi\t ve\t verilen\t sürede\t giderilmemesi\t hâlinde\t kiracı,\t sözleşmeyi\tfeshedebilir. Kiraya veren, kiralanandaki ayıbı gidermek yerine, uygun bir süre içinde ayıpsız benzeriyle değiştirebilir. Kiraya veren, kiracıya aynı malın ayıpsız bir benzerini hemen vererek ve uğradığı zararın tamamını gidererek, onun seçimlik haklarını kullanmasını önleyebilir.', '**Türk Borçlar Kanunu (İlgili Maddeler)**\nD. Kiracının borçları I. Kira bedelini ödeme borcu 1. Genel olarak MADDE\t313-\tKiracı, kira bedelini ödemekle yükümlüdür. \t 2. İfa zamanı MADDE\t 314-\tKiracı, aksine sözleşme ve yerel âdet olmadıkça, kira bedelini ve gerekiyorsa yan giderleri, her ayın sonunda ve en geç kira süresinin bitiminde ödemekle yükümlüdür.   3. Kiracının temerrüdü MADDE\t 315-\tKiracı, kiralananın tesliminden sonra muaccel olan kira bedelini veya yan gideri ödeme borcunu ifa etmezse, kiraya veren kiracıya yazılı olarak bir süre verip, bu sürede de ifa etmeme durumunda, sözleşmeyi feshedeceğini bildirebilir. Kiracıya verilecek süre en az on gün, konut ve çatılı işyeri kiralarında ise en az otuz gündür. Bu süre, kiracıya yazılı bildirimin yapıldığı tarihi izleyen günden itibaren işlemeye başlar.   II. Özenle kullanma ve komşulara saygı gösterme borcu MADDE\t 316-\tKiracı, kiralananı, sözleşmeye uygun olarak özenle kullanmak ve kiralananın bulunduğu taşınmazda oturan kişiler ile komşulara gerekli saygıyı göstermekle yükümlüdür. Kiracının bu yükümlülüğüne aykırı davranması durumunda kiraya veren, konut ve çatılı işyeri kirasında, en az otuz gün süre vererek, aykırılığın giderilmesi, aksi takdirde sözleşmeyi feshedeceği konusunda yazılı bir ihtarda bulunur. Diğer kira ilişkilerinde ise, kiraya veren, kiracıya önceden bir ihtarda bulunmaksızın, yazılı bir bildirimle sözleşmeyi hemen feshedebilir. Konut\tve\tçatılı\tişyeri\tkirasında,\tkiracının\tkiralanana\tkasten\tağır\tbir\tzarar\tvermesi,\tkiracıya\tverilecek\tsürenin\tyararsız\tolacağının\tanlaşılması\tveya\tkiracının\tbu\tyükümlülüğe\taykırı\t davranışının\t kiraya\t veren\t veya\t aynı\t taşınmazda\t oturan\t kişiler\t ile\t komşular\tbakımından\tçekilmez\tolması\tdurumlarında\tkiraya\tveren,\tyazılı\tbir\tbildirimle\tsözleşmeyi\themen\tfeshedebilir. \t III. Temizlik ve bakım giderlerini ödeme borcu MADDE\t 317- Kiracı, kiralananın olağan kullanımı için gerekli temizlik ve bakım giderlerini ödemekle yükümlüdür. Bu konuda yerel âdete de bakılır.']","Evet, kiracı olarak evde sonradan bir ayıp (kusur) çıkması durumunda belirli haklarınız vardır. Bu haklar, Türk Borçlar Kanunu'nun ilgili maddelerine dayanmaktadır.

Kiracı, kiralanan gayrimenkulde sonradan meydana gelen ayıplar için kiraya verenden şu taleplerde bulunabilir: Ayıpların giderilmesini istemek veya kira bedelinden ayıpla orantılı bir indirim yapılmasını talep etmek ya da zararın tazmini için başvuruda bulunmak. Önemli bir ayıp durumunda ise, kiracı sözleşmeyi feshetme hakkına da sahiptir.

Ayıbın giderilmesini isteme hakkınız vardır ve bunun için kiraya verene uygun bir süre verilir. Eğer bu süre içinde ayıp giderilmezse, kiracı ayıbı kendi hesabına giderip giderlerinizi kira bedelinden düşebilirsiniz. Ayrıca, kiralananın önemli ölçüde kullanıma elverişliliği ortadan kalkarsa ve ayıp giderilmezse, sözleşmeyi feshetme hakkınız bulunmaktadır. 

Kiraya veren, ayıbı gidermek yerine, belirlenen süre içinde ayıpsız bir benzeri ile değiştirme hakkına sahiptir. Ancak, kiracı bu durumda da seçim haklarını kullanabilir.","Kiraya verenden ayıbın giderilmesini isteyebilir, kira bedelinden indirim talep edebilir veya zararının giderilmesini isteyebilirsiniz. Önemli bir ayıp durumunda sözleşmeyi feshetme hakkınız da saklıdır.",1.0,0.830306613936758,0.49455256138540005
Kiracı komşulara saygısızlık yaparsa ev sahibi ne yapabilir?,"['**Türk Borçlar Kanunu (İlgili Maddeler)**\nD. Kiracının borçları I. Kira bedelini ödeme borcu 1. Genel olarak MADDE\t313-\tKiracı, kira bedelini ödemekle yükümlüdür. \t 2. İfa zamanı MADDE\t 314-\tKiracı, aksine sözleşme ve yerel âdet olmadıkça, kira bedelini ve gerekiyorsa yan giderleri, her ayın sonunda ve en geç kira süresinin bitiminde ödemekle yükümlüdür.   3. Kiracının temerrüdü MADDE\t 315-\tKiracı, kiralananın tesliminden sonra muaccel olan kira bedelini veya yan gideri ödeme borcunu ifa etmezse, kiraya veren kiracıya yazılı olarak bir süre verip, bu sürede de ifa etmeme durumunda, sözleşmeyi feshedeceğini bildirebilir. Kiracıya verilecek süre en az on gün, konut ve çatılı işyeri kiralarında ise en az otuz gündür. Bu süre, kiracıya yazılı bildirimin yapıldığı tarihi izleyen günden itibaren işlemeye başlar.   II. Özenle kullanma ve komşulara saygı gösterme borcu MADDE\t 316-\tKiracı, kiralananı, sözleşmeye uygun olarak özenle kullanmak ve kiralananın bulunduğu taşınmazda oturan kişiler ile komşulara gerekli saygıyı göstermekle yükümlüdür. Kiracının bu yükümlülüğüne aykırı davranması durumunda kiraya veren, konut ve çatılı işyeri kirasında, en az otuz gün süre vererek, aykırılığın giderilmesi, aksi takdirde sözleşmeyi feshedeceği konusunda yazılı bir ihtarda bulunur. Diğer kira ilişkilerinde ise, kiraya veren, kiracıya önceden bir ihtarda bulunmaksızın, yazılı bir bildirimle sözleşmeyi hemen feshedebilir. Konut\tve\tçatılı\tişyeri\tkirasında,\tkiracının\tkiralanana\tkasten\tağır\tbir\tzarar\tvermesi,\tkiracıya\tverilecek\tsürenin\tyararsız\tolacağının\tanlaşılması\tveya\tkiracının\tbu\tyükümlülüğe\taykırı\t davranışının\t kiraya\t veren\t veya\t aynı\t taşınmazda\t oturan\t kişiler\t ile\t komşular\tbakımından\tçekilmez\tolması\tdurumlarında\tkiraya\tveren,\tyazılı\tbir\tbildirimle\tsözleşmeyi\themen\tfeshedebilir. \t III. Temizlik ve bakım giderlerini ödeme borcu MADDE\t 317- Kiracı, kiralananın olağan kullanımı için gerekli temizlik ve bakım giderlerini ödemekle yükümlüdür. Bu konuda yerel âdete de bakılır.', '**Türk Borçlar Kanunu (İlgili Maddeler)**\n3. Yapı malikinin sorumluluğu a. Giderim yükümlülüğü MADDE\t 69- Bir binanın veya diğer yapı eserlerinin maliki, bunların yapımındaki bozukluklardan veya bakımındaki eksikliklerden doğan zararı gidermekle yükümlüdür. İntifa ve oturma hakkı sahipleri de, binanın bakımındaki eksikliklerden doğan zararlardan, malikle birlikte müteselsilen sorumludurlar. Sorumluların, bu sebeplerle kendilerine karşı sorumlu olan diğer kişilere rücu hakkı saklıdır.   b. Zarar tehlikesini önleme MADDE\t 70- Bir başkasına ait bina veya\t diğer\t yapı\t eserlerinden\t zarar\t görme\ttehlikesiyle\tkarşılaşan\tkişi, bu tehlikenin giderilmesi için gerekli önlemlerin alınmasını hak sahiplerinden isteyebilir. Kişilerin\tve\tmalların\tkorunması\thakkındaki\tkamu\thukuku\tkuralları\tsaklıdır.  2. Kiralananın sonradan ayıplı hâle gelmesinden sorumluluk a. Genel olarak MADDE\t 305-\tKiralanan sonradan ayıplı duruma gelirse kiracı, kiraya verenden ayıpların giderilmesini veya kira bedelinden ayıpla orantılı bir indirim yapılmasını ya da zararının giderilmesini isteyebilir. Ancak, zararın giderilmesi istemi diğer seçimlik hakların kullanılmasını önlemez. Önemli ayıp durumunda kiracının sözleşmeyi fesih hakkı saklıdır.   b. Ayıbın giderilmesini isteme ve fesih MADDE\t 306-\tKiracı, kiraya verenden kiralanandaki ayıbın uygun bir sürede giderilmesini isteyebilir; bu sürede ayıp giderilmezse kiracı, ayıbı kiraya veren hesabına gidertebilir ve bundan doğan alacağını kira bedelinden indirebilir veya kiralananın ayıpsız bir benzeri ile değiştirilmesini isteyebilir. Ayıbın,\t kiralananın\t öngörülen\t kullanıma\t elverişliliğini\t ortadan\t kaldırması\t ya\t da\tönemli\t ölçüde\t engellemesi\t ve\t verilen\t sürede\t giderilmemesi\t hâlinde\t kiracı,\t sözleşmeyi\tfeshedebilir. Kiraya veren, kiralanandaki ayıbı gidermek yerine, uygun bir süre içinde ayıpsız benzeriyle değiştirebilir. Kiraya veren, kiracıya aynı malın ayıpsız bir benzerini hemen vererek ve uğradığı zararın tamamını gidererek, onun seçimlik haklarını kullanmasını önleyebilir.', '**Türk Borçlar Kanunu (İlgili Maddeler)**\nya\t da\tönemli\t ölçüde\t engellemesi\t ve\t verilen\t sürede\t giderilmemesi\t hâlinde\t kiracı,\t sözleşmeyi\tfeshedebilir. Kiraya veren, kiralanandaki ayıbı gidermek yerine, uygun bir süre içinde ayıpsız benzeriyle değiştirebilir. Kiraya veren, kiracıya aynı malın ayıpsız bir benzerini hemen vererek ve uğradığı zararın tamamını gidererek, onun seçimlik haklarını kullanmasını önleyebilir.']","Ev sahibi, kiracının komşulara saygısızlık yapması durumunda çeşitli adımlar atabilir. Kiracının, kiralanan taşınmazda oturan kişiler ile komşulara gerekli saygıyı göstermesi gerektiği, Türk Borçlar Kanunu'nun 316. maddesinde belirtilmiştir. 

Eğer kiracı bu yükümlülüğüne aykırı davranıyorsa, ev sahibi önce kiracıya yazılı bir ihtarda bulunmalıdır. Bu ihtarda, kiracının saygısız davranışlarını düzeltmesi için en az 30 gün süre tanınır. Eğer kiracı belirtilen süre içinde durumu düzeltmezse, ev sahibi kiralama sözleşmesini feshedebilir.

Ayrıca, kiracının saygısız davranışlarının komşular bakımından çekilmez olması durumunda, ev sahibi ek bir ihtara gerek kalmadan sözleşmeyi hemen feshetme hakkına sahiptir. Yani, kiracının davranışları ciddi bir sorun teşkil ediyorsa, ev sahibi hızlı bir şekilde harekete geçebilir.","Konut ve çatılı işyeri kiralarında, kiracı komşulara saygı gösterme borcuna aykırı davranırsa, ev sahibi en az otuz gün süre vererek yazılı bir ihtarda bulunur. Aykırılık giderilmezse sözleşmeyi feshedebilir.",1.0,0.42783964543350433,0.9472469245965323
Apartman asansörünün bakımını ne sıklıkla yaptırmalıyız?,"['**Asansör İşletme ve Bakım Yönetmeliği**\nbinaya/yapıya ait yönetim bürosunda kalıcı olarak muhafaza eder. \n(4) Asansör monte eden veya onun yetkili servisi, insan can ve mal güvenliği yönünden \nasansörün risk taşıması durumunda bina sorumlusunu yazılı olarak bilgilendirir. Bina sorumlusu \nasansör monte eden veya onun yetkili servisi vasıtasıyla asansörün güv enli hale getirilmesini \nsağlamakla yükümlüdür. \n(5) Asansör monte eden veya onun yetkili servisi, asansörde yapılan aksam ve parça \ndeğişiklikleri ile bildirilen kazaları asansör kayıt defterine işler. \n(6) Bakım sözleşmesi yapıldıktan sonra asansör monte ede n veya onun yetkili servisi, \nbinadaki/yapıdaki asansör sayısı dikkate alınarak bina sorumlusunun belirleyeceği sayıda kişiye acil \ndurumlarda kurtarma çalışması konusunda yılda en az bir defa eğitim verir. Eğitim, yetkili servis \nteknik bakım ve onarım perso neli tarafından verilir. Verilen bu eğitim yetkili servis teknik sorumlusu \nve eğitimi veren kişi tarafından imzalanan bir tutanakla kayıt altına alınır ve tutanağın bir sureti bina \nsorumlusuna iletilir. Bina sorumlusu, eğitim alan kişi/kişilerin değişmesi halinde yeni kişi/kişilere \neğitim verilmesini sağlar. Kurtarma talimatının, kurtarma çalışmasını yapacak kişi/kişilerin kolaylıkla \ngörebilecekleri yerlerde muhafaza edilmesi ve amacına uygun hazırlanmış olması gerekir. \n(7) Asansör monte eden, piyasaya arz ettiği her tip ve özellikteki asansör için yedek aksam ve \nparçayı en az üç yıl süreyle temin etmekle yükümlüdür. \n(8) Asansör monte eden, kendisi tarafından piyasaya arz edilen asansöre bakım, onarım ve \nservis hizmeti veren bir başka asansör monte edenin ve ya onun yetkili servisinin veya bina \nsorumlusunun, yedek aksam veya parça ile asansörde bakım yapmayı mümkün kılacak her türlü cihaz \nve donanım talebini normal piyasa koşullarında sağlamak zorundadır. \n(9) Bakım, onarım, arıza giderme ve periyodik kontrol f aaliyetleri yürütülürken gerekli iş sağlığı', '**Asansör İşletme ve Bakım Yönetmeliği**\nservis hizmeti veren bir başka asansör monte edenin ve ya onun yetkili servisinin veya bina \nsorumlusunun, yedek aksam veya parça ile asansörde bakım yapmayı mümkün kılacak her türlü cihaz \nve donanım talebini normal piyasa koşullarında sağlamak zorundadır. \n(9) Bakım, onarım, arıza giderme ve periyodik kontrol f aaliyetleri yürütülürken gerekli iş sağlığı \nve güvenliği tedbirleri 20/6/2012 tarihli ve 6331 sayılı İş Sağlığı ve Güvenliği Kanunu ve ilgili mevzuat \nhükümleri doğrultusunda bina sorumlusu ile bakım sözleşmesi imzalayan asansör monte eden veya \nonun yetkili servisince alınır. \n(10) Bakım esnasında, bakım ve onarım işlerinden kaynaklı nedenlerle gerek teknik bakım ve \nonarım personelinin gerekse bakımla ilgisi bulunmayan kişi/kişilerin yaralanmasına veya ölümüne \nneden olabilecek ihmallere dair sorumluluk, bina sorumlusunun bakım sözleşmesi imzaladığı asansör \nmonte eden veya onun yetkili servisindedir. \n(11) Periyodik kontrol neticesinde güvensiz olarak tanımlanan ve kırmızı renkli bilgi etiketi \niliştirilen asansöre; kusurlu, hafif kusurlu veya kusursuz hale getir ilinceye kadar bakım hizmeti \nsunulamaz. Güvensiz olma durumundan, kusurlu duruma geçen ve periyodik kontrol tarihi başlangıç \nkabul edilerek yüz yirmi gün içerisinde hafif kusurlu veya kusursuz hale getirilmeyen asansöre de söz \nkonusu sürenin sona erdiği za man itibarıyla bakım hizmeti sunulamaz. Asansör monte eden veya \nonun yetkili servisi bu süre zarfında bina sorumlusundan aylık bakım ücreti talebinde bulunamaz. \n(12) Asansör monte eden veya onun yetkili servisi; bakım, onarım, arıza giderme ve periyodik \nkontrol faaliyetleri yürütülürken görevlendireceği teknik bakım ve onarım personeline ilişkin \ntanımlayıcı tüm bilgilerin bakım sözleşmesinde yer almasını sağlar. Teknik bakım ve onarım \npersoneline ilişkin değişiklik olması halinde, bu değişikliğe dair bilginin de söz konusu bakım \nsözleşmesinde yer alması ilgili asansör monte eden veya onun yetkili servisince sağlanır.', '**Asansör İşletme ve Bakım Yönetmeliği**\nBiten kayıt defteri, bina sorumlusu tarafından asa nsörün kullanım ömrü boyunca muhafaza edilir. \nKayıt defteri ile ilgili tüm gereklilikler halen kullanımda olan bütün asansörler için de geçerlidir. \n(4) Asansör bakım, onarım ve servis hizmeti sonrasında oluşan atığın bertaraf edilmesi \n9/8/1983 tarihli ve 2872 sayılı Çevre Kanununa uygun olarak yapılır. \n(5) Asansör Yönetmeliği (2014/33/AB) kapsamında piyasaya arz edilen veya kullanımda olan \nasansör/asansörler için yapılacak olan bakım sözleşmesinde/sözleşmelerinde, o asansöre/asansörlere \nyönelik herhangi bir  cihaz veya şifreleme gibi yöntemlerle engelleme veya kısıtlama yapılıp \nyapılmadığına dair bilginin yer alması asansör monte eden veya onun yetkili servisi tarafından \nsağlanır. \nBakımın kapsamı \nMADDE 9 – (1) Asansörün, asansörü oluşturan tüm aksam ve parçal arın bakımı asansör monte \neden tarafından hazırlanmış olan bakım kılavuzunda yer alan talimatlara ve                                  güncel \nTS EN 13015: Asansör ve Yürüyen Merdivenlerin Bakımı, Bakım Talimatları İçin Kurallar standardında \nbelirtilen gerekliliklere göre yapılır. \n(2) Bu Yönetmeliğe göre bakım; \na) Yağlama ve temizlemeyi, \nb) Kontrolleri, \nc) Kurtarma çalışmalarını, \nç) Ayarlama işlemlerini, \nd) Kullanıma veya yıpranmaya bağlı olarak meydana gelebilen bileşen onarımını veya \ndeğişimini, \nkapsar. \n(3) Bu Yönetmeliğe göre bakım; \na) Asansörün yerinin değiştirilmesini, \nb) Tahrik ünitesi, askı sistemi, taşıyıcı/kabin, durak kapısı ve/veya asansör güvenlik \naksamlarının değişimini, \nc) Asansör kumanda sisteminde yapılan değişiklikleri, \nç) İtfaiye tarafından yapılan kurtarma çalışmalarını, \nd) Asansör kuyusunun dış bölümlerinin temizlenmesini, \ne) Taşıyıcı/kabin iç kısmının temizlenmesini, \nkapsamaz. \n(4) 15/8/2004 tarihinden önce monte edilen ve ilgili mevzuata göre ilgili idare tarafından kayıt \naltına alınan a sansörün beyan yükünde ve/veya beyan hızında ve/veya seyir mesafesinde değişiklik', '**Asansör İşletme ve Bakım Yönetmeliği**\nonaylı tescil belgesi ilgili idare tarafından düzenlenir ve asansör monte edene sunulur. \n(7) İlgili idare, tescil başvurusun da ikinci fıkrada istenen belgelerin dışında asansör monte \nedenden herhangi bir belge talebinde bulunamaz. \nÜÇÜNCÜ BÖLÜM \nBakım, Bakımın Kapsamı ve Bakımla İlgili Diğer Hususlar \nBakım \nMADDE 8 – (1) Bu Yönetmelik kapsamında yer alan asansörün bakımı, bina sor umlusunun \nbakım sözleşmesi imzaladığı asansör monte eden veya onun yetkili servisi tarafından yapılır. Yapı \nkullanma izin belgesi alan ve amacına uygun olacak şekilde ilk kez kullanıma açılan binada/yapıda \nyasal olarak bina sorumlusu atanana kadar asansör yaptırıcısı ile asansör monte eden veya onun \nyetkili servisi arasında bakım sözleşmesi yapılır.  \n(2) Bakım sözleşmesinin birden fazla asansörü kapsaması durumunda, bakım hizmeti sunulacak \nher bir asansöre ait asansör kimlik numarası ve asansörün açık adresi bu sözleşmede belirtilir. \n(3) Piyasaya arz edilen asansörün beyan yükü, beyan hızı, tahrik türü, motor seri numarası ve \ngücü, halat ve/veya zincirler ile tip kontrol belgesi gerektiren aksam ve parçaların teknik özellikleri, \ntesis planları ve elektrik de vre şemaları ile asansör periyodik kontrol sonuçları ve kazaların kayıt \nedileceği asansör kayıt defteri, söz konusu asansörü piyasaya arz eden asansör monte eden \ntarafından sağlanır. Ayrıca asansörün kimlik numarası, piyasaya arz tarihi ve tescil tarihi as ansör kayıt \ndefterinde belirtilir. Asansör kayıt defterinin bitmesi durumunda, yeni defter bina sorumlusuyla \nbakım sözleşmesi imzalayan asansör monte eden veya onun yetkili servisi tarafından temin edilir. \nBiten kayıt defteri, bina sorumlusu tarafından asa nsörün kullanım ömrü boyunca muhafaza edilir. \nKayıt defteri ile ilgili tüm gereklilikler halen kullanımda olan bütün asansörler için de geçerlidir. \n(4) Asansör bakım, onarım ve servis hizmeti sonrasında oluşan atığın bertaraf edilmesi \n9/8/1983 tarihli ve 2872 sayılı Çevre Kanununa uygun olarak yapılır.', '**Asansör İşletme ve Bakım Yönetmeliği**\nh) Hizmet denetimi: Asansör monte edene veya onun yetkili servisine veya bina sorumlusuna \nyönelik Bakanlık tarafından yapılan denetimi, \nı) İlgili idare: Be lediyeleri veya belediye sınırları dışında kalan alanlardaki yapılar için il özel \nidarelerini, \ni) İktisadi işletmeci: Asansör monte edeni, asansör güvenlik aksamı imalatçısını, yetkili \ntemsilciyi, ithalatçıyı veya dağıtıcıyı, \nj) Kurtarma çalışması: Asansör  içerisinde insanın veya insanların mahsur kaldığına dair bilginin \nalınmasıyla birlikte kurtarma talimatına uygun olarak yapılan ve insanın veya insanların serbest \nkalmasıyla sonuçlanan çalışmayı, \nk) Mevcut asansör: 15/8/2004 tarihinden önce monte edilen v e halen kullanılmakta olan \nasansörü, \nl) Mesleki yeterlilik belgesi: Mesleki Yeterlilik Kurumu tarafından onaylanmış olan ve bireyin \nbilgi, beceri ve yetkinliğini ifade eden belgeyi, \nm) Muayene kuruluşu: Türkiye’de yerleşik özel veya kamu kuruluşlarından, TS EN ISO/IEC \n17020 standardına göre Türk Akreditasyon Kurumunca 4/5/2018 tarihli ve 30411 sayılı Resmî \nGazete’de yayımlanan Asansör Periyodik Kontrol Yönetmeliği kapsamında A tipi muayene kuruluşu \nolarak akredite edilen kuruluşu, \nn) Periyodik kontrol: Asansörün güvenli kullanımı ve işletme yönünden uygun çalışıp \nçalışmadığına dair yaptırılacak olan muayeneyi, \no) Piyasaya arz: Asansörün ticari veya kamu faaliyetleri kapsamında ücretli veya ücretsiz olarak \nkullanımının sağlanmasını, \nö) Ruhsat makamı: Belediyeleri veya belediye sınırları dışında kalan alanlardaki binalar/yapılar \niçin valilikleri veya ilgili mevzuat çerçevesinde yapı ruhsatı ve yapı kullanma izin belgesi verme \nyetkisine sahip kurum ve kuruluşları, \np) Ser vis teknik sorumlusu: Yetkili servis faaliyetlerini idari ve teknik olarak yöneten, gerekli \ndokümanları hazırlayan/hazırlatan ve yetkili servis adına yasal olarak temsil ve ilzama yetkili olan \nkişiyi,  \nr) Teknik bakım personeli: Yetkili servis bünyesinde a sansörlerde bakım, onarım ve servis işini', '**Asansör İşletme ve Bakım Yönetmeliği**\nç) İtfaiye tarafından yapılan kurtarma çalışmalarını, \nd) Asansör kuyusunun dış bölümlerinin temizlenmesini, \ne) Taşıyıcı/kabin iç kısmının temizlenmesini, \nkapsamaz. \n(4) 15/8/2004 tarihinden önce monte edilen ve ilgili mevzuata göre ilgili idare tarafından kayıt \naltına alınan a sansörün beyan yükünde ve/veya beyan hızında ve/veya seyir mesafesinde değişiklik \nyapılması halinde, bu asansörde, güncel TS EN 81-80 standardı gereklilikleri esas alınır. \n(5)  15/8/2004 ile 1/9/2017 tarihleri arasında piyasaya arz edilen ve ilgili mevzuat a göre ilgili \nidare tarafından kayıt altına alınan asansörün beyan yükünde ve/veya beyan hızında ve/veya seyir \nmesafesinde değişiklik yapılması halinde, bu asansörde, ilk defa piyasaya arz edildiği tarihte \nyürürlükte bulunan uyumlaştırılmış standart gereklilikleri esas alınır. \n(6) Üçüncü fıkranın (a), (b) ve (c) bentlerinde, dördüncü ve beşinci fıkralarında yer alan ve \nbakım çalışması olarak değerlendirilmeyen asansöre ait değişiklikler, asansör monte eden tarafından \nyerine getirilir. Bu değişikliklerin ilg ili mevzuatına ve/veya standardına uygun yapılıp yapılmadığına \ndair sorumluluk, söz konusu değişiklikleri yapan asansör monte edendedir. Bu değişiklikleri yapmak \nüzere asansör monte eden adına hareket eden montaj elemanının ve/veya teknik bakım ve onarım \npersonelinin, bu Yönetmelikte ve/veya ilgili mevzuatta belirtilen yeterlilik belgesine sahip olması \ngerekir. \n(7) Dördüncü ve beşinci fıkrada belirtilen durumlarda asansör monte eden tarafından asansör \nuygulama projesi hazırlanır/hazırlatılır ve ruhsat makam ının onayına sunulur. Ruhsat makamı \ntarafından onaylanan asansör uygulama projesine uygun olacak şekilde beyan yükünde ve/veya \nbeyan hızında ve/veya seyir mesafesinde değişiklik yapılan asansörün tescili için asansör monte eden \ntarafından yeşil renkli bilg i etiketine esas periyodik kontrol raporuyla birlikte altmış gün içerisinde']","Evet, apartman asansörünün bakımını belirli bir periyotta yaptırmak zorundasınız. Asansör Yönetmeliği uyarınca, asansörlerin yılda en az bir kez periyodik kontrol ve bakımının gerçekleştirilmesi gerekmektedir. 

Asansör Yönetmeliği'nde belirtilen gereklilikler, asansörün güvenli kullanımı ve işletme açısından uygun çalışıp çalışmadığını değerlendirmek amacıyla düzenlenmiştir. Bununla birlikte, asansörün bakımını yapan firmaların, asansörü oluşturan tüm aksam ve parçaların bakımını, bu bakım kılavuzunda yer alan talimatlara uygun olarak gerçekleştirmesi gerekmektedir. Yani, yasal olarak asansörünüzün bakımını yılda en az bir kez yaptırmak ve bu bakımları yetkili bir servis sağlayıcısı tarafından gerçekleştirilmesini sağlamak zorundasınız.","Asansörün bakımı, asansör monte eden veya onun yetkili servisi tarafından periyodik olarak ayda en az bir defa yapılmalıdır.",0.5,0.5395849020465376,0.6998668791252737
"Asansör denetiminde kırmızı etiket aldı, kullanmaya devam edebilir miyiz?","['**Asansör İşletme ve Bakım Yönetmeliği**\nç) İtfaiye tarafından yapılan kurtarma çalışmalarını, \nd) Asansör kuyusunun dış bölümlerinin temizlenmesini, \ne) Taşıyıcı/kabin iç kısmının temizlenmesini, \nkapsamaz. \n(4) 15/8/2004 tarihinden önce monte edilen ve ilgili mevzuata göre ilgili idare tarafından kayıt \naltına alınan a sansörün beyan yükünde ve/veya beyan hızında ve/veya seyir mesafesinde değişiklik \nyapılması halinde, bu asansörde, güncel TS EN 81-80 standardı gereklilikleri esas alınır. \n(5)  15/8/2004 ile 1/9/2017 tarihleri arasında piyasaya arz edilen ve ilgili mevzuat a göre ilgili \nidare tarafından kayıt altına alınan asansörün beyan yükünde ve/veya beyan hızında ve/veya seyir \nmesafesinde değişiklik yapılması halinde, bu asansörde, ilk defa piyasaya arz edildiği tarihte \nyürürlükte bulunan uyumlaştırılmış standart gereklilikleri esas alınır. \n(6) Üçüncü fıkranın (a), (b) ve (c) bentlerinde, dördüncü ve beşinci fıkralarında yer alan ve \nbakım çalışması olarak değerlendirilmeyen asansöre ait değişiklikler, asansör monte eden tarafından \nyerine getirilir. Bu değişikliklerin ilg ili mevzuatına ve/veya standardına uygun yapılıp yapılmadığına \ndair sorumluluk, söz konusu değişiklikleri yapan asansör monte edendedir. Bu değişiklikleri yapmak \nüzere asansör monte eden adına hareket eden montaj elemanının ve/veya teknik bakım ve onarım \npersonelinin, bu Yönetmelikte ve/veya ilgili mevzuatta belirtilen yeterlilik belgesine sahip olması \ngerekir. \n(7) Dördüncü ve beşinci fıkrada belirtilen durumlarda asansör monte eden tarafından asansör \nuygulama projesi hazırlanır/hazırlatılır ve ruhsat makam ının onayına sunulur. Ruhsat makamı \ntarafından onaylanan asansör uygulama projesine uygun olacak şekilde beyan yükünde ve/veya \nbeyan hızında ve/veya seyir mesafesinde değişiklik yapılan asansörün tescili için asansör monte eden \ntarafından yeşil renkli bilg i etiketine esas periyodik kontrol raporuyla birlikte altmış gün içerisinde', '**Asansör İşletme ve Bakım Yönetmeliği**\n6 ncı maddesinin birinci fıkrasında öngörülen idari para cezası uygulanır. \n(6) İdari para cezası, ceza kararının ilgiliye tebliğinden itibaren bir ay içerisinde ödenir. \n(7) (Ek:RG-10/2/2023-32100) Bu Yönetmelik hükümlerine aykırı davrananlar hakkında 7223 \nsayılı Kanun kapsamında uygulanacak idari para cezası kararları; \na) Denetimin Bakanlık merkez birimi personeli tarafından yapılması halinde sorumluluk alanı \nçerçevesinde bakan yardımcısı tarafından, \nb) Denetimin sadece il müdürlüğü personeli tarafından veya Bakanlık merkez birimi personeli \nile il müdürlüğü personelinin birlikte katılımıyla yapılması halinde asansörün monte edildiği yerdeki il \nmüdürü tarafından, \nverilir. \nAtıflar \nMADDE 18 – (1) 24/6/2015 tarihli ve   29396 sayılı Resmî Gazete’de yayımlanan Asansör \nİşletme, Bakım ve Periyodik Kontro l Yönetmeliğine yapılan bütün atıflar, bu Yönetmeliğe yapılmış \nsayılır. \nYürürlükten kaldırılan yönetmelik \nMADDE 19 – (1) 24/6/2015 tarihli ve 29396 sayılı Resmî Gazete’de yayımlanan Asansör \nİşletme, Bakım ve Periyodik Kontrol Yönetmeliği yürürlükten kaldırılmıştır. \nKayıt altına alınmamış asansörün tescili \nGEÇİCİ MADDE 1 – (1) Bu Yönetmeliğe göre TS EN 81 -80 standardı esas alınarak güvenlik \nseviyesi artırılan mevcut asansör veya 15/8/2004 -24/6/2015 tarihleri arasında piyasaya arz \nedilmesine rağmen kayıt altı na alınmamış olan asansör, bir defaya mahsus olmak üzere ilgili idare \ntarafından tescil edilir. Bina sorumlusu: \na) Mevcut asansörün güvenlik seviyesinin TS EN 81 -80 standardına göre artırıldığını \nispatlayacak olan yeşil veya mavi renkli bilgi etiketine esa s periyodik kontrol raporuyla, bir sonraki \nperiyodik kontrol tarihine kadar ilgili idareye başvurur. \nb) 15/8/2004 -24/6/2015 tarihleri arasında piyasaya arz edilmesine rağmen kayıt altına \nalınmamış olan asansöre ait yeşil veya mavi renkli bilgi etiketine es as periyodik kontrol raporuyla, bir \nsonraki periyodik kontrol tarihine kadar ilgili idareye başvurur.', '**Asansör İşletme ve Bakım Yönetmeliği**\nuygulama projesi hazırlanır/hazırlatılır ve ruhsat makam ının onayına sunulur. Ruhsat makamı \ntarafından onaylanan asansör uygulama projesine uygun olacak şekilde beyan yükünde ve/veya \nbeyan hızında ve/veya seyir mesafesinde değişiklik yapılan asansörün tescili için asansör monte eden \ntarafından yeşil renkli bilg i etiketine esas periyodik kontrol raporuyla birlikte altmış gün içerisinde \nilgili idareye başvurulur. Asansörün tescil belgesi, Ek -2’de yer alan içeriğe uygun olacak şekilde ilgili \nidare tarafından düzenlenir ve asansör monte edene sunulur. \nBakımla ilgili diğer hususlar \nMADDE 10 – (1) Bina sorumlusu ile sözleşme imzalayan asansör monte eden veya onun yetkili \nservisi, güvenli kullanım için söz konusu asansörü oluşturan aksam ve parçaları da içerecek şekilde bir \nbütün olarak gerekli koşulları sağlayıp sağlam adığına ilişkin durum tespit raporu hazırlar ve bina \nsorumlusuna iletir. Durum tespit raporu asansör monte edenin piyasaya arz ettiği ve bakım \nsözleşmesi yaptığı asansör için hazırlanmaz. \n(2) Asansör monte eden veya onun yetkili servisince her bakımda yapılan işlemler güncel TS EN \n13015: Asansör ve Yürüyen Merdivenlerin Bakımı, Bakım Talimatları İçin Kurallar standardındaki \ngereklilikleri de içerecek şekilde hazırlanmış olan bakım föyü ile kayıt altına alınır ve bir nüshası bina \nsorumlusuna teslim edilir, b ir nüshası da kendisi tarafından muhafaza edilir ve talep edilmesi \ndurumunda Bakanlığa ve diğer ilgililere sunulur. \n(3) Bina sorumlusu bakım föylerini asansörün makina veya makara dairesinde veya \nbinaya/yapıya ait yönetim bürosunda kalıcı olarak muhafaza eder. \n(4) Asansör monte eden veya onun yetkili servisi, insan can ve mal güvenliği yönünden \nasansörün risk taşıması durumunda bina sorumlusunu yazılı olarak bilgilendirir. Bina sorumlusu \nasansör monte eden veya onun yetkili servisi vasıtasıyla asansörün güv enli hale getirilmesini \nsağlamakla yükümlüdür.', '**Asansör İşletme ve Bakım Yönetmeliği**\nyetkisine sahip kurum ve kuruluşları, \np) Ser vis teknik sorumlusu: Yetkili servis faaliyetlerini idari ve teknik olarak yöneten, gerekli \ndokümanları hazırlayan/hazırlatan ve yetkili servis adına yasal olarak temsil ve ilzama yetkili olan \nkişiyi,  \nr) Teknik bakım personeli: Yetkili servis bünyesinde a sansörlerde bakım, onarım ve servis işini \nyürütmek üzere görevlendirilen ve ilgili mevzuat kapsamında belgeli olan asansör bakım ve \nonarımcısını, \ns) Tescil: Asansörün resmî olarak ilgili idare tarafından kayıt altına alınmasını, \nş) TSE: Türk Standardları Enstitüsünü, \nt) TS EN 81 -80 standardı: Asansörler - Yapım ve Montaj için Güvenlik Kuralları: Yolcu ve Yük \nAsansörleri için Özel Uygulamalar - Bölüm 80: Mevcut Yolcu ve Yük Asansörlerinin Güvenliğini \nGeliştirme Kurallarını, \nu) Yetkili servis: Asansörlerde ba kım, onarım ve servis hizmetinin yürütülebilmesi için asansör \nmonte edenin kendi adına kurduğu servis istasyonu veya gerekli olduğu durumlarda sorumluluğu \nkendinde olmak üzere sözleşme ile yetki verdiği gerçek veya tüzel kişiyi, \nü) (Ek:RG-10/2/2023-32100) Bakan yardımcısı: Sanayi ve Teknoloji Bakanlığının ilgili bakan \nyardımcısını, \nv) (Ek:RG-10/2/2023-32100) İl müdürlüğü: Sanayi ve teknoloji il müdürlüğünü, \ny) (Ek:RG-10/2/2023-32100) İl müdürü: Sanayi ve teknoloji il müdürünü, \nifade eder. \nİKİNCİ BÖLÜM \nAsansör Kimlik Numarası, Asansörün Binaya/Yapıya Fenni \nUygunluğunun Kontrolü ve Asansörün Tescili \nAsansör kimlik numarası \nMADDE 5 – (1) Bu Yönetmelik kapsamında bulunan her asansör, bir asansör kimlik numarası ile \ntanımlanır. \n(2) Asansör kimlik numarası Asansör Periyodik Kontrol Yönetmeliğinde belirtilen usul ve \nesaslara uygun olarak muayene kuruluşu tarafından periyodik kontrol aşamasından önce oluşturulur. \nAsansör kimlik numarası Asansör Periyodik Kontrol Yönetmeliğinin 21 inci maddesinde tanımlanan \nformata uygun bir etiket üzerinde belirtilir. Bu etiket, periyodik kontrol aşamasında muayene', '**Asansör İşletme ve Bakım Yönetmeliği**\ntanımlanır. \n(2) Asansör kimlik numarası Asansör Periyodik Kontrol Yönetmeliğinde belirtilen usul ve \nesaslara uygun olarak muayene kuruluşu tarafından periyodik kontrol aşamasından önce oluşturulur. \nAsansör kimlik numarası Asansör Periyodik Kontrol Yönetmeliğinin 21 inci maddesinde tanımlanan \nformata uygun bir etiket üzerinde belirtilir. Bu etiket, periyodik kontrol aşamasında muayene \nkuruluşu tarafından asansör kabinine iliştirilir.  \n(3) Asansör kabinine iliştirilen ve asansör kimlik numarasını içeren etiketin, asansörün kullanım \nömrü boyunca muh afaza edilmesine ve gerektiğinde yenilenmesine dair sorumluluk,   bina \nsorumlusundadır. \nAsansörün binaya/yapıya fenni uygunluğunun kontrolü \nMADDE 6 – (1) Asansör Yönetmeliği (2014/33/AB) kapsamında monte edilen asansörün monte \nedildiği binaya/yapıya fenni u ygunluğuna ilişkin kontroller 3/5/1985 tarihli ve 3194 sayılı İmar \nKanununa, ilgili mevzuata ve erişilebilirlik mevzuatına uygun olacak şekilde ilgili ruhsat makamı \ntarafından yürütülür. \n(2) Birinci fıkrada belirtilen kontrollerin ilgili mevzuatına uygun b ir şekilde yürütülmesine dair \nsorumluluk ilgili ruhsat makamındadır. \nAsansörün tescili \nMADDE 7 – (1) Asansör Yönetmeliği (2014/33/AB) kapsamında piyasaya arz edilen her asansör \nilgili idareye tescil ettirilir. Tescil başvurusu, asansörün piyasaya arz edild iği tarih itibarıyla altmış gün \niçerisinde söz konusu asansörü piyasaya arz eden asansör monte eden tarafından yapılır. \n(2) Asansör monte eden, tescil işlemi için aşağıda belirtilen belgelerin bir sureti ile birlikte ilgili \nidareye başvurur: \na) Sanayi sicil belgesi. \nb) Onaylanmış kuruluşça düzenlenen uygunluk belgesi veya raporu. \nc) AB uygunluk beyanı. \nç) Garanti belgesi. \nd) (Değişik:RG-3/4/2021-31443) AB uygunluk beyanı ve garanti belgesini imzalayan yetkilinin \nadı, soyadı ve unvanına dair bilgileri içerecek şekilde kendisi tarafından hazırlanan ve onaylanan yazılı \nbeyan belgesi. \ne) TSE Hizmet Yeterlilik Belgesi.', '**Asansör İşletme ve Bakım Yönetmeliği**\nperiyodik kontrol tarihine kadar ilgili idareye başvurur. \nb) 15/8/2004 -24/6/2015 tarihleri arasında piyasaya arz edilmesine rağmen kayıt altına \nalınmamış olan asansöre ait yeşil veya mavi renkli bilgi etiketine es as periyodik kontrol raporuyla, bir \nsonraki periyodik kontrol tarihine kadar ilgili idareye başvurur. \n(2) Asansörün tescil belgesi, Ek -5’te yer alan içeriğe uygun olacak şekilde ilgili idare tarafından \ndüzenlenir ve bina sorumlusuna sunulur. \nYürürlük \nMADDE 20 – (1) Bu Yönetmeliğin; \na) 13 üncü maddesinin on ikinci fıkrası yayımı tarihinden on iki ay sonra, \nb) Diğer hükümleri yayımı tarihinde, \nyürürlüğe girer. \nYürütme \nMADDE 21 – (1) Bu Yönetmelik hükümlerini Sanayi ve Teknoloji Bakanı yürütür. \n  \nEkleri için tıklayınız. \n  \n  Yönetmeliğin Yayımlandığı Resmî Gazete’nin \nTarihi Sayısı \n6/4/2019 30737 \nYönetmelikte Değişiklik Yapan Yönetmeliklerin Yayımlandığı Resmî \nGazetelerin \nTarihi Sayısı \n1.        3/4/2021 31443 \n2.         11/7/2021 31538  \n3. 10/2/2023 32100']","Hayır, kırmızı etiket aldıysanız asansörü kullanmaya devam edemezsiniz. Kırmızı etiket, asansörün güvenli olmadığını ve kullanılmaması gerektiğini belirtir. Bu durum, 2014/33/AB sayılı Asansör Yönetmeliği'nde belirtilen güvenlik standartlarına dayanmaktadır. 

Kırmızı etiket, asansörün periyodik kontrol veya bakım gerektirdiğini ve bu nedenle acilen güvenli hale getirilmesi gerektiğini ifade eder. Bu tür bir durumda, asansör monte eden veya yetkili servisin asansörü onarıp yeniden güvenli bir şekilde çalışır hale getirmesi gerekmektedir. Kısacası, asansör güvenli hale gelmeden kullanılmamalıdır.","Hayır. Kırmızı renkli bilgi etiketi iliştirilen (güvensiz) asansöre, kusurlu veya kusursuz hale getirilinceye kadar bakım hizmeti sunulamaz ve kullanılması güvenli değildir. 120 gün içinde düzeltilmezse hizmet dışı bırakılır.",0.25,0.4499410953513245,0.5204935978346102
Asansörde biri mahsur kalırsa kurtarma eğitimini kim verir?,"['**Asansör İşletme ve Bakım Yönetmeliği**\nbirisinden mezun olmamaları hâlinde 5/6/1986 tarihli ve 3308 sayılı Mesleki Eğitim Kanunu \nkapsamında asansör bakım ve onarımı konusunda ustalık belgesine sahip olmaları veya, \nc) Meslek yüksekokullarının makine, elektrik, elektronik, elektrik -elektronik, mekatronik veya \nelektromekanik taşıyıcılar bölümlerinden mezun olmaları veya, \nç) Bu fıkranın (a), (b) ve (c) bentlerinde belirtilen şartları sağlayan kişinin/kişilerin dışında teknik \nbakım ve onarım personeli olarak istihdam edilen kişinin/kişilerin asansör bakım ve onarımı \nkonusunda mesleki yeterlilik belgesine sahip olması, \ngerekir. \n(6) Yetkili servis sözleşmesi noter huzurunda yapılır ve iki yılda bir yenilenir. \n(7) Yetkili servis sözleşmesinin kapsamı, asansör monte edenin vereceği yetki ve sorumluluklar \nçerçevesinde belirlenir. \n(8) Yetkili servis sözleşmesi asansörlerde bakım, onarım ve servis hizmetlerine ilişkin detayları  \niçermek zorundadır. Asansör montajı ve 9 uncu maddenin üçüncü fıkrasında belirtilen konular \nsözleşme kapsamının dışında tutulur. \n(9) Bakım hizmeti sunulurken asansöre verilebilecek hasarlara ve kazalara ilişkin yetkiyi veren \nasansör monte edenin de müteselsilen sorumlu olacağı yetkili servis sözleşmesinde belirtilir. \n(10) Bölge servisi olarak sözleşme imzalanan yetkili servisin TSE Hizmet Yeterlilik Belgesinde, \nyetkiyi veren asansör monte edenin unvanı ve markasına ilişkin bilgiler yer alır. \n(11) Asansör monte eden, bölge servisi olarak sözleşme imzalayacağı yetkili servis personelinin \neğitimini sağlar ve bu konuda hazırlanmış olan her türlü bilgi ve belgenin dokümantasyonunu \noluşturarak muhafaza eder. \n(12) Yetkili servis kendisi tarafından asansöre verilen  bakım, onarım ve servis hizmeti ile ilgili \nolarak mesleki hata ve/veya ihmaller nedeniyle bina sorumlusunun ve diğer üçüncü şahıslar \ntarafından ileri sürülecek zarar ve ziyan taleplerini karşılamak üzere en az 500.000 TL tutarında', '**Asansör İşletme ve Bakım Yönetmeliği**\nbinaya/yapıya ait yönetim bürosunda kalıcı olarak muhafaza eder. \n(4) Asansör monte eden veya onun yetkili servisi, insan can ve mal güvenliği yönünden \nasansörün risk taşıması durumunda bina sorumlusunu yazılı olarak bilgilendirir. Bina sorumlusu \nasansör monte eden veya onun yetkili servisi vasıtasıyla asansörün güv enli hale getirilmesini \nsağlamakla yükümlüdür. \n(5) Asansör monte eden veya onun yetkili servisi, asansörde yapılan aksam ve parça \ndeğişiklikleri ile bildirilen kazaları asansör kayıt defterine işler. \n(6) Bakım sözleşmesi yapıldıktan sonra asansör monte ede n veya onun yetkili servisi, \nbinadaki/yapıdaki asansör sayısı dikkate alınarak bina sorumlusunun belirleyeceği sayıda kişiye acil \ndurumlarda kurtarma çalışması konusunda yılda en az bir defa eğitim verir. Eğitim, yetkili servis \nteknik bakım ve onarım perso neli tarafından verilir. Verilen bu eğitim yetkili servis teknik sorumlusu \nve eğitimi veren kişi tarafından imzalanan bir tutanakla kayıt altına alınır ve tutanağın bir sureti bina \nsorumlusuna iletilir. Bina sorumlusu, eğitim alan kişi/kişilerin değişmesi halinde yeni kişi/kişilere \neğitim verilmesini sağlar. Kurtarma talimatının, kurtarma çalışmasını yapacak kişi/kişilerin kolaylıkla \ngörebilecekleri yerlerde muhafaza edilmesi ve amacına uygun hazırlanmış olması gerekir. \n(7) Asansör monte eden, piyasaya arz ettiği her tip ve özellikteki asansör için yedek aksam ve \nparçayı en az üç yıl süreyle temin etmekle yükümlüdür. \n(8) Asansör monte eden, kendisi tarafından piyasaya arz edilen asansöre bakım, onarım ve \nservis hizmeti veren bir başka asansör monte edenin ve ya onun yetkili servisinin veya bina \nsorumlusunun, yedek aksam veya parça ile asansörde bakım yapmayı mümkün kılacak her türlü cihaz \nve donanım talebini normal piyasa koşullarında sağlamak zorundadır. \n(9) Bakım, onarım, arıza giderme ve periyodik kontrol f aaliyetleri yürütülürken gerekli iş sağlığı', '**Asansör İşletme ve Bakım Yönetmeliği**\nveya onun yetkili servisi tarafından yerine getirilir. \nYetkili servis ile ilgili şartlar \nMADDE 13 – (1) (Değişik:RG-10/2/2023-32100) Yetkili servis, merkez ve bölge servisi olarak \nyapılandırılır. Asansör monte eden, kendi bünyesinde en az bir merkez servisini kurmak zorundadır. \nAsansör monte eden, 12  nci maddenin üçüncü fıkrasının birinci ve ikinci cümlelerinde belirtilen \ngerekliliklere göre kendi bünyesinde bölge servisini kurar veya sözleşme ile bir başka asansör monte \nedeni veya onun yetkili servisini bölge servisi olarak görevlendirir. Merkez servisinin ve bölge \nservisinin güncel TS 12255: Yetkili Servisler -Asansör Bakım Servisleri -Kurallar standardı kapsamında \nTSE hizmet yeterlilik belgesine sahip olması gerekir. Asansör monte eden, merkez ve bölge servisi \ndışında asansöre ait yedek parça ve malzeme stoku i le satışı ve bina sorumlularıyla irtibat için şube \nkurabilir. Şube için tahsis edilen mekanların veya alanların, asansör monte edene ait olan ticaret sicil \nkayıt belgesinde belirtilmesi ve  13/1/2011 tarihli ve 6102 sayılı Türk Ticaret Kanunu gereklilikleri ne \nuygun olması gerekir. Şube içerisinde 9 uncu maddenin ikinci fıkrasının (d) bendinde belirtilen bileşen \nonarımı işleminin yürütülmesi halinde, şubenin ayrıca ilgili standart gerekliliklerini sağlaması ve TSE \nhizmet yeterlilik belgesine sahip olması gerekir. \n(2) Yetkili servis merkezinin veya bölgesinin bünyesinde, en az bir servis teknik sorumlusunun, \nen az iki teknik bakım ve onarım personelinin ve en az bir ida ri personelin tam zamanlı olarak \nistihdam edilmesi zorunludur. (Mülga cümle:RG-10/2/2023-32100) \n(3) Yetkili servis merkezinde veya bölgesinde ikinci fıkraya göre asgari şartlarda istihdam \nedilmesi zorunlu olan personelin kendi isteği ile işten ayrılması durumunda, işten ayrılan personelin \nyerine 22/5/2003 tarihli ve 4857 sayılı İş Kanununda belirtilen fesih süresi sonu itibarıyla yeni', '**Asansör İşletme ve Bakım Yönetmeliği**\nh) Hizmet denetimi: Asansör monte edene veya onun yetkili servisine veya bina sorumlusuna \nyönelik Bakanlık tarafından yapılan denetimi, \nı) İlgili idare: Be lediyeleri veya belediye sınırları dışında kalan alanlardaki yapılar için il özel \nidarelerini, \ni) İktisadi işletmeci: Asansör monte edeni, asansör güvenlik aksamı imalatçısını, yetkili \ntemsilciyi, ithalatçıyı veya dağıtıcıyı, \nj) Kurtarma çalışması: Asansör  içerisinde insanın veya insanların mahsur kaldığına dair bilginin \nalınmasıyla birlikte kurtarma talimatına uygun olarak yapılan ve insanın veya insanların serbest \nkalmasıyla sonuçlanan çalışmayı, \nk) Mevcut asansör: 15/8/2004 tarihinden önce monte edilen v e halen kullanılmakta olan \nasansörü, \nl) Mesleki yeterlilik belgesi: Mesleki Yeterlilik Kurumu tarafından onaylanmış olan ve bireyin \nbilgi, beceri ve yetkinliğini ifade eden belgeyi, \nm) Muayene kuruluşu: Türkiye’de yerleşik özel veya kamu kuruluşlarından, TS EN ISO/IEC \n17020 standardına göre Türk Akreditasyon Kurumunca 4/5/2018 tarihli ve 30411 sayılı Resmî \nGazete’de yayımlanan Asansör Periyodik Kontrol Yönetmeliği kapsamında A tipi muayene kuruluşu \nolarak akredite edilen kuruluşu, \nn) Periyodik kontrol: Asansörün güvenli kullanımı ve işletme yönünden uygun çalışıp \nçalışmadığına dair yaptırılacak olan muayeneyi, \no) Piyasaya arz: Asansörün ticari veya kamu faaliyetleri kapsamında ücretli veya ücretsiz olarak \nkullanımının sağlanmasını, \nö) Ruhsat makamı: Belediyeleri veya belediye sınırları dışında kalan alanlardaki binalar/yapılar \niçin valilikleri veya ilgili mevzuat çerçevesinde yapı ruhsatı ve yapı kullanma izin belgesi verme \nyetkisine sahip kurum ve kuruluşları, \np) Ser vis teknik sorumlusu: Yetkili servis faaliyetlerini idari ve teknik olarak yöneten, gerekli \ndokümanları hazırlayan/hazırlatan ve yetkili servis adına yasal olarak temsil ve ilzama yetkili olan \nkişiyi,  \nr) Teknik bakım personeli: Yetkili servis bünyesinde a sansörlerde bakım, onarım ve servis işini', '**Asansör İşletme ve Bakım Yönetmeliği**\noluşturarak muhafaza eder. \n(12) Yetkili servis kendisi tarafından asansöre verilen  bakım, onarım ve servis hizmeti ile ilgili \nolarak mesleki hata ve/veya ihmaller nedeniyle bina sorumlusunun ve diğer üçüncü şahıslar \ntarafından ileri sürülecek zarar ve ziyan taleplerini karşılamak üzere en az 500.000 TL tutarında \nmesleki sorumluluk sigor tasını yaptırır. Bir sonraki yıl için geçerli sayılacak olan mesleki sorumluluk \nsigortasının değeri, 213 sayılı Kanun hükümleri uyarınca o yıl tespit ve ilan edilen yeniden değerleme \noranı kadar arttırılır. \n(13) TSE Hizmet Yeterlilik Belgesi için Türk Stan dardları Enstitüsüne yapılan başvurularda, ilgili \nstandart şartları ile birlikte bu maddede belirtilen gereklilikler de aranır. \nBEŞİNCİ BÖLÜM \nBina Sorumlusunun Yükümlülükleri ve Hizmet Denetimi \nBina sorumlusunun yükümlülükleri \nMADDE 14 – (1) Bina sorumlusu, asansörün güvenli bir şekilde çalışmasını sağlamak üzere (Ek \nibare:RG-11/7/2021-31538) asansör monte eden veya onun yetkili servisi ile bakım sözleşmesi \nimzalamaktan, bakımını yaptırmaktan ve bakım ücretinin ödenmesinden sorumludur. \n(2) Bina sorumlusu, e ngellilerin erişilebilirliği için asansörün güvenli bir şekilde sürekli olarak \nçalıştırılmasını sağlar. Kamuya açık alanlarla ilgili olarak birinci cümlede belirtilen konuya ilişkin \nşikâyetler ilgisi nedeniyle Valilik bünyesinde bulunan erişilebilirlik izleme ve denetleme komisyonuna, \nkonutlarla/meskenlerle ilgili şikâyetler ise konutun/meskenin bağlı bulunduğu ilgili idaresine iletilir. \n(3) Bina sorumlusu, asansörle ilgili herhangi bir tehlikeli durumu bakım sözleşmesi imzalanan \nasansör monte eden veya onu n yetkili servisine iletir ve söz konusu asansöre, asansör monte eden \nveya onun yetkili servisi tarafından müdahale edilene kadar gerekli güvenlik tedbirini alır. \nHizmet denetimi \nMADDE 15 – (1) Asansör monte eden tarafından garanti ile ilgili şartların ve satış sonrası', '**Asansör İşletme ve Bakım Yönetmeliği**\nservis hizmeti veren bir başka asansör monte edenin ve ya onun yetkili servisinin veya bina \nsorumlusunun, yedek aksam veya parça ile asansörde bakım yapmayı mümkün kılacak her türlü cihaz \nve donanım talebini normal piyasa koşullarında sağlamak zorundadır. \n(9) Bakım, onarım, arıza giderme ve periyodik kontrol f aaliyetleri yürütülürken gerekli iş sağlığı \nve güvenliği tedbirleri 20/6/2012 tarihli ve 6331 sayılı İş Sağlığı ve Güvenliği Kanunu ve ilgili mevzuat \nhükümleri doğrultusunda bina sorumlusu ile bakım sözleşmesi imzalayan asansör monte eden veya \nonun yetkili servisince alınır. \n(10) Bakım esnasında, bakım ve onarım işlerinden kaynaklı nedenlerle gerek teknik bakım ve \nonarım personelinin gerekse bakımla ilgisi bulunmayan kişi/kişilerin yaralanmasına veya ölümüne \nneden olabilecek ihmallere dair sorumluluk, bina sorumlusunun bakım sözleşmesi imzaladığı asansör \nmonte eden veya onun yetkili servisindedir. \n(11) Periyodik kontrol neticesinde güvensiz olarak tanımlanan ve kırmızı renkli bilgi etiketi \niliştirilen asansöre; kusurlu, hafif kusurlu veya kusursuz hale getir ilinceye kadar bakım hizmeti \nsunulamaz. Güvensiz olma durumundan, kusurlu duruma geçen ve periyodik kontrol tarihi başlangıç \nkabul edilerek yüz yirmi gün içerisinde hafif kusurlu veya kusursuz hale getirilmeyen asansöre de söz \nkonusu sürenin sona erdiği za man itibarıyla bakım hizmeti sunulamaz. Asansör monte eden veya \nonun yetkili servisi bu süre zarfında bina sorumlusundan aylık bakım ücreti talebinde bulunamaz. \n(12) Asansör monte eden veya onun yetkili servisi; bakım, onarım, arıza giderme ve periyodik \nkontrol faaliyetleri yürütülürken görevlendireceği teknik bakım ve onarım personeline ilişkin \ntanımlayıcı tüm bilgilerin bakım sözleşmesinde yer almasını sağlar. Teknik bakım ve onarım \npersoneline ilişkin değişiklik olması halinde, bu değişikliğe dair bilginin de söz konusu bakım \nsözleşmesinde yer alması ilgili asansör monte eden veya onun yetkili servisince sağlanır.']","Evet, asansörde mahsur kalan kişilerin kurtarılması için eğitim, asansör monte edenin yetkili servisi tarafından verilmektedir. Bu durum, 5/6/1986 tarihli ve 3308 sayılı Mesleki Eğitim Kanunu kapsamında düzenlenmiştir. 

Asansör monte eden veya onun yetkili servisi, binadaki asansör sayısına bağlı olarak bina sorumlusunun belirleyeceği sayıda kişiye acil durumlarda kurtarma çalışması konusunda yılda en az bir defa eğitim vermekle yükümlüdür. Bu eğitimi, yetkili servis teknik bakım ve onarım personeli sağlar ve verilen eğitim ilgili bir tutanakla kayıt altına alınır. Böylece, bina sorumlusunun belirlediği kişiler gerektiğinde kurtarma operasyonlarına katılabilmek için gerekli bilgiyi edinmiş olur.","Asansör monte eden veya onun yetkili servisi, bina sorumlusunun belirleyeceği sayıda kişiye yılda en az bir defa kurtarma eğitimi verir.",0.75,0.7919546328421102,0.5996972968306281
Binada kaç tane yangın söndürme tüpü bulundurmak zorundayız?,"['**Binaların Yangından Korunması Yönetmeliği**\nK.) (1) Taşınabilir söndürme cihazlarının tipi ve sayısı, mekânlarda var olan durum ve risklere göre belirlenir. Buna göre; a) A sınıfı yangın çıkması muhtemel yerlerde, öncelikle çok maksatlı kuru kimyevi tozlu veya sulu, b) B sınıfı yangın çıkması muhtemel yerlerde, öncelikle kuru kimyevi tozlu, karbondioksitli veya köpüklü, c) C sınıfı yangın çıkması muhtemel yerlerde, öncelikle kuru kimyevi tozlu veya karbondioksitli, ç) D sınıfı yangın çıkması muhtemel yerlerde, öncelikle kuru metal tozlu, söndürme cihazları bulundurulur. Hastanelerde, huzurevlerinde, anaokullarında ve benzeri yerlerde sulu veya temiz gazlı söndürme cihazlarının tercih edilmesi gerekir. (2) Düşük tehlike sınıfında her 500 m2, orta tehlike ve yüksek tehlike sınıfında her 250 m² yapı inşaat alanı için 1 adet olmak üzere, uygun tipte 6 kg’lık kuru kimyevî tozlu veya eşdeğeri gazlı yangın söndürme cihazları bulundurulması gerekir. (3) Otoparklarda, depolarda, tesisat dairelerinde ve benzeri yerlerde ayrıca tekerlekli tip söndürme cihazı bulundurulması mecburidir. (4) Söndürme cihazları dışarıya doğru, geçiş boşluklarının yakınına ve dengeli dağıtılarak, görülebilecek şekilde işaretlenir ve her durumda kolayca girilebilir yerlere, yangın dolaplarının içine veya yakınına yerleştirilir. Söndürme cihazlarına ulaşma mesafesi en fazla 25 m olur. Söndürme cihazlarının, kapı arkasında, yangın dolapları hariç kapalı dolaplarda ve derin duvar girintilerinde bulundurulmaması ve ısıtma cihazlarının üstüne veya yakınına konulmaması gerekir. Ancak, herhangi bir sebeple söndürme cihazlarının doğrudan görünmesini engelleyen yerlere konulması halinde, yerlerinin uygun fosforlu işaretler ile gösterilmesi şarttır.  (5) Taşınabilir söndürme cihazlarında söndürücünün duvara bağlantı asma halkası duvardan kolaylıkla alınabilecek şekilde yerleştirilir ve 4 kg’dan daha ağır ve 12 kg’dan hafif olan cihazların zeminden olan yüksekliği yaklaşık 90 cm’yi aşmayacak şekilde montaj yapılır. (6) Arabalı yangın söndürme', '**Binaların Yangından Korunması Yönetmeliği**\nengelleyen yerlere konulması halinde, yerlerinin uygun fosforlu işaretler ile gösterilmesi şarttır.  (5) Taşınabilir söndürme cihazlarında söndürücünün duvara bağlantı asma halkası duvardan kolaylıkla alınabilecek şekilde yerleştirilir ve 4 kg’dan daha ağır ve 12 kg’dan hafif olan cihazların zeminden olan yüksekliği yaklaşık 90 cm’yi aşmayacak şekilde montaj yapılır. (6) Arabalı yangın söndürme cihazlarının TS EN 1866 ve diğer taşınabilir yangın söndürme cihazlarının TS 862- EN 3 kalite belgeli olması şarttır. (7) Yangın söndürme cihazlarının periyodik kontrolü ve bakımı TS ISO 11602-2 standardına göre yapılır. Söndürme cihazlarının bakımını yapan üreticinin veya servis firmalarının dolum ve servis yeterlilik belgesine sahip olması gerekir. Servis veren firmalar, istenildiğinde müşterilerine belgelerini göstermek zorundadır. Söndürme cihazlarının standartlarda belirtilen hususlar doğrultusunda yılda bir kez yerinde genel kontrolleri yapılır ve dördüncü yılın sonunda içindeki söndürme maddeleri yenilenerek hidrostatik testleri yapılır. Cihazlar dolum için alındığında, söndürme cihazlarının bulundukları yerleri tehlike altında bırakmamak için, servisi yapan firmalar, bakıma aldıkları yangın söndürme cihazlarının yerine, aldıkları söndürücü cihazın özelliğinde ve aynı sayıda kullanıma hazır yangın söndürme cihazlarını geçici olarak bırakmak zorundadır.', '**Binaların Yangından Korunması Yönetmeliği**\n(7) Giriş, çıkış ve şaftları üst katlardan 120 dakika yangına dayanıklı döşeme veya bölme ile ayrılan bodrum katlar, beşinci fıkrada belirtilen yapı yüksekliklerine dahil edilmez ve yangın güvenlik tedbirleri bakımından ayrı değerlendirilir. (8) Çatı arası piyeslerden binanın normal merdivenine veya korunumlu kaçış merdivenine alternatif kaçış imkânı sağlanması durumunda, çatı arası piyes yüksekliği beşinci fıkrada belirtilen yapı yüksekliklerine dahil edilmez.  Elektrik tesisatı ve sistemlerin özellikleri MADDE 67- (1) Binalarda kurulan elektrik tesisatının, kaçış yolları aydınlatmasının ve yangın algılama ve uyarı sistemlerinin, yangın hâlinde veya herhangi bir acil hâlde, binada bulunanlara zarar vermeyecek, panik çıkmasını önleyecek, binanın emniyetli bir şekilde boşaltılmasını sağlayacak ve güvenli bir ortam oluşturacak şekilde tasarlanması, tesis edilmesi ve çalışır durumda tutulması gerekir. (2) Her türlü elektrik tesisatının, kaçış yolları aydınlatmasının, acil durum aydınlatma ve yönlendirmesinin ve yangın algılama ve uyarı sistemlerinin, ilgili tesisat yönetmeliklerine ve standartlarına uygun olarak tasarlanması ve tesis edilmesi şarttır. (3) Binalarda kurulacak elektrik tesisatının, kaçış yolları aydınlatmasının ve yangın algılama ve uyarı sistemlerinin tasarımı ve uygulaması, ruhsat veren idarenin kontrol ve onayına tabidir. Sistemlerin ve cihazların periyodik kontrolü, test ve bakımları, bina sahibi veya yöneticisi ile bunların yazılı olarak sorumluluklarını devrettiği bina yetkilisince yaptırılır.   Taşınabilir söndürme cihazları (4) MADDE 99- (Değişik: 10/8/2009-2009/15316 K.) (1) Taşınabilir söndürme cihazlarının tipi ve sayısı, mekânlarda var olan durum ve risklere göre belirlenir. Buna göre; a) A sınıfı yangın çıkması muhtemel yerlerde, öncelikle çok maksatlı kuru kimyevi tozlu veya sulu, b) B sınıfı yangın çıkması muhtemel yerlerde, öncelikle kuru kimyevi tozlu, karbondioksitli veya köpüklü, c) C sınıfı yangın çıkması muhtemel yerlerde, öncelikle', '**Binaların Yangından Korunması Yönetmeliği**\ndosya ve diğer eşyayı, olay yerinde bulunanların da yardımı ile ve büro şeflerinin nezareti altında mümkünse çuvallara ve torbalara koyarak boşaltılmaya hazır hâle getirir. Çuval ve torbalar, bina yetkililerinin gerek görmesi hâlinde binanın henüz yanma tehlikesi olmayan kısımlarına taşınır. Yanan binanın genel olarak boşaltılmasına olay yerine gelen itfaiye amirinin veya en büyük mülki amirin emriyle başlanır. c) Koruma ekibi boşaltılan eşya ve evrakı, güvenlik güçleri veya bina yetkililerinin göstereceği bir yerde muhafaza altına alır ve yangın söndürüldükten sonra o binanın ilgililerine teslim eder. ç) İlk yardım ekibi yangında yaralanan veya hastalananlar için ilk yardım hizmeti verir. (5) Yangından haberdar olan bina sahibi, yöneticisi, amiri ile acil durum ekipleri en seri şekilde görev başına gelip, söndürme, kurtarma, koruma ve ilk yardım işlerini yürütmek zorundadır.', '**Binaların Yangından Korunması Yönetmeliği**\nher birinin içinden bir yangın güvenlik holünden geçilerek yangın merdivenine ulaşılıyor ise binanın genel merdiveninin korunumlu olması gerekli değildir. ç) Yapı yüksekliği 51.50 m’den yüksek olan konutlarda, birbirlerine alternatif ve yangın güvenlik holü olan ve basınçlandırılan en az 2 kaçış merdiveni yapılması şarttır. (6) Konut yapılarının farklı amaçla kullanılan bodrum katlarında, konut ile  ortak kullanılan kaçış merdivenlerinin önüne yangın güvenlik holü düzenlenmesi gerekir.', '**Binaların Yangından Korunması Yönetmeliği**\ntuttuğu saat kadar mesai günlerinde izin verilir.  Ekiplerin çalışma esasları MADDE 128- (1) Acil durum ekiplerinin birbirleriyle işbirliği yapmaları ve karşılıklı yardımlaşmada bulunmaları esastır. (2) Ekiplerin yangın anında sevk ve idaresi, itfaiye gelinceye kadar iç düzenlemeyi uygulamakla görevli amir veya yardımcılarına aittir.  Bu süre içinde ekipler amirlerinden emir alırlar. İtfaiye gelince, bu ekipler derhal itfaiye amirinin emrine girerler. (3) Bina sahibi ve yöneticileri ile bina amirleri; ekiplerin, yapılarda meydana gelecek yangınlara müdahale etmeleri ve kurtarma işlemlerini yürütmelerinde kullanmaları için gereken malzemeleri bulundurmak zorundadırlar. Yapının büyüklüğüne, kullanım amacına, mevcut koruma sistemlerine ve oluşturulan ekip özelliklerine göre, mahalli itfaiye teşkilatı ve sivil savunma müdürlüğünün görüşü alınarak, gerekli ise gaz maskesi, teneffüs cihazı, yedek hortum, lans, hidrant anahtarı ve benzeri malzemeler bulundurulur. Bulundurulacak malzemeler, itfaiye teşkilatında kullanılan malzemelere uygun olmak zorundadır. Araç-gereç ve malzemenin bakımı ve korunması, iç düzenlemeyi uygulamakla görevli amirin sorumluluğu altında görevliler tarafından yapılır. (4) Yangın haberini alan acil durum ekipleri, kendilerine ait araç-gereç ve malzemelerini alarak derhal olay yerine hareket ederler. Olay yerinde; a) Söndürme ekibi yangın yerinin altındaki, üstündeki ve yanlarındaki odalarda gereken tertibatı alır, yangının genişlemesini önlemeye ve söndürmeye çalışırlar. b) Kurtarma ekibi önce canlıları kurtarır. Daha sonra yangında ilk kurtarılacak evrak, dosya ve diğer eşyayı, olay yerinde bulunanların da yardımı ile ve büro şeflerinin nezareti altında mümkünse çuvallara ve torbalara koyarak boşaltılmaya hazır hâle getirir. Çuval ve torbalar, bina yetkililerinin gerek görmesi hâlinde binanın henüz yanma tehlikesi olmayan kısımlarına taşınır. Yanan binanın genel olarak boşaltılmasına olay yerine gelen itfaiye amirinin veya en büyük mülki amirin']","Yangın söndürme tüpü sayısı, binanın kullanım amacına ve büyüklüğüne bağlı olarak belirlenmektedir. Her binada, düşük tehlike sınıfındaki alanlar için her 500 m² başına 1 adet, orta ve yüksek tehlike sınıfındaki alanlar için ise her 250 m² başına 1 adet yangın söndürme tüpü bulundurulması gerekmektedir.

Dolayısıyla, binanızın büyüklüğüne ve kullanım amacına bağlı olarak gerekli olan yangın söndürme tüpü sayısını belirlemek için bu kriterleri göz önünde bulundurmalısınız. Bununla birlikte, tüplerin doğru konumlandırılması ve kolay erişilebilir olmaları da önemli bir zorunluluktur.","Düşük tehlike sınıfında her 500 m² için, orta ve yüksek tehlike sınıfında her 250 m² yapı inşaat alanı için 1 adet olmak üzere, uygun tipte 6 kg’lık yangın söndürme cihazı bulundurulması gerekir.",0.8571428571428571,0.0,0.6697763170321334
Daire kapısından yangın merdivenine mesafe en fazla kaç metre olabilir?,"[""**Binaların Yangından Korunması Yönetmeliği**\nDış kaçış merdivenleri MADDE 42- (1) Dışarıda yapılan açık kaçış merdiveni, ilgili gereklere uyulması şartıyla iç kaçış merdivenleri yerine kullanılabilir. Dış kaçış merdiveninin korunumlu yuva içinde bulunması şart değildir. (2) Açık dış kaçış merdiveninin herhangi bir bölümüne, yanlardan yatay ve alttan düşey uzaklık olarak 3 m içerisinde merdivenin özelliklerinden daha az korunumlu kapı ve pencere gibi duvar boşluğu bulunamaz. (3) Bina yüksekliği 21.50 m’den fazla olan binalarda, bina dışında açık merdivenlere  izin verilmez.  Dairesel merdiven MADDE 43- (1) Dairesel merdivenler; yanmaz malzemeden yapılmaları ve en az 100 cm genişlikte olmaları hâlinde, kullanıcı yükü 25 kişiyi aşmayan herhangi bir kattan, ara kattan, veya balkonlardan zorunlu çıkış olarak hizmet verebilir. Belirtilen şartları sağlamayan dairesel merdivenler, zorunlu çıkış olarak kullanılamaz. (2) Dairesel merdivenler 9.50 m'den daha yüksek olamaz. (3) Basamağın kova merkezinden en fazla 50 cm uzaklıktaki basış genişliği 250 mm’den az olamaz. (4) Basamak yüksekliği 175 mm'den çok olamaz. (5) Baş kurtarma yüksekliği 2.50 m'den az olamaz.  Kaçış yolu kapıları MADDE 47- (1) Kaçış yolu kapılarının en az temiz genişliği 80 cm’den ve yüksekliği 200 cm’den az olamaz. Kaçış yolu kapılarında eşik olmaması gerekir. Dönel kapılar ile turnikeler, çıkış kapısı olarak kullanılamaz. (2) Kaçış yolu kapıları kanatlarının, kullanıcıların hareketini engellememesi gerekir. Kullanıcı yükü 50 kişiyi aşan mekânlardaki çıkış kapılarının kaçış yönüne doğru açılması şarttır. Kaçış yolu kapılarının el ile açılması ve kilitli tutulmaması gerekir. (3) Kaçış merdiveni ve yangın güvenlik holü kapılarının; duman sızdırmaz ve 4 kattan daha az kata hizmet veriyor ise en az 60 dakika, bodrum katlara ve 4 kattan daha fazla kata hizmet veriyor ise en az 90 dakika yangına karşı dayanıklı olması şarttır. Kapıların, kendiliğinden kapatan düzenekler ile donatılması ve itfaiyecilerin veya görevlilerin gerektiğinde dışarıdan içeriye"", '**Binaların Yangından Korunması Yönetmeliği**\ntutulmaması gerekir. (3) Kaçış merdiveni ve yangın güvenlik holü kapılarının; duman sızdırmaz ve 4 kattan daha az kata hizmet veriyor ise en az 60 dakika, bodrum katlara ve 4 kattan daha fazla kata hizmet veriyor ise en az 90 dakika yangına karşı dayanıklı olması şarttır. Kapıların, kendiliğinden kapatan düzenekler ile donatılması ve itfaiyecilerin veya görevlilerin gerektiğinde dışarıdan içeriye girmelerine imkân sağlayacak şekilde olması gerekir. (4) Kaçış kapısında, tek kanatlı kapıda temiz genişlik, kapı kasası veya lamba çıkıntısı ile 90 derece açılmış kanat yüzeyi arasındaki ölçüdür. Tek kanatlı bir çıkış kapısının temiz genişliği 80 cm’den az ve 120 cm’den çok olamaz. İki kanatlı kapıda temiz genişlik, her iki kanat 90 derece açık durumda iken, kanat yüzeyleri arasındaki ölçüdür.  (5) Merdivenden tabii zemin seviyesinde güvenlikli bir alana açılan bütün kaçış yolu kapıları ile bir kattaki kişi sayısının 100’ü geçmesi hâlinde, kaçış merdiveni, kaçış koridoru ve yangın güvenlik holü kapıları, kaçış yönünde kapı kolu kullanılmadan açılabilecek şekilde düzenlenir. (6) Kapıların en çok 110 N kuvvetle açılabilecek şekilde tasarlanması gerekir.  Konutlar MADDE 48- (Değişik: 10/8/2009-2009/15316 K.)  (1) Bodrum katlar dâhil 4 katı geçmeyen konutlar ile tek evler, ikiz evler ve sıra evler gibi konutlarda, tek bir kullanıma hizmet veren binalarda veya böyle bir binanın ayrılmış bir bölümünde kaçışlar, kaçış mesafesi aranmaksızın normal merdivenlerle sağlanabilir. Bu merdivenlerde başka herhangi bir özellik aranmaz.  (2) Birinci fıkrada belirtilenler dışındaki konutlarda, konut içindeki herhangi bir noktadan konut çıkış kapısına kadar olan uzaklığın  20 m’yi, yağmurlama sistemi olan konutlarda 30 m’yi geçmemesi gerekir. İkiden çok ara kat bulunmayan apartman dairelerinde tek kapı bulunması hâlinde, bu kapı üst katta düzenlenemez. Üstteki katın döşeme alanı, bu kat için ayrı bir çıkış sağlanmadıkça 70 m2’yi aşamaz. (3) Konut birimlerinden bütün çıkışların, kaçış', '**Binaların Yangından Korunması Yönetmeliği**\nher birinin içinden bir yangın güvenlik holünden geçilerek yangın merdivenine ulaşılıyor ise binanın genel merdiveninin korunumlu olması gerekli değildir. ç) Yapı yüksekliği 51.50 m’den yüksek olan konutlarda, birbirlerine alternatif ve yangın güvenlik holü olan ve basınçlandırılan en az 2 kaçış merdiveni yapılması şarttır. (6) Konut yapılarının farklı amaçla kullanılan bodrum katlarında, konut ile  ortak kullanılan kaçış merdivenlerinin önüne yangın güvenlik holü düzenlenmesi gerekir.', '**Binaların Yangından Korunması Yönetmeliği**\nkonut içindeki herhangi bir noktadan konut çıkış kapısına kadar olan uzaklığın  20 m’yi, yağmurlama sistemi olan konutlarda 30 m’yi geçmemesi gerekir. İkiden çok ara kat bulunmayan apartman dairelerinde tek kapı bulunması hâlinde, bu kapı üst katta düzenlenemez. Üstteki katın döşeme alanı, bu kat için ayrı bir çıkış sağlanmadıkça 70 m2’yi aşamaz. (3) Konut birimlerinden bütün çıkışların, kaçış merdivenlerine veya güvenli bir açık alana doğrudan erişim imkânı sağlayacak şekilde olması gerekir. (4) Kaçış uzaklığı, apartman dairelerinin kapısından başlanarak ölçülür. Bir apartman dairesi için aynı kat düzeyinde iki kapı gerektiğinde, yalnızca tek doğrultuda kaçış veya tek bir kaçış merdiveni sağlanıyor ise kaçış uzaklığı en uzaktaki kapıdan başlanarak ve iki ayrı doğrultuda kaçış imkânı sağlanabiliyor ise kaçış uzaklığı her bir kapıdan başlanarak ölçülür. (5) Kaçış mesafeleri uygun olmak şartıyla, binaların sadece konut bölümlerine hizmet veren kaçış merdivenleri aşağıdaki şekilde düzenlenir: a) Yapı yüksekliği 21.50 m’nin altındaki konutlarda korunumsuz normal merdiven kaçış yolu olarak kabul edilir ve ikinci çıkış aranmaz. b) Yapı yüksekliği 21.50 m’den fazla ve 30.50 m’den az olan konutlarda, en az 2 merdiven düzenlenmesi, merdivenlerden en az birisinin korunumlu olması ve her daireden 2 merdivene de ulaşılması gerekir. c) Yapı yüksekliği 30.50 m’den fazla ve 51.50 m’den az olan konutlarda, birbirlerine alternatif, her ikisi de korunumlu ve en az birinde yangın güvenlik holü düzenlenmiş veya basınçlandırma uygulanmış 2 kaçış merdiveni yapılması mecburidir. Kattaki konutların her birinin içinden bir yangın güvenlik holünden geçilerek yangın merdivenine ulaşılıyor ise binanın genel merdiveninin korunumlu olması gerekli değildir. ç) Yapı yüksekliği 51.50 m’den yüksek olan konutlarda, birbirlerine alternatif ve yangın güvenlik holü olan ve basınçlandırılan en az 2 kaçış merdiveni yapılması şarttır. (6) Konut yapılarının farklı amaçla kullanılan bodrum katlarında, konut', '**Binaların Yangından Korunması Yönetmeliği**\n(7) Giriş, çıkış ve şaftları üst katlardan 120 dakika yangına dayanıklı döşeme veya bölme ile ayrılan bodrum katlar, beşinci fıkrada belirtilen yapı yüksekliklerine dahil edilmez ve yangın güvenlik tedbirleri bakımından ayrı değerlendirilir. (8) Çatı arası piyeslerden binanın normal merdivenine veya korunumlu kaçış merdivenine alternatif kaçış imkânı sağlanması durumunda, çatı arası piyes yüksekliği beşinci fıkrada belirtilen yapı yüksekliklerine dahil edilmez.  Elektrik tesisatı ve sistemlerin özellikleri MADDE 67- (1) Binalarda kurulan elektrik tesisatının, kaçış yolları aydınlatmasının ve yangın algılama ve uyarı sistemlerinin, yangın hâlinde veya herhangi bir acil hâlde, binada bulunanlara zarar vermeyecek, panik çıkmasını önleyecek, binanın emniyetli bir şekilde boşaltılmasını sağlayacak ve güvenli bir ortam oluşturacak şekilde tasarlanması, tesis edilmesi ve çalışır durumda tutulması gerekir. (2) Her türlü elektrik tesisatının, kaçış yolları aydınlatmasının, acil durum aydınlatma ve yönlendirmesinin ve yangın algılama ve uyarı sistemlerinin, ilgili tesisat yönetmeliklerine ve standartlarına uygun olarak tasarlanması ve tesis edilmesi şarttır. (3) Binalarda kurulacak elektrik tesisatının, kaçış yolları aydınlatmasının ve yangın algılama ve uyarı sistemlerinin tasarımı ve uygulaması, ruhsat veren idarenin kontrol ve onayına tabidir. Sistemlerin ve cihazların periyodik kontrolü, test ve bakımları, bina sahibi veya yöneticisi ile bunların yazılı olarak sorumluluklarını devrettiği bina yetkilisince yaptırılır.   Taşınabilir söndürme cihazları (4) MADDE 99- (Değişik: 10/8/2009-2009/15316 K.) (1) Taşınabilir söndürme cihazlarının tipi ve sayısı, mekânlarda var olan durum ve risklere göre belirlenir. Buna göre; a) A sınıfı yangın çıkması muhtemel yerlerde, öncelikle çok maksatlı kuru kimyevi tozlu veya sulu, b) B sınıfı yangın çıkması muhtemel yerlerde, öncelikle kuru kimyevi tozlu, karbondioksitli veya köpüklü, c) C sınıfı yangın çıkması muhtemel yerlerde, öncelikle', '**Binaların Yangından Korunması Yönetmeliği**\nK.) (1) Taşınabilir söndürme cihazlarının tipi ve sayısı, mekânlarda var olan durum ve risklere göre belirlenir. Buna göre; a) A sınıfı yangın çıkması muhtemel yerlerde, öncelikle çok maksatlı kuru kimyevi tozlu veya sulu, b) B sınıfı yangın çıkması muhtemel yerlerde, öncelikle kuru kimyevi tozlu, karbondioksitli veya köpüklü, c) C sınıfı yangın çıkması muhtemel yerlerde, öncelikle kuru kimyevi tozlu veya karbondioksitli, ç) D sınıfı yangın çıkması muhtemel yerlerde, öncelikle kuru metal tozlu, söndürme cihazları bulundurulur. Hastanelerde, huzurevlerinde, anaokullarında ve benzeri yerlerde sulu veya temiz gazlı söndürme cihazlarının tercih edilmesi gerekir. (2) Düşük tehlike sınıfında her 500 m2, orta tehlike ve yüksek tehlike sınıfında her 250 m² yapı inşaat alanı için 1 adet olmak üzere, uygun tipte 6 kg’lık kuru kimyevî tozlu veya eşdeğeri gazlı yangın söndürme cihazları bulundurulması gerekir. (3) Otoparklarda, depolarda, tesisat dairelerinde ve benzeri yerlerde ayrıca tekerlekli tip söndürme cihazı bulundurulması mecburidir. (4) Söndürme cihazları dışarıya doğru, geçiş boşluklarının yakınına ve dengeli dağıtılarak, görülebilecek şekilde işaretlenir ve her durumda kolayca girilebilir yerlere, yangın dolaplarının içine veya yakınına yerleştirilir. Söndürme cihazlarına ulaşma mesafesi en fazla 25 m olur. Söndürme cihazlarının, kapı arkasında, yangın dolapları hariç kapalı dolaplarda ve derin duvar girintilerinde bulundurulmaması ve ısıtma cihazlarının üstüne veya yakınına konulmaması gerekir. Ancak, herhangi bir sebeple söndürme cihazlarının doğrudan görünmesini engelleyen yerlere konulması halinde, yerlerinin uygun fosforlu işaretler ile gösterilmesi şarttır.  (5) Taşınabilir söndürme cihazlarında söndürücünün duvara bağlantı asma halkası duvardan kolaylıkla alınabilecek şekilde yerleştirilir ve 4 kg’dan daha ağır ve 12 kg’dan hafif olan cihazların zeminden olan yüksekliği yaklaşık 90 cm’yi aşmayacak şekilde montaj yapılır. (6) Arabalı yangın söndürme']","Mesafe sınırı konusunda net bir ölçüm vermek mümkün değil; bu durumun hangi koşullarda belirlendiğine bağlıdır. Ancak, konutlarda yangın güvenliği ile ilgili genel kurala göre, konut içindeki herhangi bir noktadan konut çıkış kapısına kadar olan uzaklığın 20 metreyi, yağmurlama sistemi olan konutlarda ise 30 metreyi geçmemesi gerektiği belirlenmiştir. 

Bu kurala, Kat Mülkiyeti Kanunu ve yangın güvenliği yönetmelikleri çerçevesinde uymak gerekir. Dolayısıyla, daire kapısından yangın merdivenine olan mesafenin bu limitleri aşmaması esastır. Eğer yangın merdiveni bu mesafeleri aşarsa, emniyet açısından tehlikeli bir durum söz konusu olur.","Konut içindeki herhangi bir noktadan çıkış kapısına kadar olan uzaklık normalde 20 metreyi, yağmurlama sistemi olan konutlarda 30 metreyi geçmemelidir.",0.5714285714285714,0.0,0.6738014143869407
Kaçış merdiveni kapıları kilitli olabilir mi?,"['**Binaların Yangından Korunması Yönetmeliği**\ntutulmaması gerekir. (3) Kaçış merdiveni ve yangın güvenlik holü kapılarının; duman sızdırmaz ve 4 kattan daha az kata hizmet veriyor ise en az 60 dakika, bodrum katlara ve 4 kattan daha fazla kata hizmet veriyor ise en az 90 dakika yangına karşı dayanıklı olması şarttır. Kapıların, kendiliğinden kapatan düzenekler ile donatılması ve itfaiyecilerin veya görevlilerin gerektiğinde dışarıdan içeriye girmelerine imkân sağlayacak şekilde olması gerekir. (4) Kaçış kapısında, tek kanatlı kapıda temiz genişlik, kapı kasası veya lamba çıkıntısı ile 90 derece açılmış kanat yüzeyi arasındaki ölçüdür. Tek kanatlı bir çıkış kapısının temiz genişliği 80 cm’den az ve 120 cm’den çok olamaz. İki kanatlı kapıda temiz genişlik, her iki kanat 90 derece açık durumda iken, kanat yüzeyleri arasındaki ölçüdür.  (5) Merdivenden tabii zemin seviyesinde güvenlikli bir alana açılan bütün kaçış yolu kapıları ile bir kattaki kişi sayısının 100’ü geçmesi hâlinde, kaçış merdiveni, kaçış koridoru ve yangın güvenlik holü kapıları, kaçış yönünde kapı kolu kullanılmadan açılabilecek şekilde düzenlenir. (6) Kapıların en çok 110 N kuvvetle açılabilecek şekilde tasarlanması gerekir.  Konutlar MADDE 48- (Değişik: 10/8/2009-2009/15316 K.)  (1) Bodrum katlar dâhil 4 katı geçmeyen konutlar ile tek evler, ikiz evler ve sıra evler gibi konutlarda, tek bir kullanıma hizmet veren binalarda veya böyle bir binanın ayrılmış bir bölümünde kaçışlar, kaçış mesafesi aranmaksızın normal merdivenlerle sağlanabilir. Bu merdivenlerde başka herhangi bir özellik aranmaz.  (2) Birinci fıkrada belirtilenler dışındaki konutlarda, konut içindeki herhangi bir noktadan konut çıkış kapısına kadar olan uzaklığın  20 m’yi, yağmurlama sistemi olan konutlarda 30 m’yi geçmemesi gerekir. İkiden çok ara kat bulunmayan apartman dairelerinde tek kapı bulunması hâlinde, bu kapı üst katta düzenlenemez. Üstteki katın döşeme alanı, bu kat için ayrı bir çıkış sağlanmadıkça 70 m2’yi aşamaz. (3) Konut birimlerinden bütün çıkışların, kaçış', ""**Binaların Yangından Korunması Yönetmeliği**\nDış kaçış merdivenleri MADDE 42- (1) Dışarıda yapılan açık kaçış merdiveni, ilgili gereklere uyulması şartıyla iç kaçış merdivenleri yerine kullanılabilir. Dış kaçış merdiveninin korunumlu yuva içinde bulunması şart değildir. (2) Açık dış kaçış merdiveninin herhangi bir bölümüne, yanlardan yatay ve alttan düşey uzaklık olarak 3 m içerisinde merdivenin özelliklerinden daha az korunumlu kapı ve pencere gibi duvar boşluğu bulunamaz. (3) Bina yüksekliği 21.50 m’den fazla olan binalarda, bina dışında açık merdivenlere  izin verilmez.  Dairesel merdiven MADDE 43- (1) Dairesel merdivenler; yanmaz malzemeden yapılmaları ve en az 100 cm genişlikte olmaları hâlinde, kullanıcı yükü 25 kişiyi aşmayan herhangi bir kattan, ara kattan, veya balkonlardan zorunlu çıkış olarak hizmet verebilir. Belirtilen şartları sağlamayan dairesel merdivenler, zorunlu çıkış olarak kullanılamaz. (2) Dairesel merdivenler 9.50 m'den daha yüksek olamaz. (3) Basamağın kova merkezinden en fazla 50 cm uzaklıktaki basış genişliği 250 mm’den az olamaz. (4) Basamak yüksekliği 175 mm'den çok olamaz. (5) Baş kurtarma yüksekliği 2.50 m'den az olamaz.  Kaçış yolu kapıları MADDE 47- (1) Kaçış yolu kapılarının en az temiz genişliği 80 cm’den ve yüksekliği 200 cm’den az olamaz. Kaçış yolu kapılarında eşik olmaması gerekir. Dönel kapılar ile turnikeler, çıkış kapısı olarak kullanılamaz. (2) Kaçış yolu kapıları kanatlarının, kullanıcıların hareketini engellememesi gerekir. Kullanıcı yükü 50 kişiyi aşan mekânlardaki çıkış kapılarının kaçış yönüne doğru açılması şarttır. Kaçış yolu kapılarının el ile açılması ve kilitli tutulmaması gerekir. (3) Kaçış merdiveni ve yangın güvenlik holü kapılarının; duman sızdırmaz ve 4 kattan daha az kata hizmet veriyor ise en az 60 dakika, bodrum katlara ve 4 kattan daha fazla kata hizmet veriyor ise en az 90 dakika yangına karşı dayanıklı olması şarttır. Kapıların, kendiliğinden kapatan düzenekler ile donatılması ve itfaiyecilerin veya görevlilerin gerektiğinde dışarıdan içeriye"", '**Binaların Yangından Korunması Yönetmeliği**\nkonut içindeki herhangi bir noktadan konut çıkış kapısına kadar olan uzaklığın  20 m’yi, yağmurlama sistemi olan konutlarda 30 m’yi geçmemesi gerekir. İkiden çok ara kat bulunmayan apartman dairelerinde tek kapı bulunması hâlinde, bu kapı üst katta düzenlenemez. Üstteki katın döşeme alanı, bu kat için ayrı bir çıkış sağlanmadıkça 70 m2’yi aşamaz. (3) Konut birimlerinden bütün çıkışların, kaçış merdivenlerine veya güvenli bir açık alana doğrudan erişim imkânı sağlayacak şekilde olması gerekir. (4) Kaçış uzaklığı, apartman dairelerinin kapısından başlanarak ölçülür. Bir apartman dairesi için aynı kat düzeyinde iki kapı gerektiğinde, yalnızca tek doğrultuda kaçış veya tek bir kaçış merdiveni sağlanıyor ise kaçış uzaklığı en uzaktaki kapıdan başlanarak ve iki ayrı doğrultuda kaçış imkânı sağlanabiliyor ise kaçış uzaklığı her bir kapıdan başlanarak ölçülür. (5) Kaçış mesafeleri uygun olmak şartıyla, binaların sadece konut bölümlerine hizmet veren kaçış merdivenleri aşağıdaki şekilde düzenlenir: a) Yapı yüksekliği 21.50 m’nin altındaki konutlarda korunumsuz normal merdiven kaçış yolu olarak kabul edilir ve ikinci çıkış aranmaz. b) Yapı yüksekliği 21.50 m’den fazla ve 30.50 m’den az olan konutlarda, en az 2 merdiven düzenlenmesi, merdivenlerden en az birisinin korunumlu olması ve her daireden 2 merdivene de ulaşılması gerekir. c) Yapı yüksekliği 30.50 m’den fazla ve 51.50 m’den az olan konutlarda, birbirlerine alternatif, her ikisi de korunumlu ve en az birinde yangın güvenlik holü düzenlenmiş veya basınçlandırma uygulanmış 2 kaçış merdiveni yapılması mecburidir. Kattaki konutların her birinin içinden bir yangın güvenlik holünden geçilerek yangın merdivenine ulaşılıyor ise binanın genel merdiveninin korunumlu olması gerekli değildir. ç) Yapı yüksekliği 51.50 m’den yüksek olan konutlarda, birbirlerine alternatif ve yangın güvenlik holü olan ve basınçlandırılan en az 2 kaçış merdiveni yapılması şarttır. (6) Konut yapılarının farklı amaçla kullanılan bodrum katlarında, konut', '**Binaların Yangından Korunması Yönetmeliği**\nher birinin içinden bir yangın güvenlik holünden geçilerek yangın merdivenine ulaşılıyor ise binanın genel merdiveninin korunumlu olması gerekli değildir. ç) Yapı yüksekliği 51.50 m’den yüksek olan konutlarda, birbirlerine alternatif ve yangın güvenlik holü olan ve basınçlandırılan en az 2 kaçış merdiveni yapılması şarttır. (6) Konut yapılarının farklı amaçla kullanılan bodrum katlarında, konut ile  ortak kullanılan kaçış merdivenlerinin önüne yangın güvenlik holü düzenlenmesi gerekir.', '**Binaların Yangından Korunması Yönetmeliği**\n(7) Giriş, çıkış ve şaftları üst katlardan 120 dakika yangına dayanıklı döşeme veya bölme ile ayrılan bodrum katlar, beşinci fıkrada belirtilen yapı yüksekliklerine dahil edilmez ve yangın güvenlik tedbirleri bakımından ayrı değerlendirilir. (8) Çatı arası piyeslerden binanın normal merdivenine veya korunumlu kaçış merdivenine alternatif kaçış imkânı sağlanması durumunda, çatı arası piyes yüksekliği beşinci fıkrada belirtilen yapı yüksekliklerine dahil edilmez.  Elektrik tesisatı ve sistemlerin özellikleri MADDE 67- (1) Binalarda kurulan elektrik tesisatının, kaçış yolları aydınlatmasının ve yangın algılama ve uyarı sistemlerinin, yangın hâlinde veya herhangi bir acil hâlde, binada bulunanlara zarar vermeyecek, panik çıkmasını önleyecek, binanın emniyetli bir şekilde boşaltılmasını sağlayacak ve güvenli bir ortam oluşturacak şekilde tasarlanması, tesis edilmesi ve çalışır durumda tutulması gerekir. (2) Her türlü elektrik tesisatının, kaçış yolları aydınlatmasının, acil durum aydınlatma ve yönlendirmesinin ve yangın algılama ve uyarı sistemlerinin, ilgili tesisat yönetmeliklerine ve standartlarına uygun olarak tasarlanması ve tesis edilmesi şarttır. (3) Binalarda kurulacak elektrik tesisatının, kaçış yolları aydınlatmasının ve yangın algılama ve uyarı sistemlerinin tasarımı ve uygulaması, ruhsat veren idarenin kontrol ve onayına tabidir. Sistemlerin ve cihazların periyodik kontrolü, test ve bakımları, bina sahibi veya yöneticisi ile bunların yazılı olarak sorumluluklarını devrettiği bina yetkilisince yaptırılır.   Taşınabilir söndürme cihazları (4) MADDE 99- (Değişik: 10/8/2009-2009/15316 K.) (1) Taşınabilir söndürme cihazlarının tipi ve sayısı, mekânlarda var olan durum ve risklere göre belirlenir. Buna göre; a) A sınıfı yangın çıkması muhtemel yerlerde, öncelikle çok maksatlı kuru kimyevi tozlu veya sulu, b) B sınıfı yangın çıkması muhtemel yerlerde, öncelikle kuru kimyevi tozlu, karbondioksitli veya köpüklü, c) C sınıfı yangın çıkması muhtemel yerlerde, öncelikle', '**Binaların Yangından Korunması Yönetmeliği**\nK.) (1) Taşınabilir söndürme cihazlarının tipi ve sayısı, mekânlarda var olan durum ve risklere göre belirlenir. Buna göre; a) A sınıfı yangın çıkması muhtemel yerlerde, öncelikle çok maksatlı kuru kimyevi tozlu veya sulu, b) B sınıfı yangın çıkması muhtemel yerlerde, öncelikle kuru kimyevi tozlu, karbondioksitli veya köpüklü, c) C sınıfı yangın çıkması muhtemel yerlerde, öncelikle kuru kimyevi tozlu veya karbondioksitli, ç) D sınıfı yangın çıkması muhtemel yerlerde, öncelikle kuru metal tozlu, söndürme cihazları bulundurulur. Hastanelerde, huzurevlerinde, anaokullarında ve benzeri yerlerde sulu veya temiz gazlı söndürme cihazlarının tercih edilmesi gerekir. (2) Düşük tehlike sınıfında her 500 m2, orta tehlike ve yüksek tehlike sınıfında her 250 m² yapı inşaat alanı için 1 adet olmak üzere, uygun tipte 6 kg’lık kuru kimyevî tozlu veya eşdeğeri gazlı yangın söndürme cihazları bulundurulması gerekir. (3) Otoparklarda, depolarda, tesisat dairelerinde ve benzeri yerlerde ayrıca tekerlekli tip söndürme cihazı bulundurulması mecburidir. (4) Söndürme cihazları dışarıya doğru, geçiş boşluklarının yakınına ve dengeli dağıtılarak, görülebilecek şekilde işaretlenir ve her durumda kolayca girilebilir yerlere, yangın dolaplarının içine veya yakınına yerleştirilir. Söndürme cihazlarına ulaşma mesafesi en fazla 25 m olur. Söndürme cihazlarının, kapı arkasında, yangın dolapları hariç kapalı dolaplarda ve derin duvar girintilerinde bulundurulmaması ve ısıtma cihazlarının üstüne veya yakınına konulmaması gerekir. Ancak, herhangi bir sebeple söndürme cihazlarının doğrudan görünmesini engelleyen yerlere konulması halinde, yerlerinin uygun fosforlu işaretler ile gösterilmesi şarttır.  (5) Taşınabilir söndürme cihazlarında söndürücünün duvara bağlantı asma halkası duvardan kolaylıkla alınabilecek şekilde yerleştirilir ve 4 kg’dan daha ağır ve 12 kg’dan hafif olan cihazların zeminden olan yüksekliği yaklaşık 90 cm’yi aşmayacak şekilde montaj yapılır. (6) Arabalı yangın söndürme']","Hayır, kaçış merdiveni kapıları kilitli tutulamaz. Kaçış yolu kapılarının, yangın veya acil durumlarda hızlıca açılabilmesi gerektiği için, asla kilitli olmaması gerekmektedir. Bu durum, yangın güvenliği açısından büyük önem taşır. İlgili yönetmeliklere göre kaçış yolu kapılarının el ile açılması ve kilitli tutulmaması gerekir. Böylece, acil durumda insanların güvenli bir şekilde binayı terk etmeleri sağlanır.",Hayır. Kaçış yolu kapılarının el ile açılması ve kilitli tutulmaması gerekir.,0.7142857142857143,0.8649420257804333,0.7442760256731261
"Komşum sürekli gürültü yapıyor ve kötü koku yayıyor, kanuni hakkım nedir?","['**Kat Mülkiyeti Kanunu**\n“özürlünün” ibareleri sırasıyla “Engellilerin” ve “engellinin”  şeklinde değiştirilmiştir. \nüzerine ısı yalıtımı, ısıtma sisteminin yakıt dönüşümü ve ısıtma sisteminin merkezi sistemden \nferdi sisteme veya ferdi sistemden merkezi sisteme dönüştürülmesi, kat maliklerinin sayı ve \narsa payı çoğunl uğu i le verecekleri karar üzerine yapılır. Ancak toplam inşaat alanı ikibin \nmetrekare ve üzeri olan binalarda merkezi ısıtma sisteminin ferdi ısıtma sistemine dönüştü-\nrülmesi, kat maliklerinin sayı ve arsa payı olarak oybirliği ile verecekleri karar üzerine yapılır. \nBu konuda yapılacak ortak işlerin giderleri arsa payı oranına göre ödenir. Merkezi ısıtma sis-\ntemlerinde ısınma giderl erinin paylaştırılmasına ilişkin usûl ve esaslar Bayındırlık ve İskan \nBakanlığı tarafından yürürlüğe konulacak yönetmelikle düzenlenir.  \n(Değişik beşinci fıkra: 18/4/2007-5627/16 md.) Isıtma sisteminin merkezi sistemden \nferdi sisteme veya ferdi sistemden merkezi sisteme dönüştürülmesine karar verilmesi halinde, \nyönetim planının bu karara aykırı hükümleri değiştirilmiş sayılır. \n \nII - Çok masraflı ve lüks olanlar:', '**Kat Mülkiyeti Kanunu**\nEk Madde 3 – (Ek:13/4/1983 - 2814/15 md.; Mülga: 14/11/2007-5711/24 md.) \n \nKat irtifakına geçiş: \nEk Madde 4 – (Ek: 13/4/1983 - 2814/15 md.) \nBeş veya daha fazla kişi tarafı ndan üzerinde bir veya birden çok yapı yaptırılmak \namacıyla birlikte bir arsa edinilmiş olması ve pay sahiplerinden en az beşte dördünün kat irti-\nfakına geçiş kon usunda aldığı karara uyulmaması halinde, karara uymayan pay sahiplerinin \ngayrimenkuldeki paylarının iptaline ve bu payların, isteyen diğer pay sahipleri adına tesciline \nsulh mahkemesi tarafından aşağıdaki şartlarla karar verilir: \na) Müşterek gayrimenkulün yukarıda belirtilen amaçla edinildiğinin ispat edilmiş olması, \nb) Müşterek maliklerin yukarıda açıklanan çoğunluğunun kat irtifakına geçiş kararına \nveya bununla ilgili yükümlülüklere noterlikçe yapılan tebligata rağmen iki ay içinde uyulmamış \nolması, \nc) Karara uymayan müşterek maliklerin paylarının mahkemece tespit edilen rayiç be-\ndelinin mahkeme veznesine depo edilmesi. \n \nHatalı blok veya bağımsız bölüm numaralarının düzeltilmesi', '**Kat Mülkiyeti Kanunu**\nbankada kendi adına ve fakat anagayrimenkulün yönetici sıfatı gösterilmek suretiyle, hesap \naçtırılması; \nk) Kat malikleri kurulunun toplantıya çağırılması. \nl) (Ek: 4/4/2015 -6645/82 md.) Anagayrimenkulde bulunan asansörlerin güvenli bir \nşekilde işletilmesinin sağlanması amacıyla aylık bakımları ile yıllık kontrollerinin ilgili teknik \ndüzenlemelere uygun şekilde yaptırılması ve bu işlemlere ilişkin ücretlerin ödenmesi. \n(Ek fıkra: 4/4/2015-6645/82 md.) Bu Kanunun 34 üncü maddesinde belirtilen şartları \ntaşımasına rağmen yönetici ataması yapılmayan anagayrimenkulde, birinci fıkrada sayılan \nişlerin yaptırılmasından kat malikleri müştereken sorumludur. \n \n2. Defter tutulması ve belgelerin saklanması:', '**Kat Mülkiyeti Kanunu**\nMadde 23 – Kat maliklerinden birinin bağımsız bölümünde veya bu bölümdeki tesis-\nlerde meydana gelen bir hasar veya bozukluğun onarımı veya giderilmes i veya tesislerin ye-\nniden yapılması ile yapı güvenliğiyle ilgili olarak yapılması gerekli görülen teknik inceleme-\nler için diğer bir bağımsız bölüme girmek gerekiyorsa, o bölümün maliki veya o bölümde \nbaşka sıfatla otura nlar, giriş müsaadesi vermeye ve böl ümde gerekli işlerin yapılmasına ka t-\nlanmaya mecburdurlar.6 \n                                                           \n6 14/11/2007 tarihli ve 5711 sayılı Kanunun 11 inci maddesiyle; bu fıkrada yer alan ""tesislerin yeniden \nyapılması"" ibaresinden sonra gelmek üzere ""ile yapı güvenliğiyle ilgili olarak yapılması gerekli görülen \nteknik incelemeler"" ibaresi eklenmiştir. \nAnagayrimenkulün bir kısmının harap olması halinde, harap olan bağımsız bölüm ve \neklentilerinin veya ortak yerlerin veya bağımsız bölümdeki tesislerin yeniden yapılması için, \nsağlam kalan bağımsız bölümlerin içinden veya dışından faydalanılması gerekiyorsa, o bö-\nlümlerin malikleri veya orada başka sıfatla oturanlar buna müsaade etmeye mecburdurlar. \nYukarıdaki fıkralarda yazılı müsaade yüzünden, kat maliklerinin veya orada başka sı-\nfatla oturanların uğrayacakları zararı, lehine müsaade verilen bağımsız bölüm malikleri derhal \nödemekle yükümlüdürler.  \n \nVII - Yasak işler:', '**Kat Mülkiyeti Kanunu**\nMadde 42 – Kat malikleri,anagayrimenkulün ortak yerlerinde kendi başlarında bir deği-\nşiklik yapamazlar; ortak yerlerin düzgün veya bunları kullanmanın daha rahat ve kolay bir hale \nkonulmasına veya bu yerlerden elde edilecek faydanın çoğaltılmasına yarıyacak bütün yenilik \nve ilaveler, kat maliklerinin sayı ve arsa payı çoğunluğu ile verecekleri karar üzerine yapılır. \n(Ek fıkra: 1/7/2005 -5378/19 md.) Engellilerin yaşamı için zorunluluk göstermesi \nhâlinde, proje tadili kat maliklerinin en geç üç ay içerisinde yapacağı toplantıda görüşülerek \nsayı ve arsa payı ç oğunluğu ile karara bağlanır. Toplantının bu süre iç erisinde yapılamaması \nveya tadilat talebinin çoğunlukla kabul edilmemesi durumunda; ilgili kat malikinin talebi üze-\nrine bina güve nliğinin tehlikeye sokulmadığını bildirir komisyon raporuna istinaden ilgili \nmercilerden alınacak  tasdikli  proje değişikliği veya krokiye göre inşaat, onarım ve tesis yapı-\nlır. İlgili merciler, tasdikli proje değişikliği veya kroki taleplerini en geç altı ay içinde sonuç-\nlandırır.  Komisyonun teşkili, çalışma usûlü ile engellinin kullanımından sonraki süreç ile \nilgili usûl ve esaslar Bayındırlık ve İskan Bakanlığı ile Özürlüler İdaresi Başkanlığı tarafından \nmüştereken hazırlanacak yönetmelikle belirlenir.7 \nBu işlerin giderleri, yeniliklerden faydalananlar tarafından, faydalanma oranına göre, \nödenir. \n(Değişik dördüncü fıkra : 18/4/20 07-5627/16 md.) Kat maliklerinden birinin isteği \n                                                           \n7 25/4/2013 tarihli ve 6462 sayılı Kanunun 1 inci maddesiyle, bu fıkrada yer alan “Özürlülerin” ve \n“özürlünün” ibareleri sırasıyla “Engellilerin” ve “engellinin”  şeklinde değiştirilmiştir. \nüzerine ısı yalıtımı, ısıtma sisteminin yakıt dönüşümü ve ısıtma sisteminin merkezi sistemden \nferdi sisteme veya ferdi sistemden merkezi sisteme dönüştürülmesi, kat maliklerinin sayı ve \narsa payı çoğunl uğu i le verecekleri karar üzerine yapılır. Ancak toplam inşaat alanı ikibin', '**Kat Mülkiyeti Kanunu**\nğince verilen emre rağmen, bu kanunda yazılı borç ve yükümleri yerine getirmemek suretiyle \nöteki kat maliklerinin haklarını ihlal etmekte devamlı olarak bir yıl ısrar edilmesi; \nc) Kendi bağımsız bölümünü randevu evi veya kumarhane veya benzeri yer olarak \nkullanmak suretiyle ahlak ve adaba aykırı harekette bulunması.  \n(Değişik dördüncü fıkra: 14/11/2007-5711/12 md.) Bu maddedeki dava hakkı, devir \nkonusunda kat maliklerince alınan dava açma kararının öğrenilmesi tarihinden başlay arak altı \nay ve her halde dava hakkının doğumundan başlayarak beş yıl içinde kullanı lmazsa veya dava \nsebebi ortadan kalkmışsa düşer. \n \nB) Kat irtifakı sahiplerinin borçları:']","Evet, komşunuzun gürültü yapması ve kötü koku yayması durumunda kanuni haklarınız bulunmaktadır. Kat Mülkiyeti Kanunu'na göre, kat maliklerinin diğer maliklere karşı olan yükümlülükleri arasında, kendi bağımsız bölümünü kullanırken diğer maliklerin huzur ve sükununu bozacak şekilde hareket etmemeleri de yer almaktadır.

Bu nedenle, komşunuzun sürekli gürültü yapması ve kötü kokular yayması, diğer kat maliklerinin yaşam kalitesini etkileyen bir durumdur. İlk olarak, bu konuyu komşunuzla dostane bir şekilde konuşarak çözmeye çalışabilirsiniz. Eğer bu işe yaramazsa, apartman yönetimiyle durumu görüşmek veya yazılı bir şikayet oluşturmak en uygun yol olacaktır.

Apartman yöneticisi, bu konuda gerekli adımları atmakla yükümlüdür ve gerektiğinde kat malikleri kurulunu toplayarak sorunu çözebilir. Eğer hiçbir çözüm bulunamazsa, yargı yoluna başvurarak komşunuz aleyhine dava açma hakkınız mevcuttur. Ancak bu süreçte, durumu yazılı olarak belgelemek ve kayıt altında tutmak önemlidir.","Medeni Kanun'a göre herkes taşınmaz mülkiyetinden doğan yetkileri kullanırken komşularını olumsuz etkileyecek taşkınlıktan kaçınmalıdır. Gürültü yapmak, koku çıkartmak gibi rahatsızlıklar vermek yasaktır.",1.0,0.4650149378098428,0.5151978460835225
Polis veya yönetici evime izinsiz girebilir mi?,"['**T.C. Anayasası (İlgili Maddeler)**\nB. Konut dokunulmazlığı Madde 21 – (Değişik: 3/10/2001-4709/6 md.) Kimsenin konutuna dokunulamaz. Millî güvenlik, kamu düzeni, suç işlenmesinin önlenmesi, genel sağlık ve genel ahlâkın korunması veya başkalarının hak ve özgürlüklerinin korunması sebeplerinden biri veya birkaçına bağlı olarak usulüne göre verilmiş hâkim kararı olmadıkça; yine bu sebeplere bağlı olarak gecikmesinde sakınca bulunan hallerde de kanunla yetkili kılınmış merciin yazılı emri bulunmadıkça; kimsenin konutuna girilemez, arama yapılamaz ve buradaki eşyaya el konulamaz. Yetkili merciin kararı yirmidört saat içinde görevli hâkimin onayına sunulur. Hâkim, kararını el koymadan itibaren kırksekiz saat içinde açıklar; aksi halde, el koyma kendiliğinden kalkar.  XII. Mülkiyet hakkı Madde 35 – Herkes, mülkiyet ve miras haklarına sahiptir. Bu haklar, ancak kamu yararı amacıyla, kanunla sınırlanabilir. Mülkiyet hakkının kullanılması toplum yararına aykırı olamaz.  A. Hak arama hürriyeti Madde 36 – Herkes, meşru vasıta ve yollardan faydalanmak suretiyle yargı mercileri önünde davacı veya davalı olarak iddia ve savunma ile adil yargılanma hakkına sahiptir.[16] Hiçbir mahkeme, görev ve yetkisi içindeki davaya bakmaktan kaçınamaz.  IV. Çalışma ve sözleşme hürriyeti Madde 48 – Herkes, dilediği alanda çalışma ve sözleşme hürriyetlerine sahiptir. Özel teşebbüsler kurmak serbesttir. Devlet, özel teşebbüslerin milli ekonominin gereklerine ve sosyal amaçlara uygun yürümesini, güvenlik ve kararlılık içinde çalışmasını sağlayacak tedbirleri alır.', '**Kat Mülkiyeti Kanunu**\nMadde 35 – Yöneticinin görevleri, yönetim planında belirtilir; yönetim planında aksi-\nne hüküm olmadıkça, yönetici aşağıdaki işleri görür: \na) Kat malikleri kurulunca verilen kararların yerine getirilmesi; \nb) Anagayrimenkulün gayesine uygun olarak kullanılması, korunması, bakımı ve ona-\nrımı için gereken tedbirlerin alınması; \nc) Anagayrimenkulün sigorta ettirilmesi; \nd) Anagayrimenkulün genel yönetim işleriyle korunma, onarım, temizlik gibi bakım \nişleri ve asansör ve kalorifer, sıca k ve soğuk hava işletmesi ve sigorta için yönetim planında \ngösterilen zamanda, eğer böyle bir zaman gösterilmemişse, her takvim yılının ilk ayı içinde, \nkat maliklerinden avans olarak münasip miktarda paranın toplanması ve bu avansın harcanıp \nbitmesi halinde, geri kalan işler için tekrar avans toplanması; \ne) Anagayrimenkulün yönetimiyle ilgili diğer bütün ödemelerin kabulü, yönetim dola-\nyısiyle doğan borçların ödenmesi ve kat malikleri tarafından ayrıca yetkili kılınmışsa, bağı m-\nsız bölümlere ait kiraların toplanması; \nf) Anagayrimenkulün tümünü ilgilendiren tebligatın kabulü; \ng) Anagayrimenkulü ilgilendiren bir sürenin geçmesinden veya bir hakkın kaybına \nmeydan vermiyecek gerekli tedbirlerin alınması; \nh) Anagayrimenkulün korunması ve bakımı için kat maliklerini n yararına olan husus-\nlarda gerekli tedbirlerin, onlar adına alınması; \ni) Kat mülkiyetine ilişkin borç ve yükümlerini yerine getirmiyen kat maliklerine karşı da-\nva ve icra takibi yapılması ve kanuni ipotek hakkının kat mülkiyeti kütüğüne tescil ettirilmesi; \nj) Topladığı paraları ve avansları yatırmak ve gerektiğinde almak üzere muteber bir \nbankada kendi adına ve fakat anagayrimenkulün yönetici sıfatı gösterilmek suretiyle, hesap \naçtırılması; \nk) Kat malikleri kurulunun toplantıya çağırılması. \nl) (Ek: 4/4/2015 -6645/82 md.) Anagayrimenkulde bulunan asansörlerin güvenli bir \nşekilde işletilmesinin sağlanması amacıyla aylık bakımları ile yıllık kontrollerinin ilgili teknik', '**Kat Mülkiyeti Kanunu**\nMadde 69 – (Ek: 14/11/2007-5711/22 md.) \nToplu yapı kapsamında bulunan parsel ve parsellerdeki birden çok bağımsız bölümü \nkapsayan ana yapıda ortak yerleri bulunan blok yapıların her biri, kendi sorunlarına ve yalnız \no bloğa ait ortak yerlere ilişkin olarak, o blokta bulunan b ağımsız bölüm maliklerinden oluşan \nblok kat malikleri kurulunca yönetilir. Bir parselde blok niteliğinde olmayan yapılar varsa \nveya bu niteli kteki yapılarla blok yapılar aynı parselde yer alıyorsa, kendi sorunlarına ve o \nparsele ait ortak yerlere ilişkin o larak, o parselde bulunan bağımsız bölüm maliklerinden olu-\nşan kat malikleri kurulunca yönetilir. Yönetim plânında blokların ve blok niteliğinde o lmayan \nyapıların idare tarzı ayrıca belirtilir.  \nBir adada birden çok parsel yer alıyorsa, adayı oluşturan pars ellere ait ortak yerler, o \nadada bulunan bağımsız bölüm maliklerinden oluşan ada kat malikleri kurulunca yönetilir ve \nyönetim tarzı, kanunların emredici hükümleri saklı kalmak şartıyla, bu kurul tarafından karar-\nlaştırılır. Bu yetki, yönetim plânında ada te msilciler kuruluna verilebilir. Yönetim plânında \nbaşka türlü düze nlenmemişse, ada temsilciler kurulu, blok yapılarda her blokta bulunan ba-\nğımsız bölüm malikl erince seçilen blok yöneticileri ve blok niteliğinde olmayan yapıların \nbağımsız bölüm maliklerince seçilen temsilcilerden oluşur. Ada temsilciler kurulu üyelerinin \nsayısı ve nasıl seçil eceği toplu yapının özelliği dikkate alınarak yönetim plânında belirtilir. \nAda temsilciler kurulunda bu yönet iciler ve temsilciler yönettikleri ve temsil ettikleri bağım-\nsız bölüm sayısı kadar oy hakkına sahiptirler.  \nToplu yapı kapsamındaki ortak yapı, yer ve tesisler, bu kapsamda yer alan bağımsız \nbölüm maliklerinden oluşan toplu yapı kat malikleri kurulunca yönetilir ve yönetim tarzı, ka-\nnunların emredici hükümleri saklı kalmak şartıyla, bu kurul tarafından kararlaştırılır. Bu yetki,', '**Kat Mülkiyeti Kanunu**\nbankada kendi adına ve fakat anagayrimenkulün yönetici sıfatı gösterilmek suretiyle, hesap \naçtırılması; \nk) Kat malikleri kurulunun toplantıya çağırılması. \nl) (Ek: 4/4/2015 -6645/82 md.) Anagayrimenkulde bulunan asansörlerin güvenli bir \nşekilde işletilmesinin sağlanması amacıyla aylık bakımları ile yıllık kontrollerinin ilgili teknik \ndüzenlemelere uygun şekilde yaptırılması ve bu işlemlere ilişkin ücretlerin ödenmesi. \n(Ek fıkra: 4/4/2015-6645/82 md.) Bu Kanunun 34 üncü maddesinde belirtilen şartları \ntaşımasına rağmen yönetici ataması yapılmayan anagayrimenkulde, birinci fıkrada sayılan \nişlerin yaptırılmasından kat malikleri müştereken sorumludur. \n \n2. Defter tutulması ve belgelerin saklanması:', '**Kat Mülkiyeti Kanunu**\nMadde 34 – Kat malikleri, anagayrimenkulün yönetimini kendi  aralarından veya dı-\nşardan seçecekleri bir kimseye veya üç kişilik bir kurula verebilirler; bu kimseye (Yönetici), \nkurula da (Yönetim kurulu) denir. \nAnagayrimenkulün sekiz veya daha fazla bağımsız bölümü varsa, yönetici atanması \nmecburidir. \nAnagayrimenkulün bütün bölümleri bir kişinin mülkiyetinde ise, malik kanunen yöne-\ntici durumundadır. \nYönetici, kat maliklerinin, hem sayı hem arsa payı bakımından çoğunluğu tarafından \natanır. \nYönetici her yıl kat malikleri kurulunun kanuni yıllık toplantısında yeniden atanır; eski \nyönetici tekrar atanabilir. \nKat malikleri anagayrimenkulün yönetiminde anlaşamaz veya toplanıp bir yönetici \natayamazlarsa, o geyrimenkulün bulunduğu yerin sulh mahkemesince, kat maliklerinden biri-\nnin müracaatı üzerine ve mümkünse diğerleri de din lendikten sonra, gayrimenkule bir yöneti-\nci atanır. Bu yönetici, aynen kat maliklerince atanan yöneticinin yetkilerine sahip ve kat ma-\nliklerine karşı sorumlu olur. \nSulh mahkemesince atanan yönetici, bu atanma üzerinden altı ay geçmedikçe, kat ma-\nlikleri kurulunca değiştirilemez Ancak haklı bir sebep çıkarsa, onu atamış olan sulh mahke-\nmesi, değiştirmeye müsaade edebilir.  \nYönetici atanırken kendisiyle yapılan sözleşmede, teminat göstermesi şart edilebilir; \nsözleşmede böyle bir şart olmasa bile, haklı bir sebeb in çıkması halinde, kat malikleri kurulu, \nyöneticiden teminat göstermesini istiyebilir.    \n(Değişik son fıkra: 14/11/2007-5711/18 md.) Yöneticinin ad ve soyadı ile iş ve ev ad-\nresinin anagayrimenkulün kapısı yanına veya girişte görülecek bir yere çerçeve iç inde asılma-\nsı mecburidir. Bu yapılmazsa, yöneticiden veya yönetim kurulu üyelerinin her birine, ilgilinin \nbaşvurması üzerine aynı mahkemece, elli Türk Lir asından ikiyüzelli Türk Lirasına kadar idarî \npara cezası verilir. \n \nII - Yöneticinin görevleri: \n1. Genel yönetim işlerinin görülmesi:', '**Kat Mülkiyeti Kanunu**\nMadde 70 – (Ek: 14/11/2007-5711/22 md.) \nToplu yapı kapsamındaki yapı ve yerler için tamamını kapsayan bir tek yönetim plânı \ndüzenlenir. Yönetim plânı, toplu yapı kapsamındaki bütün kat maliklerini bağlar. Yönetim \nplânının değiştirilebilmesi için, toplu yapı temsilciler kurulu üyelerinin temsil ettikleri bağım-\nsız bölümlerin tamsayısının beşte dördünün oyu şarttır. \nGeçici yönetimle ilgili yönetim plânı hükümleri, toplu yapı alanındaki bağımsız bölüm \nmaliklerinin beşte dördünün oylarıyla değiştirilebilir.  \n \nYönetici ve denetçi atama \nMadde 71 – (Ek: 14/11/2007-5711/22 md.) \nYönetim plânında başka türlü düzenlenmedikçe, blok kat malikleri kurulu blok için, \nblok niteliğinde olmayan yapıların yer aldığı parseldeki kat malikleri kendilerine özg ülenen \nortak yer ve tesisler için, toplu yapı temsilciler kurulu ise toplu yapı kapsamındaki bütün ortak \nyapı, yer ve tesisler için yönetici ve denetçi atar.  \nBlok yöneticisi ve denetçisi, bloktaki kat maliklerinin; blok niteliğinde olmayan yap ı-\nların ortak yer ve tesisleri için yönetici ve denetçi, bu yapılardaki kat maliklerinin sayı ve arsa \npayı bakımından çoğunluğu tarafından seçilir. Toplu yapı kapsamındaki bütün ortak yapı, yer \nve tesisler için yönetici ve denetçi ise, toplu yapı temsilciler kuruluna katılan yönetici ve tem-\nsilcilerin, yönettikleri ve temsil ettikleri bağımsız bölüm sa yısının salt çoğunluğunun oyu ile \natanır. \n \nOrtak giderlere katılma', '**Kat Mülkiyeti Kanunu**\nsız bölüm sayısı kadar oy hakkına sahiptirler.  \nToplu yapı kapsamındaki ortak yapı, yer ve tesisler, bu kapsamda yer alan bağımsız \nbölüm maliklerinden oluşan toplu yapı kat malikleri kurulunca yönetilir ve yönetim tarzı, ka-\nnunların emredici hükümleri saklı kalmak şartıyla, bu kurul tarafından kararlaştırılır. Bu yetki, \nyönetim plânında toplu yapı temsilciler kuruluna verilebilir. Yönetim plânında başka türlü \ndüzenlenmemişse, toplu yapı temsilciler kurulu, blok yapılarda her blokta bulunan bağımsız \nbölüm maliklerince seçilen blok yöneticileri ve blok niteliğinde olmayan yapıların bağımsız \nbölüm maliklerince seçilen temsilcilerden oluşur. Toplu yapı temsilciler kurulu üyelerinin \nsayısı ve nasıl seçileceği toplu yapının özelliği dikkate alınarak yönetim plânında  belirtilir. \nToplu yapı temsilciler kurulu nda bu yöneticiler ve temsilciler yönettikleri ve temsil ettikleri \nbağımsız bölüm sayısı kadar oy hakkına sahiptirler.  \n \nYönetim plânı ve değiştirilmesi', '**Türk Medeni Kanunu (İlgili Maddeler)**\nmülkiyetin\t devamına\t ilişkin\t sözleşmeler,\t resmî\tşekle\tbağlıdır\tve\ttapu\tkütüğüne\tşerh\tverilebilir. Uygun\tolmayan\tzamanda\tpaylaşma\tisteminde\tbulunulamaz. \t b.\tPaylaşma\tbiçimi Madde\t 699-\tPaylaşma,\t malın\t aynen\t bölüşülmesi\t veya\t pazarlık\t ya\t da\t artırmayla\tsatılarak\tbedelinin\tbölüşülmesi\tbiçiminde\tgerçekleştirilir. Paylaşma\t biçiminde\t uyuşma\t sağlanamazsa,\t paydaşlardan\t birinin\t istemi\t üzerine\thâkim,\tmalın\taynen\tbölünerek\tpaylaştırılmasına,\tbölünen\tparçaların\tdeğerlerinin\tbirbirine\tdenk\t düşmemesi\t hâlinde\t eksik\t değerdeki\t parçaya\t para\t eklenerek\t denkleştirme\tsağlanmasına\tkarar\tverir. Bölme\tistemi\tdurum\tve\tkoşullara\tuygun\tgörülmezse\tve\tözellikle\tpaylı\tmalın\tönemli\tbir\t değer\t kaybına\t uğramadan\t bölünmesine\t olanak\t yoksa,\t açık\t artırmayla\t satışa\thükmolunur.\t Satışın\t paydaşlar\t arasında\t artırmayla\t yapılmasına\t karar\t verilmesi,\t bütün\tpaydaşların\trızasına\tbağlıdır. c.\tİntifa\thakkı\tsahibinin\tdurumu \t Madde\t700-\tBir\tpaydaşın\tkendi\tpayı\tüzerinde\tintifa\thakkı\tkurması\thâlinde,\tdiğer\tpaydaşlardan\t biri\t intifa\t hakkının\t kurulduğunun\t kendisine\t tebliğinden\t başlayarak\t üç\t ay\tiçinde\t paylaşma\t isteminde\t bulunursa;\t satış\t yoluyla\t paylaşmada\t intifa\t hakkı,\t buna\t ilişkin\tpaya\tdüşecek\tbedel\tüzerinde\tdevam\teder.', '**Türk Medeni Kanunu (İlgili Maddeler)**\nIII.\tKomşu\thakkı 1.\tKullanma\tbiçimi Madde\t 737-\tHerkes,\t taşınmaz\t mülkiyetinden\t doğan\t yetkileri\t kullanırken\t ve\tözellikle\t işletme\t faaliyetini\t sürdürürken,\t komşularını\t olumsuz\t şekilde\t etkileyecek\ttaşkınlıktan\tkaçınmakla\tyükümlüdür. Özellikle,\ttaşınmazın\tdurumuna,\tniteliğine\tve\tyerel\tâdete\tgöre\tkomşular\tarasında\thoş\tgörülebilecek\tdereceyi\taşan\tduman,\tbuğu,\tkurum,\ttoz,\tkoku\tçıkartarak,\tgürültü\tveya\tsarsıntı\tyaparak\trahatsızlık\tvermek\tyasaktır. Yerel\tâdete\tuygun\tve\tkaçınılmaz\ttaşkınlıklardan\tdoğan\tdenkleştirmeye\tilişkin\thaklar\tsaklıdır.', '**Türk Medeni Kanunu (İlgili Maddeler)**\nc.\tArazinin\tmülkiyetinin\tmalzeme\tsahibine\tverilmesi Madde\t 724-\tYapının\t değeri\t açıkça\t arazinin\t değerinden\t fazlaysa,\t iyiniyetli\t taraf\tuygun\t bir\t bedel\t karşılığında\t yapının\t ve\t arazinin\t tamamının\t veya\t yeterli\t bir\t kısmının\tmülkiyetinin\tmalzeme\tsahibine\tverilmesini\tisteyebilir.  C.\tBirlikte\tmülkiyet I.\tPaylı\tmülkiyet 1.\tGenel\tkurallar Madde\t688-\tPaylı\tmülkiyette\tbirden\tçok\tkimse,\tmaddî\tolarak\tbölünmüş\tolmayan\tbir\tşeyin\ttamamına\tbelli\tpaylarla\tmaliktir. Başka\ttürlü\tbelirlenmedikçe,\tpaylar\teşit\tsayılır. Paydaşlardan\ther\tbiri\tkendi\tpayı\tbakımından\tmalik\thak\tve\tyükümlülüklerine\tsahip\tolur.\tPay\tdevredilebilir,\trehnedilebilir\tve\talacaklılar\ttarafından\thaczettirilebilir. \t 2.\tYönetim\tve\ttasarruf a.\tAnlaşmalar Madde\t 689-\tPaydaşlar,\t kendi\t aralarında\t oybirliğiyle\t anlaşarak\t yararlanma,\tkullanma\t ve\t yönetime\t ilişkin\t konularda\t kanun\t hükümlerinden\t farklı\t bir\t düzenleme\tyapabilirler.\t Ancak,\t böyle\t bir\t anlaşmayla\t paydaşların\t aşağıdaki\t hak\t ve\t yetkileri\tkaldırılamaz\tve\tsınırlandırılamaz: 1.\tPaylı\tmülkiyet\tkonusu\teşyanın\tkullanılabilirliğinin\tve\tdeğerinin\tkorunması\tiçin\tzorunlu\t olan\t yönetim\t işlerini\t yapmak\t ve\t gerektiğinde\t mahkemeden\t buna\t ilişkin\tönlemlerin\talınmasını\tistemek, 2.\t Eşyayı\t bir\t zarar\t tehlikesinden\t veya\t zararın\t artmasından\t korumak\t için\t derhâl\talınması\tgereken\tönlemleri\tbütün\tpaydaşlar\thesabına\talmak. Taşınmazlarla\t ilgili\t anlaşmalar\t imzalarının\t noterlikçe\t onaylanması\t koşuluyla\tpaydaşlardan\tbirinin\tbaşvurusu\tüzerine\ttapu\tkütüğüne\tşerh\tverilebilir. \t b.\tOlağan\työnetim\tişleri Madde\t 690-\tPaydaşlardan\t her\t biri\t olağan\t yönetim\t işlerini\t yapmaya,\t özellikle\tküçük\tonarımları\tyaptırmaya\tve\ttarımsal\tişleri\tyürütmeye\tyetkilidir. Zorunlu\tve\tivedi\tişlerin\tyapılmasına\tilişkin\tkanun\thükümleri\tsaklı\tkalmak\tkaydıyla,\tpaydaşların\t çoğunlukla\t alacağı\t kararla\t olağan\t yönetim\t işlerinde\t yetkiyle\t ilgili\t farklı\tdüzenleme\tgetirilebilir. \t c.\tÖnemli\työnetim\tişleri', '**Türk Medeni Kanunu (İlgili Maddeler)**\nd.\tOlağanüstü\työnetim\tişleri\tve\ttasarruflar Madde\t 692-\tPaylı\t malın\t özgülendiği\t amacın\t değiştirilmesi,\t korumanın\t veya\tolağan\tşekilde\tkullanmanın\tgerekli\tkıldığı\tölçüyü\taşan\tyapı\tişlerine\tgirişilmesi\tveya\tpaylı\tmalın\ttamamı\tüzerinde\ttasarruf\tişlemlerinin\tyapılması,\toybirliğiyle\taksi\tkararlaştırılmış\tolmadıkça,\tbütün\tpaydaşların\tkabulüne\tbağlıdır. Paylar\t üzerinde\t taşınmaz\t rehni\t veya\t taşınmaz\t yükü\t kurulmuşsa,\t paydaşlar\t malın\ttamamını\tbenzer\thaklarla\tkayıtlayamazlar. \t 3.\tYararlanma,\tkullanma\tve\tkoruma Madde\t693-\tPaydaşlardan\ther\tbiri,\tdiğerlerinin\thakları\tile\tbağdaştığı\tölçüde\tpaylı\tmaldan\tyararlanabilir\tve\tonu\tkullanabilir. Uyuşmazlık\thâlinde\tyararlanma\tve\tkullanma\tşeklini\thâkim\tbelirler.\tBu\tbelirleme,\tpaylı\tmalın\tkullanılmasının\tzaman\tveya\tyer\titibarıyla\tpaydaşlar\tarasında\tbölünmesi\tbiçiminde\tde\tolabilir. Paydaşlardan\t her\t biri,\t bölünemeyen\t ortak\t menfaatlerin\t korunmasını\t diğer\tpaydaşları\ttemsilen\tsağlayabilir. \t 4.\tGiderler\tve\tyükümlülükler Madde\t 694-\tPaylı\t mülkiyetten\t doğan\t veya\t paylı\t malı\t ilgilendiren\t yönetim\tgiderleri,\t vergiler\t ve\t diğer\t yükümlülükler,\t aksine\t bir\t hüküm\t bulunmadıkça,\t paydaşlar\ttarafından\tpayları\toranında\tkarşılanır. Payına\t düşenden\t fazlasını\t ödemiş\t bulunan\t paydaş,\t diğerlerine\t payları\t oranında\trücu\tedebilir. \t 5.\tKararların\tbağlayıcılığı Madde\t 695-\tYararlanma,\t kullanma\t ve\t yönetime\t ilişkin\t konularda\t paydaşların\tyaptıkları\t düzenleme\t ve\t aldıkları\t kararlar\t ile\t mahkemece\t verilen\t kararlar,\t sonradan\tpaydaş\tolan\tveya\tpay\tüzerinde\taynî\thak\tkazanan\tkimseleri\tde\tbağlar. Taşınmazlarda\t yararlanma,\t kullanma\t ve\t yönetime\t ilişkin\t kararların\t sonradan\tpaydaş\t olan\t veya\t pay\t üzerinde\t aynî\t hak\t kazananları\t bağlaması\t için,\t bunların\t tapu\tkütüğüne\tşerh\tedilmesi\tgerekir. \t 6.\tPaydaşlıktan\tçıkarma a.\tPaydaşın\tçıkarılması Madde\t696-\tKendi\ttutum\tve\tdavranışlarıyla\tveya\tmalın\tkullanılmasını\tbıraktığı\tya\tda\tfiillerinden\t sorumlu\t olduğu\t kişilerin\t tutum\t ve\t davranışlarıyla\t diğer\t paydaşların', ""**Türk Medeni Kanunu (İlgili Maddeler)**\nAynen\tayrılmasına\tolanak\tbulunmayan\tmaldaki\tpayın\tdava\ttarihindeki\tdeğeriyle\tkendilerine\t devrini\t isteyen\t paydaş\t veya\t paydaşlar\t bu\t istemlerini\t paydaşlıktan\t çıkarma\tistemi\t ile\t birlikte\t ileri\t sürmek\t zorundadırlar.\t Hâkim,\t hüküm\t vermeden\t önce\t re'sen\tbelirleyeceği\tuygun\tbir\tsüre\tiçinde\tpay\tdeğerinin\tödenmesine\tveya\ttevdiine\tkarar\tverir.\tDavanın\tkabulü\thâlinde\tpayın\tistemde\tbulunan\tadına\ttesciline\thükmolunur. Payı\t karşılayacak\t kısım\t maldan\t aynen\t ayrılamaz\t ve\t bu\t payı\t isteyen\t paydaş\t da\tbulunmazsa\t hâkim,\t davalıya\t payını\t devretmesi\t için\t bir\t süre\t belirler\t ve\t bu\t süre\t içinde\tdevredilmeyen\tpayın\taçık\tartırmayla\tsatışına\tkarar\tverir.\tSatış\tkararı,\tcebrî\ticra\tyoluyla\tparaya\tçevirmeye\tilişkin\thükümler\tuyarınca\tyerine\tgetirilir. \t b.\tDiğer\thak\tsahiplerinin\tçıkarılması Madde\t 697-\tBir\t paydaşın\t çıkarılmasına\t ilişkin\t hükümler,\t kıyas\t yoluyla,\t pay\tüzerinde\t intifa\t veya\t diğer\t bir\t aynî\t ya\t da\t tapuya\t şerh\t edilmiş\t kişisel\t yararlanma\t hakkı\tsahipleri\thakkında\tda\tuygulanır.\tAncak,\tdevri\tcaiz\tolmayan\tbir\thakkın\tuygun\tbir\ttazminat\tkarşılığında\tsona\termesine\tkarar\tverilir. \t 7.\tPaylı\tmülkiyetin\tsona\termesi a.\tPaylaşma\tistemi Madde\t 698-\tHukukî\t bir\t işlem\t gereğince\t veya\t paylı\t malın\t sürekli\t bir\t amaca\tözgülenmiş\tolması\tsebebiyle\tpaylı\tmülkiyeti\tdevam\tettirme\tyükümlülüğü\tbulunmadıkça,\tpaydaşlardan\ther\tbiri\tmalın\tpaylaşılmasını\tisteyebilir. Paylaşmayı\t isteme\t hakkı,\t hukukî\t bir\t işlemle\t en\t çok\t on\t yıllık\t süre\t ile\tsınırlandırılabilir.\t Taşınmazlarda\t paylı\t mülkiyetin\t devamına\t ilişkin\t sözleşmeler,\t resmî\tşekle\tbağlıdır\tve\ttapu\tkütüğüne\tşerh\tverilebilir. Uygun\tolmayan\tzamanda\tpaylaşma\tisteminde\tbulunulamaz. \t b.\tPaylaşma\tbiçimi Madde\t 699-\tPaylaşma,\t malın\t aynen\t bölüşülmesi\t veya\t pazarlık\t ya\t da\t artırmayla\tsatılarak\tbedelinin\tbölüşülmesi\tbiçiminde\tgerçekleştirilir. Paylaşma\t biçiminde\t uyuşma\t sağlanamazsa,\t paydaşlardan\t birinin\t istemi"", '**Türk Medeni Kanunu (İlgili Maddeler)**\nve\t yönetime\t ilişkin\t kararların\t sonradan\tpaydaş\t olan\t veya\t pay\t üzerinde\t aynî\t hak\t kazananları\t bağlaması\t için,\t bunların\t tapu\tkütüğüne\tşerh\tedilmesi\tgerekir. \t 6.\tPaydaşlıktan\tçıkarma a.\tPaydaşın\tçıkarılması Madde\t696-\tKendi\ttutum\tve\tdavranışlarıyla\tveya\tmalın\tkullanılmasını\tbıraktığı\tya\tda\tfiillerinden\t sorumlu\t olduğu\t kişilerin\t tutum\t ve\t davranışlarıyla\t diğer\t paydaşların\t tamamına\tveya\tbir\tkısmına\tkarşı\tolan\tyükümlülüklerini\tağır\tbiçimde\tçiğneyen\tpaydaş,\tbu\tyüzden\tonlar\tiçin\t paylı\t mülkiyet\t ilişkisinin\t devamını\t çekilmez\t hâle\t getirmişse,\t mahkeme\t kararıyla\tpaydaşlıktan\tçıkarılabilir. Davanın\t açılması,\t aksi\t kararlaştırılmış\t olmadıkça,\t pay\t ve\t paydaş\t çoğunluğuyla\tkarar\tverilmesine\tbağlıdır. Hâkim,\t çıkarma\t istemini\t haklı\t gördüğü\t takdirde,\t çıkarılacak\t paydaşın\t payını\tkarşılayacak\tkısmı\tmaldan\tayırmaya\tolanak\tvarsa,\tbu\tayırmayı\tyaparak\tayrılan\tparçanın\tpaylı\tmülkiyetten\tçıkarılana\tözgülenmesine\tkarar\tverir.']","Hayır, polis veya yönetici evinize izinsiz giremez. Anayasa'nın 21. maddesi gereğince, kimsenin konutuna izinsiz olarak girilmesi, arama yapılması veya oradaki eşyalara el konulması mümkün değildir. Bu tür işlemler, ancak bir hakim kararıyla veya gecikmesinde sakınca bulunan acil durumlarda, yetkili mercilerin yazılı emri ile gerçekleştirilebilir.

Bu bağlamda, eğer bir polis memurunun veya apartman yöneticisinin böyle bir girişimde bulunması söz konusuysa, yasal bir dayanağı yoksa hukuka aykırıdır. Ev konut dokunulmazlığı ilkesinin korunduğu bir alan olduğundan, izinsiz giriş kesinlikle yasaktır.",Hayır. Anayasa'nın 21. maddesine göre kimsenin konutuna dokunulamaz. Hâkim kararı veya kanunla yetkili kılınmış merciin yazılı emri olmadıkça kimsenin konutuna girilemez ve arama yapılamaz.,1.0,0.5375766408206616,0.9347161708278237
"Apartman yönetim planında kararların salt çoğunlukla alınacağı yazmasına rağmen, plan değişikliği için yöneticinin 4/5 çoğunluk istemesi hukuken doğru mudur? Hangi hüküm geçerlidir?",[],"Hayır, bu hukuken doğru değildir. Kat Mülkiyeti Kanunu'na göre, kat malikleri kurulunun kararlarını alabilmesi için gerekli olan çoğunluk sayısı, yönetim planında belirtilen şartların aksine olamaz. 

Eğer yönetim planında kararların salt çoğunlukla alınacağı belirtilmişse, bu durum geçerlidir. Kat Mülkiyeti Kanunu Madde 28'e göre, değişiklikler veya yönetim planına ilaveler için gerekli olan oy oranı, yönetim planında belirtilen oranı değil, kanunun öngördüğü 4/5 oranını gerektirmektedir. Ancak eğer yönetim planı, 4/5 çoğunluk şartı arıyorsa bu durum kanun emredici hükümlerine aykırıdır ve geçersizdir. 

Kısaca, yönetim planında aksine hüküm olsa da, Kanun emredicidir ve Kanun geçerlidir. ","Yöneticinin kararı (Kanun) geçerlidir. Kat Mülkiyeti Kanunu'nun 28. maddesi emredici niteliktedir ve yönetim planının değiştirilmesi için bütün kat maliklerinin beşte dördünün (4/5) oyunu şart koşar. Yönetim planındaki 'salt çoğunluk' maddesi, kanunun bu emredici hükmüne aykırı olduğu için geçersizdir.",0.0,0.5139774788519604,0.7022467138969893
Üst kattan su sızması durumunda komşunun 'konut dokunulmazlığı' gerekçesiyle tamirat için usta girişine izin vermemesi hukuken korunur mu? Hangi yasal yol izlenmelidir?,"['**T.C. Anayasası (İlgili Maddeler)**\nB. Konut dokunulmazlığı Madde 21 – (Değişik: 3/10/2001-4709/6 md.) Kimsenin konutuna dokunulamaz. Millî güvenlik, kamu düzeni, suç işlenmesinin önlenmesi, genel sağlık ve genel ahlâkın korunması veya başkalarının hak ve özgürlüklerinin korunması sebeplerinden biri veya birkaçına bağlı olarak usulüne göre verilmiş hâkim kararı olmadıkça; yine bu sebeplere bağlı olarak gecikmesinde sakınca bulunan hallerde de kanunla yetkili kılınmış merciin yazılı emri bulunmadıkça; kimsenin konutuna girilemez, arama yapılamaz ve buradaki eşyaya el konulamaz. Yetkili merciin kararı yirmidört saat içinde görevli hâkimin onayına sunulur. Hâkim, kararını el koymadan itibaren kırksekiz saat içinde açıklar; aksi halde, el koyma kendiliğinden kalkar.  XII. Mülkiyet hakkı Madde 35 – Herkes, mülkiyet ve miras haklarına sahiptir. Bu haklar, ancak kamu yararı amacıyla, kanunla sınırlanabilir. Mülkiyet hakkının kullanılması toplum yararına aykırı olamaz.  A. Hak arama hürriyeti Madde 36 – Herkes, meşru vasıta ve yollardan faydalanmak suretiyle yargı mercileri önünde davacı veya davalı olarak iddia ve savunma ile adil yargılanma hakkına sahiptir.[16] Hiçbir mahkeme, görev ve yetkisi içindeki davaya bakmaktan kaçınamaz.  IV. Çalışma ve sözleşme hürriyeti Madde 48 – Herkes, dilediği alanda çalışma ve sözleşme hürriyetlerine sahiptir. Özel teşebbüsler kurmak serbesttir. Devlet, özel teşebbüslerin milli ekonominin gereklerine ve sosyal amaçlara uygun yürümesini, güvenlik ve kararlılık içinde çalışmasını sağlayacak tedbirleri alır.']","Hayır, komşunun ""konut dokunulmazlığı"" gerekçesiyle tamirat için usta girişine izin vermemesi hukuken korunmaz. Bu durum, Kat Mülkiyeti Kanunu'na göre çözülebilir. 

Apartmanda meydana gelen su sızıntısı, hem sizin yaşam alanınızı hem de apartmanın ortak alanlarını etkileyen bir sorun teşkil eder. Kat Mülkiyeti Kanunu'na göre, komşular malikler arasında yaşanan bu tür durumlarda birbirlerine yardımcı olmakla yükümlüdürler. Örneğin,  Üst kattan gelen su sızıntısı, alt kat sahibinin yaşam alanını olumsuz etkiliyorsa, üst kat maliki bu durumu düzeltmek için gerekli önlemleri almak zorundadır.

Eğer komşunuz, su sızıntısının onarımı için ustanın girmesine izin vermiyorsa, öncelikle sorunu iyi bir şekilde ifade eden bir yazılı talep ile gitmek yararlı olacaktır. Eğer bu talebin ardından hala durumu düzeltmiyorsa, konuyu ilgili Mahkemeye taşıyabilir veya Medeni Kanun çerçevesinde ihtiyati tedbir talebinde bulunabilirsiniz. Yargı mercileri, komşuların birbirlerine karşı olan yükümlülüklerini yerine getirmelerini sağlamakla yetkilidir.","Konut dokunulmazlığı (Anayasa Md. 21) mutlak değildir; KMK Madde 23 uyarınca kat malikleri, diğer bölümlerdeki arızaların giderilmesi için kendi bölümlerine girilmesine izin vermekle yükümlüdür. Komşu rıza göstermezse, KMK Madde 33 uyarınca Sulh Hukuk Mahkemesi'nden 'Hâkimin Müdahalesi' istenerek mahkeme kararıyla (Anayasal 'hâkim kararı' istisnası) giriş sağlanabilir.",0.25,0.4185226710939709,0.728461744584466
"Aidat borcu için yönetimin doğrudan ev sahibine icra takibi başlatması durumunda, ev sahibinin 'kiracı varken bana gelemezsiniz' itirazı haklı mıdır?",[],"Hayır, ev sahibinin ""kiracı varken bana gelemezsiniz"" itirazı haklı değildir. Kat Mülkiyeti Kanunu'na (KMK) göre, apartman ve site yönetimi aidat borçları için doğrudan ev sahibine icra takibi başlatabilir. 

Yönetim, kat malikinin herhangi bir yükümlülüğünden (aidat gibi) dolayı kiracının bulunup bulunmamasına bakmaksızın, doğrudan kat maliki olan ev sahipleri hakkında icra takibi yapma hakkına sahiptir. Bu nedenle, kiracı durumu, ev sahibinin borçlarının ödenmesi konusunda herhangi bir koruma sağlamaz.","Ev sahibi haksızdır. KMK Madde 22'ye göre kat maliki aidat borcundan birinci derecede sorumludur. Kiracı ise bu borçtan sadece kira miktarı ile sınırlı olarak ve malikle birlikte 'müştereken ve müteselsilen' sorumludur. Yönetici, alacak için ister malike ister kiracıya (veya her ikisine birden) başvurma konusunda seçimlik hakka sahiptir.",0.0,0.294383399000157,0.5439165657513593
Kat malikleri kurulu oy birliğiyle karar alsa dahi güvenlik gerekçesiyle yangın merdiveni kapılarını kilitli tutabilir mi?,"['**Kat Mülkiyeti Kanunu**\n“özürlünün” ibareleri sırasıyla “Engellilerin” ve “engellinin”  şeklinde değiştirilmiştir. \nüzerine ısı yalıtımı, ısıtma sisteminin yakıt dönüşümü ve ısıtma sisteminin merkezi sistemden \nferdi sisteme veya ferdi sistemden merkezi sisteme dönüştürülmesi, kat maliklerinin sayı ve \narsa payı çoğunl uğu i le verecekleri karar üzerine yapılır. Ancak toplam inşaat alanı ikibin \nmetrekare ve üzeri olan binalarda merkezi ısıtma sisteminin ferdi ısıtma sistemine dönüştü-\nrülmesi, kat maliklerinin sayı ve arsa payı olarak oybirliği ile verecekleri karar üzerine yapılır. \nBu konuda yapılacak ortak işlerin giderleri arsa payı oranına göre ödenir. Merkezi ısıtma sis-\ntemlerinde ısınma giderl erinin paylaştırılmasına ilişkin usûl ve esaslar Bayındırlık ve İskan \nBakanlığı tarafından yürürlüğe konulacak yönetmelikle düzenlenir.  \n(Değişik beşinci fıkra: 18/4/2007-5627/16 md.) Isıtma sisteminin merkezi sistemden \nferdi sisteme veya ferdi sistemden merkezi sisteme dönüştürülmesine karar verilmesi halinde, \nyönetim planının bu karara aykırı hükümleri değiştirilmiş sayılır. \n \nII - Çok masraflı ve lüks olanlar:', '**Kat Mülkiyeti Kanunu**\nMadde 23 – Kat maliklerinden birinin bağımsız bölümünde veya bu bölümdeki tesis-\nlerde meydana gelen bir hasar veya bozukluğun onarımı veya giderilmes i veya tesislerin ye-\nniden yapılması ile yapı güvenliğiyle ilgili olarak yapılması gerekli görülen teknik inceleme-\nler için diğer bir bağımsız bölüme girmek gerekiyorsa, o bölümün maliki veya o bölümde \nbaşka sıfatla otura nlar, giriş müsaadesi vermeye ve böl ümde gerekli işlerin yapılmasına ka t-\nlanmaya mecburdurlar.6 \n                                                           \n6 14/11/2007 tarihli ve 5711 sayılı Kanunun 11 inci maddesiyle; bu fıkrada yer alan ""tesislerin yeniden \nyapılması"" ibaresinden sonra gelmek üzere ""ile yapı güvenliğiyle ilgili olarak yapılması gerekli görülen \nteknik incelemeler"" ibaresi eklenmiştir. \nAnagayrimenkulün bir kısmının harap olması halinde, harap olan bağımsız bölüm ve \neklentilerinin veya ortak yerlerin veya bağımsız bölümdeki tesislerin yeniden yapılması için, \nsağlam kalan bağımsız bölümlerin içinden veya dışından faydalanılması gerekiyorsa, o bö-\nlümlerin malikleri veya orada başka sıfatla oturanlar buna müsaade etmeye mecburdurlar. \nYukarıdaki fıkralarda yazılı müsaade yüzünden, kat maliklerinin veya orada başka sı-\nfatla oturanların uğrayacakları zararı, lehine müsaade verilen bağımsız bölüm malikleri derhal \nödemekle yükümlüdürler.  \n \nVII - Yasak işler:', '**Kat Mülkiyeti Kanunu**\nğince verilen emre rağmen, bu kanunda yazılı borç ve yükümleri yerine getirmemek suretiyle \nöteki kat maliklerinin haklarını ihlal etmekte devamlı olarak bir yıl ısrar edilmesi; \nc) Kendi bağımsız bölümünü randevu evi veya kumarhane veya benzeri yer olarak \nkullanmak suretiyle ahlak ve adaba aykırı harekette bulunması.  \n(Değişik dördüncü fıkra: 14/11/2007-5711/12 md.) Bu maddedeki dava hakkı, devir \nkonusunda kat maliklerince alınan dava açma kararının öğrenilmesi tarihinden başlay arak altı \nay ve her halde dava hakkının doğumundan başlayarak beş yıl içinde kullanı lmazsa veya dava \nsebebi ortadan kalkmışsa düşer. \n \nB) Kat irtifakı sahiplerinin borçları:', '**Kat Mülkiyeti Kanunu**\n(Ek fıkra: 15/2/2018-7099/4 md.) (Değişik altıncı fıkra:9/6/2021-7327/11 md.) Yapı \nkullanma izin b elgesi düzenlenen tüm yapıların cins değişikliği işlemleri resen yapılır. Yapı \nkullanma izin belgesini düzenlemeye yetkili idare tarafından Mekânsal Adres Kayıt Sistemine \nyüklenerek elektronik ortamda kadastro müdürlüğüne gönderilen yapı kullanma izin belgesi ile \nyapı aplikasyon projesine göre kadastro müdürlüğünce tescil bildirimi düzenlenir. Tapu \nmüdürlüğüne gönderilen tescil bildirimi üzerine başkaca bir belge aranmaksızın cins değişikliği \nresen tescil edilir. Cins değişikliği yapılmış taşınmaz kat irtifakı tesisli ise, kat irtifakının tesciline \nait resmî senede ve 12 nci maddede yazılı belgelere dayalı olarak başkaca bir belge aranmaksızın \nresen kat mülkiyetine çevrilir. Bu işlemler, döner sermaye hizmet bedelinden muaftır. \n                                                           \n2 9/6/2021 tarihli ve 7327 sayılı Kanunun 11 inci maddesiyle, bu fıkranın birinci cümlesinde yer alan \n“kat karşılığı temlik sözleşmesi ve” ibaresi “kat karşılığı temlik sözleşmesi veya” şeklinde değiştirilmiş, \ncümlede yer alan “cins değişikliği,” ibaresi madde metninden çıkarılmıştır. \nKat mülkiyetine konu olmaya elverişli bir gayrimenkul üzerindeki ortaklığın giderilmesi \ndavalarında, mirasçılardan veya ortak maliklerden biri, paylaşmanın, kat mülkiyeti kurulması ve \nbağımsız bölümlerin tahsisi suretiyle yapılmasını isterse, hakim, o gayrimenkulün mülkiyetinin, \n12 nci maddede yazılı belgelere dayanılarak kat mülkiyetine çevrilmesine ve paylar denkleşti-\nrilmek suretiyle bağımsız bölümlerin ortaklara ayrı ayrı tahsisine karar verebilir. \n(Ek fıkra: 14/11/2007 -5711/3 md.) Gelirinin ortak giderlere harcanması için veya \nbaşka bir amaçla ortak yararlanmaya tahsis edilen bağımsız bölümlerin malik hanesine, bun-\nlardan yararlanan ""bağımsız bölümlerin numaraları"" yazılmak suretiyle kat mülkiyeti kütüğ ü-', '**Kat Mülkiyeti Kanunu**\nMadde 45 – Anagayrimenkulün bir hakla kayıtlanması veya arsanın bölünmesi ve bö-\nlünen kı smın mülkiyetinin başkasına devrolunması gibi temliki tasarruflar veya a nayapının \ndış duvarlarının, çatı veya damının reklam ma ksadiyle kiralanması gibi önemli yönetim işleri \nancak bütün kat maliklerinin oybirliğiyle verecekleri karar üzerine yapılabilir. \n \nALTINCI BÖLÜM \nKat Mülkiyetinin ve Kat İrtifakının Sona Ermesi \nA) Kat mülkiyetinin sona ermesi: \nI - Anagayrimenkulün arsasiyle birlikte yok olması veya kamulaştırılması ile:', '**Kat Mülkiyeti Kanunu**\nMadde 25 – Kat maliklerinden biri bu kanuna göre kendisine düşen borçları ve yü-\nkümleri yerine getirmemek suretiyle diğer kat maliklerinin haklarını, onlar için çekilmez hale \ngelecek derecede ihlal ederse, onlar, o kat malikinin müstakil bölümü üzerindeki mülkiyet \nhakkının kendilerine devredilmesini hakimden istiyebilirler.  \n(Değişik ikinci fıkra: 14/11/2007 -5711/12 md.) Bu gibi bir kat maliki hakkında, ba-\nğımsız böl ümün mülkiyetinin hükme en yakın tarihteki değeri o kat malikine ödenerek bu \nmülkiyetin diğer kat malikleri ne, arsa payları oranında devredilmesi için davanın açılması, \naksi kararlaştırı lmış olmadıkça, diğer kat maliklerinin sayı ve arsa payı çoğunluğuyla karar \nvermesine bağlıdır. Bu karara rağmen kat maliklerinden bir kısmı bu davayı açmak istemezse, \ndavayı öteki kat malikleri açar ve hâkim hüküm vermeden önce devir bedelinin ileride hak \nsahibine ödenmek üzere bankada üçer aylık vadeli hesaba yatırılması ve makbuzunun ibrazı \niçin davacılara resen belirleyeceği uygun bir süre verir. Devir bedelinin süresi içinde  yatırıldı-\nğına ilişkin belge ibraz edildiğinde ve davanın kabulü halinde hâkim, davalının bağımsız bö-\nlümünün mülkiyetinin davayı açmış olan kat maliklerine arsa payları oranında devredilmesine \nve devir bedelinin işlemiş faiziyle birlikte davalıya ödenmesine karar verir. \nAşağıdaki durumlarda, birinci fıkrada yazılı çekilmezlik, her halde mevcut farz edilir : \na) Ortak giderlerden ve avanstan kendine düşen borçları ödemediği için hakkında iki \ntakvim yılı içinde üç defa icra veya dava takibi yapılmasına sebep olunması; \nb) Anagayrimenkulün bulunduğu yerin sulh hakimi tarafından 33 üncü madde gere-\nğince verilen emre rağmen, bu kanunda yazılı borç ve yükümleri yerine getirmemek suretiyle \nöteki kat maliklerinin haklarını ihlal etmekte devamlı olarak bir yıl ısrar edilmesi; \nc) Kendi bağımsız bölümünü randevu evi veya kumarhane veya benzeri yer olarak \nkullanmak suretiyle ahlak ve adaba aykırı harekette bulunması.']","Hayır, kat malikleri kurulu oy birliğiyle karar alsa dahi güvenlik gerekçesiyle yangın merdiveni kapılarını kilitli tutamaz. 

Kat Mülkiyeti Kanunu'nun 19. maddesine göre, yangın merdivenleri gibi acil çıkış yollarının sürekli olarak açık tutulması gerekmektedir. Yangın merdivenlerinin kapılarını kilitlemek, bu yolların kullanılmasını engelleyeceğinden, güvenlik açısından sakıncalıdır. Acil durumlarda bu kapıların hızla açılabilmesi önemlidir ve herhangi bir kısıtlama bu güvenlik önlemlerini ihlal eder. 

Dolayısıyla, kat malikleri kurulunun böyle bir kararı, kanunun emredici hükümlerine aykırı olacaktır.","Hayır, bu karar geçersizdir. Binaların Yangından Korunması Hakkında Yönetmelik Madde 47, kaçış yolu kapılarının kilitli tutulmamasını emreder. Kamu düzenini ve can güvenliğini ilgilendiren emredici hükümler, KMK Madde 27 uyarınca kat malikleri kurulunun özel kararlarından üstündür.",0.0,0.4126746057588567,0.7144000239227379
"Binanın dış cephesinden kopan bir parçanın verdiği zarardan, bütçe onayı vermeyen kat malikleri mi yoksa yönetici mi sorumludur?","['**Kat Mülkiyeti Kanunu**\npayları, değeri karşılığında bölümlerini yeniden yaptırmak isteyenlere öncelikle devredilir. \nHarabolan bağımsız bölümler üze rindeki kat mülkiyeti bu maddede yazılı süreler de-\nvamınca kendiliğinden kat irtifakına çevrilir ve kat mülkiyeti kütüğünde beyanlar hanesine \ngeçici şerh verilir. Bağımsız bölüm yapılınca onun üz erindeki kat mülkiyeti yeniden doğar ve \ngeçici şerh kütükten silinir. \n \nIII - Bildirme ödevi ve kaydın silinmesi:', '**Kat Mülkiyeti Kanunu**\nMadde 23 – Kat maliklerinden birinin bağımsız bölümünde veya bu bölümdeki tesis-\nlerde meydana gelen bir hasar veya bozukluğun onarımı veya giderilmes i veya tesislerin ye-\nniden yapılması ile yapı güvenliğiyle ilgili olarak yapılması gerekli görülen teknik inceleme-\nler için diğer bir bağımsız bölüme girmek gerekiyorsa, o bölümün maliki veya o bölümde \nbaşka sıfatla otura nlar, giriş müsaadesi vermeye ve böl ümde gerekli işlerin yapılmasına ka t-\nlanmaya mecburdurlar.6 \n                                                           \n6 14/11/2007 tarihli ve 5711 sayılı Kanunun 11 inci maddesiyle; bu fıkrada yer alan ""tesislerin yeniden \nyapılması"" ibaresinden sonra gelmek üzere ""ile yapı güvenliğiyle ilgili olarak yapılması gerekli görülen \nteknik incelemeler"" ibaresi eklenmiştir. \nAnagayrimenkulün bir kısmının harap olması halinde, harap olan bağımsız bölüm ve \neklentilerinin veya ortak yerlerin veya bağımsız bölümdeki tesislerin yeniden yapılması için, \nsağlam kalan bağımsız bölümlerin içinden veya dışından faydalanılması gerekiyorsa, o bö-\nlümlerin malikleri veya orada başka sıfatla oturanlar buna müsaade etmeye mecburdurlar. \nYukarıdaki fıkralarda yazılı müsaade yüzünden, kat maliklerinin veya orada başka sı-\nfatla oturanların uğrayacakları zararı, lehine müsaade verilen bağımsız bölüm malikleri derhal \nödemekle yükümlüdürler.  \n \nVII - Yasak işler:', '**Kat Mülkiyeti Kanunu**\nrilmek suretiyle bağımsız bölümlerin ortaklara ayrı ayrı tahsisine karar verebilir. \n(Ek fıkra: 14/11/2007 -5711/3 md.) Gelirinin ortak giderlere harcanması için veya \nbaşka bir amaçla ortak yararlanmaya tahsis edilen bağımsız bölümlerin malik hanesine, bun-\nlardan yararlanan ""bağımsız bölümlerin numaraları"" yazılmak suretiyle kat mülkiyeti kütüğ ü-\nne tescil edilir. Bu husus bağımsız bölümlerin beyanlar hanesinde gösterilir. \n \nB) Kat mülkiyeti kütüğü:', '**Kat Mülkiyeti Kanunu**\nMadde 4 – Ortak yerlerin konusu sözleşme ile belirtilebilir. Aşağıda yazılı yerler ve \nşeyler bu Kanun gereğince her halde ortak yer sayılır. \na) Temeller ve ana duvarlar, taşıyıcı sistemi oluşturan kiriş, kolon ve perde duvarlar ile \ntaşıyıcı sistemin parçası diğer elemanlar, bağımsız bölümleri ayıran ortak duvarlar, tavan ve \ntabanlar, avlular, genel giriş kapıları, antreler, merdivenler, asansörler, sahanlıklar, koridorlar \nve buralardaki genel tuvalet ve lavabolar, kapıcı daire veya odaları, genel çamaşırlık ve çam a-\nşır kurutma yerleri, genel kömürlük ve ortak garajlar, elektrik, su ve havagazı saatlerinin ko-\nrunmasına mahsus olup bağımsız bölüm dışında bulunan yuvalar ve kapalı  kısımlar, kalorifer \ndaireleri, kuyu ve sarnıçlar, yapının genel su depoları, sığınaklar,1 \nb) Her kat malikinin kendi bölümü dışındaki kanalizasyon tesisleri ve çöp kanalları ile \nkalorifer, su, havagazı ve elektrik tesisleri, telefon, radyo ve televizyon i çin ortak şebeke ve \nantenler sıcak ve soğuk hava tesisleri, \nc) Çatılar, bacalar, genel dam terasları, yağmur olukları, yangın emniyet merdivenleri. \nYukarıda sayılanların dışında kalıp da, yine ortaklaşa kullanma, korunma veya fayda-\nlanma için zaruri olan diğer yerler ve şeyler de (Ortak yer) konusuna girer. \n \nB) Bağlantılar : \nI - Bağımsız bölümlerle arsa payı arasındaki bağlantı:', '**Kat Mülkiyeti Kanunu**\nğince verilen emre rağmen, bu kanunda yazılı borç ve yükümleri yerine getirmemek suretiyle \nöteki kat maliklerinin haklarını ihlal etmekte devamlı olarak bir yıl ısrar edilmesi; \nc) Kendi bağımsız bölümünü randevu evi veya kumarhane veya benzeri yer olarak \nkullanmak suretiyle ahlak ve adaba aykırı harekette bulunması.  \n(Değişik dördüncü fıkra: 14/11/2007-5711/12 md.) Bu maddedeki dava hakkı, devir \nkonusunda kat maliklerince alınan dava açma kararının öğrenilmesi tarihinden başlay arak altı \nay ve her halde dava hakkının doğumundan başlayarak beş yıl içinde kullanı lmazsa veya dava \nsebebi ortadan kalkmışsa düşer. \n \nB) Kat irtifakı sahiplerinin borçları:', '**Kat Mülkiyeti Kanunu**\nMadde 47 – Anayapının tümü harap olmuşsa, anagayrimenkul üzerindeki kat mülki-\nyeti kendiliğinden sona erer. \nAnayapının bağımsız bölümlerinden biri tamamen harap olur ve o bö lümün maliki iki \nyıl içinde bölümünü yeniden yaptırmazsa, diğer kat malikleri veya bunlardan bir kısmı,  bu \nsürenin tamamlanmasından başlıyarak bir yıl içinde o bölüme ait arsa payının, değeri karşıl ı-\nğında ve arsa payları oranında kendilerine devredilmesini  hakimden istiyebilirler. Bu halde \ndevrolunan arsa payları kat mülkiyeti kütüğünün ilgili sayfalarının (Beyanlar) hanesine işaret \nolunur; arsa payını devralanlar,  devraldıkları tarihten başlıyarak iki yıl içinde, harap olan ba-\nğımsız bölümü yeniden yaptırma ya veya aynı süre içerisinde bütün kat malikleri bağımsız \nbölümlere bağlı arsa paylarını bu kanunun 3 üncü maddesinin 2 nci fıkrasındaki esaslara göre \nyeniden hasaplıyarak kat mülkiyeti kütüğüne geçirtmeye mecburdurlar. \nYukardaki fıkra hükmüne uyulmadığı t akdirde anagayrimenkul üzerindeki kat mülki-\nyeti kendiliğinden sona ererek, gerek o gayrimenkul ve gerek harap olan bölümler için alınan \nsigorta bedeli üzerinde ortak mülkiyet hükümleri uygulanır. \nBirden ziyade bağımsız bölüm tamamen harap olup da bunlardan  birinin yeniden ya-\npılması diğerinin yapılmasına bağlı bulunuyorsa, bağımsız bölümleri harap olan kat malikleri \nbunları yeniden yaptırıp yaptırmıyacaklarını, harabolma tarihinden başlıyarak altı ay içinde \ndiğer kat maliklerine yazılı olarak bildirmeye mecburdurlar. (Değişik son cümle: 14/11/2007-\n5711/20 md.) Bildirmeyenlerin yeniden yaptırmak istemedikleri kabul olunur ve onların arsa \npayları, değeri karşılığında bölümlerini yeniden yaptırmak isteyenlere öncelikle devredilir. \nHarabolan bağımsız bölümler üze rindeki kat mülkiyeti bu maddede yazılı süreler de-\nvamınca kendiliğinden kat irtifakına çevrilir ve kat mülkiyeti kütüğünde beyanlar hanesine \ngeçici şerh verilir. Bağımsız bölüm yapılınca onun üz erindeki kat mülkiyeti yeniden doğar ve']","Evet, binanın dış cephesinden kopan bir parçanın verdiği zarardan kat malikleri sorumludur. Kat Mülkiyeti Kanunu Madde 20 uyarınca, ortak yerlerin bakım ve onarımdan kat malikleri birlikte sorumludur. Dış cephe gibi ortak alanların bakımsızlığı veya bozulması nedeniyle oluşan zararlar, genellikle bütçenin onayını sağlamayan kat maliklerinin kendi sorumluluğundadır. Burada, şeylerin güvenliğini sağlamak ve ortak alanların bakımını üstlenmek adına yönetici de bir rol oynasa da, kesin sorumluluk kat maliklerine aittir. 

Eğer yönetim planında farklı bir düzenleme yoksa, kanun gereği, bu tür durumlarda tüm kat maliklerinin sorumluluğu bulunmaktadır.","Yapı malikleri (kat malikleri) sorumludur. Türk Borçlar Kanunu Madde 69 uyarınca binanın bakım eksikliğinden doğan zararlardan yapı maliki kusursuz sorumludur. Yönetici, KMK Madde 35 kapsamında koruma görevini yerine getirmemiş olsa bile, asıl sorumluluk bütçeyi onaylamayan veya binanın bakımından sorumlu olan kat maliklerindedir.",0.0,0.6423726117269414,0.597950430786637
"KMK herkesin gidere katılması gerektiğini söylerken, yönetim planında 'dükkanlar asansör giderinden muaftır' yazıyorsa dükkan sahibi asansör tamirine katılmalı mıdır?",[],"Hayır, dükkan sahibi asansör tamirine katılmak zorunda değildir. Kat Mülkiyeti Kanunu'na göre, kat maliklerinin ortak giderlere katılması zorunludur. Ancak, yönetim planında ""dükkanlar asansör giderinden muaftır"" ifadesi yer alıyorsa, bu durum dükkan sahiplerinin asansör giderlerine katılmamalarını sağlar.

Yönetim planında aksine hüküm olsa da, Kanun emredicidir ve Kanun geçerlidir. Bu nedenle, eğer yönetim planında mükellefiyeti düzenleyen bir hüküm varsa, o hüküm geçerli olur. Yani, dükkan sahipleri asansör tamir giderlerinden muaf tutulmalı ve bu giderleri ödemeleri beklenmemelidir.","Dükkan sahibi katılmaz. KMK Madde 20'nin genel kuralı 'aralarında başka türlü anlaşma olmadıkça' şartına bağlıdır. Yönetim planı kat malikleri arasındaki sözleşme hükmündedir (Madde 28) ve bu konuda özel bir muafiyet tanınmışsa, kanundaki genel paylaşıma göre önceliklidir.",0.0,0.7464078685977534,0.5334449679773812
"Kombi motorunun yanması gibi esaslı bir arızada, kombi demirbaş olduğu halde kiracı mı yoksa ev sahibi mi tamir giderini üstlenmelidir?","['**Türk Borçlar Kanunu (İlgili Maddeler)**\nya\t da\tönemli\t ölçüde\t engellemesi\t ve\t verilen\t sürede\t giderilmemesi\t hâlinde\t kiracı,\t sözleşmeyi\tfeshedebilir. Kiraya veren, kiralanandaki ayıbı gidermek yerine, uygun bir süre içinde ayıpsız benzeriyle değiştirebilir. Kiraya veren, kiracıya aynı malın ayıpsız bir benzerini hemen vererek ve uğradığı zararın tamamını gidererek, onun seçimlik haklarını kullanmasını önleyebilir.', '**Türk Borçlar Kanunu (İlgili Maddeler)**\n3. Yapı malikinin sorumluluğu a. Giderim yükümlülüğü MADDE\t 69- Bir binanın veya diğer yapı eserlerinin maliki, bunların yapımındaki bozukluklardan veya bakımındaki eksikliklerden doğan zararı gidermekle yükümlüdür. İntifa ve oturma hakkı sahipleri de, binanın bakımındaki eksikliklerden doğan zararlardan, malikle birlikte müteselsilen sorumludurlar. Sorumluların, bu sebeplerle kendilerine karşı sorumlu olan diğer kişilere rücu hakkı saklıdır.   b. Zarar tehlikesini önleme MADDE\t 70- Bir başkasına ait bina veya\t diğer\t yapı\t eserlerinden\t zarar\t görme\ttehlikesiyle\tkarşılaşan\tkişi, bu tehlikenin giderilmesi için gerekli önlemlerin alınmasını hak sahiplerinden isteyebilir. Kişilerin\tve\tmalların\tkorunması\thakkındaki\tkamu\thukuku\tkuralları\tsaklıdır.  2. Kiralananın sonradan ayıplı hâle gelmesinden sorumluluk a. Genel olarak MADDE\t 305-\tKiralanan sonradan ayıplı duruma gelirse kiracı, kiraya verenden ayıpların giderilmesini veya kira bedelinden ayıpla orantılı bir indirim yapılmasını ya da zararının giderilmesini isteyebilir. Ancak, zararın giderilmesi istemi diğer seçimlik hakların kullanılmasını önlemez. Önemli ayıp durumunda kiracının sözleşmeyi fesih hakkı saklıdır.   b. Ayıbın giderilmesini isteme ve fesih MADDE\t 306-\tKiracı, kiraya verenden kiralanandaki ayıbın uygun bir sürede giderilmesini isteyebilir; bu sürede ayıp giderilmezse kiracı, ayıbı kiraya veren hesabına gidertebilir ve bundan doğan alacağını kira bedelinden indirebilir veya kiralananın ayıpsız bir benzeri ile değiştirilmesini isteyebilir. Ayıbın,\t kiralananın\t öngörülen\t kullanıma\t elverişliliğini\t ortadan\t kaldırması\t ya\t da\tönemli\t ölçüde\t engellemesi\t ve\t verilen\t sürede\t giderilmemesi\t hâlinde\t kiracı,\t sözleşmeyi\tfeshedebilir. Kiraya veren, kiralanandaki ayıbı gidermek yerine, uygun bir süre içinde ayıpsız benzeriyle değiştirebilir. Kiraya veren, kiracıya aynı malın ayıpsız bir benzerini hemen vererek ve uğradığı zararın tamamını gidererek, onun seçimlik haklarını kullanmasını önleyebilir.', '**Türk Borçlar Kanunu (İlgili Maddeler)**\nD. Kiracının borçları I. Kira bedelini ödeme borcu 1. Genel olarak MADDE\t313-\tKiracı, kira bedelini ödemekle yükümlüdür. \t 2. İfa zamanı MADDE\t 314-\tKiracı, aksine sözleşme ve yerel âdet olmadıkça, kira bedelini ve gerekiyorsa yan giderleri, her ayın sonunda ve en geç kira süresinin bitiminde ödemekle yükümlüdür.   3. Kiracının temerrüdü MADDE\t 315-\tKiracı, kiralananın tesliminden sonra muaccel olan kira bedelini veya yan gideri ödeme borcunu ifa etmezse, kiraya veren kiracıya yazılı olarak bir süre verip, bu sürede de ifa etmeme durumunda, sözleşmeyi feshedeceğini bildirebilir. Kiracıya verilecek süre en az on gün, konut ve çatılı işyeri kiralarında ise en az otuz gündür. Bu süre, kiracıya yazılı bildirimin yapıldığı tarihi izleyen günden itibaren işlemeye başlar.   II. Özenle kullanma ve komşulara saygı gösterme borcu MADDE\t 316-\tKiracı, kiralananı, sözleşmeye uygun olarak özenle kullanmak ve kiralananın bulunduğu taşınmazda oturan kişiler ile komşulara gerekli saygıyı göstermekle yükümlüdür. Kiracının bu yükümlülüğüne aykırı davranması durumunda kiraya veren, konut ve çatılı işyeri kirasında, en az otuz gün süre vererek, aykırılığın giderilmesi, aksi takdirde sözleşmeyi feshedeceği konusunda yazılı bir ihtarda bulunur. Diğer kira ilişkilerinde ise, kiraya veren, kiracıya önceden bir ihtarda bulunmaksızın, yazılı bir bildirimle sözleşmeyi hemen feshedebilir. Konut\tve\tçatılı\tişyeri\tkirasında,\tkiracının\tkiralanana\tkasten\tağır\tbir\tzarar\tvermesi,\tkiracıya\tverilecek\tsürenin\tyararsız\tolacağının\tanlaşılması\tveya\tkiracının\tbu\tyükümlülüğe\taykırı\t davranışının\t kiraya\t veren\t veya\t aynı\t taşınmazda\t oturan\t kişiler\t ile\t komşular\tbakımından\tçekilmez\tolması\tdurumlarında\tkiraya\tveren,\tyazılı\tbir\tbildirimle\tsözleşmeyi\themen\tfeshedebilir. \t III. Temizlik ve bakım giderlerini ödeme borcu MADDE\t 317- Kiracı, kiralananın olağan kullanımı için gerekli temizlik ve bakım giderlerini ödemekle yükümlüdür. Bu konuda yerel âdete de bakılır.']","Evet, kombi motorunun yanması gibi esaslı bir arızada, tamir giderini ev sahibi üstlenmelidir. Türk Borçlar Kanunu (TBK) Madde 306'ya göre, kiralanan taşınmazın ayıplı durumu söz konusu olduğunda, kiracı kiraya verenden ayıbın giderilmesini isteyebilir. Kombi, kiralanan taşınmazın demirbaşı olarak kabul edildiği için, arıza durumunda tamir giderleri kiraya veren tarafından karşılanmalıdır.

Kiracı, kiraya verenin bu durumu uygun bir sürede giderememesi hâlinde, kendi hesabına tamiri yapabilir ve masrafı kira bedelinden indirme hakkına sahiptir. Bu bağlamda, kiracının sorumluluğu, kiralananın olağan kullanımı için gerekli olan temizlik ve bakım giderleriyle sınırlıdır. Bu nedenle, esaslı bir arıza durumunda, sorumluluk ev sahibine aittir.","Esaslı tamiratı ev sahibi üstlenmelidir. TBK Madde 317 uyarınca kiracı sadece olağan kullanım için gereken temizlik ve bakım giderlerinden sorumludur. Parça bozulması veya motor yanması gibi mülkün kullanım elverişliliğini etkileyen 'ayıplar', TBK Madde 305 ve 306 gereği kiraya verenin (ev sahibinin) sorumluluk alanındadır.",0.5,0.46292161578208574,0.7045849388918523
