user_input,retrieved_contexts,response,reference,faithfulness,answer_relevancy,answer_correctness
"Çatı akıyor, tamir masrafına zemin kattaki dükkan katılmak zorunda mı?","['**Kat Mülkiyeti Kanunu**\nMadde 5 – Kat mülkiyetinin başkasına devri veya miras yoluyla geçmesi halinde, ona \nbağlı arsa payı da birlikte geçer; arsa payı, ka t mülkiyetinden veya kat irtifakından ayrı olarak \ndevredilemiyeceği gibi, miras yoluyla da geçmez ve başka bir hakla kayıtlanamaz. \n                                                           \n1 14/11/2007 tarihli ve 5711 sayılı Kanunun 2 nci maddesiyle; bu bende ""Temeller ve ana duvarlar,"" \nibaresinden sonra gelmek üzere ""taşıyıcı sistemi oluşturan kiriş, kolon ve perde duvarlar ile taşıyıcı \nsistemin parçası diğer elemanlar,"" ibaresi eklenmiştir. \nAnagayrimenkulde, kat mülkiyetine bağlanmamış veya lehine kat irtifakı kurulmamış \narsa payı bırakılamaz. \nKat mülkiyetini kayıtlayan haklar, kendiliğinden arsa payını da kayıtlar. \nKat irtifakına konu olan arsa üzerinde bu hakla bağdaşması mümkün olmayan irtifak-\nlar kurulamaz. \nAnagayrimenkulde kat mülkiyetinin kurulmasından önce o gayrimenkulün kütükteki \nsayfasına tescil veya şerhe dilmiş olan haklar kat mülkiyetini de, kaide olarak arsa payı ora-\nnında, kendiliğinden kayıtlar. \n \nII - Bağımsız bölümlerle eklentiler ve ortak yerler arasındaki bağlantı:', '**Kat Mülkiyeti Kanunu**\nMadde 44 – Anagayrimenkulün üstüne kat ilavesi veya mevcut çekme kat yerine tam \nkat yapılması veya zemin veya bodrum katlarında veya arsanın boş kısmında 24 üncü madd e-\nnin ikinci fıkrasında yazılı yerlerin sonradan yapımı veya ilavesi için: \na) Kat malikleri kurulunun buna oybirliğiyle karar vermesi; \nb) Anagayrimenkulün bu inşaattan sonra alacağı duruma göre, yapılan yeni ilaveler de \ndahil olmak üzere bütün bağımsız bölümlerine tahsis olunacak arsa paylarının, usulüne göre \nyeniden ve oybirliğiyle tesbit edilmesi; \nc) İlave edilecek yeni bağımsız bölüme tahsis edilen arsa payı üzerinde, tapu memuru \nhuzurunda yapılacak resmi senetle, 14 üncü maddeye göre kat irtifakı kurularak bunun, ana-\ngayrimenkulün bütün bağımsız bölümlerinin kat mülkiyeti kütüğündeki irtifaklar hanesine \ntescil edilmesi ve anagayrimenkulün kapanan eski kütük sayfasiyle 13 üncü madde hükmüne \ngöre bağlantı sağlanması; \nŞarttır. \nBu nitelikteki ilave ve genişletmelere muvafakat etmekle beraber kendisi katılmak is-\ntemiyen kat maliklerinin arsa paylarında n, bu ilaveler sebebiyle azalan kısmın, ilaveyi yaptı-\nranların bağımsız bölümlerine tahsisini kabul ettikleri, resmi senette belirtilir. \nBu takdirde, yeni bağımsız bölümün yapılmasına katılmıyan kat maliklerinin arsa pay-\nlarından yeni tahsis sebebiyle azalan kısmın bedeli kendilerine ödenmek şartiyle, yeni yapılan \nbağımsız bölüm, kat irtifakı kurulmasına dair olan eski resmi senet gereğince kat mülkiyetine \nçevrilerek onu yaptıranın mülkü veya yaptıranların ortak mülkü olur ve kat mülkiyeti kütüğ ü-\nnün ayrı bir sayfasına yeni malik veya malikler adına tescil edilir. \n \nG) Temliki tasarruflar ve önemli işler:', '**Kat Mülkiyeti Kanunu**\n(Ek fıkra: 15/2/2018-7099/4 md.) (Değişik altıncı fıkra:9/6/2021-7327/11 md.) Yapı \nkullanma izin b elgesi düzenlenen tüm yapıların cins değişikliği işlemleri resen yapılır. Yapı \nkullanma izin belgesini düzenlemeye yetkili idare tarafından Mekânsal Adres Kayıt Sistemine \nyüklenerek elektronik ortamda kadastro müdürlüğüne gönderilen yapı kullanma izin belgesi ile \nyapı aplikasyon projesine göre kadastro müdürlüğünce tescil bildirimi düzenlenir. Tapu \nmüdürlüğüne gönderilen tescil bildirimi üzerine başkaca bir belge aranmaksızın cins değişikliği \nresen tescil edilir. Cins değişikliği yapılmış taşınmaz kat irtifakı tesisli ise, kat irtifakının tesciline \nait resmî senede ve 12 nci maddede yazılı belgelere dayalı olarak başkaca bir belge aranmaksızın \nresen kat mülkiyetine çevrilir. Bu işlemler, döner sermaye hizmet bedelinden muaftır. \n                                                           \n2 9/6/2021 tarihli ve 7327 sayılı Kanunun 11 inci maddesiyle, bu fıkranın birinci cümlesinde yer alan \n“kat karşılığı temlik sözleşmesi ve” ibaresi “kat karşılığı temlik sözleşmesi veya” şeklinde değiştirilmiş, \ncümlede yer alan “cins değişikliği,” ibaresi madde metninden çıkarılmıştır. \nKat mülkiyetine konu olmaya elverişli bir gayrimenkul üzerindeki ortaklığın giderilmesi \ndavalarında, mirasçılardan veya ortak maliklerden biri, paylaşmanın, kat mülkiyeti kurulması ve \nbağımsız bölümlerin tahsisi suretiyle yapılmasını isterse, hakim, o gayrimenkulün mülkiyetinin, \n12 nci maddede yazılı belgelere dayanılarak kat mülkiyetine çevrilmesine ve paylar denkleşti-\nrilmek suretiyle bağımsız bölümlerin ortaklara ayrı ayrı tahsisine karar verebilir. \n(Ek fıkra: 14/11/2007 -5711/3 md.) Gelirinin ortak giderlere harcanması için veya \nbaşka bir amaçla ortak yararlanmaya tahsis edilen bağımsız bölümlerin malik hanesine, bun-\nlardan yararlanan ""bağımsız bölümlerin numaraları"" yazılmak suretiyle kat mülkiyeti kütüğ ü-', '**Kat Mülkiyeti Kanunu**\nMadde 18 – Kat malikleri, gerek bağımsız bölümlerini, gerek eklentileri ve ortak yerleri \nkullanırken doğruluk kaidelerine uymak, özellikle birbirini rahatsız etmemek, birbirinin hakla-\nrını çiğnememek ve yönetim planı hükümlerine uymakla, karşılıklı olarak yükümlüdürler. \nBu kanunda kat maliklerinin borçlarına dair olan hükümler, bağımsız bölümlerdeki ki-\nracılara ve oturma (Sükna) hakkı sahiplerine veya bu bölümlerden herhangi bir suretle devam-\nlı olarak faydalananlara da uygulanır; bu borçları yerine getirmiyenler kat malikleriyle birlik-\nte, müteselsil olarak sorumlu olur. \n(Mülga son fıkra: 14/11/2007-5711/24 md.) \n \nII - Anagayrimenkulün bakımı, korunması ve zarardan sorumluluk: \nMadde 19 – Kat malikleri, anagayrimenkulün bakımına ve mimarı durumu ile güzel-\nliğini ve sağlamlığını titizlikle korumaya mecburdurlar. \n(Değişik ikinci fıkra: 14/11/2007-5711/8 md.) Kat maliklerinden biri, bütün kat malik-\nlerinin beşte dördünün yazılı rızası olmadıkça anagayrimenkulün ortak yerlerinde inşaat, onarım \nve tesisler, değişik renkte dış badana veya boya yaptıramaz. Ancak, ortak yer ve tesislerdeki bir \nbozukluğun anayapıya veya bağımsız bir bölüme veya bölümlere zarar verdiğinin ve acilen \nonarılması gerektiğinin veya anayapının güçlendirilmesinin zorunlu olduğunun ma hkemece \ntespit edilmiş olması halinde, bu onarım ve güçlendirmenin projesine ve tekniğine uygun bi-\nçimde yapılması konusunda kat maliklerinin rızası aranmaz. Kat maliki kendi bağı msız bölü-\nmünde anayapıya zarar verecek nitelikte onarım, tesis ve değişiklik yapamaz. Tavan, taban veya \nduvar ile birbirine bağlantılı bulunan bağımsız bölümlerin bağlantılı yerlerinde, bu bölüm ma-\nliklerinin ortak rızası ile anayapıya zarar vermeyecek onarım, tesis ve değişiklik yapılabilir. \nHer kat maliki anagayrimenkule ve diğer bağımsız bölümlere, kusuru ile verdiği za-\nrardan dolayı diğer kat maliklerine karşı sorumludur. \n \nIII - Anagayrimenkulün genel giderlerine katılma:', '**Kat Mülkiyeti Kanunu**\nMadde 42 – Kat malikleri,anagayrimenkulün ortak yerlerinde kendi başlarında bir deği-\nşiklik yapamazlar; ortak yerlerin düzgün veya bunları kullanmanın daha rahat ve kolay bir hale \nkonulmasına veya bu yerlerden elde edilecek faydanın çoğaltılmasına yarıyacak bütün yenilik \nve ilaveler, kat maliklerinin sayı ve arsa payı çoğunluğu ile verecekleri karar üzerine yapılır. \n(Ek fıkra: 1/7/2005 -5378/19 md.) Engellilerin yaşamı için zorunluluk göstermesi \nhâlinde, proje tadili kat maliklerinin en geç üç ay içerisinde yapacağı toplantıda görüşülerek \nsayı ve arsa payı ç oğunluğu ile karara bağlanır. Toplantının bu süre iç erisinde yapılamaması \nveya tadilat talebinin çoğunlukla kabul edilmemesi durumunda; ilgili kat malikinin talebi üze-\nrine bina güve nliğinin tehlikeye sokulmadığını bildirir komisyon raporuna istinaden ilgili \nmercilerden alınacak  tasdikli  proje değişikliği veya krokiye göre inşaat, onarım ve tesis yapı-\nlır. İlgili merciler, tasdikli proje değişikliği veya kroki taleplerini en geç altı ay içinde sonuç-\nlandırır.  Komisyonun teşkili, çalışma usûlü ile engellinin kullanımından sonraki süreç ile \nilgili usûl ve esaslar Bayındırlık ve İskan Bakanlığı ile Özürlüler İdaresi Başkanlığı tarafından \nmüştereken hazırlanacak yönetmelikle belirlenir.7 \nBu işlerin giderleri, yeniliklerden faydalananlar tarafından, faydalanma oranına göre, \nödenir. \n(Değişik dördüncü fıkra : 18/4/20 07-5627/16 md.) Kat maliklerinden birinin isteği \n                                                           \n7 25/4/2013 tarihli ve 6462 sayılı Kanunun 1 inci maddesiyle, bu fıkrada yer alan “Özürlülerin” ve \n“özürlünün” ibareleri sırasıyla “Engellilerin” ve “engellinin”  şeklinde değiştirilmiştir. \nüzerine ısı yalıtımı, ısıtma sisteminin yakıt dönüşümü ve ısıtma sisteminin merkezi sistemden \nferdi sisteme veya ferdi sistemden merkezi sisteme dönüştürülmesi, kat maliklerinin sayı ve \narsa payı çoğunl uğu i le verecekleri karar üzerine yapılır. Ancak toplam inşaat alanı ikibin', '**Kat Mülkiyeti Kanunu**\nMadde 10 – Kat mülkiyeti ve kat irtifakı resmi senetle ve tapu siciline tescil ile doğar. \nAnagayrimenkulün tümünün mülkiyeti (Kat mülkiyeti) ne çevrilmeden o gayrimenkulün \nyalnız bir veya birkaç bölümü üzerinde kat mülkiyeti kurulamaz. \n(Değişik üçüncü fıkra: 14/11/2007 -5711/3 md.) Kat mülkiyeti kurulurken aynı katta \nbirbirine bitişik bulunan aynı nevideki birden fazla bağımsı z bölüm veya bir yapının otel, iş \nveya ticaret yeri gibi iktisadî açıdan veya kullanma bakımından bütünlük arz eden birden çok \nkatı veya böl ümü, kat mülkiyeti kütüğüne tek bağımsız bölüm olarak tescil edilebilir. Böyle \nbir tescilin yapılabilmesi için, buna uygun değişiklik projesinin ve yapı kullanma izin belgesi-\nnin Tapu Sicil Müdürlüğüne verilmiş olması gereklidir. \n(Değişik dördüncü fıkra: 15/2/2018 -7099/4 md.) Kat mülkiyetinin tescili, tapu \nmemurunca düzenlenen resmî senet uyarınca veya aşağıdaki fıkralara göre yapılabilir. \n(Ek fıkra: 15/2/2018 -7099/4 md.) Hak sahiplerine isabet eden bağımsız bölümlerin \nbelirlenmiş olması şartıyla arsa maliki ile yüklenici arasında düzenlenen kat karşılığı inşaat \nsözleşmesi, kat karşılığı temlik sözleşmesi veya  bağımsız bölümlerin taksimine ilişkin note r-\nlik sözleşmesine istinaden inşa edilecek olan binaya ilişkin (…)2 kat irtifakı ve kat mülkiyeti \ntesisi işlemi, yüklenici tarafından talep edilm esi halinde ilgili idare tarafından yapılır. Tapuya \ntescil işlemlerinde elektronik ortamda düzenlenen ve ilgili idare tarafından onaylı mimari pro-\nje ile yönetim planı esas alınır. Mimari proje ile yönetim planında malik imzası aranmaz.2 \n(Ek fıkra: 15/2/2018-7099/4 md.) (Değişik altıncı fıkra:9/6/2021-7327/11 md.) Yapı \nkullanma izin b elgesi düzenlenen tüm yapıların cins değişikliği işlemleri resen yapılır. Yapı \nkullanma izin belgesini düzenlemeye yetkili idare tarafından Mekânsal Adres Kayıt Sistemine \nyüklenerek elektronik ortamda kadastro müdürlüğüne gönderilen yapı kullanma izin belgesi ile']","Evet, zemin kattaki dükkan sahibi çatı akması tamir masrafına katılmak zorundadır. Kat Mülkiyeti Kanunu Madde 42 uyarınca, kat maliklerinin anagayrimenkulün ortak yerlerinde yapılacak onarımların giderleri, tüm kat maliklerine ait olup, bunlar arsa paylarıyla orantılı olarak paylaşılır.

Ancak, tamiratın acil bir durumdan kaynaklanması halinde (örneğin çatı akması) ve tüm kat maliklerinin bilgisi dahilinde yapılması gerektiği için, bu masrafa katılma yükümlülüğü, ilgili tüm kat maliklerine, dükkan sahipleri dahil olmak üzere, aittir. Zemin katın durumu tamirat gerektiriyorsa ve bu durum diğer katları etkiliyorsa, masrafın paylaşımı kaçınılmazdır.","Evet, katılmak zorundadır. Kanuna göre çatılar 'ortak yer' sayılır. Kat malikleri, anagayrimenkulün bütün ortak yerlerinin bakım, koruma ve onarım giderlerine kendi arsa payları oranında katılmakla yükümlüdür. Zemin katta oturmaları veya çatıdan doğrudan faydalanmamaları bu yükümlülüğü ortadan kaldırmaz.",0.0,0.41892140630625874,0.8008574956923877
Apartman yönetim planını değiştirmek için kaç kişinin oyu gerekir?,[],"Evet, apartman yönetim planını değiştirmek için kat malikleri arasındaki oy oranı önemlidir. Kat Mülkiyeti Kanunu Madde 22 uyarınca, yönetim planında değişiklik yapılabilmesi için kat maliklerinin en az dörtte üçünün (3/4) oy çokluğuyla karar alınması gerekmektedir. 

Bu nedenle, yönetim planının değişikliği için gerekli olan oy oranı, kat maliklerinin en az 3/4'ünün onayıdır.",Yönetim planının değiştirilmesi için bütün kat maliklerinin beşte dördünün (4/5) oyu şarttır.,1.0,0.7508767394435706,0.598530338722588
Kat malikleri toplantısı ne zaman yapılır?,[],"Kat malikleri toplantısı, Kat Mülkiyeti Kanunu gereğince her yıl en az bir kez yapılması zorunludur. Bu toplantı, yönetim planında belirtilen tarih veya süre içerisinde düzenlenir. Eğer yönetim planında böyle bir düzenleme yoksa, genellikle yılın belli bir döneminde, örneğin ilkbahar veya sonbahar aylarında yapılması tercih edilir. 

Toplantı günü, gündemi ve yeri, kat maliklerine önceden bildirilmelidir. Kat malikleri toplantısının zamanlaması ve düzenlenmesine ilişkin kurallara yönetim planı da yön verebilir. Ancak ne olursa olsun, kanun gereği en az bir kez yıllık toplantı yapılması gerekmektedir.","Yönetim planında bir zaman gösterilmemişse, her takvim yılının ilk ayı içinde toplanır. Toplu yapılarda ise en geç iki yılda bir defadan az olmamak üzere ikinci takvim yılının ilk ayı içinde toplanır.",1.0,0.9818663751829021,0.5849602426364809
"Komşum evini randevu evi veya kumarhane olarak kullanıyor, ne yapabiliriz?","['**Kat Mülkiyeti Kanunu**\nğince verilen emre rağmen, bu kanunda yazılı borç ve yükümleri yerine getirmemek suretiyle \nöteki kat maliklerinin haklarını ihlal etmekte devamlı olarak bir yıl ısrar edilmesi; \nc) Kendi bağımsız bölümünü randevu evi veya kumarhane veya benzeri yer olarak \nkullanmak suretiyle ahlak ve adaba aykırı harekette bulunması.  \n(Değişik dördüncü fıkra: 14/11/2007-5711/12 md.) Bu maddedeki dava hakkı, devir \nkonusunda kat maliklerince alınan dava açma kararının öğrenilmesi tarihinden başlay arak altı \nay ve her halde dava hakkının doğumundan başlayarak beş yıl içinde kullanı lmazsa veya dava \nsebebi ortadan kalkmışsa düşer. \n \nB) Kat irtifakı sahiplerinin borçları:', '**Kat Mülkiyeti Kanunu**\nMadde 23 – Kat maliklerinden birinin bağımsız bölümünde veya bu bölümdeki tesis-\nlerde meydana gelen bir hasar veya bozukluğun onarımı veya giderilmes i veya tesislerin ye-\nniden yapılması ile yapı güvenliğiyle ilgili olarak yapılması gerekli görülen teknik inceleme-\nler için diğer bir bağımsız bölüme girmek gerekiyorsa, o bölümün maliki veya o bölümde \nbaşka sıfatla otura nlar, giriş müsaadesi vermeye ve böl ümde gerekli işlerin yapılmasına ka t-\nlanmaya mecburdurlar.6 \n                                                           \n6 14/11/2007 tarihli ve 5711 sayılı Kanunun 11 inci maddesiyle; bu fıkrada yer alan ""tesislerin yeniden \nyapılması"" ibaresinden sonra gelmek üzere ""ile yapı güvenliğiyle ilgili olarak yapılması gerekli görülen \nteknik incelemeler"" ibaresi eklenmiştir. \nAnagayrimenkulün bir kısmının harap olması halinde, harap olan bağımsız bölüm ve \neklentilerinin veya ortak yerlerin veya bağımsız bölümdeki tesislerin yeniden yapılması için, \nsağlam kalan bağımsız bölümlerin içinden veya dışından faydalanılması gerekiyorsa, o bö-\nlümlerin malikleri veya orada başka sıfatla oturanlar buna müsaade etmeye mecburdurlar. \nYukarıdaki fıkralarda yazılı müsaade yüzünden, kat maliklerinin veya orada başka sı-\nfatla oturanların uğrayacakları zararı, lehine müsaade verilen bağımsız bölüm malikleri derhal \nödemekle yükümlüdürler.  \n \nVII - Yasak işler:', '**Kat Mülkiyeti Kanunu**\n(Ek fıkra: 15/2/2018-7099/4 md.) (Değişik altıncı fıkra:9/6/2021-7327/11 md.) Yapı \nkullanma izin b elgesi düzenlenen tüm yapıların cins değişikliği işlemleri resen yapılır. Yapı \nkullanma izin belgesini düzenlemeye yetkili idare tarafından Mekânsal Adres Kayıt Sistemine \nyüklenerek elektronik ortamda kadastro müdürlüğüne gönderilen yapı kullanma izin belgesi ile \nyapı aplikasyon projesine göre kadastro müdürlüğünce tescil bildirimi düzenlenir. Tapu \nmüdürlüğüne gönderilen tescil bildirimi üzerine başkaca bir belge aranmaksızın cins değişikliği \nresen tescil edilir. Cins değişikliği yapılmış taşınmaz kat irtifakı tesisli ise, kat irtifakının tesciline \nait resmî senede ve 12 nci maddede yazılı belgelere dayalı olarak başkaca bir belge aranmaksızın \nresen kat mülkiyetine çevrilir. Bu işlemler, döner sermaye hizmet bedelinden muaftır. \n                                                           \n2 9/6/2021 tarihli ve 7327 sayılı Kanunun 11 inci maddesiyle, bu fıkranın birinci cümlesinde yer alan \n“kat karşılığı temlik sözleşmesi ve” ibaresi “kat karşılığı temlik sözleşmesi veya” şeklinde değiştirilmiş, \ncümlede yer alan “cins değişikliği,” ibaresi madde metninden çıkarılmıştır. \nKat mülkiyetine konu olmaya elverişli bir gayrimenkul üzerindeki ortaklığın giderilmesi \ndavalarında, mirasçılardan veya ortak maliklerden biri, paylaşmanın, kat mülkiyeti kurulması ve \nbağımsız bölümlerin tahsisi suretiyle yapılmasını isterse, hakim, o gayrimenkulün mülkiyetinin, \n12 nci maddede yazılı belgelere dayanılarak kat mülkiyetine çevrilmesine ve paylar denkleşti-\nrilmek suretiyle bağımsız bölümlerin ortaklara ayrı ayrı tahsisine karar verebilir. \n(Ek fıkra: 14/11/2007 -5711/3 md.) Gelirinin ortak giderlere harcanması için veya \nbaşka bir amaçla ortak yararlanmaya tahsis edilen bağımsız bölümlerin malik hanesine, bun-\nlardan yararlanan ""bağımsız bölümlerin numaraları"" yazılmak suretiyle kat mülkiyeti kütüğ ü-', '**Kat Mülkiyeti Kanunu**\nMadde 25 – Kat maliklerinden biri bu kanuna göre kendisine düşen borçları ve yü-\nkümleri yerine getirmemek suretiyle diğer kat maliklerinin haklarını, onlar için çekilmez hale \ngelecek derecede ihlal ederse, onlar, o kat malikinin müstakil bölümü üzerindeki mülkiyet \nhakkının kendilerine devredilmesini hakimden istiyebilirler.  \n(Değişik ikinci fıkra: 14/11/2007 -5711/12 md.) Bu gibi bir kat maliki hakkında, ba-\nğımsız böl ümün mülkiyetinin hükme en yakın tarihteki değeri o kat malikine ödenerek bu \nmülkiyetin diğer kat malikleri ne, arsa payları oranında devredilmesi için davanın açılması, \naksi kararlaştırı lmış olmadıkça, diğer kat maliklerinin sayı ve arsa payı çoğunluğuyla karar \nvermesine bağlıdır. Bu karara rağmen kat maliklerinden bir kısmı bu davayı açmak istemezse, \ndavayı öteki kat malikleri açar ve hâkim hüküm vermeden önce devir bedelinin ileride hak \nsahibine ödenmek üzere bankada üçer aylık vadeli hesaba yatırılması ve makbuzunun ibrazı \niçin davacılara resen belirleyeceği uygun bir süre verir. Devir bedelinin süresi içinde  yatırıldı-\nğına ilişkin belge ibraz edildiğinde ve davanın kabulü halinde hâkim, davalının bağımsız bö-\nlümünün mülkiyetinin davayı açmış olan kat maliklerine arsa payları oranında devredilmesine \nve devir bedelinin işlemiş faiziyle birlikte davalıya ödenmesine karar verir. \nAşağıdaki durumlarda, birinci fıkrada yazılı çekilmezlik, her halde mevcut farz edilir : \na) Ortak giderlerden ve avanstan kendine düşen borçları ödemediği için hakkında iki \ntakvim yılı içinde üç defa icra veya dava takibi yapılmasına sebep olunması; \nb) Anagayrimenkulün bulunduğu yerin sulh hakimi tarafından 33 üncü madde gere-\nğince verilen emre rağmen, bu kanunda yazılı borç ve yükümleri yerine getirmemek suretiyle \nöteki kat maliklerinin haklarını ihlal etmekte devamlı olarak bir yıl ısrar edilmesi; \nc) Kendi bağımsız bölümünü randevu evi veya kumarhane veya benzeri yer olarak \nkullanmak suretiyle ahlak ve adaba aykırı harekette bulunması.', '**Kat Mülkiyeti Kanunu**\nMadde 74 – (Ek: 14/11/2007-5711/22 md.) \nBu bölümde öngörülen özel hükümler saklı kalmak kaydıyla, bu Kanunda yer alan b ü-\ntün hükümler, toplu yapılar hakkında da aynen veya kıyas yoluyla tatbik edilir. \n \nGörevli mahkeme: \nEk Madde 1 – (Ek: 13/4/1983-2814/15 md.) \nBu Kanunun uygulanmasından doğacak her türlü anlaşmazlık s ulh mahkemelerinde \nçözümlenir. \n \nKullanma yerlerinin boşaltılması: \nEk Madde 2 – (Ek: 13/4/1983 - 2814/15 md.) \nKat malikleri kurulunca veya bu kurulca yetki verilen yönetici tarafından sözleşmeleri \nherhangi bir nedenle feshedilen veya sona eren, kapıcı, kalo riferci, bahçıvan ve bekçiler ile \ndışarıdan atanan yöneticiler kendilerine bu göre vleri dolayısıyla bir yer tahsis edilmiş ise, bu \nyerleri onbeş gün içerisinde boşaltmak zorundadırlar. Bu süre içinde boşaltılmayan yerler \nyöneticinin veya kat maliklerinden herhangi birinin başvurusu üzerine başkaca tebligata l ü-\nzum kalmadan mahalli mülki amirlerin kararı ile bir hafta içinde zabıtaca boşalttırılır. İdare ve \nyargı organlarına yapıl acak başvuru, bu kararların yerine getirilmesini durdurmaz. İlgililerin \nkanun ve sözleşmeden doğan hakları saklıdır. \n \nBirden çok yapılarda uygulanacak özel hükümler: \nEk Madde 3 – (Ek:13/4/1983 - 2814/15 md.; Mülga: 14/11/2007-5711/24 md.) \n \nKat irtifakına geçiş:', '**Kat Mülkiyeti Kanunu**\nbankada kendi adına ve fakat anagayrimenkulün yönetici sıfatı gösterilmek suretiyle, hesap \naçtırılması; \nk) Kat malikleri kurulunun toplantıya çağırılması. \nl) (Ek: 4/4/2015 -6645/82 md.) Anagayrimenkulde bulunan asansörlerin güvenli bir \nşekilde işletilmesinin sağlanması amacıyla aylık bakımları ile yıllık kontrollerinin ilgili teknik \ndüzenlemelere uygun şekilde yaptırılması ve bu işlemlere ilişkin ücretlerin ödenmesi. \n(Ek fıkra: 4/4/2015-6645/82 md.) Bu Kanunun 34 üncü maddesinde belirtilen şartları \ntaşımasına rağmen yönetici ataması yapılmayan anagayrimenkulde, birinci fıkrada sayılan \nişlerin yaptırılmasından kat malikleri müştereken sorumludur. \n \n2. Defter tutulması ve belgelerin saklanması:']","Evet, komşunuzun bağımsız bölümünü randevu evi veya kumarhane gibi bir yer olarak kullanması kat mülkiyeti kanununa aykırıdır. Kat Mülkiyeti Kanunu Madde 25'e göre, bu tür bir kullanım ahlak ve adaba aykırı hareket olarak kabul edilmektedir.

Bu durumda, komşunuz hakkında kat malikleri, kendilerine ait haklarının ihlal edildiğini düşünerek mahkeme yoluna gidebilirler. Bu tür bir davranışın devam etmesi halinde, kat malikleri, komşunun mülkü üzerindeki mülkiyet hakkının kendilerine devredilmesini talep edebilirler. Dolayısıyla, ilk adım olarak yönetici veya kat malikleri toplantısında konuyu gündeme getirerek, bu durumu resmi olarak kaydetmek ve gerektiğinde dava açma süreçlerine hazırlıklı olmak amacıyla görüşmelisiniz.","Bir kat maliki dairesini randevu evi veya kumarhane olarak kullanarak ahlak ve adaba aykırı harekette bulunursa, diğer kat malikleri o dairenin mülkiyetinin kendilerine devredilmesini hakimden isteyebilirler (Çekilmezlik hali).",0.6666666666666666,0.8551684213886847,0.7884163777706384
"Kiracıyım, kirayı en geç ne zaman ödemem gerekir?",[],"Ben sadece apartman ve komşuluk hukuku konularında yardımcı olabilirim. Kiracılık ilişkisiyle ilgili bilgi almak için ""Kira Sözleşmeleri"" konusuna başvurmanız gerekir.","Aksine bir sözleşme veya yerel âdet yoksa, kira bedelini her ayın sonunda ve en geç kira süresinin bitiminde ödemekle yükümlüsünüz.",0.0,0.0,0.11619715862446725
Evde sonradan bir ayıp (kusur) çıkarsa kiracı olarak haklarım nelerdir?,[],"Ben sadece apartman ve komşuluk hukuku konularında yardımcı olabilirim. Bu nedenle, kiracı haklarıyla ilgili kesin bir bilgi veremem. Ancak sorunuz Kat Mülkiyeti Kanunu ile alakalı unsurlar içeriyorsa, yardımcı olabilirim. Eğer apartman veya site yaşamıyla ilgili bir konu sormak isterseniz, çekinmeden iletin.","Kiraya verenden ayıbın giderilmesini isteyebilir, kira bedelinden indirim talep edebilir veya zararının giderilmesini isteyebilirsiniz. Önemli bir ayıp durumunda sözleşmeyi feshetme hakkınız da saklıdır.",0.0,0.0,0.10940433110882115
Kiracı komşulara saygısızlık yaparsa ev sahibi ne yapabilir?,"['**Türk Borçlar Kanunu (İlgili Maddeler)**\nD. Kiracının borçları I. Kira bedelini ödeme borcu 1. Genel olarak MADDE\t313-\tKiracı, kira bedelini ödemekle yükümlüdür. \t 2. İfa zamanı MADDE\t 314-\tKiracı, aksine sözleşme ve yerel âdet olmadıkça, kira bedelini ve gerekiyorsa yan giderleri, her ayın sonunda ve en geç kira süresinin bitiminde ödemekle yükümlüdür.   3. Kiracının temerrüdü MADDE\t 315-\tKiracı, kiralananın tesliminden sonra muaccel olan kira bedelini veya yan gideri ödeme borcunu ifa etmezse, kiraya veren kiracıya yazılı olarak bir süre verip, bu sürede de ifa etmeme durumunda, sözleşmeyi feshedeceğini bildirebilir. Kiracıya verilecek süre en az on gün, konut ve çatılı işyeri kiralarında ise en az otuz gündür. Bu süre, kiracıya yazılı bildirimin yapıldığı tarihi izleyen günden itibaren işlemeye başlar.   II. Özenle kullanma ve komşulara saygı gösterme borcu MADDE\t 316-\tKiracı, kiralananı, sözleşmeye uygun olarak özenle kullanmak ve kiralananın bulunduğu taşınmazda oturan kişiler ile komşulara gerekli saygıyı göstermekle yükümlüdür. Kiracının bu yükümlülüğüne aykırı davranması durumunda kiraya veren, konut ve çatılı işyeri kirasında, en az otuz gün süre vererek, aykırılığın giderilmesi, aksi takdirde sözleşmeyi feshedeceği konusunda yazılı bir ihtarda bulunur. Diğer kira ilişkilerinde ise, kiraya veren, kiracıya önceden bir ihtarda bulunmaksızın, yazılı bir bildirimle sözleşmeyi hemen feshedebilir. Konut\tve\tçatılı\tişyeri\tkirasında,\tkiracının\tkiralanana\tkasten\tağır\tbir\tzarar\tvermesi,\tkiracıya\tverilecek\tsürenin\tyararsız\tolacağının\tanlaşılması\tveya\tkiracının\tbu\tyükümlülüğe\taykırı\t davranışının\t kiraya\t veren\t veya\t aynı\t taşınmazda\t oturan\t kişiler\t ile\t komşular\tbakımından\tçekilmez\tolması\tdurumlarında\tkiraya\tveren,\tyazılı\tbir\tbildirimle\tsözleşmeyi\themen\tfeshedebilir. \t III. Temizlik ve bakım giderlerini ödeme borcu MADDE\t 317- Kiracı, kiralananın olağan kullanımı için gerekli temizlik ve bakım giderlerini ödemekle yükümlüdür. Bu konuda yerel âdete de bakılır.', '**Türk Borçlar Kanunu (İlgili Maddeler)**\n3. Yapı malikinin sorumluluğu a. Giderim yükümlülüğü MADDE\t 69- Bir binanın veya diğer yapı eserlerinin maliki, bunların yapımındaki bozukluklardan veya bakımındaki eksikliklerden doğan zararı gidermekle yükümlüdür. İntifa ve oturma hakkı sahipleri de, binanın bakımındaki eksikliklerden doğan zararlardan, malikle birlikte müteselsilen sorumludurlar. Sorumluların, bu sebeplerle kendilerine karşı sorumlu olan diğer kişilere rücu hakkı saklıdır.   b. Zarar tehlikesini önleme MADDE\t 70- Bir başkasına ait bina veya\t diğer\t yapı\t eserlerinden\t zarar\t görme\ttehlikesiyle\tkarşılaşan\tkişi, bu tehlikenin giderilmesi için gerekli önlemlerin alınmasını hak sahiplerinden isteyebilir. Kişilerin\tve\tmalların\tkorunması\thakkındaki\tkamu\thukuku\tkuralları\tsaklıdır.  2. Kiralananın sonradan ayıplı hâle gelmesinden sorumluluk a. Genel olarak MADDE\t 305-\tKiralanan sonradan ayıplı duruma gelirse kiracı, kiraya verenden ayıpların giderilmesini veya kira bedelinden ayıpla orantılı bir indirim yapılmasını ya da zararının giderilmesini isteyebilir. Ancak, zararın giderilmesi istemi diğer seçimlik hakların kullanılmasını önlemez. Önemli ayıp durumunda kiracının sözleşmeyi fesih hakkı saklıdır.   b. Ayıbın giderilmesini isteme ve fesih MADDE\t 306-\tKiracı, kiraya verenden kiralanandaki ayıbın uygun bir sürede giderilmesini isteyebilir; bu sürede ayıp giderilmezse kiracı, ayıbı kiraya veren hesabına gidertebilir ve bundan doğan alacağını kira bedelinden indirebilir veya kiralananın ayıpsız bir benzeri ile değiştirilmesini isteyebilir. Ayıbın,\t kiralananın\t öngörülen\t kullanıma\t elverişliliğini\t ortadan\t kaldırması\t ya\t da\tönemli\t ölçüde\t engellemesi\t ve\t verilen\t sürede\t giderilmemesi\t hâlinde\t kiracı,\t sözleşmeyi\tfeshedebilir. Kiraya veren, kiralanandaki ayıbı gidermek yerine, uygun bir süre içinde ayıpsız benzeriyle değiştirebilir. Kiraya veren, kiracıya aynı malın ayıpsız bir benzerini hemen vererek ve uğradığı zararın tamamını gidererek, onun seçimlik haklarını kullanmasını önleyebilir.', '**Türk Borçlar Kanunu (İlgili Maddeler)**\nya\t da\tönemli\t ölçüde\t engellemesi\t ve\t verilen\t sürede\t giderilmemesi\t hâlinde\t kiracı,\t sözleşmeyi\tfeshedebilir. Kiraya veren, kiralanandaki ayıbı gidermek yerine, uygun bir süre içinde ayıpsız benzeriyle değiştirebilir. Kiraya veren, kiracıya aynı malın ayıpsız bir benzerini hemen vererek ve uğradığı zararın tamamını gidererek, onun seçimlik haklarını kullanmasını önleyebilir.']","Kiracının komşulara saygısızlık yapması durumunda ev sahibinin yapabileceği işlemler bulunmaktadır. Evet, kiracının bu tür davranışları, kiracı açısından önemli yasal yükümlülükler doğurur. Kat Mülkiyeti Kanunu'na göre, kiracı, kiralananı özenle kullanmak ve komşulara saygı göstermekle yükümlüdür (KMK Madde 16). Kiracının bu yükümlülüklere aykırı davranışı durumunda, kiraya veren (ev sahibi) belirli adımlar atabilir.

Kiracı, komşularına saygısızlık yaparsa, ev sahibi öncelikle kiracıya yazılı bir ihtar göndererek durumu düzeltmesi için bir süre tanımalıdır. Bu süre genellikle en az otuz gündür. Eğer kiracı, verilen süre içerisinde aykırılığı gidermiyorsa, ev sahibi sözleşmeyi feshetme hakkına sahiptir. Ayrıca, eğer kiracının davranışı komşular bakımından çekilmez bir hal alıyorsa, ev sahibi ihtar vermeksizin sözleşmeyi hemen feshedebilir.

Özetle, kiracının saygısız davranışları durumunda ev sahibi, yazılı ihtar ile durumu düzeltmesini istedikten sonra, sürenin dolmasına bağlı olarak sözleşmeyi feshetme yoluna gidebilir. Bu tür durumlar için gerekli yasal süreçler ve dikkat edilmesi gereken hususlar vardır.","Konut ve çatılı işyeri kiralarında, kiracı komşulara saygı gösterme borcuna aykırı davranırsa, ev sahibi en az otuz gün süre vererek yazılı bir ihtarda bulunur. Aykırılık giderilmezse sözleşmeyi feshedebilir.",0.9166666666666666,1.0,0.9392790712120398
Apartman asansörünün bakımını ne sıklıkla yaptırmalıyız?,"['**Asansör İşletme ve Bakım Yönetmeliği**\nBiten kayıt defteri, bina sorumlusu tarafından asa nsörün kullanım ömrü boyunca muhafaza edilir. \nKayıt defteri ile ilgili tüm gereklilikler halen kullanımda olan bütün asansörler için de geçerlidir. \n(4) Asansör bakım, onarım ve servis hizmeti sonrasında oluşan atığın bertaraf edilmesi \n9/8/1983 tarihli ve 2872 sayılı Çevre Kanununa uygun olarak yapılır. \n(5) Asansör Yönetmeliği (2014/33/AB) kapsamında piyasaya arz edilen veya kullanımda olan \nasansör/asansörler için yapılacak olan bakım sözleşmesinde/sözleşmelerinde, o asansöre/asansörlere \nyönelik herhangi bir  cihaz veya şifreleme gibi yöntemlerle engelleme veya kısıtlama yapılıp \nyapılmadığına dair bilginin yer alması asansör monte eden veya onun yetkili servisi tarafından \nsağlanır. \nBakımın kapsamı \nMADDE 9 – (1) Asansörün, asansörü oluşturan tüm aksam ve parçal arın bakımı asansör monte \neden tarafından hazırlanmış olan bakım kılavuzunda yer alan talimatlara ve                                  güncel \nTS EN 13015: Asansör ve Yürüyen Merdivenlerin Bakımı, Bakım Talimatları İçin Kurallar standardında \nbelirtilen gerekliliklere göre yapılır. \n(2) Bu Yönetmeliğe göre bakım; \na) Yağlama ve temizlemeyi, \nb) Kontrolleri, \nc) Kurtarma çalışmalarını, \nç) Ayarlama işlemlerini, \nd) Kullanıma veya yıpranmaya bağlı olarak meydana gelebilen bileşen onarımını veya \ndeğişimini, \nkapsar. \n(3) Bu Yönetmeliğe göre bakım; \na) Asansörün yerinin değiştirilmesini, \nb) Tahrik ünitesi, askı sistemi, taşıyıcı/kabin, durak kapısı ve/veya asansör güvenlik \naksamlarının değişimini, \nc) Asansör kumanda sisteminde yapılan değişiklikleri, \nç) İtfaiye tarafından yapılan kurtarma çalışmalarını, \nd) Asansör kuyusunun dış bölümlerinin temizlenmesini, \ne) Taşıyıcı/kabin iç kısmının temizlenmesini, \nkapsamaz. \n(4) 15/8/2004 tarihinden önce monte edilen ve ilgili mevzuata göre ilgili idare tarafından kayıt \naltına alınan a sansörün beyan yükünde ve/veya beyan hızında ve/veya seyir mesafesinde değişiklik', '**Asansör İşletme ve Bakım Yönetmeliği**\nbinaya/yapıya ait yönetim bürosunda kalıcı olarak muhafaza eder. \n(4) Asansör monte eden veya onun yetkili servisi, insan can ve mal güvenliği yönünden \nasansörün risk taşıması durumunda bina sorumlusunu yazılı olarak bilgilendirir. Bina sorumlusu \nasansör monte eden veya onun yetkili servisi vasıtasıyla asansörün güv enli hale getirilmesini \nsağlamakla yükümlüdür. \n(5) Asansör monte eden veya onun yetkili servisi, asansörde yapılan aksam ve parça \ndeğişiklikleri ile bildirilen kazaları asansör kayıt defterine işler. \n(6) Bakım sözleşmesi yapıldıktan sonra asansör monte ede n veya onun yetkili servisi, \nbinadaki/yapıdaki asansör sayısı dikkate alınarak bina sorumlusunun belirleyeceği sayıda kişiye acil \ndurumlarda kurtarma çalışması konusunda yılda en az bir defa eğitim verir. Eğitim, yetkili servis \nteknik bakım ve onarım perso neli tarafından verilir. Verilen bu eğitim yetkili servis teknik sorumlusu \nve eğitimi veren kişi tarafından imzalanan bir tutanakla kayıt altına alınır ve tutanağın bir sureti bina \nsorumlusuna iletilir. Bina sorumlusu, eğitim alan kişi/kişilerin değişmesi halinde yeni kişi/kişilere \neğitim verilmesini sağlar. Kurtarma talimatının, kurtarma çalışmasını yapacak kişi/kişilerin kolaylıkla \ngörebilecekleri yerlerde muhafaza edilmesi ve amacına uygun hazırlanmış olması gerekir. \n(7) Asansör monte eden, piyasaya arz ettiği her tip ve özellikteki asansör için yedek aksam ve \nparçayı en az üç yıl süreyle temin etmekle yükümlüdür. \n(8) Asansör monte eden, kendisi tarafından piyasaya arz edilen asansöre bakım, onarım ve \nservis hizmeti veren bir başka asansör monte edenin ve ya onun yetkili servisinin veya bina \nsorumlusunun, yedek aksam veya parça ile asansörde bakım yapmayı mümkün kılacak her türlü cihaz \nve donanım talebini normal piyasa koşullarında sağlamak zorundadır. \n(9) Bakım, onarım, arıza giderme ve periyodik kontrol f aaliyetleri yürütülürken gerekli iş sağlığı', '**Asansör İşletme ve Bakım Yönetmeliği**\nservis hizmeti veren bir başka asansör monte edenin ve ya onun yetkili servisinin veya bina \nsorumlusunun, yedek aksam veya parça ile asansörde bakım yapmayı mümkün kılacak her türlü cihaz \nve donanım talebini normal piyasa koşullarında sağlamak zorundadır. \n(9) Bakım, onarım, arıza giderme ve periyodik kontrol f aaliyetleri yürütülürken gerekli iş sağlığı \nve güvenliği tedbirleri 20/6/2012 tarihli ve 6331 sayılı İş Sağlığı ve Güvenliği Kanunu ve ilgili mevzuat \nhükümleri doğrultusunda bina sorumlusu ile bakım sözleşmesi imzalayan asansör monte eden veya \nonun yetkili servisince alınır. \n(10) Bakım esnasında, bakım ve onarım işlerinden kaynaklı nedenlerle gerek teknik bakım ve \nonarım personelinin gerekse bakımla ilgisi bulunmayan kişi/kişilerin yaralanmasına veya ölümüne \nneden olabilecek ihmallere dair sorumluluk, bina sorumlusunun bakım sözleşmesi imzaladığı asansör \nmonte eden veya onun yetkili servisindedir. \n(11) Periyodik kontrol neticesinde güvensiz olarak tanımlanan ve kırmızı renkli bilgi etiketi \niliştirilen asansöre; kusurlu, hafif kusurlu veya kusursuz hale getir ilinceye kadar bakım hizmeti \nsunulamaz. Güvensiz olma durumundan, kusurlu duruma geçen ve periyodik kontrol tarihi başlangıç \nkabul edilerek yüz yirmi gün içerisinde hafif kusurlu veya kusursuz hale getirilmeyen asansöre de söz \nkonusu sürenin sona erdiği za man itibarıyla bakım hizmeti sunulamaz. Asansör monte eden veya \nonun yetkili servisi bu süre zarfında bina sorumlusundan aylık bakım ücreti talebinde bulunamaz. \n(12) Asansör monte eden veya onun yetkili servisi; bakım, onarım, arıza giderme ve periyodik \nkontrol faaliyetleri yürütülürken görevlendireceği teknik bakım ve onarım personeline ilişkin \ntanımlayıcı tüm bilgilerin bakım sözleşmesinde yer almasını sağlar. Teknik bakım ve onarım \npersoneline ilişkin değişiklik olması halinde, bu değişikliğe dair bilginin de söz konusu bakım \nsözleşmesinde yer alması ilgili asansör monte eden veya onun yetkili servisince sağlanır.', '**Asansör İşletme ve Bakım Yönetmeliği**\nonaylı tescil belgesi ilgili idare tarafından düzenlenir ve asansör monte edene sunulur. \n(7) İlgili idare, tescil başvurusun da ikinci fıkrada istenen belgelerin dışında asansör monte \nedenden herhangi bir belge talebinde bulunamaz. \nÜÇÜNCÜ BÖLÜM \nBakım, Bakımın Kapsamı ve Bakımla İlgili Diğer Hususlar \nBakım \nMADDE 8 – (1) Bu Yönetmelik kapsamında yer alan asansörün bakımı, bina sor umlusunun \nbakım sözleşmesi imzaladığı asansör monte eden veya onun yetkili servisi tarafından yapılır. Yapı \nkullanma izin belgesi alan ve amacına uygun olacak şekilde ilk kez kullanıma açılan binada/yapıda \nyasal olarak bina sorumlusu atanana kadar asansör yaptırıcısı ile asansör monte eden veya onun \nyetkili servisi arasında bakım sözleşmesi yapılır.  \n(2) Bakım sözleşmesinin birden fazla asansörü kapsaması durumunda, bakım hizmeti sunulacak \nher bir asansöre ait asansör kimlik numarası ve asansörün açık adresi bu sözleşmede belirtilir. \n(3) Piyasaya arz edilen asansörün beyan yükü, beyan hızı, tahrik türü, motor seri numarası ve \ngücü, halat ve/veya zincirler ile tip kontrol belgesi gerektiren aksam ve parçaların teknik özellikleri, \ntesis planları ve elektrik de vre şemaları ile asansör periyodik kontrol sonuçları ve kazaların kayıt \nedileceği asansör kayıt defteri, söz konusu asansörü piyasaya arz eden asansör monte eden \ntarafından sağlanır. Ayrıca asansörün kimlik numarası, piyasaya arz tarihi ve tescil tarihi as ansör kayıt \ndefterinde belirtilir. Asansör kayıt defterinin bitmesi durumunda, yeni defter bina sorumlusuyla \nbakım sözleşmesi imzalayan asansör monte eden veya onun yetkili servisi tarafından temin edilir. \nBiten kayıt defteri, bina sorumlusu tarafından asa nsörün kullanım ömrü boyunca muhafaza edilir. \nKayıt defteri ile ilgili tüm gereklilikler halen kullanımda olan bütün asansörler için de geçerlidir. \n(4) Asansör bakım, onarım ve servis hizmeti sonrasında oluşan atığın bertaraf edilmesi \n9/8/1983 tarihli ve 2872 sayılı Çevre Kanununa uygun olarak yapılır.', '**Asansör İşletme ve Bakım Yönetmeliği**\nuygulama projesi hazırlanır/hazırlatılır ve ruhsat makam ının onayına sunulur. Ruhsat makamı \ntarafından onaylanan asansör uygulama projesine uygun olacak şekilde beyan yükünde ve/veya \nbeyan hızında ve/veya seyir mesafesinde değişiklik yapılan asansörün tescili için asansör monte eden \ntarafından yeşil renkli bilg i etiketine esas periyodik kontrol raporuyla birlikte altmış gün içerisinde \nilgili idareye başvurulur. Asansörün tescil belgesi, Ek -2’de yer alan içeriğe uygun olacak şekilde ilgili \nidare tarafından düzenlenir ve asansör monte edene sunulur. \nBakımla ilgili diğer hususlar \nMADDE 10 – (1) Bina sorumlusu ile sözleşme imzalayan asansör monte eden veya onun yetkili \nservisi, güvenli kullanım için söz konusu asansörü oluşturan aksam ve parçaları da içerecek şekilde bir \nbütün olarak gerekli koşulları sağlayıp sağlam adığına ilişkin durum tespit raporu hazırlar ve bina \nsorumlusuna iletir. Durum tespit raporu asansör monte edenin piyasaya arz ettiği ve bakım \nsözleşmesi yaptığı asansör için hazırlanmaz. \n(2) Asansör monte eden veya onun yetkili servisince her bakımda yapılan işlemler güncel TS EN \n13015: Asansör ve Yürüyen Merdivenlerin Bakımı, Bakım Talimatları İçin Kurallar standardındaki \ngereklilikleri de içerecek şekilde hazırlanmış olan bakım föyü ile kayıt altına alınır ve bir nüshası bina \nsorumlusuna teslim edilir, b ir nüshası da kendisi tarafından muhafaza edilir ve talep edilmesi \ndurumunda Bakanlığa ve diğer ilgililere sunulur. \n(3) Bina sorumlusu bakım föylerini asansörün makina veya makara dairesinde veya \nbinaya/yapıya ait yönetim bürosunda kalıcı olarak muhafaza eder. \n(4) Asansör monte eden veya onun yetkili servisi, insan can ve mal güvenliği yönünden \nasansörün risk taşıması durumunda bina sorumlusunu yazılı olarak bilgilendirir. Bina sorumlusu \nasansör monte eden veya onun yetkili servisi vasıtasıyla asansörün güv enli hale getirilmesini \nsağlamakla yükümlüdür.', '**Asansör İşletme ve Bakım Yönetmeliği**\nservisi tarafından asansörde değiştirilecek olan aksam veya parça, söz konusu değişimin yapıldığı tarih \nitibarıyla en az iki yıl süre ile garanti edilir. \n(4) Garanti süresi biten asansörde değiştirilen aksam veya parça, bu aksamı/parçayı imal eden \nveya ticari bir faaliyet yoluyla bedelli/bedelsiz olarak kullanımı için bina sorumlusuna sağlayan iktisadi \nişletmeci tarafından en az iki yı l süre ile garanti edilir. İktisadi işletmeci,         Ek-3’te yer alan içeriğe \nuygun olacak şekilde garanti belgesini düzenlemek ve bina sorumlusuna sunmak zorundadır.  \n(5) Garanti belgesinde tanımlanacak olan azami tamir süresi on beş günden fazla olamaz. \n(6) Asansör Yönetmeliği (2014/33/AB) kapsamında piyasaya arz edilen her asansöre yönelik \ngaranti süresi boyunca sunulacak olan bakım hizmeti, bina sorumlusunun başka bir asansör monte \neden veya onun yetkili servisi ile sözleşme imzalayacağını beyan etmeme si durumunda, o asansörü \npiyasaya arz eden asansör monte eden veya onun yetkili servisi tarafından verilir. \n(7) Bina sorumlusunun garanti süresi içerisinde bir başka asansör monte eden veya onun yetkili \nservisi ile bakım sözleşmesi imzalaması, o asansörü p iyasaya arz eden asansör monte edenin garanti \nile ilgili yükümlülüklerini ortadan kaldırır. \n(8) Asansörün arızalanması durumunda, tamirde geçen süre garanti süresine eklenir. \nSatış sonrası hizmetler \nMADDE 12 – (1) Asansör Yönetmeliği (2014/33/AB) kapsamınd a piyasaya arz edilen ve garanti \nedilen her asansöre yönelik garanti kapsamında yürütülecek olan satış sonrası bakım, onarım ve \nservis hizmetleri, o asansörü piyasaya arz eden asansör monte eden veya onun yetkili servisi \ntarafından yerine getirilir. \n(2) Garanti kapsamında satış sonrası hizmetlerin tam ve eksiksiz yerine getirilebilmesi amacıyla, \nbu Yönetmelikte belirlenmiş olan asgari kriterler çerçevesinde en az bir yetkili servis istasyonu \nasansör monte edenin bünyesinde kurulur.']","Evet, apartman asansörünün bakımını düzenli olarak yaptırmalısınız. Kat Mülkiyeti Kanunu ve Asansör Yönetmeliği’ne göre, asansörlerin bakım ve kontrollerinin belirli periyotlarla yapılması zorunludur.

Asansör Yönetmeliği'nin gerekliliklerine göre, asansörlerin bakımı, asansör monte eden firma ya da yetkili servisi tarafından gerçekleştirilmektedir. Bakım işlemleri, asansörün kullanım güvenliği açısından kritik öneme sahiptir. Ayrıca, bakım yapılmadığında, asansörlerin güvenliğini riske atmış olursunuz.

Temel olarak, asansör bakımları en az yılda bir kez yapılmalıdır. Ancak, asansörün kullanım yoğunluğu ve durumu gibi faktörlere bağlı olarak bu sıklık artırılabilir. Bakım sırasında, asansörün tüm aksam ve parçaları kontrol edilerek gerekli yağlama, temizlik ve onarım işlemleri yapılmalı, bunlar da özenle kaydedilmelidir. Bakım sözleşmesine göre bu işlemlerin hangi sıklıkla yapılacağı da net bir şekilde belirtilmelidir. 

Sonuç olarak, asansör bakımının sürekliliği, hem bina sakinlerinin güvenliği hem de asansörün uzun ömürlü olması açısından büyük önem taşımaktadır.","Asansörün bakımı, asansör monte eden veya onun yetkili servisi tarafından periyodik olarak ayda en az bir defa yapılmalıdır.",1.0,0.6864440300178103,0.46698565061587094
"Asansör denetiminde kırmızı etiket aldı, kullanmaya devam edebilir miyiz?","['**Asansör İşletme ve Bakım Yönetmeliği**\nç) İtfaiye tarafından yapılan kurtarma çalışmalarını, \nd) Asansör kuyusunun dış bölümlerinin temizlenmesini, \ne) Taşıyıcı/kabin iç kısmının temizlenmesini, \nkapsamaz. \n(4) 15/8/2004 tarihinden önce monte edilen ve ilgili mevzuata göre ilgili idare tarafından kayıt \naltına alınan a sansörün beyan yükünde ve/veya beyan hızında ve/veya seyir mesafesinde değişiklik \nyapılması halinde, bu asansörde, güncel TS EN 81-80 standardı gereklilikleri esas alınır. \n(5)  15/8/2004 ile 1/9/2017 tarihleri arasında piyasaya arz edilen ve ilgili mevzuat a göre ilgili \nidare tarafından kayıt altına alınan asansörün beyan yükünde ve/veya beyan hızında ve/veya seyir \nmesafesinde değişiklik yapılması halinde, bu asansörde, ilk defa piyasaya arz edildiği tarihte \nyürürlükte bulunan uyumlaştırılmış standart gereklilikleri esas alınır. \n(6) Üçüncü fıkranın (a), (b) ve (c) bentlerinde, dördüncü ve beşinci fıkralarında yer alan ve \nbakım çalışması olarak değerlendirilmeyen asansöre ait değişiklikler, asansör monte eden tarafından \nyerine getirilir. Bu değişikliklerin ilg ili mevzuatına ve/veya standardına uygun yapılıp yapılmadığına \ndair sorumluluk, söz konusu değişiklikleri yapan asansör monte edendedir. Bu değişiklikleri yapmak \nüzere asansör monte eden adına hareket eden montaj elemanının ve/veya teknik bakım ve onarım \npersonelinin, bu Yönetmelikte ve/veya ilgili mevzuatta belirtilen yeterlilik belgesine sahip olması \ngerekir. \n(7) Dördüncü ve beşinci fıkrada belirtilen durumlarda asansör monte eden tarafından asansör \nuygulama projesi hazırlanır/hazırlatılır ve ruhsat makam ının onayına sunulur. Ruhsat makamı \ntarafından onaylanan asansör uygulama projesine uygun olacak şekilde beyan yükünde ve/veya \nbeyan hızında ve/veya seyir mesafesinde değişiklik yapılan asansörün tescili için asansör monte eden \ntarafından yeşil renkli bilg i etiketine esas periyodik kontrol raporuyla birlikte altmış gün içerisinde', '**Asansör İşletme ve Bakım Yönetmeliği**\ntanımlanır. \n(2) Asansör kimlik numarası Asansör Periyodik Kontrol Yönetmeliğinde belirtilen usul ve \nesaslara uygun olarak muayene kuruluşu tarafından periyodik kontrol aşamasından önce oluşturulur. \nAsansör kimlik numarası Asansör Periyodik Kontrol Yönetmeliğinin 21 inci maddesinde tanımlanan \nformata uygun bir etiket üzerinde belirtilir. Bu etiket, periyodik kontrol aşamasında muayene \nkuruluşu tarafından asansör kabinine iliştirilir.  \n(3) Asansör kabinine iliştirilen ve asansör kimlik numarasını içeren etiketin, asansörün kullanım \nömrü boyunca muh afaza edilmesine ve gerektiğinde yenilenmesine dair sorumluluk,   bina \nsorumlusundadır. \nAsansörün binaya/yapıya fenni uygunluğunun kontrolü \nMADDE 6 – (1) Asansör Yönetmeliği (2014/33/AB) kapsamında monte edilen asansörün monte \nedildiği binaya/yapıya fenni u ygunluğuna ilişkin kontroller 3/5/1985 tarihli ve 3194 sayılı İmar \nKanununa, ilgili mevzuata ve erişilebilirlik mevzuatına uygun olacak şekilde ilgili ruhsat makamı \ntarafından yürütülür. \n(2) Birinci fıkrada belirtilen kontrollerin ilgili mevzuatına uygun b ir şekilde yürütülmesine dair \nsorumluluk ilgili ruhsat makamındadır. \nAsansörün tescili \nMADDE 7 – (1) Asansör Yönetmeliği (2014/33/AB) kapsamında piyasaya arz edilen her asansör \nilgili idareye tescil ettirilir. Tescil başvurusu, asansörün piyasaya arz edild iği tarih itibarıyla altmış gün \niçerisinde söz konusu asansörü piyasaya arz eden asansör monte eden tarafından yapılır. \n(2) Asansör monte eden, tescil işlemi için aşağıda belirtilen belgelerin bir sureti ile birlikte ilgili \nidareye başvurur: \na) Sanayi sicil belgesi. \nb) Onaylanmış kuruluşça düzenlenen uygunluk belgesi veya raporu. \nc) AB uygunluk beyanı. \nç) Garanti belgesi. \nd) (Değişik:RG-3/4/2021-31443) AB uygunluk beyanı ve garanti belgesini imzalayan yetkilinin \nadı, soyadı ve unvanına dair bilgileri içerecek şekilde kendisi tarafından hazırlanan ve onaylanan yazılı \nbeyan belgesi. \ne) TSE Hizmet Yeterlilik Belgesi.', '**Asansör İşletme ve Bakım Yönetmeliği**\nuygulama projesi hazırlanır/hazırlatılır ve ruhsat makam ının onayına sunulur. Ruhsat makamı \ntarafından onaylanan asansör uygulama projesine uygun olacak şekilde beyan yükünde ve/veya \nbeyan hızında ve/veya seyir mesafesinde değişiklik yapılan asansörün tescili için asansör monte eden \ntarafından yeşil renkli bilg i etiketine esas periyodik kontrol raporuyla birlikte altmış gün içerisinde \nilgili idareye başvurulur. Asansörün tescil belgesi, Ek -2’de yer alan içeriğe uygun olacak şekilde ilgili \nidare tarafından düzenlenir ve asansör monte edene sunulur. \nBakımla ilgili diğer hususlar \nMADDE 10 – (1) Bina sorumlusu ile sözleşme imzalayan asansör monte eden veya onun yetkili \nservisi, güvenli kullanım için söz konusu asansörü oluşturan aksam ve parçaları da içerecek şekilde bir \nbütün olarak gerekli koşulları sağlayıp sağlam adığına ilişkin durum tespit raporu hazırlar ve bina \nsorumlusuna iletir. Durum tespit raporu asansör monte edenin piyasaya arz ettiği ve bakım \nsözleşmesi yaptığı asansör için hazırlanmaz. \n(2) Asansör monte eden veya onun yetkili servisince her bakımda yapılan işlemler güncel TS EN \n13015: Asansör ve Yürüyen Merdivenlerin Bakımı, Bakım Talimatları İçin Kurallar standardındaki \ngereklilikleri de içerecek şekilde hazırlanmış olan bakım föyü ile kayıt altına alınır ve bir nüshası bina \nsorumlusuna teslim edilir, b ir nüshası da kendisi tarafından muhafaza edilir ve talep edilmesi \ndurumunda Bakanlığa ve diğer ilgililere sunulur. \n(3) Bina sorumlusu bakım föylerini asansörün makina veya makara dairesinde veya \nbinaya/yapıya ait yönetim bürosunda kalıcı olarak muhafaza eder. \n(4) Asansör monte eden veya onun yetkili servisi, insan can ve mal güvenliği yönünden \nasansörün risk taşıması durumunda bina sorumlusunu yazılı olarak bilgilendirir. Bina sorumlusu \nasansör monte eden veya onun yetkili servisi vasıtasıyla asansörün güv enli hale getirilmesini \nsağlamakla yükümlüdür.', '**Asansör İşletme ve Bakım Yönetmeliği**\nyetkisine sahip kurum ve kuruluşları, \np) Ser vis teknik sorumlusu: Yetkili servis faaliyetlerini idari ve teknik olarak yöneten, gerekli \ndokümanları hazırlayan/hazırlatan ve yetkili servis adına yasal olarak temsil ve ilzama yetkili olan \nkişiyi,  \nr) Teknik bakım personeli: Yetkili servis bünyesinde a sansörlerde bakım, onarım ve servis işini \nyürütmek üzere görevlendirilen ve ilgili mevzuat kapsamında belgeli olan asansör bakım ve \nonarımcısını, \ns) Tescil: Asansörün resmî olarak ilgili idare tarafından kayıt altına alınmasını, \nş) TSE: Türk Standardları Enstitüsünü, \nt) TS EN 81 -80 standardı: Asansörler - Yapım ve Montaj için Güvenlik Kuralları: Yolcu ve Yük \nAsansörleri için Özel Uygulamalar - Bölüm 80: Mevcut Yolcu ve Yük Asansörlerinin Güvenliğini \nGeliştirme Kurallarını, \nu) Yetkili servis: Asansörlerde ba kım, onarım ve servis hizmetinin yürütülebilmesi için asansör \nmonte edenin kendi adına kurduğu servis istasyonu veya gerekli olduğu durumlarda sorumluluğu \nkendinde olmak üzere sözleşme ile yetki verdiği gerçek veya tüzel kişiyi, \nü) (Ek:RG-10/2/2023-32100) Bakan yardımcısı: Sanayi ve Teknoloji Bakanlığının ilgili bakan \nyardımcısını, \nv) (Ek:RG-10/2/2023-32100) İl müdürlüğü: Sanayi ve teknoloji il müdürlüğünü, \ny) (Ek:RG-10/2/2023-32100) İl müdürü: Sanayi ve teknoloji il müdürünü, \nifade eder. \nİKİNCİ BÖLÜM \nAsansör Kimlik Numarası, Asansörün Binaya/Yapıya Fenni \nUygunluğunun Kontrolü ve Asansörün Tescili \nAsansör kimlik numarası \nMADDE 5 – (1) Bu Yönetmelik kapsamında bulunan her asansör, bir asansör kimlik numarası ile \ntanımlanır. \n(2) Asansör kimlik numarası Asansör Periyodik Kontrol Yönetmeliğinde belirtilen usul ve \nesaslara uygun olarak muayene kuruluşu tarafından periyodik kontrol aşamasından önce oluşturulur. \nAsansör kimlik numarası Asansör Periyodik Kontrol Yönetmeliğinin 21 inci maddesinde tanımlanan \nformata uygun bir etiket üzerinde belirtilir. Bu etiket, periyodik kontrol aşamasında muayene', '**Asansör İşletme ve Bakım Yönetmeliği**\n6 ncı maddesinin birinci fıkrasında öngörülen idari para cezası uygulanır. \n(6) İdari para cezası, ceza kararının ilgiliye tebliğinden itibaren bir ay içerisinde ödenir. \n(7) (Ek:RG-10/2/2023-32100) Bu Yönetmelik hükümlerine aykırı davrananlar hakkında 7223 \nsayılı Kanun kapsamında uygulanacak idari para cezası kararları; \na) Denetimin Bakanlık merkez birimi personeli tarafından yapılması halinde sorumluluk alanı \nçerçevesinde bakan yardımcısı tarafından, \nb) Denetimin sadece il müdürlüğü personeli tarafından veya Bakanlık merkez birimi personeli \nile il müdürlüğü personelinin birlikte katılımıyla yapılması halinde asansörün monte edildiği yerdeki il \nmüdürü tarafından, \nverilir. \nAtıflar \nMADDE 18 – (1) 24/6/2015 tarihli ve   29396 sayılı Resmî Gazete’de yayımlanan Asansör \nİşletme, Bakım ve Periyodik Kontro l Yönetmeliğine yapılan bütün atıflar, bu Yönetmeliğe yapılmış \nsayılır. \nYürürlükten kaldırılan yönetmelik \nMADDE 19 – (1) 24/6/2015 tarihli ve 29396 sayılı Resmî Gazete’de yayımlanan Asansör \nİşletme, Bakım ve Periyodik Kontrol Yönetmeliği yürürlükten kaldırılmıştır. \nKayıt altına alınmamış asansörün tescili \nGEÇİCİ MADDE 1 – (1) Bu Yönetmeliğe göre TS EN 81 -80 standardı esas alınarak güvenlik \nseviyesi artırılan mevcut asansör veya 15/8/2004 -24/6/2015 tarihleri arasında piyasaya arz \nedilmesine rağmen kayıt altı na alınmamış olan asansör, bir defaya mahsus olmak üzere ilgili idare \ntarafından tescil edilir. Bina sorumlusu: \na) Mevcut asansörün güvenlik seviyesinin TS EN 81 -80 standardına göre artırıldığını \nispatlayacak olan yeşil veya mavi renkli bilgi etiketine esa s periyodik kontrol raporuyla, bir sonraki \nperiyodik kontrol tarihine kadar ilgili idareye başvurur. \nb) 15/8/2004 -24/6/2015 tarihleri arasında piyasaya arz edilmesine rağmen kayıt altına \nalınmamış olan asansöre ait yeşil veya mavi renkli bilgi etiketine es as periyodik kontrol raporuyla, bir \nsonraki periyodik kontrol tarihine kadar ilgili idareye başvurur.', '**Asansör İşletme ve Bakım Yönetmeliği**\nBiten kayıt defteri, bina sorumlusu tarafından asa nsörün kullanım ömrü boyunca muhafaza edilir. \nKayıt defteri ile ilgili tüm gereklilikler halen kullanımda olan bütün asansörler için de geçerlidir. \n(4) Asansör bakım, onarım ve servis hizmeti sonrasında oluşan atığın bertaraf edilmesi \n9/8/1983 tarihli ve 2872 sayılı Çevre Kanununa uygun olarak yapılır. \n(5) Asansör Yönetmeliği (2014/33/AB) kapsamında piyasaya arz edilen veya kullanımda olan \nasansör/asansörler için yapılacak olan bakım sözleşmesinde/sözleşmelerinde, o asansöre/asansörlere \nyönelik herhangi bir  cihaz veya şifreleme gibi yöntemlerle engelleme veya kısıtlama yapılıp \nyapılmadığına dair bilginin yer alması asansör monte eden veya onun yetkili servisi tarafından \nsağlanır. \nBakımın kapsamı \nMADDE 9 – (1) Asansörün, asansörü oluşturan tüm aksam ve parçal arın bakımı asansör monte \neden tarafından hazırlanmış olan bakım kılavuzunda yer alan talimatlara ve                                  güncel \nTS EN 13015: Asansör ve Yürüyen Merdivenlerin Bakımı, Bakım Talimatları İçin Kurallar standardında \nbelirtilen gerekliliklere göre yapılır. \n(2) Bu Yönetmeliğe göre bakım; \na) Yağlama ve temizlemeyi, \nb) Kontrolleri, \nc) Kurtarma çalışmalarını, \nç) Ayarlama işlemlerini, \nd) Kullanıma veya yıpranmaya bağlı olarak meydana gelebilen bileşen onarımını veya \ndeğişimini, \nkapsar. \n(3) Bu Yönetmeliğe göre bakım; \na) Asansörün yerinin değiştirilmesini, \nb) Tahrik ünitesi, askı sistemi, taşıyıcı/kabin, durak kapısı ve/veya asansör güvenlik \naksamlarının değişimini, \nc) Asansör kumanda sisteminde yapılan değişiklikleri, \nç) İtfaiye tarafından yapılan kurtarma çalışmalarını, \nd) Asansör kuyusunun dış bölümlerinin temizlenmesini, \ne) Taşıyıcı/kabin iç kısmının temizlenmesini, \nkapsamaz. \n(4) 15/8/2004 tarihinden önce monte edilen ve ilgili mevzuata göre ilgili idare tarafından kayıt \naltına alınan a sansörün beyan yükünde ve/veya beyan hızında ve/veya seyir mesafesinde değişiklik']","Hayır, kırmızı etiket almış bir asansörü kullanmaya devam edemezsiniz. 

Asansörün kırmızı etiket alması, muayene sırasında ciddi güvenlik sorunları tespit edildiğini ve asansörün güvenli bir şekilde kullanılamayacağını gösterir. Bu durum, Bina Sorumlusunun asansörün güvenli hale getirilmesini sağlamakla yükümlü olduğunu belirtmektedir. Asansör monte eden veya onun yetkili servisi, asansörün risk taşıdığı durumlarda bina sorumlusunu bilgilendirir ve güvenli hale getirilmesi için gerekli işlemler başlatılmalıdır. 

Asansörlere ilişkin düzenlemeler, ilgili yönetmelikler çerçevesinde yapılmakta olup, kırmızı etiket almış bir asansörün kullanımı yasaktır. Güvenliği sağlamadan asansörün kullanılmasına devam edilmesi, insan can ve mal güvenliği açısından tehlikeli bir durum oluşturur.","Hayır. Kırmızı renkli bilgi etiketi iliştirilen (güvensiz) asansöre, kusurlu veya kusursuz hale getirilinceye kadar bakım hizmeti sunulamaz ve kullanılması güvenli değildir. 120 gün içinde düzeltilmezse hizmet dışı bırakılır.",0.4,0.5334190928304491,0.5656112013201072
Asansörde biri mahsur kalırsa kurtarma eğitimini kim verir?,"['**Asansör İşletme ve Bakım Yönetmeliği**\nservis hizmeti veren bir başka asansör monte edenin ve ya onun yetkili servisinin veya bina \nsorumlusunun, yedek aksam veya parça ile asansörde bakım yapmayı mümkün kılacak her türlü cihaz \nve donanım talebini normal piyasa koşullarında sağlamak zorundadır. \n(9) Bakım, onarım, arıza giderme ve periyodik kontrol f aaliyetleri yürütülürken gerekli iş sağlığı \nve güvenliği tedbirleri 20/6/2012 tarihli ve 6331 sayılı İş Sağlığı ve Güvenliği Kanunu ve ilgili mevzuat \nhükümleri doğrultusunda bina sorumlusu ile bakım sözleşmesi imzalayan asansör monte eden veya \nonun yetkili servisince alınır. \n(10) Bakım esnasında, bakım ve onarım işlerinden kaynaklı nedenlerle gerek teknik bakım ve \nonarım personelinin gerekse bakımla ilgisi bulunmayan kişi/kişilerin yaralanmasına veya ölümüne \nneden olabilecek ihmallere dair sorumluluk, bina sorumlusunun bakım sözleşmesi imzaladığı asansör \nmonte eden veya onun yetkili servisindedir. \n(11) Periyodik kontrol neticesinde güvensiz olarak tanımlanan ve kırmızı renkli bilgi etiketi \niliştirilen asansöre; kusurlu, hafif kusurlu veya kusursuz hale getir ilinceye kadar bakım hizmeti \nsunulamaz. Güvensiz olma durumundan, kusurlu duruma geçen ve periyodik kontrol tarihi başlangıç \nkabul edilerek yüz yirmi gün içerisinde hafif kusurlu veya kusursuz hale getirilmeyen asansöre de söz \nkonusu sürenin sona erdiği za man itibarıyla bakım hizmeti sunulamaz. Asansör monte eden veya \nonun yetkili servisi bu süre zarfında bina sorumlusundan aylık bakım ücreti talebinde bulunamaz. \n(12) Asansör monte eden veya onun yetkili servisi; bakım, onarım, arıza giderme ve periyodik \nkontrol faaliyetleri yürütülürken görevlendireceği teknik bakım ve onarım personeline ilişkin \ntanımlayıcı tüm bilgilerin bakım sözleşmesinde yer almasını sağlar. Teknik bakım ve onarım \npersoneline ilişkin değişiklik olması halinde, bu değişikliğe dair bilginin de söz konusu bakım \nsözleşmesinde yer alması ilgili asansör monte eden veya onun yetkili servisince sağlanır.', '**Asansör İşletme ve Bakım Yönetmeliği**\n(4) Mevcut asansörün güvenlik seviyesinin arttırılmasına dair sorumluluk, bina sorumlusuna \naittir. \nYEDİNCİ BÖLÜM \nÇeşitli ve Son Hükümler \nİdari yaptırımlar \nMADDE 17 – (Değişik:RG-11/7/2021-31538)  \n(1) Bu Yönetmeliğe aykırı hareket eden asansör monte eden veya onun yetkili servisine, bina \nsorumlusuna veya kat maliklerine, servis teknik sorumlusuna ve asans ör yaptırıcısına 1705 sayılı \nKanunun 6  ncı maddesinin birinci fıkrasında öngörülen idari para cezası uygulanır. Ancak bina \nsorumlusuna veya kat maliklerine geçici 1 inci maddede belirtilen tescil işlemini yaptırmadığından \ndolayı birinci cümlede ifade edilen idari para cezası uygulanmaz. \n(2) Bu Yönetmelik gerekliliklerini sağlamayan asansör monte eden veya onun yetkili \nservisinin sınai ve ticari faaliyetleri 1705 sayılı Kanunun 6  ncı maddesinin ikinci fıkrası uyarınca \ndurdurulur. \n(3) 11 inci maddenin birinci , ikinci, üçüncü, dördüncü, beşinci, altıncı ve sekizinci fıkralarında \nbelirtilen şartları sağlamayan asansör monte edene veya onun yetkili servisine 7223 sayılı Kanunun \n20 nci maddesinin birinci fıkrasının (b) bendinde öngörülen idari para cezası uygulanır. \n(4) 7  nci maddenin birinci fıkrasına göre süresi içerisinde ilgili idareye tescil başvurusunu \nyapmayan veya asansörü ilgili idareye tescil ettirmeyen asansör monte edene 7223 sayılı Kanunun \n20 nci maddesinin birinci fıkrasının (e) bendinde öngörülen idari para cezası uygulanır. \n(5) Bu Yönetmelikte belirtilen satış sonrası hizmetlere ilişkin şartlar ile yetkili servis ile ilgili \nşartları sağlamayan asansör monte edene veya onun yetkili servisine 1705 sayılı Kanunun \n6 ncı maddesinin birinci fıkrasında öngörülen idari para cezası uygulanır. \n(6) İdari para cezası, ceza kararının ilgiliye tebliğinden itibaren bir ay içerisinde ödenir. \n(7) (Ek:RG-10/2/2023-32100) Bu Yönetmelik hükümlerine aykırı davrananlar hakkında 7223 \nsayılı Kanun kapsamında uygulanacak idari para cezası kararları;', '**Asansör İşletme ve Bakım Yönetmeliği**\nç) İtfaiye tarafından yapılan kurtarma çalışmalarını, \nd) Asansör kuyusunun dış bölümlerinin temizlenmesini, \ne) Taşıyıcı/kabin iç kısmının temizlenmesini, \nkapsamaz. \n(4) 15/8/2004 tarihinden önce monte edilen ve ilgili mevzuata göre ilgili idare tarafından kayıt \naltına alınan a sansörün beyan yükünde ve/veya beyan hızında ve/veya seyir mesafesinde değişiklik \nyapılması halinde, bu asansörde, güncel TS EN 81-80 standardı gereklilikleri esas alınır. \n(5)  15/8/2004 ile 1/9/2017 tarihleri arasında piyasaya arz edilen ve ilgili mevzuat a göre ilgili \nidare tarafından kayıt altına alınan asansörün beyan yükünde ve/veya beyan hızında ve/veya seyir \nmesafesinde değişiklik yapılması halinde, bu asansörde, ilk defa piyasaya arz edildiği tarihte \nyürürlükte bulunan uyumlaştırılmış standart gereklilikleri esas alınır. \n(6) Üçüncü fıkranın (a), (b) ve (c) bentlerinde, dördüncü ve beşinci fıkralarında yer alan ve \nbakım çalışması olarak değerlendirilmeyen asansöre ait değişiklikler, asansör monte eden tarafından \nyerine getirilir. Bu değişikliklerin ilg ili mevzuatına ve/veya standardına uygun yapılıp yapılmadığına \ndair sorumluluk, söz konusu değişiklikleri yapan asansör monte edendedir. Bu değişiklikleri yapmak \nüzere asansör monte eden adına hareket eden montaj elemanının ve/veya teknik bakım ve onarım \npersonelinin, bu Yönetmelikte ve/veya ilgili mevzuatta belirtilen yeterlilik belgesine sahip olması \ngerekir. \n(7) Dördüncü ve beşinci fıkrada belirtilen durumlarda asansör monte eden tarafından asansör \nuygulama projesi hazırlanır/hazırlatılır ve ruhsat makam ının onayına sunulur. Ruhsat makamı \ntarafından onaylanan asansör uygulama projesine uygun olacak şekilde beyan yükünde ve/veya \nbeyan hızında ve/veya seyir mesafesinde değişiklik yapılan asansörün tescili için asansör monte eden \ntarafından yeşil renkli bilg i etiketine esas periyodik kontrol raporuyla birlikte altmış gün içerisinde', '**Asansör İşletme ve Bakım Yönetmeliği**\nonaylı tescil belgesi ilgili idare tarafından düzenlenir ve asansör monte edene sunulur. \n(7) İlgili idare, tescil başvurusun da ikinci fıkrada istenen belgelerin dışında asansör monte \nedenden herhangi bir belge talebinde bulunamaz. \nÜÇÜNCÜ BÖLÜM \nBakım, Bakımın Kapsamı ve Bakımla İlgili Diğer Hususlar \nBakım \nMADDE 8 – (1) Bu Yönetmelik kapsamında yer alan asansörün bakımı, bina sor umlusunun \nbakım sözleşmesi imzaladığı asansör monte eden veya onun yetkili servisi tarafından yapılır. Yapı \nkullanma izin belgesi alan ve amacına uygun olacak şekilde ilk kez kullanıma açılan binada/yapıda \nyasal olarak bina sorumlusu atanana kadar asansör yaptırıcısı ile asansör monte eden veya onun \nyetkili servisi arasında bakım sözleşmesi yapılır.  \n(2) Bakım sözleşmesinin birden fazla asansörü kapsaması durumunda, bakım hizmeti sunulacak \nher bir asansöre ait asansör kimlik numarası ve asansörün açık adresi bu sözleşmede belirtilir. \n(3) Piyasaya arz edilen asansörün beyan yükü, beyan hızı, tahrik türü, motor seri numarası ve \ngücü, halat ve/veya zincirler ile tip kontrol belgesi gerektiren aksam ve parçaların teknik özellikleri, \ntesis planları ve elektrik de vre şemaları ile asansör periyodik kontrol sonuçları ve kazaların kayıt \nedileceği asansör kayıt defteri, söz konusu asansörü piyasaya arz eden asansör monte eden \ntarafından sağlanır. Ayrıca asansörün kimlik numarası, piyasaya arz tarihi ve tescil tarihi as ansör kayıt \ndefterinde belirtilir. Asansör kayıt defterinin bitmesi durumunda, yeni defter bina sorumlusuyla \nbakım sözleşmesi imzalayan asansör monte eden veya onun yetkili servisi tarafından temin edilir. \nBiten kayıt defteri, bina sorumlusu tarafından asa nsörün kullanım ömrü boyunca muhafaza edilir. \nKayıt defteri ile ilgili tüm gereklilikler halen kullanımda olan bütün asansörler için de geçerlidir. \n(4) Asansör bakım, onarım ve servis hizmeti sonrasında oluşan atığın bertaraf edilmesi \n9/8/1983 tarihli ve 2872 sayılı Çevre Kanununa uygun olarak yapılır.', '**Asansör İşletme ve Bakım Yönetmeliği**\nyapan kılavuzlar boyunca hareket eden bir taşıyıcısı olan kaldırma tertibatını veya sabit bir seyir yolu \nüzerinde esnek olmayan kılavuzlar üzerinde olmasa da hareket eden kaldırma tertibatını, \nc) Asansör monte eden: Asan sörün tasarımından, imalatından, montajından ve piyasaya \narzından sorumlu olan gerçek veya tüzel kişiyi, \nç) Asansör yaptırıcısı: Asansörün monte edileceği binada/yapıda inşaat işini kendi adına yapan \nveya sözleşme ile devreden yapı sahibini veya asansörün monte edileceği mevcut binada bina \nsorumlusunu, \nd) Bakanlık: Sanayi ve Teknoloji Bakanlığını, \ne) Bakım: Asansörün hizmete alınmasından sonra kullanım ömrü boyunca, kendisinin ve \nbileşenlerinin, fonksiyonlarının ve güvenlik gereklerinin, tasarlandığı veya ilgili mevzuata uygun olarak \nyenilendiği biçimde devamlılığını sağlamaya yönelik, asansör monte eden veya onun yetkili servisi \ntarafından periyodik olarak ayda en az bir defa yürütülen işlemleri, \nf) Bina sorumlusu: Asansörün güvenli bir şekilde kullanımını sağlamak amacıyla düzenli olarak \nbakımını, periyodik kontrolünü ve onarımını yaptırmaktan sorumlu olan, binada/yapıda kat \nmaliklerinin kendi aralarında seçeceği veya dışarıdan yetki vereceği kişiyi veya kat malikini veya \nmaliklerini veya kamu binalarında/y apılarında sorumlu yetkiliyi veya ticari/hizmet amaçlı yapılarda \nsorumlu yetkiliyi, \ng) Coğrafi bölge: Akdeniz, Doğu Anadolu, Ege, Güneydoğu Anadolu, İç Anadolu, Karadeniz ve \nMarmara bölgelerini, \nğ) Erişilebilirlik: Yapıların, binaların ve bilgilendirme hiz metlerinin engelliler tarafından güvenli \nve bağımsız olarak ulaşılabilir ve kullanılabilir olmasını, \nh) Hizmet denetimi: Asansör monte edene veya onun yetkili servisine veya bina sorumlusuna \nyönelik Bakanlık tarafından yapılan denetimi, \nı) İlgili idare: Be lediyeleri veya belediye sınırları dışında kalan alanlardaki yapılar için il özel \nidarelerini, \ni) İktisadi işletmeci: Asansör monte edeni, asansör güvenlik aksamı imalatçısını, yetkili', '**Asansör İşletme ve Bakım Yönetmeliği**\n(3) Bina sorumlusu, asansörle ilgili herhangi bir tehlikeli durumu bakım sözleşmesi imzalanan \nasansör monte eden veya onu n yetkili servisine iletir ve söz konusu asansöre, asansör monte eden \nveya onun yetkili servisi tarafından müdahale edilene kadar gerekli güvenlik tedbirini alır. \nHizmet denetimi \nMADDE 15 – (1) Asansör monte eden tarafından garanti ile ilgili şartların ve satış sonrası \nhizmetlerin sağlanıp sağlanmadığı, bu Yönetmelik ile belirlenmiş olan kriterlere uygun bakım, onarım \nve servis hizmetinin asansör monte eden veya onun yetkili servisince sunulup sunulmadığına dair \nhizmet denetimi, Bakanlık tarafından yapılır. \n(2) Bina sorumlusunun bu Yönetmelikte belirtilen yükümlülükleri yerine getirip getirmediğine \nilişkin denetim Bakanlık tarafından yapılır. \nALTINCI BÖLÜM \nMevcut Asansörün Güvenlik Seviyesinin Arttırılması \nMevcut asansörün güvenlik seviyesinin arttırılması \nMADDE 16 – (1) Mevcut asansörün güvenlik seviyesi, Asansör Yönetmeliği (2014/33/AB) \nkapsamında monte edilmiş olan asansörün güvenlik seviyesine yakın eş değer bir seviyeye getirilerek \narttırılır. \n(2) Mevcut asansörün güvenlik seviyesinin arttırılmasına yön elik yürütülecek işlemlerde, Ek -\n4’te yer alan ve TS EN 81 -80 standardında belirtilen tehlikeli durumlar ve söz konusu tehlikeli \ndurumlara ilişkin bahsi geçen standart ile atıf yapılan çözüm önerileri esas alınır. \n(3) Mevcut asansör için belirtilen tehlikel i durumlar, TS EN 81 -80 standardına uygun olacak \nşekilde Bakanlık tarafından yayımlanan mevzuat ekindeki asansör periyodik kontrol listelerinde \ntanımlanır. \n(4) Mevcut asansörün güvenlik seviyesinin arttırılmasına dair sorumluluk, bina sorumlusuna \naittir. \nYEDİNCİ BÖLÜM \nÇeşitli ve Son Hükümler \nİdari yaptırımlar \nMADDE 17 – (Değişik:RG-11/7/2021-31538)  \n(1) Bu Yönetmeliğe aykırı hareket eden asansör monte eden veya onun yetkili servisine, bina \nsorumlusuna veya kat maliklerine, servis teknik sorumlusuna ve asans ör yaptırıcısına 1705 sayılı']","Evet, asansörde biri mahsur kaldığında kurtarma eğitimi genellikle asansör monte eden veya onun yetkili servisi tarafından verilir. 

Asansör yönetmeliği gereği, bina sorumlusunun bakım sözleşmesi imzaladığı asansör monte eden veya onun yetkili servisi, bakım, onarım, arıza giderme ve periyodik kontrol faaliyetlerini yürütmekle yükümlüdür. Bu bağlamda, kurtarma süreciyle ilgili gerekli eğitimlerin de verilmesi beklenmektedir. Bina sorumlusunun, herhangi bir tehlikeli durumu asansör monte eden veya yetkili servisine iletmesi ve güvenlik tedbirlerinin alınmasını sağlaması gerekmektedir. 

Bu nedenle kurtarma eğitimini, asansör monte eden firmanın veya yetkili servisinin sağlaması beklenir.","Asansör monte eden veya onun yetkili servisi, bina sorumlusunun belirleyeceği sayıda kişiye yılda en az bir defa kurtarma eğitimi verir.",0.5,0.5607176135602955,0.5638663764384239
Binada kaç tane yangın söndürme tüpü bulundurmak zorundayız?,"['**Binaların Yangından Korunması Yönetmeliği**\nK.) (1) Taşınabilir söndürme cihazlarının tipi ve sayısı, mekânlarda var olan durum ve risklere göre belirlenir. Buna göre; a) A sınıfı yangın çıkması muhtemel yerlerde, öncelikle çok maksatlı kuru kimyevi tozlu veya sulu, b) B sınıfı yangın çıkması muhtemel yerlerde, öncelikle kuru kimyevi tozlu, karbondioksitli veya köpüklü, c) C sınıfı yangın çıkması muhtemel yerlerde, öncelikle kuru kimyevi tozlu veya karbondioksitli, ç) D sınıfı yangın çıkması muhtemel yerlerde, öncelikle kuru metal tozlu, söndürme cihazları bulundurulur. Hastanelerde, huzurevlerinde, anaokullarında ve benzeri yerlerde sulu veya temiz gazlı söndürme cihazlarının tercih edilmesi gerekir. (2) Düşük tehlike sınıfında her 500 m2, orta tehlike ve yüksek tehlike sınıfında her 250 m² yapı inşaat alanı için 1 adet olmak üzere, uygun tipte 6 kg’lık kuru kimyevî tozlu veya eşdeğeri gazlı yangın söndürme cihazları bulundurulması gerekir. (3) Otoparklarda, depolarda, tesisat dairelerinde ve benzeri yerlerde ayrıca tekerlekli tip söndürme cihazı bulundurulması mecburidir. (4) Söndürme cihazları dışarıya doğru, geçiş boşluklarının yakınına ve dengeli dağıtılarak, görülebilecek şekilde işaretlenir ve her durumda kolayca girilebilir yerlere, yangın dolaplarının içine veya yakınına yerleştirilir. Söndürme cihazlarına ulaşma mesafesi en fazla 25 m olur. Söndürme cihazlarının, kapı arkasında, yangın dolapları hariç kapalı dolaplarda ve derin duvar girintilerinde bulundurulmaması ve ısıtma cihazlarının üstüne veya yakınına konulmaması gerekir. Ancak, herhangi bir sebeple söndürme cihazlarının doğrudan görünmesini engelleyen yerlere konulması halinde, yerlerinin uygun fosforlu işaretler ile gösterilmesi şarttır.  (5) Taşınabilir söndürme cihazlarında söndürücünün duvara bağlantı asma halkası duvardan kolaylıkla alınabilecek şekilde yerleştirilir ve 4 kg’dan daha ağır ve 12 kg’dan hafif olan cihazların zeminden olan yüksekliği yaklaşık 90 cm’yi aşmayacak şekilde montaj yapılır. (6) Arabalı yangın söndürme', '**Binaların Yangından Korunması Yönetmeliği**\nengelleyen yerlere konulması halinde, yerlerinin uygun fosforlu işaretler ile gösterilmesi şarttır.  (5) Taşınabilir söndürme cihazlarında söndürücünün duvara bağlantı asma halkası duvardan kolaylıkla alınabilecek şekilde yerleştirilir ve 4 kg’dan daha ağır ve 12 kg’dan hafif olan cihazların zeminden olan yüksekliği yaklaşık 90 cm’yi aşmayacak şekilde montaj yapılır. (6) Arabalı yangın söndürme cihazlarının TS EN 1866 ve diğer taşınabilir yangın söndürme cihazlarının TS 862- EN 3 kalite belgeli olması şarttır. (7) Yangın söndürme cihazlarının periyodik kontrolü ve bakımı TS ISO 11602-2 standardına göre yapılır. Söndürme cihazlarının bakımını yapan üreticinin veya servis firmalarının dolum ve servis yeterlilik belgesine sahip olması gerekir. Servis veren firmalar, istenildiğinde müşterilerine belgelerini göstermek zorundadır. Söndürme cihazlarının standartlarda belirtilen hususlar doğrultusunda yılda bir kez yerinde genel kontrolleri yapılır ve dördüncü yılın sonunda içindeki söndürme maddeleri yenilenerek hidrostatik testleri yapılır. Cihazlar dolum için alındığında, söndürme cihazlarının bulundukları yerleri tehlike altında bırakmamak için, servisi yapan firmalar, bakıma aldıkları yangın söndürme cihazlarının yerine, aldıkları söndürücü cihazın özelliğinde ve aynı sayıda kullanıma hazır yangın söndürme cihazlarını geçici olarak bırakmak zorundadır.', '**Binaların Yangından Korunması Yönetmeliği**\n(7) Giriş, çıkış ve şaftları üst katlardan 120 dakika yangına dayanıklı döşeme veya bölme ile ayrılan bodrum katlar, beşinci fıkrada belirtilen yapı yüksekliklerine dahil edilmez ve yangın güvenlik tedbirleri bakımından ayrı değerlendirilir. (8) Çatı arası piyeslerden binanın normal merdivenine veya korunumlu kaçış merdivenine alternatif kaçış imkânı sağlanması durumunda, çatı arası piyes yüksekliği beşinci fıkrada belirtilen yapı yüksekliklerine dahil edilmez.  Elektrik tesisatı ve sistemlerin özellikleri MADDE 67- (1) Binalarda kurulan elektrik tesisatının, kaçış yolları aydınlatmasının ve yangın algılama ve uyarı sistemlerinin, yangın hâlinde veya herhangi bir acil hâlde, binada bulunanlara zarar vermeyecek, panik çıkmasını önleyecek, binanın emniyetli bir şekilde boşaltılmasını sağlayacak ve güvenli bir ortam oluşturacak şekilde tasarlanması, tesis edilmesi ve çalışır durumda tutulması gerekir. (2) Her türlü elektrik tesisatının, kaçış yolları aydınlatmasının, acil durum aydınlatma ve yönlendirmesinin ve yangın algılama ve uyarı sistemlerinin, ilgili tesisat yönetmeliklerine ve standartlarına uygun olarak tasarlanması ve tesis edilmesi şarttır. (3) Binalarda kurulacak elektrik tesisatının, kaçış yolları aydınlatmasının ve yangın algılama ve uyarı sistemlerinin tasarımı ve uygulaması, ruhsat veren idarenin kontrol ve onayına tabidir. Sistemlerin ve cihazların periyodik kontrolü, test ve bakımları, bina sahibi veya yöneticisi ile bunların yazılı olarak sorumluluklarını devrettiği bina yetkilisince yaptırılır.   Taşınabilir söndürme cihazları (4) MADDE 99- (Değişik: 10/8/2009-2009/15316 K.) (1) Taşınabilir söndürme cihazlarının tipi ve sayısı, mekânlarda var olan durum ve risklere göre belirlenir. Buna göre; a) A sınıfı yangın çıkması muhtemel yerlerde, öncelikle çok maksatlı kuru kimyevi tozlu veya sulu, b) B sınıfı yangın çıkması muhtemel yerlerde, öncelikle kuru kimyevi tozlu, karbondioksitli veya köpüklü, c) C sınıfı yangın çıkması muhtemel yerlerde, öncelikle', '**Binaların Yangından Korunması Yönetmeliği**\nher birinin içinden bir yangın güvenlik holünden geçilerek yangın merdivenine ulaşılıyor ise binanın genel merdiveninin korunumlu olması gerekli değildir. ç) Yapı yüksekliği 51.50 m’den yüksek olan konutlarda, birbirlerine alternatif ve yangın güvenlik holü olan ve basınçlandırılan en az 2 kaçış merdiveni yapılması şarttır. (6) Konut yapılarının farklı amaçla kullanılan bodrum katlarında, konut ile  ortak kullanılan kaçış merdivenlerinin önüne yangın güvenlik holü düzenlenmesi gerekir.', '**Binaların Yangından Korunması Yönetmeliği**\ntuttuğu saat kadar mesai günlerinde izin verilir.  Ekiplerin çalışma esasları MADDE 128- (1) Acil durum ekiplerinin birbirleriyle işbirliği yapmaları ve karşılıklı yardımlaşmada bulunmaları esastır. (2) Ekiplerin yangın anında sevk ve idaresi, itfaiye gelinceye kadar iç düzenlemeyi uygulamakla görevli amir veya yardımcılarına aittir.  Bu süre içinde ekipler amirlerinden emir alırlar. İtfaiye gelince, bu ekipler derhal itfaiye amirinin emrine girerler. (3) Bina sahibi ve yöneticileri ile bina amirleri; ekiplerin, yapılarda meydana gelecek yangınlara müdahale etmeleri ve kurtarma işlemlerini yürütmelerinde kullanmaları için gereken malzemeleri bulundurmak zorundadırlar. Yapının büyüklüğüne, kullanım amacına, mevcut koruma sistemlerine ve oluşturulan ekip özelliklerine göre, mahalli itfaiye teşkilatı ve sivil savunma müdürlüğünün görüşü alınarak, gerekli ise gaz maskesi, teneffüs cihazı, yedek hortum, lans, hidrant anahtarı ve benzeri malzemeler bulundurulur. Bulundurulacak malzemeler, itfaiye teşkilatında kullanılan malzemelere uygun olmak zorundadır. Araç-gereç ve malzemenin bakımı ve korunması, iç düzenlemeyi uygulamakla görevli amirin sorumluluğu altında görevliler tarafından yapılır. (4) Yangın haberini alan acil durum ekipleri, kendilerine ait araç-gereç ve malzemelerini alarak derhal olay yerine hareket ederler. Olay yerinde; a) Söndürme ekibi yangın yerinin altındaki, üstündeki ve yanlarındaki odalarda gereken tertibatı alır, yangının genişlemesini önlemeye ve söndürmeye çalışırlar. b) Kurtarma ekibi önce canlıları kurtarır. Daha sonra yangında ilk kurtarılacak evrak, dosya ve diğer eşyayı, olay yerinde bulunanların da yardımı ile ve büro şeflerinin nezareti altında mümkünse çuvallara ve torbalara koyarak boşaltılmaya hazır hâle getirir. Çuval ve torbalar, bina yetkililerinin gerek görmesi hâlinde binanın henüz yanma tehlikesi olmayan kısımlarına taşınır. Yanan binanın genel olarak boşaltılmasına olay yerine gelen itfaiye amirinin veya en büyük mülki amirin', '**Binaların Yangından Korunması Yönetmeliği**\ndosya ve diğer eşyayı, olay yerinde bulunanların da yardımı ile ve büro şeflerinin nezareti altında mümkünse çuvallara ve torbalara koyarak boşaltılmaya hazır hâle getirir. Çuval ve torbalar, bina yetkililerinin gerek görmesi hâlinde binanın henüz yanma tehlikesi olmayan kısımlarına taşınır. Yanan binanın genel olarak boşaltılmasına olay yerine gelen itfaiye amirinin veya en büyük mülki amirin emriyle başlanır. c) Koruma ekibi boşaltılan eşya ve evrakı, güvenlik güçleri veya bina yetkililerinin göstereceği bir yerde muhafaza altına alır ve yangın söndürüldükten sonra o binanın ilgililerine teslim eder. ç) İlk yardım ekibi yangında yaralanan veya hastalananlar için ilk yardım hizmeti verir. (5) Yangından haberdar olan bina sahibi, yöneticisi, amiri ile acil durum ekipleri en seri şekilde görev başına gelip, söndürme, kurtarma, koruma ve ilk yardım işlerini yürütmek zorundadır.']","Evet, yangın söndürme tüpü sayısı, binanın durumu ve risklerine göre belirlenir. Kat Mülkiyeti Kanunu'na dayanarak, düşük tehlike sınıfında her 500 m² için 1 adet, orta ve yüksek tehlike sınıfında her 250 m² için 1 adet 6 kg'lık uygun tipte kuru kimyevi tozlu veya eşdeğeri gazlı yangın söndürme cihazı bulundurulması gerekmektedir.

Buna ek olarak, otoparklar, depolar ve tesisat daireleri gibi yerlerde ayrıca tekerlekli tip yangın söndürme cihazlarının bulundurulması da zorunludur. Söndürme cihazlarının yerleştirilmesi, dışarıya doğru ve kolayca görülebilecek şekilde, geçiş boşluklarına yakın yerlerde olmalıdır. Ulaşım mesafesi ise en fazla 25 metre olmalıdır.","Düşük tehlike sınıfında her 500 m² için, orta ve yüksek tehlike sınıfında her 250 m² yapı inşaat alanı için 1 adet olmak üzere, uygun tipte 6 kg’lık yangın söndürme cihazı bulundurulması gerekir.",0.8571428571428571,0.6461876934466996,0.5054189619975813
Daire kapısından yangın merdivenine mesafe en fazla kaç metre olabilir?,"['**Binaların Yangından Korunması Yönetmeliği**\nher birinin içinden bir yangın güvenlik holünden geçilerek yangın merdivenine ulaşılıyor ise binanın genel merdiveninin korunumlu olması gerekli değildir. ç) Yapı yüksekliği 51.50 m’den yüksek olan konutlarda, birbirlerine alternatif ve yangın güvenlik holü olan ve basınçlandırılan en az 2 kaçış merdiveni yapılması şarttır. (6) Konut yapılarının farklı amaçla kullanılan bodrum katlarında, konut ile  ortak kullanılan kaçış merdivenlerinin önüne yangın güvenlik holü düzenlenmesi gerekir.', ""**Binaların Yangından Korunması Yönetmeliği**\nDış kaçış merdivenleri MADDE 42- (1) Dışarıda yapılan açık kaçış merdiveni, ilgili gereklere uyulması şartıyla iç kaçış merdivenleri yerine kullanılabilir. Dış kaçış merdiveninin korunumlu yuva içinde bulunması şart değildir. (2) Açık dış kaçış merdiveninin herhangi bir bölümüne, yanlardan yatay ve alttan düşey uzaklık olarak 3 m içerisinde merdivenin özelliklerinden daha az korunumlu kapı ve pencere gibi duvar boşluğu bulunamaz. (3) Bina yüksekliği 21.50 m’den fazla olan binalarda, bina dışında açık merdivenlere  izin verilmez.  Dairesel merdiven MADDE 43- (1) Dairesel merdivenler; yanmaz malzemeden yapılmaları ve en az 100 cm genişlikte olmaları hâlinde, kullanıcı yükü 25 kişiyi aşmayan herhangi bir kattan, ara kattan, veya balkonlardan zorunlu çıkış olarak hizmet verebilir. Belirtilen şartları sağlamayan dairesel merdivenler, zorunlu çıkış olarak kullanılamaz. (2) Dairesel merdivenler 9.50 m'den daha yüksek olamaz. (3) Basamağın kova merkezinden en fazla 50 cm uzaklıktaki basış genişliği 250 mm’den az olamaz. (4) Basamak yüksekliği 175 mm'den çok olamaz. (5) Baş kurtarma yüksekliği 2.50 m'den az olamaz.  Kaçış yolu kapıları MADDE 47- (1) Kaçış yolu kapılarının en az temiz genişliği 80 cm’den ve yüksekliği 200 cm’den az olamaz. Kaçış yolu kapılarında eşik olmaması gerekir. Dönel kapılar ile turnikeler, çıkış kapısı olarak kullanılamaz. (2) Kaçış yolu kapıları kanatlarının, kullanıcıların hareketini engellememesi gerekir. Kullanıcı yükü 50 kişiyi aşan mekânlardaki çıkış kapılarının kaçış yönüne doğru açılması şarttır. Kaçış yolu kapılarının el ile açılması ve kilitli tutulmaması gerekir. (3) Kaçış merdiveni ve yangın güvenlik holü kapılarının; duman sızdırmaz ve 4 kattan daha az kata hizmet veriyor ise en az 60 dakika, bodrum katlara ve 4 kattan daha fazla kata hizmet veriyor ise en az 90 dakika yangına karşı dayanıklı olması şarttır. Kapıların, kendiliğinden kapatan düzenekler ile donatılması ve itfaiyecilerin veya görevlilerin gerektiğinde dışarıdan içeriye"", '**Binaların Yangından Korunması Yönetmeliği**\ntutulmaması gerekir. (3) Kaçış merdiveni ve yangın güvenlik holü kapılarının; duman sızdırmaz ve 4 kattan daha az kata hizmet veriyor ise en az 60 dakika, bodrum katlara ve 4 kattan daha fazla kata hizmet veriyor ise en az 90 dakika yangına karşı dayanıklı olması şarttır. Kapıların, kendiliğinden kapatan düzenekler ile donatılması ve itfaiyecilerin veya görevlilerin gerektiğinde dışarıdan içeriye girmelerine imkân sağlayacak şekilde olması gerekir. (4) Kaçış kapısında, tek kanatlı kapıda temiz genişlik, kapı kasası veya lamba çıkıntısı ile 90 derece açılmış kanat yüzeyi arasındaki ölçüdür. Tek kanatlı bir çıkış kapısının temiz genişliği 80 cm’den az ve 120 cm’den çok olamaz. İki kanatlı kapıda temiz genişlik, her iki kanat 90 derece açık durumda iken, kanat yüzeyleri arasındaki ölçüdür.  (5) Merdivenden tabii zemin seviyesinde güvenlikli bir alana açılan bütün kaçış yolu kapıları ile bir kattaki kişi sayısının 100’ü geçmesi hâlinde, kaçış merdiveni, kaçış koridoru ve yangın güvenlik holü kapıları, kaçış yönünde kapı kolu kullanılmadan açılabilecek şekilde düzenlenir. (6) Kapıların en çok 110 N kuvvetle açılabilecek şekilde tasarlanması gerekir.  Konutlar MADDE 48- (Değişik: 10/8/2009-2009/15316 K.)  (1) Bodrum katlar dâhil 4 katı geçmeyen konutlar ile tek evler, ikiz evler ve sıra evler gibi konutlarda, tek bir kullanıma hizmet veren binalarda veya böyle bir binanın ayrılmış bir bölümünde kaçışlar, kaçış mesafesi aranmaksızın normal merdivenlerle sağlanabilir. Bu merdivenlerde başka herhangi bir özellik aranmaz.  (2) Birinci fıkrada belirtilenler dışındaki konutlarda, konut içindeki herhangi bir noktadan konut çıkış kapısına kadar olan uzaklığın  20 m’yi, yağmurlama sistemi olan konutlarda 30 m’yi geçmemesi gerekir. İkiden çok ara kat bulunmayan apartman dairelerinde tek kapı bulunması hâlinde, bu kapı üst katta düzenlenemez. Üstteki katın döşeme alanı, bu kat için ayrı bir çıkış sağlanmadıkça 70 m2’yi aşamaz. (3) Konut birimlerinden bütün çıkışların, kaçış', '**Binaların Yangından Korunması Yönetmeliği**\nkonut içindeki herhangi bir noktadan konut çıkış kapısına kadar olan uzaklığın  20 m’yi, yağmurlama sistemi olan konutlarda 30 m’yi geçmemesi gerekir. İkiden çok ara kat bulunmayan apartman dairelerinde tek kapı bulunması hâlinde, bu kapı üst katta düzenlenemez. Üstteki katın döşeme alanı, bu kat için ayrı bir çıkış sağlanmadıkça 70 m2’yi aşamaz. (3) Konut birimlerinden bütün çıkışların, kaçış merdivenlerine veya güvenli bir açık alana doğrudan erişim imkânı sağlayacak şekilde olması gerekir. (4) Kaçış uzaklığı, apartman dairelerinin kapısından başlanarak ölçülür. Bir apartman dairesi için aynı kat düzeyinde iki kapı gerektiğinde, yalnızca tek doğrultuda kaçış veya tek bir kaçış merdiveni sağlanıyor ise kaçış uzaklığı en uzaktaki kapıdan başlanarak ve iki ayrı doğrultuda kaçış imkânı sağlanabiliyor ise kaçış uzaklığı her bir kapıdan başlanarak ölçülür. (5) Kaçış mesafeleri uygun olmak şartıyla, binaların sadece konut bölümlerine hizmet veren kaçış merdivenleri aşağıdaki şekilde düzenlenir: a) Yapı yüksekliği 21.50 m’nin altındaki konutlarda korunumsuz normal merdiven kaçış yolu olarak kabul edilir ve ikinci çıkış aranmaz. b) Yapı yüksekliği 21.50 m’den fazla ve 30.50 m’den az olan konutlarda, en az 2 merdiven düzenlenmesi, merdivenlerden en az birisinin korunumlu olması ve her daireden 2 merdivene de ulaşılması gerekir. c) Yapı yüksekliği 30.50 m’den fazla ve 51.50 m’den az olan konutlarda, birbirlerine alternatif, her ikisi de korunumlu ve en az birinde yangın güvenlik holü düzenlenmiş veya basınçlandırma uygulanmış 2 kaçış merdiveni yapılması mecburidir. Kattaki konutların her birinin içinden bir yangın güvenlik holünden geçilerek yangın merdivenine ulaşılıyor ise binanın genel merdiveninin korunumlu olması gerekli değildir. ç) Yapı yüksekliği 51.50 m’den yüksek olan konutlarda, birbirlerine alternatif ve yangın güvenlik holü olan ve basınçlandırılan en az 2 kaçış merdiveni yapılması şarttır. (6) Konut yapılarının farklı amaçla kullanılan bodrum katlarında, konut', '**Binaların Yangından Korunması Yönetmeliği**\n(7) Giriş, çıkış ve şaftları üst katlardan 120 dakika yangına dayanıklı döşeme veya bölme ile ayrılan bodrum katlar, beşinci fıkrada belirtilen yapı yüksekliklerine dahil edilmez ve yangın güvenlik tedbirleri bakımından ayrı değerlendirilir. (8) Çatı arası piyeslerden binanın normal merdivenine veya korunumlu kaçış merdivenine alternatif kaçış imkânı sağlanması durumunda, çatı arası piyes yüksekliği beşinci fıkrada belirtilen yapı yüksekliklerine dahil edilmez.  Elektrik tesisatı ve sistemlerin özellikleri MADDE 67- (1) Binalarda kurulan elektrik tesisatının, kaçış yolları aydınlatmasının ve yangın algılama ve uyarı sistemlerinin, yangın hâlinde veya herhangi bir acil hâlde, binada bulunanlara zarar vermeyecek, panik çıkmasını önleyecek, binanın emniyetli bir şekilde boşaltılmasını sağlayacak ve güvenli bir ortam oluşturacak şekilde tasarlanması, tesis edilmesi ve çalışır durumda tutulması gerekir. (2) Her türlü elektrik tesisatının, kaçış yolları aydınlatmasının, acil durum aydınlatma ve yönlendirmesinin ve yangın algılama ve uyarı sistemlerinin, ilgili tesisat yönetmeliklerine ve standartlarına uygun olarak tasarlanması ve tesis edilmesi şarttır. (3) Binalarda kurulacak elektrik tesisatının, kaçış yolları aydınlatmasının ve yangın algılama ve uyarı sistemlerinin tasarımı ve uygulaması, ruhsat veren idarenin kontrol ve onayına tabidir. Sistemlerin ve cihazların periyodik kontrolü, test ve bakımları, bina sahibi veya yöneticisi ile bunların yazılı olarak sorumluluklarını devrettiği bina yetkilisince yaptırılır.   Taşınabilir söndürme cihazları (4) MADDE 99- (Değişik: 10/8/2009-2009/15316 K.) (1) Taşınabilir söndürme cihazlarının tipi ve sayısı, mekânlarda var olan durum ve risklere göre belirlenir. Buna göre; a) A sınıfı yangın çıkması muhtemel yerlerde, öncelikle çok maksatlı kuru kimyevi tozlu veya sulu, b) B sınıfı yangın çıkması muhtemel yerlerde, öncelikle kuru kimyevi tozlu, karbondioksitli veya köpüklü, c) C sınıfı yangın çıkması muhtemel yerlerde, öncelikle', '**Binaların Yangından Korunması Yönetmeliği**\nK.) (1) Taşınabilir söndürme cihazlarının tipi ve sayısı, mekânlarda var olan durum ve risklere göre belirlenir. Buna göre; a) A sınıfı yangın çıkması muhtemel yerlerde, öncelikle çok maksatlı kuru kimyevi tozlu veya sulu, b) B sınıfı yangın çıkması muhtemel yerlerde, öncelikle kuru kimyevi tozlu, karbondioksitli veya köpüklü, c) C sınıfı yangın çıkması muhtemel yerlerde, öncelikle kuru kimyevi tozlu veya karbondioksitli, ç) D sınıfı yangın çıkması muhtemel yerlerde, öncelikle kuru metal tozlu, söndürme cihazları bulundurulur. Hastanelerde, huzurevlerinde, anaokullarında ve benzeri yerlerde sulu veya temiz gazlı söndürme cihazlarının tercih edilmesi gerekir. (2) Düşük tehlike sınıfında her 500 m2, orta tehlike ve yüksek tehlike sınıfında her 250 m² yapı inşaat alanı için 1 adet olmak üzere, uygun tipte 6 kg’lık kuru kimyevî tozlu veya eşdeğeri gazlı yangın söndürme cihazları bulundurulması gerekir. (3) Otoparklarda, depolarda, tesisat dairelerinde ve benzeri yerlerde ayrıca tekerlekli tip söndürme cihazı bulundurulması mecburidir. (4) Söndürme cihazları dışarıya doğru, geçiş boşluklarının yakınına ve dengeli dağıtılarak, görülebilecek şekilde işaretlenir ve her durumda kolayca girilebilir yerlere, yangın dolaplarının içine veya yakınına yerleştirilir. Söndürme cihazlarına ulaşma mesafesi en fazla 25 m olur. Söndürme cihazlarının, kapı arkasında, yangın dolapları hariç kapalı dolaplarda ve derin duvar girintilerinde bulundurulmaması ve ısıtma cihazlarının üstüne veya yakınına konulmaması gerekir. Ancak, herhangi bir sebeple söndürme cihazlarının doğrudan görünmesini engelleyen yerlere konulması halinde, yerlerinin uygun fosforlu işaretler ile gösterilmesi şarttır.  (5) Taşınabilir söndürme cihazlarında söndürücünün duvara bağlantı asma halkası duvardan kolaylıkla alınabilecek şekilde yerleştirilir ve 4 kg’dan daha ağır ve 12 kg’dan hafif olan cihazların zeminden olan yüksekliği yaklaşık 90 cm’yi aşmayacak şekilde montaj yapılır. (6) Arabalı yangın söndürme']","Evet, daire kapısından yangın merdivenine olan mesafe, konut yapısının özelliklerine göre değişiklik göstermektedir. Kat Mülkiyeti Kanunu'na göre, konut içindeki herhangi bir noktadan daire çıkış kapısına kadar olan uzaklık, genel olarak 20 metreyi geçmemelidir. Ancak, eğer binada bir yağmurlama sistemi varsa bu mesafe 30 metreye kadar çıkabilir. Bu düzenlemeler, yangın güvenliği açısından da oldukça önemlidir.

Yani, daire kapısından yangın merdivenine mesafe, en fazla genel koşullarda 20 metre, yağmurlama sistemi olan konutlarda 30 metre olmalıdır. Yangın güvenliği standartlarına uyulması gerekmektedir.","Konut içindeki herhangi bir noktadan çıkış kapısına kadar olan uzaklık normalde 20 metreyi, yağmurlama sistemi olan konutlarda 30 metreyi geçmemelidir.",0.8571428571428571,0.423542985373059,0.7300288723891621
Kaçış merdiveni kapıları kilitli olabilir mi?,"['**Binaların Yangından Korunması Yönetmeliği**\ntutulmaması gerekir. (3) Kaçış merdiveni ve yangın güvenlik holü kapılarının; duman sızdırmaz ve 4 kattan daha az kata hizmet veriyor ise en az 60 dakika, bodrum katlara ve 4 kattan daha fazla kata hizmet veriyor ise en az 90 dakika yangına karşı dayanıklı olması şarttır. Kapıların, kendiliğinden kapatan düzenekler ile donatılması ve itfaiyecilerin veya görevlilerin gerektiğinde dışarıdan içeriye girmelerine imkân sağlayacak şekilde olması gerekir. (4) Kaçış kapısında, tek kanatlı kapıda temiz genişlik, kapı kasası veya lamba çıkıntısı ile 90 derece açılmış kanat yüzeyi arasındaki ölçüdür. Tek kanatlı bir çıkış kapısının temiz genişliği 80 cm’den az ve 120 cm’den çok olamaz. İki kanatlı kapıda temiz genişlik, her iki kanat 90 derece açık durumda iken, kanat yüzeyleri arasındaki ölçüdür.  (5) Merdivenden tabii zemin seviyesinde güvenlikli bir alana açılan bütün kaçış yolu kapıları ile bir kattaki kişi sayısının 100’ü geçmesi hâlinde, kaçış merdiveni, kaçış koridoru ve yangın güvenlik holü kapıları, kaçış yönünde kapı kolu kullanılmadan açılabilecek şekilde düzenlenir. (6) Kapıların en çok 110 N kuvvetle açılabilecek şekilde tasarlanması gerekir.  Konutlar MADDE 48- (Değişik: 10/8/2009-2009/15316 K.)  (1) Bodrum katlar dâhil 4 katı geçmeyen konutlar ile tek evler, ikiz evler ve sıra evler gibi konutlarda, tek bir kullanıma hizmet veren binalarda veya böyle bir binanın ayrılmış bir bölümünde kaçışlar, kaçış mesafesi aranmaksızın normal merdivenlerle sağlanabilir. Bu merdivenlerde başka herhangi bir özellik aranmaz.  (2) Birinci fıkrada belirtilenler dışındaki konutlarda, konut içindeki herhangi bir noktadan konut çıkış kapısına kadar olan uzaklığın  20 m’yi, yağmurlama sistemi olan konutlarda 30 m’yi geçmemesi gerekir. İkiden çok ara kat bulunmayan apartman dairelerinde tek kapı bulunması hâlinde, bu kapı üst katta düzenlenemez. Üstteki katın döşeme alanı, bu kat için ayrı bir çıkış sağlanmadıkça 70 m2’yi aşamaz. (3) Konut birimlerinden bütün çıkışların, kaçış', ""**Binaların Yangından Korunması Yönetmeliği**\nDış kaçış merdivenleri MADDE 42- (1) Dışarıda yapılan açık kaçış merdiveni, ilgili gereklere uyulması şartıyla iç kaçış merdivenleri yerine kullanılabilir. Dış kaçış merdiveninin korunumlu yuva içinde bulunması şart değildir. (2) Açık dış kaçış merdiveninin herhangi bir bölümüne, yanlardan yatay ve alttan düşey uzaklık olarak 3 m içerisinde merdivenin özelliklerinden daha az korunumlu kapı ve pencere gibi duvar boşluğu bulunamaz. (3) Bina yüksekliği 21.50 m’den fazla olan binalarda, bina dışında açık merdivenlere  izin verilmez.  Dairesel merdiven MADDE 43- (1) Dairesel merdivenler; yanmaz malzemeden yapılmaları ve en az 100 cm genişlikte olmaları hâlinde, kullanıcı yükü 25 kişiyi aşmayan herhangi bir kattan, ara kattan, veya balkonlardan zorunlu çıkış olarak hizmet verebilir. Belirtilen şartları sağlamayan dairesel merdivenler, zorunlu çıkış olarak kullanılamaz. (2) Dairesel merdivenler 9.50 m'den daha yüksek olamaz. (3) Basamağın kova merkezinden en fazla 50 cm uzaklıktaki basış genişliği 250 mm’den az olamaz. (4) Basamak yüksekliği 175 mm'den çok olamaz. (5) Baş kurtarma yüksekliği 2.50 m'den az olamaz.  Kaçış yolu kapıları MADDE 47- (1) Kaçış yolu kapılarının en az temiz genişliği 80 cm’den ve yüksekliği 200 cm’den az olamaz. Kaçış yolu kapılarında eşik olmaması gerekir. Dönel kapılar ile turnikeler, çıkış kapısı olarak kullanılamaz. (2) Kaçış yolu kapıları kanatlarının, kullanıcıların hareketini engellememesi gerekir. Kullanıcı yükü 50 kişiyi aşan mekânlardaki çıkış kapılarının kaçış yönüne doğru açılması şarttır. Kaçış yolu kapılarının el ile açılması ve kilitli tutulmaması gerekir. (3) Kaçış merdiveni ve yangın güvenlik holü kapılarının; duman sızdırmaz ve 4 kattan daha az kata hizmet veriyor ise en az 60 dakika, bodrum katlara ve 4 kattan daha fazla kata hizmet veriyor ise en az 90 dakika yangına karşı dayanıklı olması şarttır. Kapıların, kendiliğinden kapatan düzenekler ile donatılması ve itfaiyecilerin veya görevlilerin gerektiğinde dışarıdan içeriye"", '**Binaların Yangından Korunması Yönetmeliği**\nkonut içindeki herhangi bir noktadan konut çıkış kapısına kadar olan uzaklığın  20 m’yi, yağmurlama sistemi olan konutlarda 30 m’yi geçmemesi gerekir. İkiden çok ara kat bulunmayan apartman dairelerinde tek kapı bulunması hâlinde, bu kapı üst katta düzenlenemez. Üstteki katın döşeme alanı, bu kat için ayrı bir çıkış sağlanmadıkça 70 m2’yi aşamaz. (3) Konut birimlerinden bütün çıkışların, kaçış merdivenlerine veya güvenli bir açık alana doğrudan erişim imkânı sağlayacak şekilde olması gerekir. (4) Kaçış uzaklığı, apartman dairelerinin kapısından başlanarak ölçülür. Bir apartman dairesi için aynı kat düzeyinde iki kapı gerektiğinde, yalnızca tek doğrultuda kaçış veya tek bir kaçış merdiveni sağlanıyor ise kaçış uzaklığı en uzaktaki kapıdan başlanarak ve iki ayrı doğrultuda kaçış imkânı sağlanabiliyor ise kaçış uzaklığı her bir kapıdan başlanarak ölçülür. (5) Kaçış mesafeleri uygun olmak şartıyla, binaların sadece konut bölümlerine hizmet veren kaçış merdivenleri aşağıdaki şekilde düzenlenir: a) Yapı yüksekliği 21.50 m’nin altındaki konutlarda korunumsuz normal merdiven kaçış yolu olarak kabul edilir ve ikinci çıkış aranmaz. b) Yapı yüksekliği 21.50 m’den fazla ve 30.50 m’den az olan konutlarda, en az 2 merdiven düzenlenmesi, merdivenlerden en az birisinin korunumlu olması ve her daireden 2 merdivene de ulaşılması gerekir. c) Yapı yüksekliği 30.50 m’den fazla ve 51.50 m’den az olan konutlarda, birbirlerine alternatif, her ikisi de korunumlu ve en az birinde yangın güvenlik holü düzenlenmiş veya basınçlandırma uygulanmış 2 kaçış merdiveni yapılması mecburidir. Kattaki konutların her birinin içinden bir yangın güvenlik holünden geçilerek yangın merdivenine ulaşılıyor ise binanın genel merdiveninin korunumlu olması gerekli değildir. ç) Yapı yüksekliği 51.50 m’den yüksek olan konutlarda, birbirlerine alternatif ve yangın güvenlik holü olan ve basınçlandırılan en az 2 kaçış merdiveni yapılması şarttır. (6) Konut yapılarının farklı amaçla kullanılan bodrum katlarında, konut', '**Binaların Yangından Korunması Yönetmeliği**\nher birinin içinden bir yangın güvenlik holünden geçilerek yangın merdivenine ulaşılıyor ise binanın genel merdiveninin korunumlu olması gerekli değildir. ç) Yapı yüksekliği 51.50 m’den yüksek olan konutlarda, birbirlerine alternatif ve yangın güvenlik holü olan ve basınçlandırılan en az 2 kaçış merdiveni yapılması şarttır. (6) Konut yapılarının farklı amaçla kullanılan bodrum katlarında, konut ile  ortak kullanılan kaçış merdivenlerinin önüne yangın güvenlik holü düzenlenmesi gerekir.', '**Binaların Yangından Korunması Yönetmeliği**\n(7) Giriş, çıkış ve şaftları üst katlardan 120 dakika yangına dayanıklı döşeme veya bölme ile ayrılan bodrum katlar, beşinci fıkrada belirtilen yapı yüksekliklerine dahil edilmez ve yangın güvenlik tedbirleri bakımından ayrı değerlendirilir. (8) Çatı arası piyeslerden binanın normal merdivenine veya korunumlu kaçış merdivenine alternatif kaçış imkânı sağlanması durumunda, çatı arası piyes yüksekliği beşinci fıkrada belirtilen yapı yüksekliklerine dahil edilmez.  Elektrik tesisatı ve sistemlerin özellikleri MADDE 67- (1) Binalarda kurulan elektrik tesisatının, kaçış yolları aydınlatmasının ve yangın algılama ve uyarı sistemlerinin, yangın hâlinde veya herhangi bir acil hâlde, binada bulunanlara zarar vermeyecek, panik çıkmasını önleyecek, binanın emniyetli bir şekilde boşaltılmasını sağlayacak ve güvenli bir ortam oluşturacak şekilde tasarlanması, tesis edilmesi ve çalışır durumda tutulması gerekir. (2) Her türlü elektrik tesisatının, kaçış yolları aydınlatmasının, acil durum aydınlatma ve yönlendirmesinin ve yangın algılama ve uyarı sistemlerinin, ilgili tesisat yönetmeliklerine ve standartlarına uygun olarak tasarlanması ve tesis edilmesi şarttır. (3) Binalarda kurulacak elektrik tesisatının, kaçış yolları aydınlatmasının ve yangın algılama ve uyarı sistemlerinin tasarımı ve uygulaması, ruhsat veren idarenin kontrol ve onayına tabidir. Sistemlerin ve cihazların periyodik kontrolü, test ve bakımları, bina sahibi veya yöneticisi ile bunların yazılı olarak sorumluluklarını devrettiği bina yetkilisince yaptırılır.   Taşınabilir söndürme cihazları (4) MADDE 99- (Değişik: 10/8/2009-2009/15316 K.) (1) Taşınabilir söndürme cihazlarının tipi ve sayısı, mekânlarda var olan durum ve risklere göre belirlenir. Buna göre; a) A sınıfı yangın çıkması muhtemel yerlerde, öncelikle çok maksatlı kuru kimyevi tozlu veya sulu, b) B sınıfı yangın çıkması muhtemel yerlerde, öncelikle kuru kimyevi tozlu, karbondioksitli veya köpüklü, c) C sınıfı yangın çıkması muhtemel yerlerde, öncelikle', '**Binaların Yangından Korunması Yönetmeliği**\nK.) (1) Taşınabilir söndürme cihazlarının tipi ve sayısı, mekânlarda var olan durum ve risklere göre belirlenir. Buna göre; a) A sınıfı yangın çıkması muhtemel yerlerde, öncelikle çok maksatlı kuru kimyevi tozlu veya sulu, b) B sınıfı yangın çıkması muhtemel yerlerde, öncelikle kuru kimyevi tozlu, karbondioksitli veya köpüklü, c) C sınıfı yangın çıkması muhtemel yerlerde, öncelikle kuru kimyevi tozlu veya karbondioksitli, ç) D sınıfı yangın çıkması muhtemel yerlerde, öncelikle kuru metal tozlu, söndürme cihazları bulundurulur. Hastanelerde, huzurevlerinde, anaokullarında ve benzeri yerlerde sulu veya temiz gazlı söndürme cihazlarının tercih edilmesi gerekir. (2) Düşük tehlike sınıfında her 500 m2, orta tehlike ve yüksek tehlike sınıfında her 250 m² yapı inşaat alanı için 1 adet olmak üzere, uygun tipte 6 kg’lık kuru kimyevî tozlu veya eşdeğeri gazlı yangın söndürme cihazları bulundurulması gerekir. (3) Otoparklarda, depolarda, tesisat dairelerinde ve benzeri yerlerde ayrıca tekerlekli tip söndürme cihazı bulundurulması mecburidir. (4) Söndürme cihazları dışarıya doğru, geçiş boşluklarının yakınına ve dengeli dağıtılarak, görülebilecek şekilde işaretlenir ve her durumda kolayca girilebilir yerlere, yangın dolaplarının içine veya yakınına yerleştirilir. Söndürme cihazlarına ulaşma mesafesi en fazla 25 m olur. Söndürme cihazlarının, kapı arkasında, yangın dolapları hariç kapalı dolaplarda ve derin duvar girintilerinde bulundurulmaması ve ısıtma cihazlarının üstüne veya yakınına konulmaması gerekir. Ancak, herhangi bir sebeple söndürme cihazlarının doğrudan görünmesini engelleyen yerlere konulması halinde, yerlerinin uygun fosforlu işaretler ile gösterilmesi şarttır.  (5) Taşınabilir söndürme cihazlarında söndürücünün duvara bağlantı asma halkası duvardan kolaylıkla alınabilecek şekilde yerleştirilir ve 4 kg’dan daha ağır ve 12 kg’dan hafif olan cihazların zeminden olan yüksekliği yaklaşık 90 cm’yi aşmayacak şekilde montaj yapılır. (6) Arabalı yangın söndürme']","Hayır, kaçış merdiveni kapıları kilitli tutulamaz. 634 sayılı Kat Mülkiyeti Kanunu'na göre, kaçış yolu kapılarının el ile açılması ve kilitli tutulmaması gerekmektedir. Bu kurallar, acil durumlarda (yangın gibi) insanların hızlı ve güvenli bir şekilde bina dışına çıkabilmelerini sağlamak amacıyla belirlenmiştir. Dolayısıyla, kaçış merdiveni kapılarının kilitli olması, güvenlik açısından yasalara aykırıdır.",Hayır. Kaçış yolu kapılarının el ile açılması ve kilitli tutulmaması gerekir.,0.6,0.7937528530017713,0.9291913127751592
"Komşum sürekli gürültü yapıyor ve kötü koku yayıyor, kanuni hakkım nedir?","['**Kat Mülkiyeti Kanunu**\n“özürlünün” ibareleri sırasıyla “Engellilerin” ve “engellinin”  şeklinde değiştirilmiştir. \nüzerine ısı yalıtımı, ısıtma sisteminin yakıt dönüşümü ve ısıtma sisteminin merkezi sistemden \nferdi sisteme veya ferdi sistemden merkezi sisteme dönüştürülmesi, kat maliklerinin sayı ve \narsa payı çoğunl uğu i le verecekleri karar üzerine yapılır. Ancak toplam inşaat alanı ikibin \nmetrekare ve üzeri olan binalarda merkezi ısıtma sisteminin ferdi ısıtma sistemine dönüştü-\nrülmesi, kat maliklerinin sayı ve arsa payı olarak oybirliği ile verecekleri karar üzerine yapılır. \nBu konuda yapılacak ortak işlerin giderleri arsa payı oranına göre ödenir. Merkezi ısıtma sis-\ntemlerinde ısınma giderl erinin paylaştırılmasına ilişkin usûl ve esaslar Bayındırlık ve İskan \nBakanlığı tarafından yürürlüğe konulacak yönetmelikle düzenlenir.  \n(Değişik beşinci fıkra: 18/4/2007-5627/16 md.) Isıtma sisteminin merkezi sistemden \nferdi sisteme veya ferdi sistemden merkezi sisteme dönüştürülmesine karar verilmesi halinde, \nyönetim planının bu karara aykırı hükümleri değiştirilmiş sayılır. \n \nII - Çok masraflı ve lüks olanlar:', '**Kat Mülkiyeti Kanunu**\nMadde 4 – Ortak yerlerin konusu sözleşme ile belirtilebilir. Aşağıda yazılı yerler ve \nşeyler bu Kanun gereğince her halde ortak yer sayılır. \na) Temeller ve ana duvarlar, taşıyıcı sistemi oluşturan kiriş, kolon ve perde duvarlar ile \ntaşıyıcı sistemin parçası diğer elemanlar, bağımsız bölümleri ayıran ortak duvarlar, tavan ve \ntabanlar, avlular, genel giriş kapıları, antreler, merdivenler, asansörler, sahanlıklar, koridorlar \nve buralardaki genel tuvalet ve lavabolar, kapıcı daire veya odaları, genel çamaşırlık ve çam a-\nşır kurutma yerleri, genel kömürlük ve ortak garajlar, elektrik, su ve havagazı saatlerinin ko-\nrunmasına mahsus olup bağımsız bölüm dışında bulunan yuvalar ve kapalı  kısımlar, kalorifer \ndaireleri, kuyu ve sarnıçlar, yapının genel su depoları, sığınaklar,1 \nb) Her kat malikinin kendi bölümü dışındaki kanalizasyon tesisleri ve çöp kanalları ile \nkalorifer, su, havagazı ve elektrik tesisleri, telefon, radyo ve televizyon i çin ortak şebeke ve \nantenler sıcak ve soğuk hava tesisleri, \nc) Çatılar, bacalar, genel dam terasları, yağmur olukları, yangın emniyet merdivenleri. \nYukarıda sayılanların dışında kalıp da, yine ortaklaşa kullanma, korunma veya fayda-\nlanma için zaruri olan diğer yerler ve şeyler de (Ortak yer) konusuna girer. \n \nB) Bağlantılar : \nI - Bağımsız bölümlerle arsa payı arasındaki bağlantı:', '**Kat Mülkiyeti Kanunu**\nEk Madde 3 – (Ek:13/4/1983 - 2814/15 md.; Mülga: 14/11/2007-5711/24 md.) \n \nKat irtifakına geçiş: \nEk Madde 4 – (Ek: 13/4/1983 - 2814/15 md.) \nBeş veya daha fazla kişi tarafı ndan üzerinde bir veya birden çok yapı yaptırılmak \namacıyla birlikte bir arsa edinilmiş olması ve pay sahiplerinden en az beşte dördünün kat irti-\nfakına geçiş kon usunda aldığı karara uyulmaması halinde, karara uymayan pay sahiplerinin \ngayrimenkuldeki paylarının iptaline ve bu payların, isteyen diğer pay sahipleri adına tesciline \nsulh mahkemesi tarafından aşağıdaki şartlarla karar verilir: \na) Müşterek gayrimenkulün yukarıda belirtilen amaçla edinildiğinin ispat edilmiş olması, \nb) Müşterek maliklerin yukarıda açıklanan çoğunluğunun kat irtifakına geçiş kararına \nveya bununla ilgili yükümlülüklere noterlikçe yapılan tebligata rağmen iki ay içinde uyulmamış \nolması, \nc) Karara uymayan müşterek maliklerin paylarının mahkemece tespit edilen rayiç be-\ndelinin mahkeme veznesine depo edilmesi. \n \nHatalı blok veya bağımsız bölüm numaralarının düzeltilmesi', '**Kat Mülkiyeti Kanunu**\nMadde 23 – Kat maliklerinden birinin bağımsız bölümünde veya bu bölümdeki tesis-\nlerde meydana gelen bir hasar veya bozukluğun onarımı veya giderilmes i veya tesislerin ye-\nniden yapılması ile yapı güvenliğiyle ilgili olarak yapılması gerekli görülen teknik inceleme-\nler için diğer bir bağımsız bölüme girmek gerekiyorsa, o bölümün maliki veya o bölümde \nbaşka sıfatla otura nlar, giriş müsaadesi vermeye ve böl ümde gerekli işlerin yapılmasına ka t-\nlanmaya mecburdurlar.6 \n                                                           \n6 14/11/2007 tarihli ve 5711 sayılı Kanunun 11 inci maddesiyle; bu fıkrada yer alan ""tesislerin yeniden \nyapılması"" ibaresinden sonra gelmek üzere ""ile yapı güvenliğiyle ilgili olarak yapılması gerekli görülen \nteknik incelemeler"" ibaresi eklenmiştir. \nAnagayrimenkulün bir kısmının harap olması halinde, harap olan bağımsız bölüm ve \neklentilerinin veya ortak yerlerin veya bağımsız bölümdeki tesislerin yeniden yapılması için, \nsağlam kalan bağımsız bölümlerin içinden veya dışından faydalanılması gerekiyorsa, o bö-\nlümlerin malikleri veya orada başka sıfatla oturanlar buna müsaade etmeye mecburdurlar. \nYukarıdaki fıkralarda yazılı müsaade yüzünden, kat maliklerinin veya orada başka sı-\nfatla oturanların uğrayacakları zararı, lehine müsaade verilen bağımsız bölüm malikleri derhal \nödemekle yükümlüdürler.  \n \nVII - Yasak işler:', '**Kat Mülkiyeti Kanunu**\nMadde 54 – (Değişik birinci fıkra: 14/11/2007-5711/21 md.) İmar Kanunu hükümle-\nrine göre ortaklaştırma halinde, ortaklaştırılan gayrimenkuller arasında kat mülkiyetine tâbi \ngayrimenkul varsa ve orta klaştırma, 9/11/1985 tarihinden önce ise 6785 sayılı İmar Kanunu-\nnun 46 ncı madd esi, bu tarihten sonra ise 3194 sayılı İmar Kanununun 16 ncı maddesi gere-\nğince ortaklığın gideri lmesi hususunda bütün malikler anlaştıkları takdirde, ortaklığın gide-\nrilmesi bu anlaşma hükümlerine göre yapılır. \n(Değişik ikinci fıkra: 14/11/2007-5711/21 md.) Böyle bir anlaşmaya varılamazsa, her \ngayrimenkulün ortaklaştırmadan önceki geçer değerleri, birinci fıkrada sözü geçen madde \nhükümlerine göre ortaklığı gidermekle görevli sulh mahkemesince ayrı ayrı takdir edilerek, \nbunlara Türkiye İstatistik Kurumunca yayımlanan üretici fiyat endeksi uygulanmak suretiyle \nher bir gayrimenkulün hükme en yakın tarih itibarıyla ulaştığı değerleri tespit edildikten so n-\nra, bunlardan değeri en fazla o lan gayrimenkulün malikine, öteki gayrimenkulleri bu değerle \nsatın almasını teklife karar verilir ve bu teklif kabul edilip bedel öd enince ortaklık giderilmiş \nolur. \nKesinleşen sulh  mahkemesi  kararının  t ebliğinden  başlıyarak bir ay içinde bedel \nödenmez veya altı ay içinde ödenmek üzere banka mektubu veya ayni teminat gösteril-\nmezse ortaklaştırılan gayrimenkullerin tümü, imar durumuna göre mü mkünse katmülki-\nyeti muhafaza ve diğer gayrimenkuller buna ilhak edilerek,  \neğer bu mümkün değilse kat mülkiyeti kaldırılarak, açık artırma yoliyle satılıp ortaklık \ngiderilir ve satış bedeli her gayrimenkulün, ikinci fıkra uyarınca takdir edilmiş olan değerleri \narasındaki orana göre, maliklere paylaştırılır. \n \nD) Harç ve vergiler:', '**Kat Mülkiyeti Kanunu**\nMadde 42 – Kat malikleri,anagayrimenkulün ortak yerlerinde kendi başlarında bir deği-\nşiklik yapamazlar; ortak yerlerin düzgün veya bunları kullanmanın daha rahat ve kolay bir hale \nkonulmasına veya bu yerlerden elde edilecek faydanın çoğaltılmasına yarıyacak bütün yenilik \nve ilaveler, kat maliklerinin sayı ve arsa payı çoğunluğu ile verecekleri karar üzerine yapılır. \n(Ek fıkra: 1/7/2005 -5378/19 md.) Engellilerin yaşamı için zorunluluk göstermesi \nhâlinde, proje tadili kat maliklerinin en geç üç ay içerisinde yapacağı toplantıda görüşülerek \nsayı ve arsa payı ç oğunluğu ile karara bağlanır. Toplantının bu süre iç erisinde yapılamaması \nveya tadilat talebinin çoğunlukla kabul edilmemesi durumunda; ilgili kat malikinin talebi üze-\nrine bina güve nliğinin tehlikeye sokulmadığını bildirir komisyon raporuna istinaden ilgili \nmercilerden alınacak  tasdikli  proje değişikliği veya krokiye göre inşaat, onarım ve tesis yapı-\nlır. İlgili merciler, tasdikli proje değişikliği veya kroki taleplerini en geç altı ay içinde sonuç-\nlandırır.  Komisyonun teşkili, çalışma usûlü ile engellinin kullanımından sonraki süreç ile \nilgili usûl ve esaslar Bayındırlık ve İskan Bakanlığı ile Özürlüler İdaresi Başkanlığı tarafından \nmüştereken hazırlanacak yönetmelikle belirlenir.7 \nBu işlerin giderleri, yeniliklerden faydalananlar tarafından, faydalanma oranına göre, \nödenir. \n(Değişik dördüncü fıkra : 18/4/20 07-5627/16 md.) Kat maliklerinden birinin isteği \n                                                           \n7 25/4/2013 tarihli ve 6462 sayılı Kanunun 1 inci maddesiyle, bu fıkrada yer alan “Özürlülerin” ve \n“özürlünün” ibareleri sırasıyla “Engellilerin” ve “engellinin”  şeklinde değiştirilmiştir. \nüzerine ısı yalıtımı, ısıtma sisteminin yakıt dönüşümü ve ısıtma sisteminin merkezi sistemden \nferdi sisteme veya ferdi sistemden merkezi sisteme dönüştürülmesi, kat maliklerinin sayı ve \narsa payı çoğunl uğu i le verecekleri karar üzerine yapılır. Ancak toplam inşaat alanı ikibin', '**Kat Mülkiyeti Kanunu**\n“özürlünün” ibareleri sırasıyla “Engellilerin” ve “engellinin”  şeklinde değiştirilmiştir. \nüzerine ısı yalıtımı, ısıtma sisteminin yakıt dönüşümü ve ısıtma sisteminin merkezi sistemden \nferdi sisteme veya ferdi sistemden merkezi sisteme dönüştürülmesi, kat maliklerinin sayı ve \narsa payı çoğunl uğu i le verecekleri karar üzerine yapılır. Ancak toplam inşaat alanı ikibin \nmetrekare ve üzeri olan binalarda merkezi ısıtma sisteminin ferdi ısıtma sistemine dönüştü-\nrülmesi, kat maliklerinin sayı ve arsa payı olarak oybirliği ile verecekleri karar üzerine yapılır. \nBu konuda yapılacak ortak işlerin giderleri arsa payı oranına göre ödenir. Merkezi ısıtma sis-\ntemlerinde ısınma giderl erinin paylaştırılmasına ilişkin usûl ve esaslar Bayındırlık ve İskan \nBakanlığı tarafından yürürlüğe konulacak yönetmelikle düzenlenir.  \n(Değişik beşinci fıkra: 18/4/2007-5627/16 md.) Isıtma sisteminin merkezi sistemden \nferdi sisteme veya ferdi sistemden merkezi sisteme dönüştürülmesine karar verilmesi halinde, \nyönetim planının bu karara aykırı hükümleri değiştirilmiş sayılır. \n \nII - Çok masraflı ve lüks olanlar:', '**Kat Mülkiyeti Kanunu**\nMadde 4 – Ortak yerlerin konusu sözleşme ile belirtilebilir. Aşağıda yazılı yerler ve \nşeyler bu Kanun gereğince her halde ortak yer sayılır. \na) Temeller ve ana duvarlar, taşıyıcı sistemi oluşturan kiriş, kolon ve perde duvarlar ile \ntaşıyıcı sistemin parçası diğer elemanlar, bağımsız bölümleri ayıran ortak duvarlar, tavan ve \ntabanlar, avlular, genel giriş kapıları, antreler, merdivenler, asansörler, sahanlıklar, koridorlar \nve buralardaki genel tuvalet ve lavabolar, kapıcı daire veya odaları, genel çamaşırlık ve çam a-\nşır kurutma yerleri, genel kömürlük ve ortak garajlar, elektrik, su ve havagazı saatlerinin ko-\nrunmasına mahsus olup bağımsız bölüm dışında bulunan yuvalar ve kapalı  kısımlar, kalorifer \ndaireleri, kuyu ve sarnıçlar, yapının genel su depoları, sığınaklar,1 \nb) Her kat malikinin kendi bölümü dışındaki kanalizasyon tesisleri ve çöp kanalları ile \nkalorifer, su, havagazı ve elektrik tesisleri, telefon, radyo ve televizyon i çin ortak şebeke ve \nantenler sıcak ve soğuk hava tesisleri, \nc) Çatılar, bacalar, genel dam terasları, yağmur olukları, yangın emniyet merdivenleri. \nYukarıda sayılanların dışında kalıp da, yine ortaklaşa kullanma, korunma veya fayda-\nlanma için zaruri olan diğer yerler ve şeyler de (Ortak yer) konusuna girer. \n \nB) Bağlantılar : \nI - Bağımsız bölümlerle arsa payı arasındaki bağlantı:', '**Kat Mülkiyeti Kanunu**\nMadde 42 – Kat malikleri,anagayrimenkulün ortak yerlerinde kendi başlarında bir deği-\nşiklik yapamazlar; ortak yerlerin düzgün veya bunları kullanmanın daha rahat ve kolay bir hale \nkonulmasına veya bu yerlerden elde edilecek faydanın çoğaltılmasına yarıyacak bütün yenilik \nve ilaveler, kat maliklerinin sayı ve arsa payı çoğunluğu ile verecekleri karar üzerine yapılır. \n(Ek fıkra: 1/7/2005 -5378/19 md.) Engellilerin yaşamı için zorunluluk göstermesi \nhâlinde, proje tadili kat maliklerinin en geç üç ay içerisinde yapacağı toplantıda görüşülerek \nsayı ve arsa payı ç oğunluğu ile karara bağlanır. Toplantının bu süre iç erisinde yapılamaması \nveya tadilat talebinin çoğunlukla kabul edilmemesi durumunda; ilgili kat malikinin talebi üze-\nrine bina güve nliğinin tehlikeye sokulmadığını bildirir komisyon raporuna istinaden ilgili \nmercilerden alınacak  tasdikli  proje değişikliği veya krokiye göre inşaat, onarım ve tesis yapı-\nlır. İlgili merciler, tasdikli proje değişikliği veya kroki taleplerini en geç altı ay içinde sonuç-\nlandırır.  Komisyonun teşkili, çalışma usûlü ile engellinin kullanımından sonraki süreç ile \nilgili usûl ve esaslar Bayındırlık ve İskan Bakanlığı ile Özürlüler İdaresi Başkanlığı tarafından \nmüştereken hazırlanacak yönetmelikle belirlenir.7 \nBu işlerin giderleri, yeniliklerden faydalananlar tarafından, faydalanma oranına göre, \nödenir. \n(Değişik dördüncü fıkra : 18/4/20 07-5627/16 md.) Kat maliklerinden birinin isteği \n                                                           \n7 25/4/2013 tarihli ve 6462 sayılı Kanunun 1 inci maddesiyle, bu fıkrada yer alan “Özürlülerin” ve \n“özürlünün” ibareleri sırasıyla “Engellilerin” ve “engellinin”  şeklinde değiştirilmiştir. \nüzerine ısı yalıtımı, ısıtma sisteminin yakıt dönüşümü ve ısıtma sisteminin merkezi sistemden \nferdi sisteme veya ferdi sistemden merkezi sisteme dönüştürülmesi, kat maliklerinin sayı ve \narsa payı çoğunl uğu i le verecekleri karar üzerine yapılır. Ancak toplam inşaat alanı ikibin', '**Kat Mülkiyeti Kanunu**\nEk Madde 3 – (Ek:13/4/1983 - 2814/15 md.; Mülga: 14/11/2007-5711/24 md.) \n \nKat irtifakına geçiş: \nEk Madde 4 – (Ek: 13/4/1983 - 2814/15 md.) \nBeş veya daha fazla kişi tarafı ndan üzerinde bir veya birden çok yapı yaptırılmak \namacıyla birlikte bir arsa edinilmiş olması ve pay sahiplerinden en az beşte dördünün kat irti-\nfakına geçiş kon usunda aldığı karara uyulmaması halinde, karara uymayan pay sahiplerinin \ngayrimenkuldeki paylarının iptaline ve bu payların, isteyen diğer pay sahipleri adına tesciline \nsulh mahkemesi tarafından aşağıdaki şartlarla karar verilir: \na) Müşterek gayrimenkulün yukarıda belirtilen amaçla edinildiğinin ispat edilmiş olması, \nb) Müşterek maliklerin yukarıda açıklanan çoğunluğunun kat irtifakına geçiş kararına \nveya bununla ilgili yükümlülüklere noterlikçe yapılan tebligata rağmen iki ay içinde uyulmamış \nolması, \nc) Karara uymayan müşterek maliklerin paylarının mahkemece tespit edilen rayiç be-\ndelinin mahkeme veznesine depo edilmesi. \n \nHatalı blok veya bağımsız bölüm numaralarının düzeltilmesi', '**Kat Mülkiyeti Kanunu**\nğince verilen emre rağmen, bu kanunda yazılı borç ve yükümleri yerine getirmemek suretiyle \nöteki kat maliklerinin haklarını ihlal etmekte devamlı olarak bir yıl ısrar edilmesi; \nc) Kendi bağımsız bölümünü randevu evi veya kumarhane veya benzeri yer olarak \nkullanmak suretiyle ahlak ve adaba aykırı harekette bulunması.  \n(Değişik dördüncü fıkra: 14/11/2007-5711/12 md.) Bu maddedeki dava hakkı, devir \nkonusunda kat maliklerince alınan dava açma kararının öğrenilmesi tarihinden başlay arak altı \nay ve her halde dava hakkının doğumundan başlayarak beş yıl içinde kullanı lmazsa veya dava \nsebebi ortadan kalkmışsa düşer. \n \nB) Kat irtifakı sahiplerinin borçları:', '**Kat Mülkiyeti Kanunu**\nMadde 23 – Kat maliklerinden birinin bağımsız bölümünde veya bu bölümdeki tesis-\nlerde meydana gelen bir hasar veya bozukluğun onarımı veya giderilmes i veya tesislerin ye-\nniden yapılması ile yapı güvenliğiyle ilgili olarak yapılması gerekli görülen teknik inceleme-\nler için diğer bir bağımsız bölüme girmek gerekiyorsa, o bölümün maliki veya o bölümde \nbaşka sıfatla otura nlar, giriş müsaadesi vermeye ve böl ümde gerekli işlerin yapılmasına ka t-\nlanmaya mecburdurlar.6 \n                                                           \n6 14/11/2007 tarihli ve 5711 sayılı Kanunun 11 inci maddesiyle; bu fıkrada yer alan ""tesislerin yeniden \nyapılması"" ibaresinden sonra gelmek üzere ""ile yapı güvenliğiyle ilgili olarak yapılması gerekli görülen \nteknik incelemeler"" ibaresi eklenmiştir. \nAnagayrimenkulün bir kısmının harap olması halinde, harap olan bağımsız bölüm ve \neklentilerinin veya ortak yerlerin veya bağımsız bölümdeki tesislerin yeniden yapılması için, \nsağlam kalan bağımsız bölümlerin içinden veya dışından faydalanılması gerekiyorsa, o bö-\nlümlerin malikleri veya orada başka sıfatla oturanlar buna müsaade etmeye mecburdurlar. \nYukarıdaki fıkralarda yazılı müsaade yüzünden, kat maliklerinin veya orada başka sı-\nfatla oturanların uğrayacakları zararı, lehine müsaade verilen bağımsız bölüm malikleri derhal \nödemekle yükümlüdürler.  \n \nVII - Yasak işler:']","Evet, komşunuzun gürültü yapması ve kötü koku yayması durumunda kanuni hakkınız vardır. Kat Mülkiyeti Kanunu'na göre, komşuların birbirlerine karşı saygılı olmaları ve her bir kat malikinin kendi bağımsız bölümü dışındaki alanları kullanırken diğer kat maliklerinin haklarına zarar vermemeleri gerekmektedir.

Gürültü ve kötü koku yayılması, diğer komşuların yaşam alanlarını olumsuz etkileyebileceği için, bu durum kat mülkiyeti gerekliliklerine aykırı bir davranıştır. Eğer sorunlar devam ediyorsa, öncelikle komşunuzla dostane bir şekilde bu durumu konuşmayı deneyebilirsiniz. Eğer bu çözüm işe yaramazsa, o zaman apartman yönetimiyle ya da site yönetimiyle görüşebilir, durumu onlara bildirebilir ve resmi bir şikayette bulunabilirsiniz.

Şikayetlerde, Kat Mülkiyeti Kanunu'nun 54. maddesi, kat maliklerinin ortak yaşam alanlarına ve komşuluk ilişkilerine saygı göstermelerini şart koşmaktadır. Eğer gerekli tedbirler alınmazsa, hukuki yola başvurarak yasal haklarınızı kullanabilirsiniz.","Medeni Kanun'a göre herkes taşınmaz mülkiyetinden doğan yetkileri kullanırken komşularını olumsuz etkileyecek taşkınlıktan kaçınmalıdır. Gürültü yapmak, koku çıkartmak gibi rahatsızlıklar vermek yasaktır.",0.3,0.4791024678188019,0.522241978770632
Polis veya yönetici evime izinsiz girebilir mi?,[],"Hayır, yönetici veya polis, evinize izinsiz giremez. Kat Mülkiyeti Kanunu'na göre, kat malikleri üzerinde özel yaşam dokunulmazlığı vardır. Polis, yasal bir gerekçe olmadan, izinsiz olarak konutunuza giremez. Yönetici ise, bina ile ilgili işlemleri yürütmek amacıyla girmesi gerekse bile, önceden bildirimde bulunmalı ve izninizi almalıdır. 

Her iki durumda da, konutunuza girişi sadece yasal yetkilere sahip kişiler gerçekleştirebilir ve bu durumda, önceden bilgi verilmesi önemlidir.",Hayır. Anayasa'nın 21. maddesine göre kimsenin konutuna dokunulamaz. Hâkim kararı veya kanunla yetkili kılınmış merciin yazılı emri olmadıkça kimsenin konutuna girilemez ve arama yapılamaz.,0.0,0.5289257763784189,0.5758754168471243
"Apartman yönetim planında kararların salt çoğunlukla alınacağı yazmasına rağmen, plan değişikliği için yöneticinin 4/5 çoğunluk istemesi hukuken doğru mudur? Hangi hüküm geçerlidir?",[],"Hayır, bu hukuken doğru değildir. Kat Mülkiyeti Kanunu'nun 28. maddesine göre, genel kurulda alınacak kararların çoğunluğu belirli şartlara bağlıdır. Eğer apartman yönetim planında kararların salt çoğunlukla alınacağı belirtilmişse, planın değiştirilmesi durumunda salt çoğunluk esas alınmalıdır. 

Yönetim planında 4/5 çoğunluk gerektirdiği yönünde bir hüküm bulunsa bile, Kat Mülkiyeti Kanunu'nun emredici hükümleri geçerli olacaktır. Yani, bu durumda Kanun'un öngördüğü salt çoğunluk esas alınır. Bu nedenle, yönetim planı kanunun bu hükmüne aykırı olamaz ve 4/5 çoğunluk talebi geçersizdir. Kanun geçerlidir.","Yöneticinin kararı (Kanun) geçerlidir. Kat Mülkiyeti Kanunu'nun 28. maddesi emredici niteliktedir ve yönetim planının değiştirilmesi için bütün kat maliklerinin beşte dördünün (4/5) oyunu şart koşar. Yönetim planındaki 'salt çoğunluk' maddesi, kanunun bu emredici hükmüne aykırı olduğu için geçersizdir.",0.0,0.5838129367923092,0.71447369152047
Üst kattan su sızması durumunda komşunun 'konut dokunulmazlığı' gerekçesiyle tamirat için usta girişine izin vermemesi hukuken korunur mu? Hangi yasal yol izlenmelidir?,"['**T.C. Anayasası (İlgili Maddeler)**\nB. Konut dokunulmazlığı Madde 21 – (Değişik: 3/10/2001-4709/6 md.) Kimsenin konutuna dokunulamaz. Millî güvenlik, kamu düzeni, suç işlenmesinin önlenmesi, genel sağlık ve genel ahlâkın korunması veya başkalarının hak ve özgürlüklerinin korunması sebeplerinden biri veya birkaçına bağlı olarak usulüne göre verilmiş hâkim kararı olmadıkça; yine bu sebeplere bağlı olarak gecikmesinde sakınca bulunan hallerde de kanunla yetkili kılınmış merciin yazılı emri bulunmadıkça; kimsenin konutuna girilemez, arama yapılamaz ve buradaki eşyaya el konulamaz. Yetkili merciin kararı yirmidört saat içinde görevli hâkimin onayına sunulur. Hâkim, kararını el koymadan itibaren kırksekiz saat içinde açıklar; aksi halde, el koyma kendiliğinden kalkar.  XII. Mülkiyet hakkı Madde 35 – Herkes, mülkiyet ve miras haklarına sahiptir. Bu haklar, ancak kamu yararı amacıyla, kanunla sınırlanabilir. Mülkiyet hakkının kullanılması toplum yararına aykırı olamaz.  A. Hak arama hürriyeti Madde 36 – Herkes, meşru vasıta ve yollardan faydalanmak suretiyle yargı mercileri önünde davacı veya davalı olarak iddia ve savunma ile adil yargılanma hakkına sahiptir.[16] Hiçbir mahkeme, görev ve yetkisi içindeki davaya bakmaktan kaçınamaz.  IV. Çalışma ve sözleşme hürriyeti Madde 48 – Herkes, dilediği alanda çalışma ve sözleşme hürriyetlerine sahiptir. Özel teşebbüsler kurmak serbesttir. Devlet, özel teşebbüslerin milli ekonominin gereklerine ve sosyal amaçlara uygun yürümesini, güvenlik ve kararlılık içinde çalışmasını sağlayacak tedbirleri alır.', '**Kat Mülkiyeti Kanunu**\nMadde 23 – Kat maliklerinden birinin bağımsız bölümünde veya bu bölümdeki tesis-\nlerde meydana gelen bir hasar veya bozukluğun onarımı veya giderilmes i veya tesislerin ye-\nniden yapılması ile yapı güvenliğiyle ilgili olarak yapılması gerekli görülen teknik inceleme-\nler için diğer bir bağımsız bölüme girmek gerekiyorsa, o bölümün maliki veya o bölümde \nbaşka sıfatla otura nlar, giriş müsaadesi vermeye ve böl ümde gerekli işlerin yapılmasına ka t-\nlanmaya mecburdurlar.6 \n                                                           \n6 14/11/2007 tarihli ve 5711 sayılı Kanunun 11 inci maddesiyle; bu fıkrada yer alan ""tesislerin yeniden \nyapılması"" ibaresinden sonra gelmek üzere ""ile yapı güvenliğiyle ilgili olarak yapılması gerekli görülen \nteknik incelemeler"" ibaresi eklenmiştir. \nAnagayrimenkulün bir kısmının harap olması halinde, harap olan bağımsız bölüm ve \neklentilerinin veya ortak yerlerin veya bağımsız bölümdeki tesislerin yeniden yapılması için, \nsağlam kalan bağımsız bölümlerin içinden veya dışından faydalanılması gerekiyorsa, o bö-\nlümlerin malikleri veya orada başka sıfatla oturanlar buna müsaade etmeye mecburdurlar. \nYukarıdaki fıkralarda yazılı müsaade yüzünden, kat maliklerinin veya orada başka sı-\nfatla oturanların uğrayacakları zararı, lehine müsaade verilen bağımsız bölüm malikleri derhal \nödemekle yükümlüdürler.  \n \nVII - Yasak işler:', '**Kat Mülkiyeti Kanunu**\nbankada kendi adına ve fakat anagayrimenkulün yönetici sıfatı gösterilmek suretiyle, hesap \naçtırılması; \nk) Kat malikleri kurulunun toplantıya çağırılması. \nl) (Ek: 4/4/2015 -6645/82 md.) Anagayrimenkulde bulunan asansörlerin güvenli bir \nşekilde işletilmesinin sağlanması amacıyla aylık bakımları ile yıllık kontrollerinin ilgili teknik \ndüzenlemelere uygun şekilde yaptırılması ve bu işlemlere ilişkin ücretlerin ödenmesi. \n(Ek fıkra: 4/4/2015-6645/82 md.) Bu Kanunun 34 üncü maddesinde belirtilen şartları \ntaşımasına rağmen yönetici ataması yapılmayan anagayrimenkulde, birinci fıkrada sayılan \nişlerin yaptırılmasından kat malikleri müştereken sorumludur. \n \n2. Defter tutulması ve belgelerin saklanması:', '**Kat Mülkiyeti Kanunu**\n“özürlünün” ibareleri sırasıyla “Engellilerin” ve “engellinin”  şeklinde değiştirilmiştir. \nüzerine ısı yalıtımı, ısıtma sisteminin yakıt dönüşümü ve ısıtma sisteminin merkezi sistemden \nferdi sisteme veya ferdi sistemden merkezi sisteme dönüştürülmesi, kat maliklerinin sayı ve \narsa payı çoğunl uğu i le verecekleri karar üzerine yapılır. Ancak toplam inşaat alanı ikibin \nmetrekare ve üzeri olan binalarda merkezi ısıtma sisteminin ferdi ısıtma sistemine dönüştü-\nrülmesi, kat maliklerinin sayı ve arsa payı olarak oybirliği ile verecekleri karar üzerine yapılır. \nBu konuda yapılacak ortak işlerin giderleri arsa payı oranına göre ödenir. Merkezi ısıtma sis-\ntemlerinde ısınma giderl erinin paylaştırılmasına ilişkin usûl ve esaslar Bayındırlık ve İskan \nBakanlığı tarafından yürürlüğe konulacak yönetmelikle düzenlenir.  \n(Değişik beşinci fıkra: 18/4/2007-5627/16 md.) Isıtma sisteminin merkezi sistemden \nferdi sisteme veya ferdi sistemden merkezi sisteme dönüştürülmesine karar verilmesi halinde, \nyönetim planının bu karara aykırı hükümleri değiştirilmiş sayılır. \n \nII - Çok masraflı ve lüks olanlar:', '**Kat Mülkiyeti Kanunu**\nMadde 35 – Yöneticinin görevleri, yönetim planında belirtilir; yönetim planında aksi-\nne hüküm olmadıkça, yönetici aşağıdaki işleri görür: \na) Kat malikleri kurulunca verilen kararların yerine getirilmesi; \nb) Anagayrimenkulün gayesine uygun olarak kullanılması, korunması, bakımı ve ona-\nrımı için gereken tedbirlerin alınması; \nc) Anagayrimenkulün sigorta ettirilmesi; \nd) Anagayrimenkulün genel yönetim işleriyle korunma, onarım, temizlik gibi bakım \nişleri ve asansör ve kalorifer, sıca k ve soğuk hava işletmesi ve sigorta için yönetim planında \ngösterilen zamanda, eğer böyle bir zaman gösterilmemişse, her takvim yılının ilk ayı içinde, \nkat maliklerinden avans olarak münasip miktarda paranın toplanması ve bu avansın harcanıp \nbitmesi halinde, geri kalan işler için tekrar avans toplanması; \ne) Anagayrimenkulün yönetimiyle ilgili diğer bütün ödemelerin kabulü, yönetim dola-\nyısiyle doğan borçların ödenmesi ve kat malikleri tarafından ayrıca yetkili kılınmışsa, bağı m-\nsız bölümlere ait kiraların toplanması; \nf) Anagayrimenkulün tümünü ilgilendiren tebligatın kabulü; \ng) Anagayrimenkulü ilgilendiren bir sürenin geçmesinden veya bir hakkın kaybına \nmeydan vermiyecek gerekli tedbirlerin alınması; \nh) Anagayrimenkulün korunması ve bakımı için kat maliklerini n yararına olan husus-\nlarda gerekli tedbirlerin, onlar adına alınması; \ni) Kat mülkiyetine ilişkin borç ve yükümlerini yerine getirmiyen kat maliklerine karşı da-\nva ve icra takibi yapılması ve kanuni ipotek hakkının kat mülkiyeti kütüğüne tescil ettirilmesi; \nj) Topladığı paraları ve avansları yatırmak ve gerektiğinde almak üzere muteber bir \nbankada kendi adına ve fakat anagayrimenkulün yönetici sıfatı gösterilmek suretiyle, hesap \naçtırılması; \nk) Kat malikleri kurulunun toplantıya çağırılması. \nl) (Ek: 4/4/2015 -6645/82 md.) Anagayrimenkulde bulunan asansörlerin güvenli bir \nşekilde işletilmesinin sağlanması amacıyla aylık bakımları ile yıllık kontrollerinin ilgili teknik', '**Kat Mülkiyeti Kanunu**\nMadde 42 – Kat malikleri,anagayrimenkulün ortak yerlerinde kendi başlarında bir deği-\nşiklik yapamazlar; ortak yerlerin düzgün veya bunları kullanmanın daha rahat ve kolay bir hale \nkonulmasına veya bu yerlerden elde edilecek faydanın çoğaltılmasına yarıyacak bütün yenilik \nve ilaveler, kat maliklerinin sayı ve arsa payı çoğunluğu ile verecekleri karar üzerine yapılır. \n(Ek fıkra: 1/7/2005 -5378/19 md.) Engellilerin yaşamı için zorunluluk göstermesi \nhâlinde, proje tadili kat maliklerinin en geç üç ay içerisinde yapacağı toplantıda görüşülerek \nsayı ve arsa payı ç oğunluğu ile karara bağlanır. Toplantının bu süre iç erisinde yapılamaması \nveya tadilat talebinin çoğunlukla kabul edilmemesi durumunda; ilgili kat malikinin talebi üze-\nrine bina güve nliğinin tehlikeye sokulmadığını bildirir komisyon raporuna istinaden ilgili \nmercilerden alınacak  tasdikli  proje değişikliği veya krokiye göre inşaat, onarım ve tesis yapı-\nlır. İlgili merciler, tasdikli proje değişikliği veya kroki taleplerini en geç altı ay içinde sonuç-\nlandırır.  Komisyonun teşkili, çalışma usûlü ile engellinin kullanımından sonraki süreç ile \nilgili usûl ve esaslar Bayındırlık ve İskan Bakanlığı ile Özürlüler İdaresi Başkanlığı tarafından \nmüştereken hazırlanacak yönetmelikle belirlenir.7 \nBu işlerin giderleri, yeniliklerden faydalananlar tarafından, faydalanma oranına göre, \nödenir. \n(Değişik dördüncü fıkra : 18/4/20 07-5627/16 md.) Kat maliklerinden birinin isteği \n                                                           \n7 25/4/2013 tarihli ve 6462 sayılı Kanunun 1 inci maddesiyle, bu fıkrada yer alan “Özürlülerin” ve \n“özürlünün” ibareleri sırasıyla “Engellilerin” ve “engellinin”  şeklinde değiştirilmiştir. \nüzerine ısı yalıtımı, ısıtma sisteminin yakıt dönüşümü ve ısıtma sisteminin merkezi sistemden \nferdi sisteme veya ferdi sistemden merkezi sisteme dönüştürülmesi, kat maliklerinin sayı ve \narsa payı çoğunl uğu i le verecekleri karar üzerine yapılır. Ancak toplam inşaat alanı ikibin', '**Kat Mülkiyeti Kanunu**\n(Ek fıkra: 15/2/2018-7099/4 md.) (Değişik altıncı fıkra:9/6/2021-7327/11 md.) Yapı \nkullanma izin b elgesi düzenlenen tüm yapıların cins değişikliği işlemleri resen yapılır. Yapı \nkullanma izin belgesini düzenlemeye yetkili idare tarafından Mekânsal Adres Kayıt Sistemine \nyüklenerek elektronik ortamda kadastro müdürlüğüne gönderilen yapı kullanma izin belgesi ile \nyapı aplikasyon projesine göre kadastro müdürlüğünce tescil bildirimi düzenlenir. Tapu \nmüdürlüğüne gönderilen tescil bildirimi üzerine başkaca bir belge aranmaksızın cins değişikliği \nresen tescil edilir. Cins değişikliği yapılmış taşınmaz kat irtifakı tesisli ise, kat irtifakının tesciline \nait resmî senede ve 12 nci maddede yazılı belgelere dayalı olarak başkaca bir belge aranmaksızın \nresen kat mülkiyetine çevrilir. Bu işlemler, döner sermaye hizmet bedelinden muaftır. \n                                                           \n2 9/6/2021 tarihli ve 7327 sayılı Kanunun 11 inci maddesiyle, bu fıkranın birinci cümlesinde yer alan \n“kat karşılığı temlik sözleşmesi ve” ibaresi “kat karşılığı temlik sözleşmesi veya” şeklinde değiştirilmiş, \ncümlede yer alan “cins değişikliği,” ibaresi madde metninden çıkarılmıştır. \nKat mülkiyetine konu olmaya elverişli bir gayrimenkul üzerindeki ortaklığın giderilmesi \ndavalarında, mirasçılardan veya ortak maliklerden biri, paylaşmanın, kat mülkiyeti kurulması ve \nbağımsız bölümlerin tahsisi suretiyle yapılmasını isterse, hakim, o gayrimenkulün mülkiyetinin, \n12 nci maddede yazılı belgelere dayanılarak kat mülkiyetine çevrilmesine ve paylar denkleşti-\nrilmek suretiyle bağımsız bölümlerin ortaklara ayrı ayrı tahsisine karar verebilir. \n(Ek fıkra: 14/11/2007 -5711/3 md.) Gelirinin ortak giderlere harcanması için veya \nbaşka bir amaçla ortak yararlanmaya tahsis edilen bağımsız bölümlerin malik hanesine, bun-\nlardan yararlanan ""bağımsız bölümlerin numaraları"" yazılmak suretiyle kat mülkiyeti kütüğ ü-', '**Türk Borçlar Kanunu (İlgili Maddeler)**\nya\t da\tönemli\t ölçüde\t engellemesi\t ve\t verilen\t sürede\t giderilmemesi\t hâlinde\t kiracı,\t sözleşmeyi\tfeshedebilir. Kiraya veren, kiralanandaki ayıbı gidermek yerine, uygun bir süre içinde ayıpsız benzeriyle değiştirebilir. Kiraya veren, kiracıya aynı malın ayıpsız bir benzerini hemen vererek ve uğradığı zararın tamamını gidererek, onun seçimlik haklarını kullanmasını önleyebilir.', '**Türk Borçlar Kanunu (İlgili Maddeler)**\n3. Yapı malikinin sorumluluğu a. Giderim yükümlülüğü MADDE\t 69- Bir binanın veya diğer yapı eserlerinin maliki, bunların yapımındaki bozukluklardan veya bakımındaki eksikliklerden doğan zararı gidermekle yükümlüdür. İntifa ve oturma hakkı sahipleri de, binanın bakımındaki eksikliklerden doğan zararlardan, malikle birlikte müteselsilen sorumludurlar. Sorumluların, bu sebeplerle kendilerine karşı sorumlu olan diğer kişilere rücu hakkı saklıdır.   b. Zarar tehlikesini önleme MADDE\t 70- Bir başkasına ait bina veya\t diğer\t yapı\t eserlerinden\t zarar\t görme\ttehlikesiyle\tkarşılaşan\tkişi, bu tehlikenin giderilmesi için gerekli önlemlerin alınmasını hak sahiplerinden isteyebilir. Kişilerin\tve\tmalların\tkorunması\thakkındaki\tkamu\thukuku\tkuralları\tsaklıdır.  2. Kiralananın sonradan ayıplı hâle gelmesinden sorumluluk a. Genel olarak MADDE\t 305-\tKiralanan sonradan ayıplı duruma gelirse kiracı, kiraya verenden ayıpların giderilmesini veya kira bedelinden ayıpla orantılı bir indirim yapılmasını ya da zararının giderilmesini isteyebilir. Ancak, zararın giderilmesi istemi diğer seçimlik hakların kullanılmasını önlemez. Önemli ayıp durumunda kiracının sözleşmeyi fesih hakkı saklıdır.   b. Ayıbın giderilmesini isteme ve fesih MADDE\t 306-\tKiracı, kiraya verenden kiralanandaki ayıbın uygun bir sürede giderilmesini isteyebilir; bu sürede ayıp giderilmezse kiracı, ayıbı kiraya veren hesabına gidertebilir ve bundan doğan alacağını kira bedelinden indirebilir veya kiralananın ayıpsız bir benzeri ile değiştirilmesini isteyebilir. Ayıbın,\t kiralananın\t öngörülen\t kullanıma\t elverişliliğini\t ortadan\t kaldırması\t ya\t da\tönemli\t ölçüde\t engellemesi\t ve\t verilen\t sürede\t giderilmemesi\t hâlinde\t kiracı,\t sözleşmeyi\tfeshedebilir. Kiraya veren, kiralanandaki ayıbı gidermek yerine, uygun bir süre içinde ayıpsız benzeriyle değiştirebilir. Kiraya veren, kiracıya aynı malın ayıpsız bir benzerini hemen vererek ve uğradığı zararın tamamını gidererek, onun seçimlik haklarını kullanmasını önleyebilir.', '**Türk Borçlar Kanunu (İlgili Maddeler)**\nD. Kiracının borçları I. Kira bedelini ödeme borcu 1. Genel olarak MADDE\t313-\tKiracı, kira bedelini ödemekle yükümlüdür. \t 2. İfa zamanı MADDE\t 314-\tKiracı, aksine sözleşme ve yerel âdet olmadıkça, kira bedelini ve gerekiyorsa yan giderleri, her ayın sonunda ve en geç kira süresinin bitiminde ödemekle yükümlüdür.   3. Kiracının temerrüdü MADDE\t 315-\tKiracı, kiralananın tesliminden sonra muaccel olan kira bedelini veya yan gideri ödeme borcunu ifa etmezse, kiraya veren kiracıya yazılı olarak bir süre verip, bu sürede de ifa etmeme durumunda, sözleşmeyi feshedeceğini bildirebilir. Kiracıya verilecek süre en az on gün, konut ve çatılı işyeri kiralarında ise en az otuz gündür. Bu süre, kiracıya yazılı bildirimin yapıldığı tarihi izleyen günden itibaren işlemeye başlar.   II. Özenle kullanma ve komşulara saygı gösterme borcu MADDE\t 316-\tKiracı, kiralananı, sözleşmeye uygun olarak özenle kullanmak ve kiralananın bulunduğu taşınmazda oturan kişiler ile komşulara gerekli saygıyı göstermekle yükümlüdür. Kiracının bu yükümlülüğüne aykırı davranması durumunda kiraya veren, konut ve çatılı işyeri kirasında, en az otuz gün süre vererek, aykırılığın giderilmesi, aksi takdirde sözleşmeyi feshedeceği konusunda yazılı bir ihtarda bulunur. Diğer kira ilişkilerinde ise, kiraya veren, kiracıya önceden bir ihtarda bulunmaksızın, yazılı bir bildirimle sözleşmeyi hemen feshedebilir. Konut\tve\tçatılı\tişyeri\tkirasında,\tkiracının\tkiralanana\tkasten\tağır\tbir\tzarar\tvermesi,\tkiracıya\tverilecek\tsürenin\tyararsız\tolacağının\tanlaşılması\tveya\tkiracının\tbu\tyükümlülüğe\taykırı\t davranışının\t kiraya\t veren\t veya\t aynı\t taşınmazda\t oturan\t kişiler\t ile\t komşular\tbakımından\tçekilmez\tolması\tdurumlarında\tkiraya\tveren,\tyazılı\tbir\tbildirimle\tsözleşmeyi\themen\tfeshedebilir. \t III. Temizlik ve bakım giderlerini ödeme borcu MADDE\t 317- Kiracı, kiralananın olağan kullanımı için gerekli temizlik ve bakım giderlerini ödemekle yükümlüdür. Bu konuda yerel âdete de bakılır.']","Hayır, komşunun konut dokunulmazlığı gerekçesiyle tamirat için usta girişine izin vermemesi hukuken korunmaz. Kat Mülkiyeti Kanunu gereğince, üst kattan su sızması durumu, ilgili kat maliki tarafından kaynağı olan bölüme müdahale edilmesini gerektirir. Bu durumda kat malikleri, kendi bağımsız bölümlerinde oluşan hasar veya bozuklukların onarımı amacıyla komşu bağımsız bölümlere giriş için müsaade vermeye mecburdurlar.

Kat Mülkiyeti Kanunu Madde 23'te belirtilmiştir ki; “kat maliklerinden birinin bağımsız bölümünde veya bu bölümdeki tesislerde meydana gelen bir hasar veya bozukluğun onarımı için gerekli görülen teknik inceleme için diğer bağımsız bölümlere girmek gerekiyorsa, o bölümün maliki müsaade etmeye mecburdur.” 

Bu durumda, eğer komşunuz gerekli müsaadeyi vermezse, bir yasal yol olarak icra takibi başlatma veya dava açma gibi hukuki yolları kullanabilirsiniz. Geçmişte oluşmuş zararın tazmini için de mahkemeye başvurabilirsiniz. Mahkeme, bu tür durumlarda ilgili kanun çerçevesinde tedbir kararı alabilir ve komşunuzdan gerekli müsaadeyi talep edebilir.","Konut dokunulmazlığı (Anayasa Md. 21) mutlak değildir; KMK Madde 23 uyarınca kat malikleri, diğer bölümlerdeki arızaların giderilmesi için kendi bölümlerine girilmesine izin vermekle yükümlüdür. Komşu rıza göstermezse, KMK Madde 33 uyarınca Sulh Hukuk Mahkemesi'nden 'Hâkimin Müdahalesi' istenerek mahkeme kararıyla (Anayasal 'hâkim kararı' istisnası) giriş sağlanabilir.",0.25,0.4217761354614236,0.475879364728113
"Aidat borcu için yönetimin doğrudan ev sahibine icra takibi başlatması durumunda, ev sahibinin 'kiracı varken bana gelemezsiniz' itirazı haklı mıdır?",[],"Hayır, ev sahibinin ""kiracı varken bana gelemezsiniz"" itirazı haklı değildir. Kat Mülkiyeti Kanunu'na göre, aidat borçları malikin sorumluluğundadır. Kiracı aidatı ödeme yükümlülüğünü yerine getirmediği durumlarda, yönetim doğrudan ev sahibi üzerinde icra takibi başlatabilir. Bu, ev sahibinin kiracısının borçları nedeniyle itiraz etmesine engel olur. 

Yani, kiracı olmasının ev sahibinin icra takibinden muaf tutulması gibi bir durum yoktur. Yönetim, aidat borcu için doğrudan malike başvurabilir.","Ev sahibi haksızdır. KMK Madde 22'ye göre kat maliki aidat borcundan birinci derecede sorumludur. Kiracı ise bu borçtan sadece kira miktarı ile sınırlı olarak ve malikle birlikte 'müştereken ve müteselsilen' sorumludur. Yönetici, alacak için ister malike ister kiracıya (veya her ikisine birden) başvurma konusunda seçimlik hakka sahiptir.",0.0,0.3085770583542804,0.5967610795016224
Kat malikleri kurulu oy birliğiyle karar alsa dahi güvenlik gerekçesiyle yangın merdiveni kapılarını kilitli tutabilir mi?,[],"Hayır, kat malikleri kurulu oy birliğiyle karar alsa dahi yangın merdiveni kapıları güvenlik gerekçesiyle kilitli tutulamaz. Yangın merdivenleri, acil durumlarda güvenli bir çıkış sağlamak amacıyla tasarlanmıştır. Kat Mülkiyeti Kanunu'na göre, yangın merdivenleri her zaman açık olmalı ve bu alanlar, acil durumlarda kullanılmak üzere engellenmemelidir. 

Eğer yangın merdivenlerinin kapıları kapalı veya kilitli olursa, bu durum güvenlik açısından ciddi riskler oluşturur ve yasal düzenlemelere de aykırıdır. Bu nedenle, kat malikleri kurulunun aldığı böyle bir karar geçerli olmaz.","Hayır, bu karar geçersizdir. Binaların Yangından Korunması Hakkında Yönetmelik Madde 47, kaçış yolu kapılarının kilitli tutulmamasını emreder. Kamu düzenini ve can güvenliğini ilgilendiren emredici hükümler, KMK Madde 27 uyarınca kat malikleri kurulunun özel kararlarından üstündür.",0.7142857142857143,0.6928339617759833,0.7743976840183635
"Binanın dış cephesinden kopan bir parçanın verdiği zarardan, bütçe onayı vermeyen kat malikleri mi yoksa yönetici mi sorumludur?","['**Kat Mülkiyeti Kanunu**\nğince verilen emre rağmen, bu kanunda yazılı borç ve yükümleri yerine getirmemek suretiyle \nöteki kat maliklerinin haklarını ihlal etmekte devamlı olarak bir yıl ısrar edilmesi; \nc) Kendi bağımsız bölümünü randevu evi veya kumarhane veya benzeri yer olarak \nkullanmak suretiyle ahlak ve adaba aykırı harekette bulunması.  \n(Değişik dördüncü fıkra: 14/11/2007-5711/12 md.) Bu maddedeki dava hakkı, devir \nkonusunda kat maliklerince alınan dava açma kararının öğrenilmesi tarihinden başlay arak altı \nay ve her halde dava hakkının doğumundan başlayarak beş yıl içinde kullanı lmazsa veya dava \nsebebi ortadan kalkmışsa düşer. \n \nB) Kat irtifakı sahiplerinin borçları:', '**Kat Mülkiyeti Kanunu**\nMadde 23 – Kat maliklerinden birinin bağımsız bölümünde veya bu bölümdeki tesis-\nlerde meydana gelen bir hasar veya bozukluğun onarımı veya giderilmes i veya tesislerin ye-\nniden yapılması ile yapı güvenliğiyle ilgili olarak yapılması gerekli görülen teknik inceleme-\nler için diğer bir bağımsız bölüme girmek gerekiyorsa, o bölümün maliki veya o bölümde \nbaşka sıfatla otura nlar, giriş müsaadesi vermeye ve böl ümde gerekli işlerin yapılmasına ka t-\nlanmaya mecburdurlar.6 \n                                                           \n6 14/11/2007 tarihli ve 5711 sayılı Kanunun 11 inci maddesiyle; bu fıkrada yer alan ""tesislerin yeniden \nyapılması"" ibaresinden sonra gelmek üzere ""ile yapı güvenliğiyle ilgili olarak yapılması gerekli görülen \nteknik incelemeler"" ibaresi eklenmiştir. \nAnagayrimenkulün bir kısmının harap olması halinde, harap olan bağımsız bölüm ve \neklentilerinin veya ortak yerlerin veya bağımsız bölümdeki tesislerin yeniden yapılması için, \nsağlam kalan bağımsız bölümlerin içinden veya dışından faydalanılması gerekiyorsa, o bö-\nlümlerin malikleri veya orada başka sıfatla oturanlar buna müsaade etmeye mecburdurlar. \nYukarıdaki fıkralarda yazılı müsaade yüzünden, kat maliklerinin veya orada başka sı-\nfatla oturanların uğrayacakları zararı, lehine müsaade verilen bağımsız bölüm malikleri derhal \nödemekle yükümlüdürler.  \n \nVII - Yasak işler:', '**Kat Mülkiyeti Kanunu**\nsız bölüm sayısı kadar oy hakkına sahiptirler.  \nToplu yapı kapsamındaki ortak yapı, yer ve tesisler, bu kapsamda yer alan bağımsız \nbölüm maliklerinden oluşan toplu yapı kat malikleri kurulunca yönetilir ve yönetim tarzı, ka-\nnunların emredici hükümleri saklı kalmak şartıyla, bu kurul tarafından kararlaştırılır. Bu yetki, \nyönetim plânında toplu yapı temsilciler kuruluna verilebilir. Yönetim plânında başka türlü \ndüzenlenmemişse, toplu yapı temsilciler kurulu, blok yapılarda her blokta bulunan bağımsız \nbölüm maliklerince seçilen blok yöneticileri ve blok niteliğinde olmayan yapıların bağımsız \nbölüm maliklerince seçilen temsilcilerden oluşur. Toplu yapı temsilciler kurulu üyelerinin \nsayısı ve nasıl seçileceği toplu yapının özelliği dikkate alınarak yönetim plânında  belirtilir. \nToplu yapı temsilciler kurulu nda bu yöneticiler ve temsilciler yönettikleri ve temsil ettikleri \nbağımsız bölüm sayısı kadar oy hakkına sahiptirler.  \n \nYönetim plânı ve değiştirilmesi', '**Kat Mülkiyeti Kanunu**\npayları, değeri karşılığında bölümlerini yeniden yaptırmak isteyenlere öncelikle devredilir. \nHarabolan bağımsız bölümler üze rindeki kat mülkiyeti bu maddede yazılı süreler de-\nvamınca kendiliğinden kat irtifakına çevrilir ve kat mülkiyeti kütüğünde beyanlar hanesine \ngeçici şerh verilir. Bağımsız bölüm yapılınca onun üz erindeki kat mülkiyeti yeniden doğar ve \ngeçici şerh kütükten silinir. \n \nIII - Bildirme ödevi ve kaydın silinmesi:', '**Kat Mülkiyeti Kanunu**\nMadde 62 – (Ek: 10/6/1985-3227/1 md.) \nKat mülkiyetine çevrilmiş birden fazla bağımsız bölümlerden bazılarının üzerinde \ndevre mülk hakkı kurulması, aksi yönetim planında kararlaştırılmamışsa, diğer bağı msız bö-\nlüm maliklerinin muvafakatlarına bağlı değildir. \n \nMadde 63 – (Ek: 10/6/1985-3227/1 md.) \nÜzerinde devre mülk hakkı kurulan yapı veya bağımsız bölümün ortak m alikleri, aksi \nsözleşme ile kararlaştırılmamışsa, şuyuun giderilmesini isteyemezler. \n \nMadde 64 – (Ek: 10/6/1985-3227/1 md.) \n                                                           \n9 24/3/2022 tarihli ve 7392 sayılı Kanunun 18 inci maddesiyle bu fıkrada yer alan “15” ibaresi “7” \nşeklinde değiştirilmiştir. \nDevre mülk hak sahipleri, kendilerine ayrılan ve tapu si cilinde belirtilen dönem süresi \nsonunda istifade ettikleri bağımsız bölüm veya yapıyı sözleşme hükümleri gereğince b oşalt-\nmaya ve yeni hak sahibine teslime mecburdurlar. \nDönem süresi sonunda tahliye olmadığı takdirde, istifade edecek dönem sahibinden bi-\nrisinin veya yöneticinin tapu kaydını ve sözleşmeyi talebine ekleyerek ibrazı halinde, m ahal-\nlin en büyük mülki amirin emri ile, başkaca bir işlem ve tebligata lüzum kalmadan, derhal \nzabıtaca boşalttırılır. İdare veya yargı organlarına yapılacak başvuru, bu boş altma işlemini \ndurdurmaz. İlgililerin kanundan ve sözleşmeden doğan hakları saklıdır. \n \nMadde 65 – (Ek: 10/6/1985-3227/1 md.) \nDevre mülk hakkı sahiplerinin hak ve borçları, yetki ve sorumluluklarının tespit ve \nuyuşmazlıkların çözümlenmesinde bu Kanunda, sözleşmede veya yönetim planın da hüküm \nbulunmayan hallerde Türk Medeni Kanunu ve ilgili diğer kanun hükümleri uygulanır. \n \nDOKUZUNCU BÖLÜM10 \nToplu Yapılara İlişkin Özel Hükümler \nKapsam', '**Kat Mülkiyeti Kanunu**\nMadde 65 – (Ek: 10/6/1985-3227/1 md.) \nDevre mülk hakkı sahiplerinin hak ve borçları, yetki ve sorumluluklarının tespit ve \nuyuşmazlıkların çözümlenmesinde bu Kanunda, sözleşmede veya yönetim planın da hüküm \nbulunmayan hallerde Türk Medeni Kanunu ve ilgili diğer kanun hükümleri uygulanır. \n \nDOKUZUNCU BÖLÜM10 \nToplu Yapılara İlişkin Özel Hükümler \nKapsam \nMadde 66 – (Ek: 14/11/2007-5711/22 md.) \nToplu yapı, bir veya birden çok imar parseli üzerinde, belli bi r onaylı yerleşim plânına \ngöre yapılmış veya yapılacak, alt yapı tesisleri, ortak kullanım yerleri, sosyal tesis ve hizme t-\nler ile bunların yönetimi bakımından birbirleriyle bağlantılı birden çok yapıyı ifade eder. \nToplu yapı kapsamındaki imar parsellerinin bitişik veya komşu olmaları şarttır. Ancak \nbu parseller arasında kalan ve imar plânına göre yol, meydan, yeşil alan, park, otopark gibi \nkamuya ayrılan yerler için bu şart aranmaz. Toplu yapı kapsamındaki her imar parseli, kat \nirtifakının veya kat mülkiyet inin tesisinde ayrı ayrı dikkate alınır. Ancak, toplu yapı birden \nfazla imar parselini içeriyorsa, münferit parseller üzerinde toplu yapı hükümlerine tâbi olacak \nşekilde kat mülkiyeti ilişkisi kurulamaz. \nYapılar tamamlandıkça, tamamlanan yapılara ilişkin k at irtifakları kat mülkiyetine \nçevrilebilir. \n \nOrtak yerler']","Evet, binanın dış cephesinden kopan bir parçanın verdiği zarardan yönetici sorumludur. Kat Mülkiyeti Kanunu’nun 35. maddesi uyarınca, yöneticinin görevi, ortak alanların bakım ve onarımı gibi işlemleri yürütmekte olup, bununla ilgili sorumluluğu da bulunmaktadır. Eğer yönetici bütçe onayı almadan bu tür bir onarımı gerçekleştirmemişse, bu durumda yine de yönetici, binanın bakım ve güvenliği açısından sorumluluk taşımaktadır.

Ortak alanların bakımından ve güvenliğinden sorumlu olan yönetici, gizli ayıplar dahi olsa, bu tür olaylarda zararın giderilmesi için gerekli tedbirleri almakla yükümlüdür. Yani, dış cephaneden kopan parçanın zararıyla ilgili olarak, yol açtığı hasar nedeniyle kat malikleri yöneticiden tazminat talep edebilir. Ancak kat malikleri bütçe onayı vermese dahi, yönetici yine de bu tür sorumlulukları taşımaktadır. ","Yapı malikleri (kat malikleri) sorumludur. Türk Borçlar Kanunu Madde 69 uyarınca binanın bakım eksikliğinden doğan zararlardan yapı maliki kusursuz sorumludur. Yönetici, KMK Madde 35 kapsamında koruma görevini yerine getirmemiş olsa bile, asıl sorumluluk bütçeyi onaylamayan veya binanın bakımından sorumlu olan kat maliklerindedir.",0.14285714285714285,0.5835046918042806,0.7312347656172743
"KMK herkesin gidere katılması gerektiğini söylerken, yönetim planında 'dükkanlar asansör giderinden muaftır' yazıyorsa dükkan sahibi asansör tamirine katılmalı mıdır?",[],"Hayır, dükkan sahibi asansör tamirine katılmamalıdır. Ancak, burada dikkat edilmesi gereken bir husus var. Kat Mülkiyeti Kanunu'na (KMK) göre, kat malikleri, ortak giderlere katılmak zorundadır. Fakat eğer yönetim planında dükkanların asansör giderlerinden muaf olduğu belirtilmişse, bu durum geçerli olacaktır.

Yine de unutmamak gerekir ki, eğer yönetim planındaki düzenleme, KMK'nın emredici hükümlerine aykırıysa, yani kat malikleri arasında adaletsiz bir yük oluşturan bir durum varsa, KMK hükmü geçerlidir. Ancak bu somut olayda, eğer yönetim planında açık bir muafiyet varsa, bu muafiyet uygulanacaktır.","Dükkan sahibi katılmaz. KMK Madde 20'nin genel kuralı 'aralarında başka türlü anlaşma olmadıkça' şartına bağlıdır. Yönetim planı kat malikleri arasındaki sözleşme hükmündedir (Madde 28) ve bu konuda özel bir muafiyet tanınmışsa, kanundaki genel paylaşıma göre önceliklidir.",0.0,0.0,0.5739403246401675
"Kombi motorunun yanması gibi esaslı bir arızada, kombi demirbaş olduğu halde kiracı mı yoksa ev sahibi mi tamir giderini üstlenmelidir?",[],Ben sadece apartman ve komşuluk hukuku konularında yardımcı olabilirim. Bu konuda net bir bilgiye ulaşmak için bir avukata danışmanızı öneririm.,"Esaslı tamiratı ev sahibi üstlenmelidir. TBK Madde 317 uyarınca kiracı sadece olağan kullanım için gereken temizlik ve bakım giderlerinden sorumludur. Parça bozulması veya motor yanması gibi mülkün kullanım elverişliliğini etkileyen 'ayıplar', TBK Madde 305 ve 306 gereği kiraya verenin (ev sahibinin) sorumluluk alanındadır.",0.0,0.0,0.08740453007279392
